---START---
--
-- ALTER_TABLE
--
-- Clean up in case a prior regression run failed
SET client_min_messages TO 'warning';
---END---
---START---
DROP ROLE IF EXISTS regress_alter_table_user1;
---END---
---START---
RESET client_min_messages;
---END---
---START---
CREATE USER regress_alter_table_user1;
---END---
---START---
CREATE TABLE attmp (gemini_pk serial PRIMARY KEY, initial int8);
---END---
---START---
COMMENT ON TABLE attmp_wrong IS 'table comment';
ERROR:  relation "attmp_wrong" does not exist
---END---
---START---
COMMENT ON TABLE attmp IS 'table comment';
---END---
---START---
COMMENT ON TABLE attmp IS NULL;
---END---
---START---
ALTER TABLE attmp ADD COLUMN xmin integer;
ERROR:  column name "xmin" conflicts with a system column name
---END---
---START---
-- fails
ALTER TABLE attmp ADD COLUMN a int4 default 3;
---END---
---START---
ALTER TABLE attmp ADD COLUMN b name;
---END---
---START---
ALTER TABLE attmp ADD COLUMN c text;
---END---
---START---
ALTER TABLE attmp ADD COLUMN d float8;
---END---
---START---
ALTER TABLE attmp ADD COLUMN e float4;
---END---
---START---
ALTER TABLE attmp ADD COLUMN f int2;
---END---
---START---
ALTER TABLE attmp ADD COLUMN g polygon;
---END---
---START---
ALTER TABLE attmp ADD COLUMN i char;
---END---
---START---
ALTER TABLE attmp ADD COLUMN k int4;
---END---
---START---
ALTER TABLE attmp ADD COLUMN l tid;
---END---
---START---
ALTER TABLE attmp ADD COLUMN m xid;
---END---
---START---
ALTER TABLE attmp ADD COLUMN n oidvector;
---END---
---START---
--ALTER TABLE attmp ADD COLUMN o lock;
ALTER TABLE attmp ADD COLUMN p boolean;
---END---
---START---
ALTER TABLE attmp ADD COLUMN q point;
---END---
---START---
ALTER TABLE attmp ADD COLUMN r lseg;
---END---
---START---
ALTER TABLE attmp ADD COLUMN s path;
---END---
---START---
ALTER TABLE attmp ADD COLUMN t box;
---END---
---START---
ALTER TABLE attmp ADD COLUMN v timestamp;
---END---
---START---
ALTER TABLE attmp ADD COLUMN w interval;
---END---
---START---
ALTER TABLE attmp ADD COLUMN x float8[];
---END---
---START---
ALTER TABLE attmp ADD COLUMN y float4[];
---END---
---START---
ALTER TABLE attmp ADD COLUMN z int2[];
---END---
---START---
INSERT INTO attmp (a, b, c, d, e, f, g,    i,    k, l, m, n, p, q, r, s, t,
	v, w, x, y, z)
   VALUES (4, 'name', 'text', 4.1, 4.1, 2, '(4.1,4.1,3.1,3.1)',
	'c',
	314159, '(1,1)', '512',
	'1 2 3 4 5 6 7 8', true, '(1.1,1.1)', '(4.1,4.1,3.1,3.1)',
	'(0,2,4.1,4.1,3.1,3.1)', '(4.1,4.1,3.1,3.1)',
	'epoch', '01:00:10', '{1.0,2.0,3.0,4.0}', '{1.0,2.0,3.0,4.0}', '{1,2,3,4}');
---END---
---START---
SELECT * FROM attmp;
 gemini_pk | initial | a |  b   |  c   |  d  |  e  | f |           g           | i |   k    |   l   |  m  |        n        | p |     q     |           r           |              s              |          t          |          v          |    w     |     x     |     y     |     z     
-----------+---------+---+------+------+-----+-----+---+-----------------------+---+--------+-------+-----+-----------------+---+-----------+-----------------------+-----------------------------+---------------------+---------------------+----------+-----------+-----------+-----------
         1 |         | 4 | name | text | 4.1 | 4.1 | 2 | ((4.1,4.1),(3.1,3.1)) | c | 314159 | (1,1) | 512 | 1 2 3 4 5 6 7 8 | t | (1.1,1.1) | [(4.1,4.1),(3.1,3.1)] | ((0,2),(4.1,4.1),(3.1,3.1)) | (4.1,4.1),(3.1,3.1) | 1970-01-01 00:00:00 | 01:00:10 | {1,2,3,4} | {1,2,3,4} | {1,2,3,4}
(1 row)

---END---
---START---
DROP TABLE attmp;
---END---
---START---
CREATE TABLE attmp (gemini_pk serial PRIMARY KEY, initial int8);
---END---
---START---
ALTER TABLE attmp ADD COLUMN a int4;
---END---
---START---
ALTER TABLE attmp ADD COLUMN b name;
---END---
---START---
ALTER TABLE attmp ADD COLUMN c text;
---END---
---START---
ALTER TABLE attmp ADD COLUMN d float8;
---END---
---START---
ALTER TABLE attmp ADD COLUMN e float4;
---END---
---START---
ALTER TABLE attmp ADD COLUMN f int2;
---END---
---START---
ALTER TABLE attmp ADD COLUMN g polygon;
---END---
---START---
ALTER TABLE attmp ADD COLUMN i char;
---END---
---START---
ALTER TABLE attmp ADD COLUMN k int4;
---END---
---START---
ALTER TABLE attmp ADD COLUMN l tid;
---END---
---START---
ALTER TABLE attmp ADD COLUMN m xid;
---END---
---START---
ALTER TABLE attmp ADD COLUMN n oidvector;
---END---
---START---
--ALTER TABLE attmp ADD COLUMN o lock;
ALTER TABLE attmp ADD COLUMN p boolean;
---END---
---START---
ALTER TABLE attmp ADD COLUMN q point;
---END---
---START---
ALTER TABLE attmp ADD COLUMN r lseg;
---END---
---START---
ALTER TABLE attmp ADD COLUMN s path;
---END---
---START---
ALTER TABLE attmp ADD COLUMN t box;
---END---
---START---
ALTER TABLE attmp ADD COLUMN v timestamp;
---END---
---START---
ALTER TABLE attmp ADD COLUMN w interval;
---END---
---START---
ALTER TABLE attmp ADD COLUMN x float8[];
---END---
---START---
ALTER TABLE attmp ADD COLUMN y float4[];
---END---
---START---
ALTER TABLE attmp ADD COLUMN z int2[];
---END---
---START---
INSERT INTO attmp (a, b, c, d, e, f, g,    i,   k, l, m, n, p, q, r, s, t,
	v, w, x, y, z)
   VALUES (4, 'name', 'text', 4.1, 4.1, 2, '(4.1,4.1,3.1,3.1)',
        'c',
	314159, '(1,1)', '512',
	'1 2 3 4 5 6 7 8', true, '(1.1,1.1)', '(4.1,4.1,3.1,3.1)',
	'(0,2,4.1,4.1,3.1,3.1)', '(4.1,4.1,3.1,3.1)',
	'epoch', '01:00:10', '{1.0,2.0,3.0,4.0}', '{1.0,2.0,3.0,4.0}', '{1,2,3,4}');
---END---
---START---
SELECT * FROM attmp;
 gemini_pk | initial | a |  b   |  c   |  d  |  e  | f |           g           | i |   k    |   l   |  m  |        n        | p |     q     |           r           |              s              |          t          |          v          |    w     |     x     |     y     |     z     
-----------+---------+---+------+------+-----+-----+---+-----------------------+---+--------+-------+-----+-----------------+---+-----------+-----------------------+-----------------------------+---------------------+---------------------+----------+-----------+-----------+-----------
         1 |         | 4 | name | text | 4.1 | 4.1 | 2 | ((4.1,4.1),(3.1,3.1)) | c | 314159 | (1,1) | 512 | 1 2 3 4 5 6 7 8 | t | (1.1,1.1) | [(4.1,4.1),(3.1,3.1)] | ((0,2),(4.1,4.1),(3.1,3.1)) | (4.1,4.1),(3.1,3.1) | 1970-01-01 00:00:00 | 01:00:10 | {1,2,3,4} | {1,2,3,4} | {1,2,3,4}
(1 row)

---END---
---START---
CREATE INDEX attmp_idx ON attmp (a, (d + e), b);
---END---
---START---
ALTER INDEX attmp_idx ALTER COLUMN 0 SET STATISTICS 1000;
ERROR:  column number must be in range from 1 to 32767
LINE 1: ALTER INDEX attmp_idx ALTER COLUMN 0 SET STATISTICS 1000;
                                           ^
---END---
---START---
ALTER INDEX attmp_idx ALTER COLUMN 1 SET STATISTICS 1000;
ERROR:  cannot alter statistics on non-expression column "a" of index "attmp_idx"
HINT:  Alter statistics on table column instead.
---END---
---START---
ALTER INDEX attmp_idx ALTER COLUMN 2 SET STATISTICS 1000;
---END---
---START---
\d+ attmp_idx
                        Index "public.attmp_idx"
 Column |       Type       | Key? | Definition | Storage | Stats target 
--------+------------------+------+------------+---------+--------------
 a      | integer          | yes  | a          | plain   | 
 expr   | double precision | yes  | (d + e)    | plain   | 1000
 b      | cstring          | yes  | b          | plain   | 
btree, for table "public.attmp"

ALTER INDEX attmp_idx ALTER COLUMN 3 SET STATISTICS 1000;
ERROR:  cannot alter statistics on non-expression column "b" of index "attmp_idx"
HINT:  Alter statistics on table column instead.
---END---
---START---
ALTER INDEX attmp_idx ALTER COLUMN 4 SET STATISTICS 1000;
ERROR:  column number 4 of relation "attmp_idx" does not exist
---END---
---START---
ALTER INDEX attmp_idx ALTER COLUMN 2 SET STATISTICS -1;
---END---
---START---
DROP TABLE attmp;
---END---
---START---
CREATE TABLE attmp (gemini_pk serial PRIMARY KEY, regtable integer);
---END---
---START---
DROP TABLE IF EXISTS attmp;
CREATE TABLE attmp (gemini_pk serial PRIMARY KEY, attmptable integer);
---END---
---START---
ALTER TABLE attmp RENAME TO attmp_new;
---END---
---START---
SELECT * FROM attmp;
ERROR:  relation "attmp" does not exist
LINE 1: SELECT * FROM attmp;
                      ^
---END---
---START---
SELECT * FROM attmp_new;
 gemini_pk | attmptable 
-----------+------------
(0 rows)

---END---
---START---
ALTER TABLE attmp RENAME TO attmp_new2;
ERROR:  relation "attmp" does not exist
---END---
---START---
SELECT * FROM attmp;
ERROR:  relation "attmp" does not exist
LINE 1: SELECT * FROM attmp;
                      ^
---END---
---START---
-- should fail
SELECT * FROM attmp_new;
 gemini_pk | attmptable 
-----------+------------
(0 rows)

---END---
---START---
SELECT * FROM attmp_new2;
ERROR:  relation "attmp_new2" does not exist
LINE 1: SELECT * FROM attmp_new2;
                      ^
---END---
---START---
DROP TABLE attmp_new;
---END---
---START---
DROP TABLE attmp_new2;
ERROR:  table "attmp_new2" does not exist
---END---
---START---
-- check rename of partitioned tables and indexes also
CREATE TABLE part_attmp (a int primary key) partition by range (a);
---END---
---START---
CREATE TABLE part_attmp1 PARTITION OF part_attmp FOR VALUES FROM (0) TO (100);
---END---
---START---
ALTER INDEX part_attmp_pkey RENAME TO part_attmp_index;
---END---
---START---
ALTER INDEX part_attmp1_pkey RENAME TO part_attmp1_index;
---END---
---START---
ALTER TABLE part_attmp RENAME TO part_at2tmp;
---END---
---START---
ALTER TABLE part_attmp1 RENAME TO part_at2tmp1;
---END---
---START---
SET ROLE regress_alter_table_user1;
---END---
---START---
ALTER INDEX part_attmp_index RENAME TO fail;
ERROR:  must be owner of index part_attmp_index
---END---
---START---
ALTER INDEX part_attmp1_index RENAME TO fail;
ERROR:  must be owner of index part_attmp1_index
---END---
---START---
ALTER TABLE part_at2tmp RENAME TO fail;
ERROR:  must be owner of table part_at2tmp
---END---
---START---
ALTER TABLE part_at2tmp1 RENAME TO fail;
ERROR:  must be owner of table part_at2tmp1
---END---
---START---
RESET ROLE;
---END---
---START---
DROP TABLE part_at2tmp;
---END---
---START---
CREATE TABLE attmp_array (gemini_pk serial PRIMARY KEY, id integer);
---END---
---START---
CREATE TABLE attmp_array2 (gemini_pk serial PRIMARY KEY, id integer);
---END---
---START---
SELECT typname FROM pg_type WHERE oid = 'attmp_array[]'::regtype;
   typname    
--------------
 _attmp_array
(1 row)

---END---
---START---
SELECT typname FROM pg_type WHERE oid = 'attmp_array2[]'::regtype;
    typname    
---------------
 _attmp_array2
(1 row)

---END---
---START---
ALTER TABLE attmp_array2 RENAME TO _attmp_array;
---END---
---START---
SELECT typname FROM pg_type WHERE oid = 'attmp_array[]'::regtype;
    typname    
---------------
 __attmp_array
(1 row)

---END---
---START---
SELECT typname FROM pg_type WHERE oid = '_attmp_array[]'::regtype;
     typname     
-----------------
 __attmp_array_1
(1 row)

---END---
---START---
DROP TABLE _attmp_array;
---END---
---START---
DROP TABLE attmp_array;
---END---
---START---
CREATE TABLE attmp_array (gemini_pk serial PRIMARY KEY, id integer);
---END---
---START---
SELECT typname FROM pg_type WHERE oid = 'attmp_array[]'::regtype;
   typname    
--------------
 _attmp_array
(1 row)

---END---
---START---
ALTER TABLE attmp_array RENAME TO _attmp_array;
---END---
---START---
SELECT typname FROM pg_type WHERE oid = '_attmp_array[]'::regtype;
    typname    
---------------
 __attmp_array
(1 row)

---END---
---START---
DROP TABLE _attmp_array;
---END---
---START---
-- ALTER TABLE ... RENAME on non-table relations
-- renaming indexes (FIXME: this should probably test the index's functionality)
ALTER INDEX IF EXISTS __onek_unique1 RENAME TO attmp_onek_unique1;
NOTICE:  relation "__onek_unique1" does not exist, skipping
---END---
---START---
ALTER INDEX IF EXISTS __attmp_onek_unique1 RENAME TO onek_unique1;
NOTICE:  relation "__attmp_onek_unique1" does not exist, skipping
---END---
---START---
ALTER INDEX onek_unique1 RENAME TO attmp_onek_unique1;
ERROR:  relation "onek_unique1" does not exist
---END---
---START---
ALTER INDEX attmp_onek_unique1 RENAME TO onek_unique1;
ERROR:  relation "attmp_onek_unique1" does not exist
---END---
---START---
SET ROLE regress_alter_table_user1;
---END---
---START---
ALTER INDEX onek_unique1 RENAME TO fail;
ERROR:  relation "onek_unique1" does not exist
---END---
---START---
-- permission denied
RESET ROLE;
---END---
---START---
CREATE TABLE alter_idx_rename_test (gemini_pk serial PRIMARY KEY, a integer);
---END---
---START---
CREATE INDEX alter_idx_rename_test_idx ON alter_idx_rename_test (a);
---END---
---START---
CREATE TABLE alter_idx_rename_test_parted (gemini_pk serial PRIMARY KEY, a integer) PARTITION BY list (a);
ERROR:  unique constraint on partitioned table must include all partitioning columns
DETAIL:  PRIMARY KEY constraint on table "alter_idx_rename_test_parted" lacks column "a" which is part of the partition key.
---END---
---START---
CREATE INDEX alter_idx_rename_test_parted_idx ON alter_idx_rename_test_parted (a);
ERROR:  relation "alter_idx_rename_test_parted" does not exist
---END---
---START---
BEGIN;
---END---
---START---
ALTER INDEX alter_idx_rename_test RENAME TO alter_idx_rename_test_2;
---END---
---START---
ALTER INDEX alter_idx_rename_test_parted RENAME TO alter_idx_rename_test_parted_2;
ERROR:  relation "alter_idx_rename_test_parted" does not exist
---END---
---START---
SELECT relation::regclass, mode FROM pg_locks
WHERE pid = pg_backend_pid() AND locktype = 'relation'
  AND relation::regclass::text LIKE 'alter\_idx%'
ORDER BY relation::regclass::text COLLATE "C";
ERROR:  current transaction is aborted, commands ignored until end of transaction block
---END---
---START---
COMMIT;
---END---
---START---
BEGIN;
---END---
---START---
ALTER INDEX alter_idx_rename_test_idx RENAME TO alter_idx_rename_test_idx_2;
---END---
---START---
ALTER INDEX alter_idx_rename_test_parted_idx RENAME TO alter_idx_rename_test_parted_idx_2;
ERROR:  relation "alter_idx_rename_test_parted_idx" does not exist
---END---
---START---
SELECT relation::regclass, mode FROM pg_locks
WHERE pid = pg_backend_pid() AND locktype = 'relation'
  AND relation::regclass::text LIKE 'alter\_idx%'
ORDER BY relation::regclass::text COLLATE "C";
ERROR:  current transaction is aborted, commands ignored until end of transaction block
---END---
---START---
COMMIT;
---END---
---START---
BEGIN;
---END---
---START---
ALTER TABLE alter_idx_rename_test_idx_2 RENAME TO alter_idx_rename_test_idx_3;
ERROR:  relation "alter_idx_rename_test_idx_2" does not exist
---END---
---START---
ALTER TABLE alter_idx_rename_test_parted_idx_2 RENAME TO alter_idx_rename_test_parted_idx_3;
ERROR:  current transaction is aborted, commands ignored until end of transaction block
---END---
---START---
SELECT relation::regclass, mode FROM pg_locks
WHERE pid = pg_backend_pid() AND locktype = 'relation'
  AND relation::regclass::text LIKE 'alter\_idx%'
ORDER BY relation::regclass::text COLLATE "C";
ERROR:  current transaction is aborted, commands ignored until end of transaction block
---END---
---START---
COMMIT;
---END---
---START---
DROP TABLE alter_idx_rename_test_2;
ERROR:  table "alter_idx_rename_test_2" does not exist
---END---
---START---
-- renaming views
CREATE VIEW attmp_view (unique1) AS SELECT unique1 FROM tenk1;
---END---
---START---
ALTER TABLE attmp_view RENAME TO attmp_view_new;
---END---
---START---
SET ROLE regress_alter_table_user1;
---END---
---START---
ALTER VIEW attmp_view_new RENAME TO fail;
ERROR:  must be owner of view attmp_view_new
---END---
---START---
-- permission denied
RESET ROLE;
---END---
---START---
-- hack to ensure we get an indexscan here
set enable_seqscan to off;
---END---
---START---
set enable_bitmapscan to off;
---END---
---START---
-- 5 values, sorted
SELECT unique1 FROM tenk1 WHERE unique1 < 5;
 unique1 
---------
       4
       2
       1
       3
       0
(5 rows)

---END---
---START---
reset enable_seqscan;
---END---
---START---
reset enable_bitmapscan;
---END---
---START---
DROP VIEW attmp_view_new;
---END---
---START---
-- toast-like relation name
alter table stud_emp rename to pg_toast_stud_emp;
---END---
---START---
alter table pg_toast_stud_emp rename to stud_emp;
---END---
---START---
-- renaming index should rename constraint as well
ALTER TABLE onek ADD CONSTRAINT onek_unique1_constraint UNIQUE (unique1);
---END---
---START---
ALTER INDEX onek_unique1_constraint RENAME TO onek_unique1_constraint_foo;
---END---
---START---
ALTER TABLE onek DROP CONSTRAINT onek_unique1_constraint_foo;
---END---
---START---
-- renaming constraint
ALTER TABLE onek ADD CONSTRAINT onek_check_constraint CHECK (unique1 >= 0);
---END---
---START---
ALTER TABLE onek RENAME CONSTRAINT onek_check_constraint TO onek_check_constraint_foo;
---END---
---START---
ALTER TABLE onek DROP CONSTRAINT onek_check_constraint_foo;
---END---
---START---
-- renaming constraint should rename index as well
ALTER TABLE onek ADD CONSTRAINT onek_unique1_constraint UNIQUE (unique1);
---END---
---START---
DROP INDEX onek_unique1_constraint;
ERROR:  cannot drop index onek_unique1_constraint because constraint onek_unique1_constraint on table onek requires it
HINT:  You can drop constraint onek_unique1_constraint on table onek instead.
---END---
---START---
-- to see whether it's there
ALTER TABLE onek RENAME CONSTRAINT onek_unique1_constraint TO onek_unique1_constraint_foo;
---END---
---START---
DROP INDEX onek_unique1_constraint_foo;
ERROR:  cannot drop index onek_unique1_constraint_foo because constraint onek_unique1_constraint_foo on table onek requires it
HINT:  You can drop constraint onek_unique1_constraint_foo on table onek instead.
---END---
---START---
-- to see whether it's there
ALTER TABLE onek DROP CONSTRAINT onek_unique1_constraint_foo;
---END---
---START---
CREATE TABLE constraint_rename_test (gemini_pk serial PRIMARY KEY, a integer CONSTRAINT con1 CHECK (a > 0), b integer, c integer);
---END---
---START---
\d constraint_rename_test
                                 Table "public.constraint_rename_test"
  Column   |  Type   | Collation | Nullable |                          Default                          
-----------+---------+-----------+----------+-----------------------------------------------------------
 gemini_pk | integer |           | not null | nextval('constraint_rename_test_gemini_pk_seq'::regclass)
 a         | integer |           |          | 
 b         | integer |           |          | 
 c         | integer |           |          | 
Indexes:
    "constraint_rename_test_pkey" PRIMARY KEY, btree (gemini_pk)
Check constraints:
    "con1" CHECK (a > 0)

CREATE TABLE constraint_rename_test2 (a int CONSTRAINT con1 CHECK (a > 0), d int) INHERITS (constraint_rename_test);
NOTICE:  moving and merging column "a" with inherited definition
DETAIL:  User-specified column moved to the position of the inherited column.
NOTICE:  merging constraint "con1" with inherited definition
---END---
---START---
\d constraint_rename_test2
                                 Table "public.constraint_rename_test2"
  Column   |  Type   | Collation | Nullable |                          Default                          
-----------+---------+-----------+----------+-----------------------------------------------------------
 gemini_pk | integer |           | not null | nextval('constraint_rename_test_gemini_pk_seq'::regclass)
 a         | integer |           |          | 
 b         | integer |           |          | 
 c         | integer |           |          | 
 d         | integer |           |          | 
Check constraints:
    "con1" CHECK (a > 0)
Inherits: constraint_rename_test

ALTER TABLE constraint_rename_test2 RENAME CONSTRAINT con1 TO con1foo;
ERROR:  cannot rename inherited constraint "con1"
---END---
---START---
-- fail
ALTER TABLE ONLY constraint_rename_test RENAME CONSTRAINT con1 TO con1foo;
ERROR:  inherited constraint "con1" must be renamed in child tables too
---END---
---START---
-- fail
ALTER TABLE constraint_rename_test RENAME CONSTRAINT con1 TO con1foo;
---END---
---START---
-- ok
\d constraint_rename_test
                                 Table "public.constraint_rename_test"
  Column   |  Type   | Collation | Nullable |                          Default                          
-----------+---------+-----------+----------+-----------------------------------------------------------
 gemini_pk | integer |           | not null | nextval('constraint_rename_test_gemini_pk_seq'::regclass)
 a         | integer |           |          | 
 b         | integer |           |          | 
 c         | integer |           |          | 
Indexes:
    "constraint_rename_test_pkey" PRIMARY KEY, btree (gemini_pk)
Check constraints:
    "con1foo" CHECK (a > 0)
Number of child tables: 1 (Use \d+ to list them.)

\d constraint_rename_test2
                                 Table "public.constraint_rename_test2"
  Column   |  Type   | Collation | Nullable |                          Default                          
-----------+---------+-----------+----------+-----------------------------------------------------------
 gemini_pk | integer |           | not null | nextval('constraint_rename_test_gemini_pk_seq'::regclass)
 a         | integer |           |          | 
 b         | integer |           |          | 
 c         | integer |           |          | 
 d         | integer |           |          | 
Check constraints:
    "con1foo" CHECK (a > 0)
Inherits: constraint_rename_test

ALTER TABLE constraint_rename_test ADD CONSTRAINT con2 CHECK (b > 0) NO INHERIT;
---END---
---START---
ALTER TABLE ONLY constraint_rename_test RENAME CONSTRAINT con2 TO con2foo;
---END---
---START---
-- ok
ALTER TABLE constraint_rename_test RENAME CONSTRAINT con2foo TO con2bar;
---END---
---START---
-- ok
\d constraint_rename_test
                                 Table "public.constraint_rename_test"
  Column   |  Type   | Collation | Nullable |                          Default                          
-----------+---------+-----------+----------+-----------------------------------------------------------
 gemini_pk | integer |           | not null | nextval('constraint_rename_test_gemini_pk_seq'::regclass)
 a         | integer |           |          | 
 b         | integer |           |          | 
 c         | integer |           |          | 
Indexes:
    "constraint_rename_test_pkey" PRIMARY KEY, btree (gemini_pk)
Check constraints:
    "con1foo" CHECK (a > 0)
    "con2bar" CHECK (b > 0) NO INHERIT
Number of child tables: 1 (Use \d+ to list them.)

\d constraint_rename_test2
                                 Table "public.constraint_rename_test2"
  Column   |  Type   | Collation | Nullable |                          Default                          
-----------+---------+-----------+----------+-----------------------------------------------------------
 gemini_pk | integer |           | not null | nextval('constraint_rename_test_gemini_pk_seq'::regclass)
 a         | integer |           |          | 
 b         | integer |           |          | 
 c         | integer |           |          | 
 d         | integer |           |          | 
Check constraints:
    "con1foo" CHECK (a > 0)
Inherits: constraint_rename_test

ALTER TABLE constraint_rename_test ADD CONSTRAINT con3 PRIMARY KEY (a);
ERROR:  multiple primary keys for table "constraint_rename_test" are not allowed
---END---
---START---
ALTER TABLE constraint_rename_test RENAME CONSTRAINT con3 TO con3foo;
ERROR:  constraint "con3" for table "constraint_rename_test" does not exist
---END---
---START---
-- ok
\d constraint_rename_test
                                 Table "public.constraint_rename_test"
  Column   |  Type   | Collation | Nullable |                          Default                          
-----------+---------+-----------+----------+-----------------------------------------------------------
 gemini_pk | integer |           | not null | nextval('constraint_rename_test_gemini_pk_seq'::regclass)
 a         | integer |           |          | 
 b         | integer |           |          | 
 c         | integer |           |          | 
Indexes:
    "constraint_rename_test_pkey" PRIMARY KEY, btree (gemini_pk)
Check constraints:
    "con1foo" CHECK (a > 0)
    "con2bar" CHECK (b > 0) NO INHERIT
Number of child tables: 1 (Use \d+ to list them.)

\d constraint_rename_test2
                                 Table "public.constraint_rename_test2"
  Column   |  Type   | Collation | Nullable |                          Default                          
-----------+---------+-----------+----------+-----------------------------------------------------------
 gemini_pk | integer |           | not null | nextval('constraint_rename_test_gemini_pk_seq'::regclass)
 a         | integer |           |          | 
 b         | integer |           |          | 
 c         | integer |           |          | 
 d         | integer |           |          | 
Check constraints:
    "con1foo" CHECK (a > 0)
Inherits: constraint_rename_test

DROP TABLE constraint_rename_test2;
---END---
---START---
DROP TABLE constraint_rename_test;
---END---
---START---
ALTER TABLE IF EXISTS constraint_not_exist RENAME CONSTRAINT con3 TO con3foo;
NOTICE:  relation "constraint_not_exist" does not exist, skipping
---END---
---START---
-- ok
ALTER TABLE IF EXISTS constraint_rename_test ADD CONSTRAINT con4 UNIQUE (a);
NOTICE:  relation "constraint_rename_test" does not exist, skipping
---END---
---START---
-- renaming constraints with cache reset of target relation
CREATE TABLE constraint_rename_cache (a int,
  CONSTRAINT chk_a CHECK (a > 0),
  PRIMARY KEY (a));
---END---
---START---
ALTER TABLE constraint_rename_cache
  RENAME CONSTRAINT chk_a TO chk_a_new;
---END---
---START---
ALTER TABLE constraint_rename_cache
  RENAME CONSTRAINT constraint_rename_cache_pkey TO constraint_rename_pkey_new;
---END---
---START---
CREATE TABLE like_constraint_rename_cache (gemini_pk serial PRIMARY KEY, LIKE constraint_rename_cache INCLUDING ALL);
ERROR:  multiple primary keys for table "like_constraint_rename_cache" are not allowed
---END---
---START---
\d like_constraint_rename_cache
DROP TABLE constraint_rename_cache;
---END---
---START---
DROP TABLE like_constraint_rename_cache;
ERROR:  table "like_constraint_rename_cache" does not exist
---END---
---START---
-- FOREIGN KEY CONSTRAINT adding TEST
CREATE TABLE attmp2 (a int primary key);
---END---
---START---
CREATE TABLE attmp3 (gemini_pk serial PRIMARY KEY, a integer, b integer);
---END---
---START---
CREATE TABLE attmp4 (gemini_pk serial PRIMARY KEY, a integer, b integer, UNIQUE (a, b));
---END---
---START---
CREATE TABLE attmp5 (gemini_pk serial PRIMARY KEY, a integer, b integer);
---END---
---START---
-- Insert rows into attmp2 (pktable)
INSERT INTO attmp2 values (1);
---END---
---START---
INSERT INTO attmp2 values (2);
---END---
---START---
INSERT INTO attmp2 values (3);
---END---
---START---
INSERT INTO attmp2 values (4);
---END---
---START---
-- Insert rows into attmp3
INSERT INTO attmp3 values (1,10);
---END---
---START---
INSERT INTO attmp3 values (1,20);
ERROR:  duplicate key value violates unique constraint "attmp3_pkey"
DETAIL:  Key (gemini_pk)=(1) already exists.
---END---
---START---
INSERT INTO attmp3 values (5,50);
---END---
---START---
-- Try (and fail) to add constraint due to invalid source columns
ALTER TABLE attmp3 add constraint attmpconstr foreign key(c) references attmp2 match full;
ERROR:  column "c" referenced in foreign key constraint does not exist
---END---
---START---
-- Try (and fail) to add constraint due to invalid destination columns explicitly given
ALTER TABLE attmp3 add constraint attmpconstr foreign key(a) references attmp2(b) match full;
ERROR:  column "b" referenced in foreign key constraint does not exist
---END---
---START---
-- Try (and fail) to add constraint due to invalid data
ALTER TABLE attmp3 add constraint attmpconstr foreign key (a) references attmp2 match full;
ERROR:  insert or update on table "attmp3" violates foreign key constraint "attmpconstr"
DETAIL:  Key (a)=(10) is not present in table "attmp2".
---END---
---START---
-- Delete failing row
DELETE FROM attmp3 where a=5;
---END---
---START---
-- Try (and succeed)
ALTER TABLE attmp3 add constraint attmpconstr foreign key (a) references attmp2 match full;
ERROR:  insert or update on table "attmp3" violates foreign key constraint "attmpconstr"
DETAIL:  Key (a)=(10) is not present in table "attmp2".
---END---
---START---
ALTER TABLE attmp3 drop constraint attmpconstr;
ERROR:  constraint "attmpconstr" of relation "attmp3" does not exist
---END---
---START---
INSERT INTO attmp3 values (5,50);
ERROR:  duplicate key value violates unique constraint "attmp3_pkey"
DETAIL:  Key (gemini_pk)=(5) already exists.
---END---
---START---
-- Try NOT VALID and then VALIDATE CONSTRAINT, but fails. Delete failure then re-validate
ALTER TABLE attmp3 add constraint attmpconstr foreign key (a) references attmp2 match full NOT VALID;
---END---
---START---
ALTER TABLE attmp3 validate constraint attmpconstr;
ERROR:  insert or update on table "attmp3" violates foreign key constraint "attmpconstr"
DETAIL:  Key (a)=(10) is not present in table "attmp2".
---END---
---START---
-- Delete failing row
DELETE FROM attmp3 where a=5;
---END---
---START---
-- Try (and succeed) and repeat to show it works on already valid constraint
ALTER TABLE attmp3 validate constraint attmpconstr;
ERROR:  insert or update on table "attmp3" violates foreign key constraint "attmpconstr"
DETAIL:  Key (a)=(10) is not present in table "attmp2".
---END---
---START---
ALTER TABLE attmp3 validate constraint attmpconstr;
ERROR:  insert or update on table "attmp3" violates foreign key constraint "attmpconstr"
DETAIL:  Key (a)=(10) is not present in table "attmp2".
---END---
---START---
-- Try a non-verified CHECK constraint
ALTER TABLE attmp3 ADD CONSTRAINT b_greater_than_ten CHECK (b > 10);
---END---
---START---
-- fail
ALTER TABLE attmp3 ADD CONSTRAINT b_greater_than_ten CHECK (b > 10) NOT VALID;
ERROR:  constraint "b_greater_than_ten" for relation "attmp3" already exists
---END---
---START---
-- succeeds
ALTER TABLE attmp3 VALIDATE CONSTRAINT b_greater_than_ten;
---END---
---START---
-- fails
DELETE FROM attmp3 WHERE NOT b > 10;
---END---
---START---
ALTER TABLE attmp3 VALIDATE CONSTRAINT b_greater_than_ten;
---END---
---START---
-- succeeds
ALTER TABLE attmp3 VALIDATE CONSTRAINT b_greater_than_ten;
---END---
---START---
-- succeeds
-- Test inherited NOT VALID CHECK constraints
select * from attmp3;
 gemini_pk | a  | b 
-----------+----+---
         1 | 10 |  
         5 | 50 |  
(2 rows)

---END---
---START---
CREATE TABLE attmp6 (gemini_pk serial PRIMARY KEY) INHERITS (attmp3);
NOTICE:  merging column "gemini_pk" with inherited definition
---END---
---START---
CREATE TABLE attmp7 (gemini_pk serial PRIMARY KEY) INHERITS (attmp3);
NOTICE:  merging column "gemini_pk" with inherited definition
---END---
---START---
INSERT INTO attmp6 VALUES (6, 30), (7, 16);
---END---
---START---
ALTER TABLE attmp3 ADD CONSTRAINT b_le_20 CHECK (b <= 20) NOT VALID;
---END---
---START---
ALTER TABLE attmp3 VALIDATE CONSTRAINT b_le_20;
---END---
---START---
-- fails
DELETE FROM attmp6 WHERE b > 20;
---END---
---START---
ALTER TABLE attmp3 VALIDATE CONSTRAINT b_le_20;
---END---
---START---
-- succeeds
-- An already validated constraint must not be revalidated
CREATE FUNCTION boo(int) RETURNS int IMMUTABLE STRICT LANGUAGE plpgsql AS $$ BEGIN RAISE NOTICE 'boo: %', $1; RETURN $1; END; $$;
---END---
---START---
INSERT INTO attmp7 VALUES (8, 18);
---END---
---START---
ALTER TABLE attmp7 ADD CONSTRAINT identity CHECK (b = boo(b));
---END---
---START---
ALTER TABLE attmp3 ADD CONSTRAINT IDENTITY check (b = boo(b)) NOT VALID;
NOTICE:  merging constraint "identity" with inherited definition
---END---
---START---
ALTER TABLE attmp3 VALIDATE CONSTRAINT identity;
---END---
---START---
CREATE TABLE parent_noinh_convalid (gemini_pk serial PRIMARY KEY, a integer);
---END---
---START---
CREATE TABLE child_noinh_convalid (gemini_pk serial PRIMARY KEY) INHERITS (parent_noinh_convalid);
NOTICE:  merging column "gemini_pk" with inherited definition
---END---
---START---
insert into parent_noinh_convalid values (1);
---END---
---START---
insert into child_noinh_convalid values (1);
---END---
---START---
alter table parent_noinh_convalid add constraint check_a_is_2 check (a = 2) no inherit not valid;
---END---
---START---
-- fail, because of the row in parent
alter table parent_noinh_convalid validate constraint check_a_is_2;
---END---
---START---
delete from only parent_noinh_convalid;
---END---
---START---
-- ok (parent itself contains no violating rows)
alter table parent_noinh_convalid validate constraint check_a_is_2;
---END---
---START---
select convalidated from pg_constraint where conrelid = 'parent_noinh_convalid'::regclass and conname = 'check_a_is_2';
 convalidated 
--------------
 t
(1 row)

---END---
---START---
-- cleanup
drop table parent_noinh_convalid, child_noinh_convalid;
---END---
---START---
-- Try (and fail) to create constraint from attmp5(a) to attmp4(a) - unique constraint on
-- attmp4 is a,b
ALTER TABLE attmp5 add constraint attmpconstr foreign key(a) references attmp4(a) match full;
ERROR:  there is no unique constraint matching given keys for referenced table "attmp4"
---END---
---START---
DROP TABLE attmp7;
---END---
---START---
DROP TABLE attmp6;
---END---
---START---
DROP TABLE attmp5;
---END---
---START---
DROP TABLE attmp4;
---END---
---START---
DROP TABLE attmp3;
---END---
---START---
DROP TABLE attmp2;
---END---
---START---
-- NOT VALID with plan invalidation -- ensure we don't use a constraint for
-- exclusion until validated
set constraint_exclusion TO 'partition';
---END---
---START---
CREATE TABLE nv_parent (gemini_pk serial PRIMARY KEY, d date, CHECK (FALSE) NO INHERIT NOT VALID);
---END---
---START---
-- not valid constraint added at creation time should automatically become valid
\d nv_parent
                                 Table "public.nv_parent"
  Column   |  Type   | Collation | Nullable |                   Default                    
-----------+---------+-----------+----------+----------------------------------------------
 gemini_pk | integer |           | not null | nextval('nv_parent_gemini_pk_seq'::regclass)
 d         | date    |           |          | 
Indexes:
    "nv_parent_pkey" PRIMARY KEY, btree (gemini_pk)
Check constraints:
    "nv_parent_check" CHECK (false) NO INHERIT

create table nv_child_2010 () inherits (nv_parent);
---END---
---START---
CREATE TABLE nv_child_2011 (gemini_pk serial PRIMARY KEY) INHERITS (nv_parent);
NOTICE:  merging column "gemini_pk" with inherited definition
---END---
---START---
alter table nv_child_2010 add check (d between '2010-01-01'::date and '2010-12-31'::date) not valid;
---END---
---START---
alter table nv_child_2011 add check (d between '2011-01-01'::date and '2011-12-31'::date) not valid;
---END---
---START---
explain (costs off) select * from nv_parent where d between '2011-08-01' and '2011-08-31';
                                QUERY PLAN                                 
---------------------------------------------------------------------------
 Append
   ->  Seq Scan on nv_parent nv_parent_1
         Filter: ((d >= '2011-08-01'::date) AND (d <= '2011-08-31'::date))
   ->  Seq Scan on nv_child_2010 nv_parent_2
         Filter: ((d >= '2011-08-01'::date) AND (d <= '2011-08-31'::date))
   ->  Seq Scan on nv_child_2011 nv_parent_3
         Filter: ((d >= '2011-08-01'::date) AND (d <= '2011-08-31'::date))
(7 rows)

---END---
---START---
CREATE TABLE nv_child_2009 (gemini_pk serial PRIMARY KEY, CHECK (d BETWEEN CAST('2009-01-01' AS date) AND CAST('2009-12-31' AS date))) INHERITS (nv_parent);
NOTICE:  merging column "gemini_pk" with inherited definition
---END---
---START---
explain (costs off) select * from nv_parent where d between '2011-08-01'::date and '2011-08-31'::date;
                                QUERY PLAN                                 
---------------------------------------------------------------------------
 Append
   ->  Seq Scan on nv_parent nv_parent_1
         Filter: ((d >= '2011-08-01'::date) AND (d <= '2011-08-31'::date))
   ->  Seq Scan on nv_child_2010 nv_parent_2
         Filter: ((d >= '2011-08-01'::date) AND (d <= '2011-08-31'::date))
   ->  Seq Scan on nv_child_2011 nv_parent_3
         Filter: ((d >= '2011-08-01'::date) AND (d <= '2011-08-31'::date))
(7 rows)

---END---
---START---
explain (costs off) select * from nv_parent where d between '2009-08-01'::date and '2009-08-31'::date;
                                QUERY PLAN                                 
---------------------------------------------------------------------------
 Append
   ->  Seq Scan on nv_parent nv_parent_1
         Filter: ((d >= '2009-08-01'::date) AND (d <= '2009-08-31'::date))
   ->  Seq Scan on nv_child_2010 nv_parent_2
         Filter: ((d >= '2009-08-01'::date) AND (d <= '2009-08-31'::date))
   ->  Seq Scan on nv_child_2011 nv_parent_3
         Filter: ((d >= '2009-08-01'::date) AND (d <= '2009-08-31'::date))
   ->  Seq Scan on nv_child_2009 nv_parent_4
         Filter: ((d >= '2009-08-01'::date) AND (d <= '2009-08-31'::date))
(9 rows)

---END---
---START---
-- after validation, the constraint should be used
alter table nv_child_2011 VALIDATE CONSTRAINT nv_child_2011_d_check;
---END---
---START---
explain (costs off) select * from nv_parent where d between '2009-08-01'::date and '2009-08-31'::date;
                                QUERY PLAN                                 
---------------------------------------------------------------------------
 Append
   ->  Seq Scan on nv_parent nv_parent_1
         Filter: ((d >= '2009-08-01'::date) AND (d <= '2009-08-31'::date))
   ->  Seq Scan on nv_child_2010 nv_parent_2
         Filter: ((d >= '2009-08-01'::date) AND (d <= '2009-08-31'::date))
   ->  Seq Scan on nv_child_2009 nv_parent_3
         Filter: ((d >= '2009-08-01'::date) AND (d <= '2009-08-31'::date))
(7 rows)

---END---
---START---
-- add an inherited NOT VALID constraint
alter table nv_parent add check (d between '2001-01-01'::date and '2099-12-31'::date) not valid;
---END---
---START---
\d nv_child_2009
                                 Table "public.nv_child_2009"
  Column   |  Type   | Collation | Nullable |                     Default                      
-----------+---------+-----------+----------+--------------------------------------------------
 gemini_pk | integer |           | not null | nextval('nv_child_2009_gemini_pk_seq'::regclass)
 d         | date    |           |          | 
Indexes:
    "nv_child_2009_pkey" PRIMARY KEY, btree (gemini_pk)
Check constraints:
    "nv_child_2009_d_check" CHECK (d >= '2009-01-01'::date AND d <= '2009-12-31'::date)
    "nv_parent_d_check" CHECK (d >= '2001-01-01'::date AND d <= '2099-12-31'::date) NOT VALID
Inherits: nv_parent

-- we leave nv_parent and children around to help test pg_dump logic
-- Foreign key adding test with mixed types
-- Note: these tables are TEMP to avoid name conflicts when this test
-- is run in parallel with foreign_key.sql.
DROP TABLE IF EXISTS PKTABLE;
NOTICE:  table "pktable" does not exist, skipping
CREATE TABLE PKTABLE (ptest1 int PRIMARY KEY);
---END---
---START---
INSERT INTO PKTABLE VALUES(42);
---END---
---START---
DROP TABLE IF EXISTS FKTABLE;
NOTICE:  table "fktable" does not exist, skipping
CREATE TABLE fktable (gemini_pk serial PRIMARY KEY, ftest1 inet);
---END---
---START---
-- This next should fail, because int=inet does not exist
ALTER TABLE FKTABLE ADD FOREIGN KEY(ftest1) references pktable;
ERROR:  foreign key constraint "fktable_ftest1_fkey" cannot be implemented
DETAIL:  Key columns "ftest1" and "ptest1" are of incompatible types: inet and integer.
---END---
---START---
-- This should also fail for the same reason, but here we
-- give the column name
ALTER TABLE FKTABLE ADD FOREIGN KEY(ftest1) references pktable(ptest1);
ERROR:  foreign key constraint "fktable_ftest1_fkey" cannot be implemented
DETAIL:  Key columns "ftest1" and "ptest1" are of incompatible types: inet and integer.
---END---
---START---
DROP TABLE FKTABLE;
---END---
---START---
-- This should succeed, even though they are different types,
-- because int=int8 exists and is a member of the integer opfamily
DROP TABLE IF EXISTS FKTABLE;
NOTICE:  table "fktable" does not exist, skipping
CREATE TABLE fktable (gemini_pk serial PRIMARY KEY, ftest1 int8);
---END---
---START---
ALTER TABLE FKTABLE ADD FOREIGN KEY(ftest1) references pktable;
---END---
---START---
-- Check it actually works
INSERT INTO FKTABLE VALUES(42);
---END---
---START---
-- should succeed
INSERT INTO FKTABLE VALUES(43);
---END---
---START---
-- should fail
DROP TABLE FKTABLE;
---END---
---START---
-- This should fail, because we'd have to cast numeric to int which is
-- not an implicit coercion (or use numeric=numeric, but that's not part
-- of the integer opfamily)
DROP TABLE IF EXISTS FKTABLE;
NOTICE:  table "fktable" does not exist, skipping
CREATE TABLE fktable (gemini_pk serial PRIMARY KEY, ftest1 numeric);
---END---
---START---
ALTER TABLE FKTABLE ADD FOREIGN KEY(ftest1) references pktable;
ERROR:  foreign key constraint "fktable_ftest1_fkey" cannot be implemented
DETAIL:  Key columns "ftest1" and "ptest1" are of incompatible types: numeric and integer.
---END---
---START---
DROP TABLE FKTABLE;
---END---
---START---
DROP TABLE PKTABLE;
---END---
---START---
-- On the other hand, this should work because int implicitly promotes to
-- numeric, and we allow promotion on the FK side
DROP TABLE IF EXISTS PKTABLE;
NOTICE:  table "pktable" does not exist, skipping
CREATE TABLE PKTABLE (ptest1 numeric PRIMARY KEY);
---END---
---START---
INSERT INTO PKTABLE VALUES(42);
---END---
---START---
DROP TABLE IF EXISTS FKTABLE;
NOTICE:  table "fktable" does not exist, skipping
CREATE TABLE fktable (gemini_pk serial PRIMARY KEY, ftest1 integer);
---END---
---START---
ALTER TABLE FKTABLE ADD FOREIGN KEY(ftest1) references pktable;
---END---
---START---
-- Check it actually works
INSERT INTO FKTABLE VALUES(42);
---END---
---START---
-- should succeed
INSERT INTO FKTABLE VALUES(43);
---END---
---START---
-- should fail
DROP TABLE FKTABLE;
---END---
---START---
DROP TABLE PKTABLE;
---END---
---START---
DROP TABLE IF EXISTS PKTABLE;
NOTICE:  table "pktable" does not exist, skipping
CREATE TABLE PKTABLE (ptest1 int, ptest2 inet,
                           PRIMARY KEY(ptest1, ptest2));
---END---
---START---
-- This should fail, because we just chose really odd types
DROP TABLE IF EXISTS FKTABLE;
NOTICE:  table "fktable" does not exist, skipping
CREATE TABLE fktable (gemini_pk serial PRIMARY KEY, ftest1 cidr, ftest2 timestamp);
---END---
---START---
ALTER TABLE FKTABLE ADD FOREIGN KEY(ftest1, ftest2) references pktable;
ERROR:  foreign key constraint "fktable_ftest1_ftest2_fkey" cannot be implemented
DETAIL:  Key columns "ftest1" and "ptest1" are of incompatible types: cidr and integer.
---END---
---START---
DROP TABLE FKTABLE;
---END---
---START---
-- Again, so should this...
DROP TABLE IF EXISTS FKTABLE;
NOTICE:  table "fktable" does not exist, skipping
CREATE TABLE fktable (gemini_pk serial PRIMARY KEY, ftest1 cidr, ftest2 timestamp);
---END---
---START---
ALTER TABLE FKTABLE ADD FOREIGN KEY(ftest1, ftest2)
     references pktable(ptest1, ptest2);
ERROR:  foreign key constraint "fktable_ftest1_ftest2_fkey" cannot be implemented
DETAIL:  Key columns "ftest1" and "ptest1" are of incompatible types: cidr and integer.
---END---
---START---
DROP TABLE FKTABLE;
---END---
---START---
-- This fails because we mixed up the column ordering
DROP TABLE IF EXISTS FKTABLE;
NOTICE:  table "fktable" does not exist, skipping
CREATE TABLE fktable (gemini_pk serial PRIMARY KEY, ftest1 integer, ftest2 inet);
---END---
---START---
ALTER TABLE FKTABLE ADD FOREIGN KEY(ftest1, ftest2)
     references pktable(ptest2, ptest1);
ERROR:  foreign key constraint "fktable_ftest1_ftest2_fkey" cannot be implemented
DETAIL:  Key columns "ftest1" and "ptest2" are of incompatible types: integer and inet.
---END---
---START---
-- As does this...
ALTER TABLE FKTABLE ADD FOREIGN KEY(ftest2, ftest1)
     references pktable(ptest1, ptest2);
ERROR:  foreign key constraint "fktable_ftest2_ftest1_fkey" cannot be implemented
DETAIL:  Key columns "ftest2" and "ptest1" are of incompatible types: inet and integer.
---END---
---START---
DROP TABLE FKTABLE;
---END---
---START---
DROP TABLE PKTABLE;
---END---
---START---
-- Test that ALTER CONSTRAINT updates trigger deferrability properly
DROP TABLE IF EXISTS PKTABLE;
NOTICE:  table "pktable" does not exist, skipping
CREATE TABLE PKTABLE (ptest1 int primary key);
---END---
---START---
DROP TABLE IF EXISTS FKTABLE;
NOTICE:  table "fktable" does not exist, skipping
CREATE TABLE fktable (gemini_pk serial PRIMARY KEY, ftest1 integer);
---END---
---START---
ALTER TABLE FKTABLE ADD CONSTRAINT fknd FOREIGN KEY(ftest1) REFERENCES pktable
  ON DELETE CASCADE ON UPDATE NO ACTION NOT DEFERRABLE;
---END---
---START---
ALTER TABLE FKTABLE ADD CONSTRAINT fkdd FOREIGN KEY(ftest1) REFERENCES pktable
  ON DELETE CASCADE ON UPDATE NO ACTION DEFERRABLE INITIALLY DEFERRED;
---END---
---START---
ALTER TABLE FKTABLE ADD CONSTRAINT fkdi FOREIGN KEY(ftest1) REFERENCES pktable
  ON DELETE CASCADE ON UPDATE NO ACTION DEFERRABLE INITIALLY IMMEDIATE;
---END---
---START---
ALTER TABLE FKTABLE ADD CONSTRAINT fknd2 FOREIGN KEY(ftest1) REFERENCES pktable
  ON DELETE CASCADE ON UPDATE NO ACTION DEFERRABLE INITIALLY DEFERRED;
---END---
---START---
ALTER TABLE FKTABLE ALTER CONSTRAINT fknd2 NOT DEFERRABLE;
---END---
---START---
ALTER TABLE FKTABLE ADD CONSTRAINT fkdd2 FOREIGN KEY(ftest1) REFERENCES pktable
  ON DELETE CASCADE ON UPDATE NO ACTION NOT DEFERRABLE;
---END---
---START---
ALTER TABLE FKTABLE ALTER CONSTRAINT fkdd2 DEFERRABLE INITIALLY DEFERRED;
---END---
---START---
ALTER TABLE FKTABLE ADD CONSTRAINT fkdi2 FOREIGN KEY(ftest1) REFERENCES pktable
  ON DELETE CASCADE ON UPDATE NO ACTION NOT DEFERRABLE;
---END---
---START---
ALTER TABLE FKTABLE ALTER CONSTRAINT fkdi2 DEFERRABLE INITIALLY IMMEDIATE;
---END---
---START---
SELECT conname, tgfoid::regproc, tgtype, tgdeferrable, tginitdeferred
FROM pg_trigger JOIN pg_constraint con ON con.oid = tgconstraint
WHERE tgrelid = 'pktable'::regclass
ORDER BY 1,2,3;
 conname |         tgfoid         | tgtype | tgdeferrable | tginitdeferred 
---------+------------------------+--------+--------------+----------------
 fkdd    | "RI_FKey_cascade_del"  |      9 | f            | f
 fkdd    | "RI_FKey_noaction_upd" |     17 | t            | t
 fkdd2   | "RI_FKey_cascade_del"  |      9 | f            | f
 fkdd2   | "RI_FKey_noaction_upd" |     17 | t            | t
 fkdi    | "RI_FKey_cascade_del"  |      9 | f            | f
 fkdi    | "RI_FKey_noaction_upd" |     17 | t            | f
 fkdi2   | "RI_FKey_cascade_del"  |      9 | f            | f
 fkdi2   | "RI_FKey_noaction_upd" |     17 | t            | f
 fknd    | "RI_FKey_cascade_del"  |      9 | f            | f
 fknd    | "RI_FKey_noaction_upd" |     17 | f            | f
 fknd2   | "RI_FKey_cascade_del"  |      9 | f            | f
 fknd2   | "RI_FKey_noaction_upd" |     17 | f            | f
(12 rows)

---END---
---START---
SELECT conname, tgfoid::regproc, tgtype, tgdeferrable, tginitdeferred
FROM pg_trigger JOIN pg_constraint con ON con.oid = tgconstraint
WHERE tgrelid = 'fktable'::regclass
ORDER BY 1,2,3;
 conname |       tgfoid        | tgtype | tgdeferrable | tginitdeferred 
---------+---------------------+--------+--------------+----------------
 fkdd    | "RI_FKey_check_ins" |      5 | t            | t
 fkdd    | "RI_FKey_check_upd" |     17 | t            | t
 fkdd2   | "RI_FKey_check_ins" |      5 | t            | t
 fkdd2   | "RI_FKey_check_upd" |     17 | t            | t
 fkdi    | "RI_FKey_check_ins" |      5 | t            | f
 fkdi    | "RI_FKey_check_upd" |     17 | t            | f
 fkdi2   | "RI_FKey_check_ins" |      5 | t            | f
 fkdi2   | "RI_FKey_check_upd" |     17 | t            | f
 fknd    | "RI_FKey_check_ins" |      5 | f            | f
 fknd    | "RI_FKey_check_upd" |     17 | f            | f
 fknd2   | "RI_FKey_check_ins" |      5 | f            | f
 fknd2   | "RI_FKey_check_upd" |     17 | f            | f
(12 rows)

---END---
---START---
CREATE TABLE atacc1 (gemini_pk serial PRIMARY KEY, test integer);
---END---
---START---
-- add a check constraint
alter table atacc1 add constraint atacc_test1 check (test>3);
---END---
---START---
-- should fail
insert into atacc1 (test) values (2);
ERROR:  new row for relation "atacc1" violates check constraint "atacc_test1"
DETAIL:  Failing row contains (1, 2).
---END---
---START---
-- should succeed
insert into atacc1 (test) values (4);
---END---
---START---
drop table atacc1;
---END---
---START---
CREATE TABLE atacc1 (gemini_pk serial PRIMARY KEY, test integer);
---END---
---START---
-- insert a soon to be failing row
insert into atacc1 (test) values (2);
---END---
---START---
-- add a check constraint (fails)
alter table atacc1 add constraint atacc_test1 check (test>3);
ERROR:  check constraint "atacc_test1" of relation "atacc1" is violated by some row
---END---
---START---
insert into atacc1 (test) values (4);
---END---
---START---
drop table atacc1;
---END---
---START---
CREATE TABLE atacc1 (gemini_pk serial PRIMARY KEY, test integer);
---END---
---START---
-- add a check constraint (fails)
alter table atacc1 add constraint atacc_test1 check (test1>3);
ERROR:  column "test1" does not exist
HINT:  Perhaps you meant to reference the column "atacc1.test".
---END---
---START---
drop table atacc1;
---END---
---START---
CREATE TABLE atacc1 (gemini_pk serial PRIMARY KEY, test integer, test2 integer, test3 integer);
---END---
---START---
-- add a check constraint (fails)
alter table atacc1 add constraint atacc_test1 check (test+test2<test3*4);
---END---
---START---
-- should fail
insert into atacc1 (test,test2,test3) values (4,4,2);
ERROR:  new row for relation "atacc1" violates check constraint "atacc_test1"
DETAIL:  Failing row contains (1, 4, 4, 2).
---END---
---START---
-- should succeed
insert into atacc1 (test,test2,test3) values (4,4,5);
---END---
---START---
drop table atacc1;
---END---
---START---
CREATE TABLE atacc1 (gemini_pk serial PRIMARY KEY, test integer CHECK (test > 3), test2 integer);
---END---
---START---
alter table atacc1 add check (test2>test);
---END---
---START---
-- should fail for $2
insert into atacc1 (test2, test) values (3, 4);
ERROR:  new row for relation "atacc1" violates check constraint "atacc1_check"
DETAIL:  Failing row contains (1, 4, 3).
---END---
---START---
drop table atacc1;
---END---
---START---
CREATE TABLE atacc1 (gemini_pk serial PRIMARY KEY, test integer);
---END---
---START---
CREATE TABLE atacc2 (gemini_pk serial PRIMARY KEY, test2 integer);
---END---
---START---
CREATE TABLE atacc3 (gemini_pk serial PRIMARY KEY, test3 integer) INHERITS (atacc1, atacc2);
NOTICE:  merging multiple inherited definitions of column "gemini_pk"
NOTICE:  merging column "gemini_pk" with inherited definition
---END---
---START---
alter table atacc2 add constraint foo check (test2>0);
---END---
---START---
-- fail and then succeed on atacc2
insert into atacc2 (test2) values (-3);
ERROR:  new row for relation "atacc2" violates check constraint "foo"
DETAIL:  Failing row contains (1, -3).
---END---
---START---
insert into atacc2 (test2) values (3);
---END---
---START---
-- fail and then succeed on atacc3
insert into atacc3 (test2) values (-3);
ERROR:  new row for relation "atacc3" violates check constraint "foo"
DETAIL:  Failing row contains (1, null, -3, null).
---END---
---START---
insert into atacc3 (test2) values (3);
---END---
---START---
drop table atacc3;
---END---
---START---
drop table atacc2;
---END---
---START---
drop table atacc1;
---END---
---START---
CREATE TABLE atacc1 (gemini_pk serial PRIMARY KEY, test integer);
---END---
---START---
CREATE TABLE atacc2 (gemini_pk serial PRIMARY KEY, test2 integer);
---END---
---START---
CREATE TABLE atacc3 (gemini_pk serial PRIMARY KEY, test3 integer) INHERITS (atacc1, atacc2);
NOTICE:  merging multiple inherited definitions of column "gemini_pk"
NOTICE:  merging column "gemini_pk" with inherited definition
---END---
---START---
alter table atacc3 no inherit atacc2;
---END---
---START---
-- fail
alter table atacc3 no inherit atacc2;
ERROR:  relation "atacc2" is not a parent of relation "atacc3"
---END---
---START---
-- make sure it really isn't a child
insert into atacc3 (test2) values (3);
---END---
---START---
select test2 from atacc2;
 test2 
-------
(0 rows)

---END---
---START---
-- fail due to missing constraint
alter table atacc2 add constraint foo check (test2>0);
---END---
---START---
alter table atacc3 inherit atacc2;
ERROR:  child table is missing constraint "foo"
---END---
---START---
-- fail due to missing column
alter table atacc3 rename test2 to testx;
---END---
---START---
alter table atacc3 inherit atacc2;
ERROR:  child table is missing column "test2"
---END---
---START---
-- fail due to mismatched data type
alter table atacc3 add test2 bool;
---END---
---START---
alter table atacc3 inherit atacc2;
ERROR:  child table "atacc3" has different type for column "test2"
---END---
---START---
alter table atacc3 drop test2;
---END---
---START---
-- succeed
alter table atacc3 add test2 int;
---END---
---START---
update atacc3 set test2 = 4 where test2 is null;
---END---
---START---
alter table atacc3 add constraint foo check (test2>0);
---END---
---START---
alter table atacc3 inherit atacc2;
---END---
---START---
-- fail due to duplicates and circular inheritance
alter table atacc3 inherit atacc2;
ERROR:  relation "atacc2" would be inherited from more than once
---END---
---START---
alter table atacc2 inherit atacc3;
ERROR:  circular inheritance not allowed
DETAIL:  "atacc3" is already a child of "atacc2".
---END---
---START---
alter table atacc2 inherit atacc2;
ERROR:  circular inheritance not allowed
DETAIL:  "atacc2" is already a child of "atacc2".
---END---
---START---
-- test that we really are a child now (should see 4 not 3 and cascade should go through)
select test2 from atacc2;
 test2 
-------
     4
(1 row)

---END---
---START---
drop table atacc2 cascade;
NOTICE:  drop cascades to table atacc3
---END---
---START---
drop table atacc1;
---END---
---START---
CREATE TABLE atacc1 (gemini_pk serial PRIMARY KEY, test integer);
---END---
---START---
CREATE TABLE atacc2 (gemini_pk serial PRIMARY KEY, test2 integer) INHERITS (atacc1);
NOTICE:  merging column "gemini_pk" with inherited definition
---END---
---START---
-- ok:
alter table atacc1 add constraint foo check (test>0) no inherit;
---END---
---START---
-- check constraint is not there on child
insert into atacc2 (test) values (-3);
---END---
---START---
-- check constraint is there on parent
insert into atacc1 (test) values (-3);
ERROR:  new row for relation "atacc1" violates check constraint "foo"
DETAIL:  Failing row contains (1, -3).
---END---
---START---
insert into atacc1 (test) values (3);
---END---
---START---
-- fail, violating row:
alter table atacc2 add constraint foo check (test>0) no inherit;
ERROR:  check constraint "foo" of relation "atacc2" is violated by some row
---END---
---START---
drop table atacc2;
---END---
---START---
drop table atacc1;
---END---
---START---
CREATE TABLE atacc1 (gemini_pk serial PRIMARY KEY, test integer);
---END---
---START---
-- add a unique constraint
alter table atacc1 add constraint atacc_test1 unique (test);
---END---
---START---
-- insert first value
insert into atacc1 (test) values (2);
---END---
---START---
-- should fail
insert into atacc1 (test) values (2);
ERROR:  duplicate key value violates unique constraint "atacc_test1"
DETAIL:  Key (test)=(2) already exists.
---END---
---START---
-- should succeed
insert into atacc1 (test) values (4);
---END---
---START---
-- try to create duplicates via alter table using - should fail
alter table atacc1 alter column test type integer using 0;
ERROR:  could not create unique index "atacc_test1"
DETAIL:  Key (test)=(0) is duplicated.
---END---
---START---
drop table atacc1;
---END---
---START---
CREATE TABLE atacc1 (gemini_pk serial PRIMARY KEY, test integer);
---END---
---START---
-- insert soon to be failing rows
insert into atacc1 (test) values (2);
---END---
---START---
insert into atacc1 (test) values (2);
---END---
---START---
-- add a unique constraint (fails)
alter table atacc1 add constraint atacc_test1 unique (test);
ERROR:  could not create unique index "atacc_test1"
DETAIL:  Key (test)=(2) is duplicated.
---END---
---START---
insert into atacc1 (test) values (3);
---END---
---START---
drop table atacc1;
---END---
---START---
CREATE TABLE atacc1 (gemini_pk serial PRIMARY KEY, test integer);
---END---
---START---
-- add a unique constraint (fails)
alter table atacc1 add constraint atacc_test1 unique (test1);
ERROR:  column "test1" named in key does not exist
---END---
---START---
drop table atacc1;
---END---
---START---
CREATE TABLE atacc1 (gemini_pk serial PRIMARY KEY, test integer, test2 integer);
---END---
---START---
-- add a unique constraint
alter table atacc1 add constraint atacc_test1 unique (test, test2);
---END---
---START---
-- insert initial value
insert into atacc1 (test,test2) values (4,4);
---END---
---START---
-- should fail
insert into atacc1 (test,test2) values (4,4);
ERROR:  duplicate key value violates unique constraint "atacc_test1"
DETAIL:  Key (test, test2)=(4, 4) already exists.
---END---
---START---
-- should all succeed
insert into atacc1 (test,test2) values (4,5);
---END---
---START---
insert into atacc1 (test,test2) values (5,4);
---END---
---START---
insert into atacc1 (test,test2) values (5,5);
---END---
---START---
drop table atacc1;
---END---
---START---
CREATE TABLE atacc1 (gemini_pk serial PRIMARY KEY, test integer, test2 integer, UNIQUE (test));
---END---
---START---
alter table atacc1 add unique (test2);
---END---
---START---
-- should fail for @@ second one @@
insert into atacc1 (test2, test) values (3, 3);
---END---
---START---
insert into atacc1 (test2, test) values (2, 3);
ERROR:  duplicate key value violates unique constraint "atacc1_test_key"
DETAIL:  Key (test)=(3) already exists.
---END---
---START---
drop table atacc1;
---END---
---START---
CREATE TABLE atacc1 (gemini_pk serial PRIMARY KEY, id serial, test integer);
---END---
---START---
-- add a primary key constraint
alter table atacc1 add constraint atacc_test1 primary key (test);
ERROR:  multiple primary keys for table "atacc1" are not allowed
---END---
---START---
-- insert first value
insert into atacc1 (test) values (2);
---END---
---START---
-- should fail
insert into atacc1 (test) values (2);
---END---
---START---
-- should succeed
insert into atacc1 (test) values (4);
---END---
---START---
-- inserting NULL should fail
insert into atacc1 (test) values(NULL);
---END---
---START---
-- try adding a second primary key (should fail)
alter table atacc1 add constraint atacc_oid1 primary key(id);
ERROR:  multiple primary keys for table "atacc1" are not allowed
---END---
---START---
-- drop first primary key constraint
alter table atacc1 drop constraint atacc_test1 restrict;
ERROR:  constraint "atacc_test1" of relation "atacc1" does not exist
---END---
---START---
-- try adding a primary key on oid (should succeed)
alter table atacc1 add constraint atacc_oid1 primary key(id);
ERROR:  multiple primary keys for table "atacc1" are not allowed
---END---
---START---
drop table atacc1;
---END---
---START---
CREATE TABLE atacc1 (gemini_pk serial PRIMARY KEY, test integer);
---END---
---START---
-- insert soon to be failing rows
insert into atacc1 (test) values (2);
---END---
---START---
insert into atacc1 (test) values (2);
---END---
---START---
-- add a primary key (fails)
alter table atacc1 add constraint atacc_test1 primary key (test);
ERROR:  multiple primary keys for table "atacc1" are not allowed
---END---
---START---
insert into atacc1 (test) values (3);
---END---
---START---
drop table atacc1;
---END---
---START---
CREATE TABLE atacc1 (gemini_pk serial PRIMARY KEY, test integer);
---END---
---START---
-- insert soon to be failing row
insert into atacc1 (test) values (NULL);
---END---
---START---
-- add a primary key (fails)
alter table atacc1 add constraint atacc_test1 primary key (test);
ERROR:  multiple primary keys for table "atacc1" are not allowed
---END---
---START---
insert into atacc1 (test) values (3);
---END---
---START---
drop table atacc1;
---END---
---START---
CREATE TABLE atacc1 (gemini_pk serial PRIMARY KEY, test integer);
---END---
---START---
-- add a primary key constraint (fails)
alter table atacc1 add constraint atacc_test1 primary key (test1);
ERROR:  column "test1" of relation "atacc1" does not exist
---END---
---START---
drop table atacc1;
---END---
---START---
CREATE TABLE atacc1 (gemini_pk serial PRIMARY KEY, test integer);
---END---
---START---
insert into atacc1 (test) values (0);
---END---
---START---
-- add a primary key column without a default (fails).
alter table atacc1 add column test2 int primary key;
ERROR:  multiple primary keys for table "atacc1" are not allowed
---END---
---START---
-- now add a primary key column with a default (succeeds).
alter table atacc1 add column test2 int default 0 primary key;
ERROR:  multiple primary keys for table "atacc1" are not allowed
---END---
---START---
drop table atacc1;
---END---
---START---
CREATE TABLE atacc1 (gemini_pk serial PRIMARY KEY, a integer);
---END---
---START---
insert into atacc1 values(1);
---END---
---START---
alter table atacc1
  add column b float8 not null default random(),
  add primary key(a);
ERROR:  multiple primary keys for table "atacc1" are not allowed
---END---
---START---
drop table atacc1;
---END---
---START---
-- additionally, we've seen issues with foreign key validation not being
-- properly delayed until after a table rewrite.  Check that works ok.
create table atacc1 (a int primary key);
---END---
---START---
alter table atacc1 add constraint atacc1_fkey foreign key (a) references atacc1 (a) not valid;
---END---
---START---
alter table atacc1 validate constraint atacc1_fkey, alter a type bigint;
---END---
---START---
drop table atacc1;
---END---
---START---
CREATE TABLE atacc1 (gemini_pk serial PRIMARY KEY, a bigint, b integer);
---END---
---START---
insert into atacc1 values(1,1);
---END---
---START---
alter table atacc1 add constraint atacc1_chk check(b = 1) not valid;
---END---
---START---
alter table atacc1 validate constraint atacc1_chk, alter a type int;
---END---
---START---
drop table atacc1;
---END---
---START---
CREATE TABLE atacc1 (gemini_pk serial PRIMARY KEY, a bigint, b integer);
---END---
---START---
insert into atacc1 values(1,2);
---END---
---START---
alter table atacc1 add constraint atacc1_chk check(b = 1) not valid;
---END---
---START---
alter table atacc1 validate constraint atacc1_chk, alter a type int;
---END---
---START---
drop table atacc1;
---END---
---START---
CREATE TABLE atacc1 (gemini_pk serial PRIMARY KEY, test integer, test2 integer);
---END---
---START---
-- add a primary key constraint
alter table atacc1 add constraint atacc_test1 primary key (test, test2);
ERROR:  multiple primary keys for table "atacc1" are not allowed
---END---
---START---
-- try adding a second primary key - should fail
alter table atacc1 add constraint atacc_test2 primary key (test);
ERROR:  multiple primary keys for table "atacc1" are not allowed
---END---
---START---
-- insert initial value
insert into atacc1 (test,test2) values (4,4);
---END---
---START---
-- should fail
insert into atacc1 (test,test2) values (4,4);
---END---
---START---
insert into atacc1 (test,test2) values (NULL,3);
---END---
---START---
insert into atacc1 (test,test2) values (3, NULL);
---END---
---START---
insert into atacc1 (test,test2) values (NULL,NULL);
---END---
---START---
-- should all succeed
insert into atacc1 (test,test2) values (4,5);
---END---
---START---
insert into atacc1 (test,test2) values (5,4);
---END---
---START---
insert into atacc1 (test,test2) values (5,5);
---END---
---START---
drop table atacc1;
---END---
---START---
-- lets do some naming tests
create table atacc1 (test int, test2 int, primary key(test));
---END---
---START---
-- only first should succeed
insert into atacc1 (test2, test) values (3, 3);
---END---
---START---
insert into atacc1 (test2, test) values (2, 3);
ERROR:  duplicate key value violates unique constraint "atacc1_pkey"
DETAIL:  Key (test)=(3) already exists.
---END---
---START---
insert into atacc1 (test2, test) values (1, NULL);
ERROR:  null value in column "test" of relation "atacc1" violates not-null constraint
DETAIL:  Failing row contains (null, 1).
---END---
---START---
drop table atacc1;
---END---
---START---
-- alter table / alter column [set/drop] not null tests
-- try altering system catalogs, should fail
alter table pg_class alter column relname drop not null;
ERROR:  permission denied: "pg_class" is a system catalog
---END---
---START---
alter table pg_class alter relname set not null;
ERROR:  permission denied: "pg_class" is a system catalog
---END---
---START---
-- try altering non-existent table, should fail
alter table non_existent alter column bar set not null;
ERROR:  relation "non_existent" does not exist
---END---
---START---
alter table non_existent alter column bar drop not null;
ERROR:  relation "non_existent" does not exist
---END---
---START---
CREATE TABLE atacc1 (gemini_pk serial PRIMARY KEY, test integer NOT NULL);
---END---
---START---
alter table atacc1 add constraint "atacc1_pkey" primary key (test);
ERROR:  multiple primary keys for table "atacc1" are not allowed
---END---
---START---
alter table atacc1 alter column test drop not null;
---END---
---START---
alter table atacc1 drop constraint "atacc1_pkey";
---END---
---START---
alter table atacc1 alter column test drop not null;
---END---
---START---
insert into atacc1 values (null);
ERROR:  null value in column "gemini_pk" of relation "atacc1" violates not-null constraint
DETAIL:  Failing row contains (null, null).
---END---
---START---
alter table atacc1 alter test set not null;
---END---
---START---
delete from atacc1;
---END---
---START---
alter table atacc1 alter test set not null;
---END---
---START---
-- try altering a non-existent column, should fail
alter table atacc1 alter bar set not null;
ERROR:  column "bar" of relation "atacc1" does not exist
---END---
---START---
alter table atacc1 alter bar drop not null;
ERROR:  column "bar" of relation "atacc1" does not exist
---END---
---START---
-- try creating a view and altering that, should fail
create view myview as select * from atacc1;
---END---
---START---
alter table myview alter column test drop not null;
ERROR:  ALTER action ALTER COLUMN ... DROP NOT NULL cannot be performed on relation "myview"
DETAIL:  This operation is not supported for views.
---END---
---START---
alter table myview alter column test set not null;
ERROR:  ALTER action ALTER COLUMN ... SET NOT NULL cannot be performed on relation "myview"
DETAIL:  This operation is not supported for views.
---END---
---START---
drop view myview;
---END---
---START---
drop table atacc1;
---END---
---START---
CREATE TABLE atacc1 (gemini_pk serial PRIMARY KEY, test_a integer, test_b integer);
---END---
---START---
insert into atacc1 values (null, 1);
ERROR:  null value in column "gemini_pk" of relation "atacc1" violates not-null constraint
DETAIL:  Failing row contains (null, 1, null).
---END---
---START---
-- constraint not cover all values, should fail
alter table atacc1 add constraint atacc1_constr_or check(test_a is not null or test_b < 10);
---END---
---START---
alter table atacc1 alter test_a set not null;
---END---
---START---
alter table atacc1 drop constraint atacc1_constr_or;
---END---
---START---
-- not valid constraint, should fail
alter table atacc1 add constraint atacc1_constr_invalid check(test_a is not null) not valid;
---END---
---START---
alter table atacc1 alter test_a set not null;
---END---
---START---
alter table atacc1 drop constraint atacc1_constr_invalid;
---END---
---START---
-- with valid constraint
update atacc1 set test_a = 1;
---END---
---START---
alter table atacc1 add constraint atacc1_constr_a_valid check(test_a is not null);
---END---
---START---
alter table atacc1 alter test_a set not null;
---END---
---START---
delete from atacc1;
---END---
---START---
insert into atacc1 values (2, null);
ERROR:  null value in column "test_a" of relation "atacc1" violates not-null constraint
DETAIL:  Failing row contains (2, null, null).
---END---
---START---
alter table atacc1 alter test_a drop not null;
---END---
---START---
-- test multiple set not null at same time
-- test_a checked by atacc1_constr_a_valid, test_b should fail by table scan
alter table atacc1 alter test_a set not null, alter test_b set not null;
---END---
---START---
-- commands order has no importance
alter table atacc1 alter test_b set not null, alter test_a set not null;
---END---
---START---
-- valid one by table scan, one by check constraints
update atacc1 set test_b = 1;
---END---
---START---
alter table atacc1 alter test_b set not null, alter test_a set not null;
---END---
---START---
alter table atacc1 alter test_a drop not null, alter test_b drop not null;
---END---
---START---
-- both column has check constraints
alter table atacc1 add constraint atacc1_constr_b_valid check(test_b is not null);
---END---
---START---
alter table atacc1 alter test_b set not null, alter test_a set not null;
---END---
---START---
drop table atacc1;
---END---
---START---
CREATE TABLE parent (gemini_pk serial PRIMARY KEY, a integer);
---END---
---START---
CREATE TABLE child (gemini_pk serial PRIMARY KEY, b varchar(255)) INHERITS (parent);
NOTICE:  merging column "gemini_pk" with inherited definition
---END---
---START---
alter table parent alter a set not null;
---END---
---START---
insert into parent values (NULL);
ERROR:  null value in column "gemini_pk" of relation "parent" violates not-null constraint
DETAIL:  Failing row contains (null, null).
---END---
---START---
insert into child (a, b) values (NULL, 'foo');
ERROR:  null value in column "a" of relation "child" violates not-null constraint
DETAIL:  Failing row contains (1, null, foo).
---END---
---START---
alter table parent alter a drop not null;
---END---
---START---
insert into parent values (NULL);
ERROR:  null value in column "gemini_pk" of relation "parent" violates not-null constraint
DETAIL:  Failing row contains (null, null).
---END---
---START---
insert into child (a, b) values (NULL, 'foo');
---END---
---START---
alter table only parent alter a set not null;
---END---
---START---
alter table child alter a set not null;
ERROR:  column "a" of relation "child" contains null values
---END---
---START---
delete from parent;
---END---
---START---
alter table only parent alter a set not null;
---END---
---START---
insert into parent values (NULL);
ERROR:  null value in column "gemini_pk" of relation "parent" violates not-null constraint
DETAIL:  Failing row contains (null, null).
---END---
---START---
alter table child alter a set not null;
---END---
---START---
insert into child (a, b) values (NULL, 'foo');
ERROR:  null value in column "a" of relation "child" violates not-null constraint
DETAIL:  Failing row contains (3, null, foo).
---END---
---START---
delete from child;
---END---
---START---
alter table child alter a set not null;
---END---
---START---
insert into child (a, b) values (NULL, 'foo');
ERROR:  null value in column "a" of relation "child" violates not-null constraint
DETAIL:  Failing row contains (4, null, foo).
---END---
---START---
drop table child;
---END---
---START---
drop table parent;
---END---
---START---
CREATE TABLE def_test (gemini_pk serial PRIMARY KEY, c1 int8 DEFAULT 5, c2 text DEFAULT 'initial_default');
---END---
---START---
insert into def_test default values;
---END---
---START---
alter table def_test alter column c1 drop default;
---END---
---START---
insert into def_test default values;
---END---
---START---
alter table def_test alter column c2 drop default;
---END---
---START---
insert into def_test default values;
---END---
---START---
alter table def_test alter column c1 set default 10;
---END---
---START---
alter table def_test alter column c2 set default 'new_default';
---END---
---START---
insert into def_test default values;
---END---
---START---
select * from def_test;
 gemini_pk | c1 |       c2        
-----------+----+-----------------
         1 |  5 | initial_default
         2 |    | initial_default
         3 |    | 
         4 | 10 | new_default
(4 rows)

---END---
---START---
-- set defaults to an incorrect type: this should fail
alter table def_test alter column c1 set default 'wrong_datatype';
ERROR:  invalid input syntax for type bigint: "wrong_datatype"
---END---
---START---
alter table def_test alter column c2 set default 20;
---END---
---START---
-- set defaults on a non-existent column: this should fail
alter table def_test alter column c3 set default 30;
ERROR:  column "c3" of relation "def_test" does not exist
---END---
---START---
-- set defaults on views: we need to create a view, add a rule
-- to allow insertions into it, and then alter the view to add
-- a default
create view def_view_test as select * from def_test;
---END---
---START---
create rule def_view_test_ins as
	on insert to def_view_test
	do instead insert into def_test select new.*;
---END---
---START---
insert into def_view_test default values;
ERROR:  null value in column "gemini_pk" of relation "def_test" violates not-null constraint
DETAIL:  Failing row contains (null, null, null).
---END---
---START---
alter table def_view_test alter column c1 set default 45;
---END---
---START---
insert into def_view_test default values;
ERROR:  null value in column "gemini_pk" of relation "def_test" violates not-null constraint
DETAIL:  Failing row contains (null, 45, null).
---END---
---START---
alter table def_view_test alter column c2 set default 'view_default';
---END---
---START---
insert into def_view_test default values;
ERROR:  null value in column "gemini_pk" of relation "def_test" violates not-null constraint
DETAIL:  Failing row contains (null, 45, view_default).
---END---
---START---
select * from def_view_test;
 gemini_pk | c1 |       c2        
-----------+----+-----------------
         1 |  5 | initial_default
         2 |    | initial_default
         3 |    | 
         4 | 10 | new_default
(4 rows)

---END---
---START---
drop rule def_view_test_ins on def_view_test;
---END---
---START---
drop view def_view_test;
---END---
---START---
drop table def_test;
---END---
---START---
-- alter table / drop column tests
-- try altering system catalogs, should fail
alter table pg_class drop column relname;
ERROR:  permission denied: "pg_class" is a system catalog
---END---
---START---
-- try altering non-existent table, should fail
alter table nosuchtable drop column bar;
ERROR:  relation "nosuchtable" does not exist
---END---
---START---
CREATE TABLE atacc1 (gemini_pk serial PRIMARY KEY, a int8 NOT NULL, b int8, c int8 NOT NULL, d int8);
---END---
---START---
insert into atacc1 values (1, 2, 3, 4);
---END---
---START---
alter table atacc1 drop a;
---END---
---START---
alter table atacc1 drop a;
ERROR:  column "a" of relation "atacc1" does not exist
---END---
---START---
-- SELECTs
select * from atacc1;
 gemini_pk | b | c | d 
-----------+---+---+---
         1 | 3 | 4 |  
(1 row)

---END---
---START---
select * from atacc1 order by a;
ERROR:  column "a" does not exist
LINE 1: select * from atacc1 order by a;
                                      ^
---END---
---START---
select * from atacc1 order by "........pg.dropped.1........";
ERROR:  column "........pg.dropped.1........" does not exist
LINE 1: select * from atacc1 order by "........pg.dropped.1........"...
                                      ^
---END---
---START---
select * from atacc1 group by a;
ERROR:  column "a" does not exist
LINE 1: select * from atacc1 group by a;
                                      ^
---END---
---START---
select * from atacc1 group by "........pg.dropped.1........";
ERROR:  column "........pg.dropped.1........" does not exist
LINE 1: select * from atacc1 group by "........pg.dropped.1........"...
                                      ^
---END---
---START---
select atacc1.* from atacc1;
 gemini_pk | b | c | d 
-----------+---+---+---
         1 | 3 | 4 |  
(1 row)

---END---
---START---
select a from atacc1;
ERROR:  column "a" does not exist
LINE 1: select a from atacc1;
               ^
---END---
---START---
select atacc1.a from atacc1;
ERROR:  column atacc1.a does not exist
LINE 1: select atacc1.a from atacc1;
               ^
---END---
---START---
select b,c,d from atacc1;
 b | c | d 
---+---+---
 3 | 4 |  
(1 row)

---END---
---START---
select a,b,c,d from atacc1;
ERROR:  column "a" does not exist
LINE 1: select a,b,c,d from atacc1;
               ^
---END---
---START---
select * from atacc1 where a = 1;
ERROR:  column "a" does not exist
LINE 1: select * from atacc1 where a = 1;
                                   ^
---END---
---START---
select "........pg.dropped.1........" from atacc1;
ERROR:  column "........pg.dropped.1........" does not exist
LINE 1: select "........pg.dropped.1........" from atacc1;
               ^
---END---
---START---
select atacc1."........pg.dropped.1........" from atacc1;
ERROR:  column atacc1.........pg.dropped.1........ does not exist
LINE 1: select atacc1."........pg.dropped.1........" from atacc1;
               ^
---END---
---START---
select "........pg.dropped.1........",b,c,d from atacc1;
ERROR:  column "........pg.dropped.1........" does not exist
LINE 1: select "........pg.dropped.1........",b,c,d from atacc1;
               ^
---END---
---START---
select * from atacc1 where "........pg.dropped.1........" = 1;
ERROR:  column "........pg.dropped.1........" does not exist
LINE 1: select * from atacc1 where "........pg.dropped.1........" = ...
                                   ^
---END---
---START---
-- UPDATEs
update atacc1 set a = 3;
ERROR:  column "a" of relation "atacc1" does not exist
LINE 1: update atacc1 set a = 3;
                          ^
---END---
---START---
update atacc1 set b = 2 where a = 3;
ERROR:  column "a" does not exist
LINE 1: update atacc1 set b = 2 where a = 3;
                                      ^
---END---
---START---
update atacc1 set "........pg.dropped.1........" = 3;
ERROR:  column "........pg.dropped.1........" of relation "atacc1" does not exist
LINE 1: update atacc1 set "........pg.dropped.1........" = 3;
                          ^
---END---
---START---
update atacc1 set b = 2 where "........pg.dropped.1........" = 3;
ERROR:  column "........pg.dropped.1........" does not exist
LINE 1: update atacc1 set b = 2 where "........pg.dropped.1........"...
                                      ^
---END---
---START---
-- INSERTs
insert into atacc1 values (10, 11, 12, 13);
---END---
---START---
insert into atacc1 values (default, 11, 12, 13);
ERROR:  duplicate key value violates unique constraint "atacc1_pkey"
DETAIL:  Key (gemini_pk)=(1) already exists.
---END---
---START---
insert into atacc1 values (11, 12, 13);
---END---
---START---
insert into atacc1 (a) values (10);
ERROR:  column "a" of relation "atacc1" does not exist
LINE 1: insert into atacc1 (a) values (10);
                            ^
---END---
---START---
insert into atacc1 (a) values (default);
ERROR:  column "a" of relation "atacc1" does not exist
LINE 1: insert into atacc1 (a) values (default);
                            ^
---END---
---START---
insert into atacc1 (a,b,c,d) values (10,11,12,13);
ERROR:  column "a" of relation "atacc1" does not exist
LINE 1: insert into atacc1 (a,b,c,d) values (10,11,12,13);
                            ^
---END---
---START---
insert into atacc1 (a,b,c,d) values (default,11,12,13);
ERROR:  column "a" of relation "atacc1" does not exist
LINE 1: insert into atacc1 (a,b,c,d) values (default,11,12,13);
                            ^
---END---
---START---
insert into atacc1 (b,c,d) values (11,12,13);
---END---
---START---
insert into atacc1 ("........pg.dropped.1........") values (10);
ERROR:  column "........pg.dropped.1........" of relation "atacc1" does not exist
LINE 1: insert into atacc1 ("........pg.dropped.1........") values (...
                            ^
---END---
---START---
insert into atacc1 ("........pg.dropped.1........") values (default);
ERROR:  column "........pg.dropped.1........" of relation "atacc1" does not exist
LINE 1: insert into atacc1 ("........pg.dropped.1........") values (...
                            ^
---END---
---START---
insert into atacc1 ("........pg.dropped.1........",b,c,d) values (10,11,12,13);
ERROR:  column "........pg.dropped.1........" of relation "atacc1" does not exist
LINE 1: insert into atacc1 ("........pg.dropped.1........",b,c,d) va...
                            ^
---END---
---START---
insert into atacc1 ("........pg.dropped.1........",b,c,d) values (default,11,12,13);
ERROR:  column "........pg.dropped.1........" of relation "atacc1" does not exist
LINE 1: insert into atacc1 ("........pg.dropped.1........",b,c,d) va...
                            ^
---END---
---START---
-- DELETEs
delete from atacc1 where a = 3;
ERROR:  column "a" does not exist
LINE 1: delete from atacc1 where a = 3;
                                 ^
---END---
---START---
delete from atacc1 where "........pg.dropped.1........" = 3;
ERROR:  column "........pg.dropped.1........" does not exist
LINE 1: delete from atacc1 where "........pg.dropped.1........" = 3;
                                 ^
---END---
---START---
delete from atacc1;
---END---
---START---
-- try dropping a non-existent column, should fail
alter table atacc1 drop bar;
ERROR:  column "bar" of relation "atacc1" does not exist
---END---
---START---
-- try removing an oid column, should succeed (as it's nonexistent)
alter table atacc1 SET WITHOUT OIDS;
---END---
---START---
-- try adding an oid column, should fail (not supported)
alter table atacc1 SET WITH OIDS;
ERROR:  syntax error at or near "WITH"
LINE 1: alter table atacc1 SET WITH OIDS;
                               ^
---END---
---START---
-- try dropping the xmin column, should fail
alter table atacc1 drop xmin;
ERROR:  cannot drop system column "xmin"
---END---
---START---
-- try creating a view and altering that, should fail
create view myview as select * from atacc1;
---END---
---START---
select * from myview;
 gemini_pk | b | c | d 
-----------+---+---+---
(0 rows)

---END---
---START---
alter table myview drop d;
ERROR:  ALTER action DROP COLUMN cannot be performed on relation "myview"
DETAIL:  This operation is not supported for views.
---END---
---START---
drop view myview;
---END---
---START---
-- test some commands to make sure they fail on the dropped column
analyze atacc1(a);
ERROR:  column "a" of relation "atacc1" does not exist
---END---
---START---
analyze atacc1("........pg.dropped.1........");
ERROR:  column "........pg.dropped.1........" of relation "atacc1" does not exist
---END---
---START---
vacuum analyze atacc1(a);
ERROR:  column "a" of relation "atacc1" does not exist
---END---
---START---
vacuum analyze atacc1("........pg.dropped.1........");
ERROR:  column "........pg.dropped.1........" of relation "atacc1" does not exist
---END---
---START---
comment on column atacc1.a is 'testing';
ERROR:  column "a" of relation "atacc1" does not exist
---END---
---START---
comment on column atacc1."........pg.dropped.1........" is 'testing';
ERROR:  column "........pg.dropped.1........" of relation "atacc1" does not exist
---END---
---START---
alter table atacc1 alter a set storage plain;
ERROR:  column "a" of relation "atacc1" does not exist
---END---
---START---
alter table atacc1 alter "........pg.dropped.1........" set storage plain;
ERROR:  column "........pg.dropped.1........" of relation "atacc1" does not exist
---END---
---START---
alter table atacc1 alter a set statistics 0;
ERROR:  column "a" of relation "atacc1" does not exist
---END---
---START---
alter table atacc1 alter "........pg.dropped.1........" set statistics 0;
ERROR:  column "........pg.dropped.1........" of relation "atacc1" does not exist
---END---
---START---
alter table atacc1 alter a set default 3;
ERROR:  column "a" of relation "atacc1" does not exist
---END---
---START---
alter table atacc1 alter "........pg.dropped.1........" set default 3;
ERROR:  column "........pg.dropped.1........" of relation "atacc1" does not exist
---END---
---START---
alter table atacc1 alter a drop default;
ERROR:  column "a" of relation "atacc1" does not exist
---END---
---START---
alter table atacc1 alter "........pg.dropped.1........" drop default;
ERROR:  column "........pg.dropped.1........" of relation "atacc1" does not exist
---END---
---START---
alter table atacc1 alter a set not null;
ERROR:  column "a" of relation "atacc1" does not exist
---END---
---START---
alter table atacc1 alter "........pg.dropped.1........" set not null;
ERROR:  column "........pg.dropped.1........" of relation "atacc1" does not exist
---END---
---START---
alter table atacc1 alter a drop not null;
ERROR:  column "a" of relation "atacc1" does not exist
---END---
---START---
alter table atacc1 alter "........pg.dropped.1........" drop not null;
ERROR:  column "........pg.dropped.1........" of relation "atacc1" does not exist
---END---
---START---
alter table atacc1 rename a to x;
ERROR:  column "a" does not exist
---END---
---START---
alter table atacc1 rename "........pg.dropped.1........" to x;
ERROR:  column "........pg.dropped.1........" does not exist
---END---
---START---
alter table atacc1 add primary key(a);
ERROR:  column "a" of relation "atacc1" does not exist
---END---
---START---
alter table atacc1 add primary key("........pg.dropped.1........");
ERROR:  column "........pg.dropped.1........" of relation "atacc1" does not exist
---END---
---START---
alter table atacc1 add unique(a);
ERROR:  column "a" named in key does not exist
---END---
---START---
alter table atacc1 add unique("........pg.dropped.1........");
ERROR:  column "........pg.dropped.1........" named in key does not exist
---END---
---START---
alter table atacc1 add check (a > 3);
ERROR:  column "a" does not exist
---END---
---START---
alter table atacc1 add check ("........pg.dropped.1........" > 3);
ERROR:  column "........pg.dropped.1........" does not exist
---END---
---START---
CREATE TABLE atacc2 (gemini_pk serial PRIMARY KEY, id int8 UNIQUE);
---END---
---START---
alter table atacc1 add foreign key (a) references atacc2(id);
ERROR:  column "a" referenced in foreign key constraint does not exist
---END---
---START---
alter table atacc1 add foreign key ("........pg.dropped.1........") references atacc2(id);
ERROR:  column "........pg.dropped.1........" referenced in foreign key constraint does not exist
---END---
---START---
alter table atacc2 add foreign key (id) references atacc1(a);
ERROR:  column "a" referenced in foreign key constraint does not exist
---END---
---START---
alter table atacc2 add foreign key (id) references atacc1("........pg.dropped.1........");
ERROR:  column "........pg.dropped.1........" referenced in foreign key constraint does not exist
---END---
---START---
drop table atacc2;
---END---
---START---
create index "testing_idx" on atacc1(a);
ERROR:  column "a" does not exist
---END---
---START---
create index "testing_idx" on atacc1("........pg.dropped.1........");
ERROR:  column "........pg.dropped.1........" does not exist
---END---
---START---
-- test create as and select into
insert into atacc1 values (21, 22, 23);
---END---
---START---
create table attest1 as select * from atacc1;
---END---
---START---
select * from attest1;
 gemini_pk | b  | c  | d 
-----------+----+----+---
        21 | 22 | 23 |  
(1 row)

---END---
---START---
drop table attest1;
---END---
---START---
select * into attest2 from atacc1;
---END---
---START---
select * from attest2;
 gemini_pk | b  | c  | d 
-----------+----+----+---
        21 | 22 | 23 |  
(1 row)

---END---
---START---
drop table attest2;
---END---
---START---
-- try dropping all columns
alter table atacc1 drop c;
---END---
---START---
alter table atacc1 drop d;
---END---
---START---
alter table atacc1 drop b;
---END---
---START---
select * from atacc1;
 gemini_pk 
-----------
        21
(1 row)

---END---
---START---
drop table atacc1;
---END---
---START---
-- test constraint error reporting in presence of dropped columns
create table atacc1 (id serial primary key, value int check (value < 10));
---END---
---START---
insert into atacc1(value) values (100);
ERROR:  new row for relation "atacc1" violates check constraint "atacc1_value_check"
DETAIL:  Failing row contains (1, 100).
---END---
---START---
alter table atacc1 drop column value;
---END---
---START---
alter table atacc1 add column value int check (value < 10);
---END---
---START---
insert into atacc1(value) values (100);
ERROR:  new row for relation "atacc1" violates check constraint "atacc1_value_check"
DETAIL:  Failing row contains (2, 100).
---END---
---START---
insert into atacc1(id, value) values (null, 0);
ERROR:  null value in column "id" of relation "atacc1" violates not-null constraint
DETAIL:  Failing row contains (null, 0).
---END---
---START---
drop table atacc1;
---END---
---START---
CREATE TABLE parent (gemini_pk serial PRIMARY KEY, a integer, b integer, c integer);
---END---
---START---
insert into parent values (1, 2, 3);
---END---
---START---
alter table parent drop a;
---END---
---START---
CREATE TABLE child (gemini_pk serial PRIMARY KEY, d varchar(255)) INHERITS (parent);
NOTICE:  merging column "gemini_pk" with inherited definition
---END---
---START---
insert into child values (12, 13, 'testing');
ERROR:  invalid input syntax for type integer: "testing"
LINE 1: insert into child values (12, 13, 'testing');
                                          ^
---END---
---START---
select * from parent;
 gemini_pk | b | c 
-----------+---+---
         1 | 3 |  
(1 row)

---END---
---START---
select * from child;
 gemini_pk | b | c | d 
-----------+---+---+---
(0 rows)

---END---
---START---
alter table parent drop c;
---END---
---START---
select * from parent;
 gemini_pk | b 
-----------+---
         1 | 3
(1 row)

---END---
---START---
select * from child;
 gemini_pk | b | d 
-----------+---+---
(0 rows)

---END---
---START---
drop table child;
---END---
---START---
drop table parent;
---END---
---START---
CREATE TABLE parent (gemini_pk serial PRIMARY KEY, a float8, b numeric, c text COLLATE "C");
---END---
---START---
CREATE TABLE child (gemini_pk serial PRIMARY KEY, a float8) INHERITS (parent);
NOTICE:  merging column "gemini_pk" with inherited definition
NOTICE:  merging column "a" with inherited definition
---END---
---START---
CREATE TABLE child (gemini_pk serial PRIMARY KEY, b numeric) INHERITS (parent);
NOTICE:  merging column "gemini_pk" with inherited definition
NOTICE:  moving and merging column "b" with inherited definition
DETAIL:  User-specified column moved to the position of the inherited column.
ERROR:  relation "child" already exists
---END---
---START---
CREATE TABLE child (gemini_pk serial PRIMARY KEY, c text COLLATE "POSIX") INHERITS (parent);
NOTICE:  merging column "gemini_pk" with inherited definition
NOTICE:  moving and merging column "c" with inherited definition
DETAIL:  User-specified column moved to the position of the inherited column.
ERROR:  column "c" has a collation conflict
DETAIL:  "C" versus "POSIX"
---END---
---START---
CREATE TABLE child (gemini_pk serial PRIMARY KEY, a double precision, b numeric) INHERITS (parent);
NOTICE:  merging column "gemini_pk" with inherited definition
NOTICE:  merging column "a" with inherited definition
NOTICE:  merging column "b" with inherited definition
ERROR:  relation "child" already exists
---END---
---START---
drop table child;
---END---
---START---
drop table parent;
---END---
---START---
-- test copy in/out
create table attest (gemini_pk serial PRIMARY KEY, a int8, b int8, c int8);
insert into attest values (1,2,3);
alter table attest drop a;
copy attest to stdout;
1	3	\N
copy attest(a) to stdout;
ERROR:  column "a" of relation "attest" does not exist
copy attest("........pg.dropped.1........") to stdout;
ERROR:  column "........pg.dropped.1........" of relation "attest" does not exist
-- copy attest from stdin;
-- 10	11	12
-- \.
---END---
---START---
select * from attest;
 gemini_pk | b | c 
-----------+---+---
         1 | 3 |  
(1 row)

---END---
---START---
-- copy attest from stdin;
-- 21	22
-- \.
---END---
---START---
select * from attest;
 gemini_pk | b | c 
-----------+---+---
         1 | 3 |  
(1 row)

---END---
---START---
-- copy attest(a) from stdin;
-- copy attest("........pg.dropped.1........") from stdin;
-- copy attest(b,c) from stdin;
-- 31	32
-- \.
---END---
---START---
select * from attest;
 gemini_pk | b | c 
-----------+---+---
         1 | 3 |  
(1 row)

---END---
---START---
drop table attest;
---END---
---START---
CREATE TABLE dropcolumn (gemini_pk serial PRIMARY KEY, a integer, b integer, e integer);
---END---
---START---
CREATE TABLE dropcolumnchild (gemini_pk serial PRIMARY KEY, c integer) INHERITS (dropcolumn);
NOTICE:  merging column "gemini_pk" with inherited definition
---END---
---START---
CREATE TABLE dropcolumnanother (gemini_pk serial PRIMARY KEY, d integer) INHERITS (dropcolumnchild);
NOTICE:  merging column "gemini_pk" with inherited definition
---END---
---START---
-- these two should fail
alter table dropColumnchild drop column a;
ERROR:  cannot drop inherited column "a"
---END---
---START---
alter table only dropColumnChild drop column b;
ERROR:  cannot drop inherited column "b"
---END---
---START---
-- these three should work
alter table only dropColumn drop column e;
---END---
---START---
alter table dropColumnChild drop column c;
---END---
---START---
alter table dropColumn drop column a;
---END---
---START---
CREATE TABLE renamecolumn (gemini_pk serial PRIMARY KEY, a integer);
---END---
---START---
CREATE TABLE renamecolumnchild (gemini_pk serial PRIMARY KEY, b integer) INHERITS (renamecolumn);
NOTICE:  merging column "gemini_pk" with inherited definition
---END---
---START---
CREATE TABLE renamecolumnanother (gemini_pk serial PRIMARY KEY, c integer) INHERITS (renamecolumnchild);
NOTICE:  merging column "gemini_pk" with inherited definition
---END---
---START---
-- these three should fail
alter table renameColumnChild rename column a to d;
ERROR:  cannot rename inherited column "a"
---END---
---START---
alter table only renameColumnChild rename column a to d;
ERROR:  inherited column "a" must be renamed in child tables too
---END---
---START---
alter table only renameColumn rename column a to d;
ERROR:  inherited column "a" must be renamed in child tables too
---END---
---START---
-- these should work
alter table renameColumn rename column a to d;
---END---
---START---
alter table renameColumnChild rename column b to a;
---END---
---START---
-- these should work
alter table if exists doesnt_exist_tab rename column a to d;
NOTICE:  relation "doesnt_exist_tab" does not exist, skipping
---END---
---START---
alter table if exists doesnt_exist_tab rename column b to a;
NOTICE:  relation "doesnt_exist_tab" does not exist, skipping
---END---
---START---
-- this should work
alter table renameColumn add column w int;
---END---
---START---
-- this should fail
alter table only renameColumn add column x int;
ERROR:  column must be added to child tables too
---END---
---START---
CREATE TABLE p1 (gemini_pk serial PRIMARY KEY, f1 integer, f2 integer);
---END---
---START---
CREATE TABLE c1 (gemini_pk serial PRIMARY KEY, f1 integer NOT NULL) INHERITS (p1);
NOTICE:  merging column "gemini_pk" with inherited definition
NOTICE:  merging column "f1" with inherited definition
---END---
---START---
-- should be rejected since c1.f1 is inherited
alter table c1 drop column f1;
ERROR:  cannot drop inherited column "f1"
---END---
---START---
-- should work
alter table p1 drop column f1;
---END---
---START---
-- c1.f1 is still there, but no longer inherited
select f1 from c1;
 f1 
----
(0 rows)

---END---
---START---
alter table c1 drop column f1;
---END---
---START---
select f1 from c1;
ERROR:  column "f1" does not exist
LINE 1: select f1 from c1;
               ^
HINT:  Perhaps you meant to reference the column "c1.f2".
---END---
---START---
drop table p1 cascade;
NOTICE:  drop cascades to table c1
---END---
---START---
CREATE TABLE p1 (gemini_pk serial PRIMARY KEY, f1 integer, f2 integer);
---END---
---START---
CREATE TABLE c1 (gemini_pk serial PRIMARY KEY) INHERITS (p1);
NOTICE:  merging column "gemini_pk" with inherited definition
---END---
---START---
-- should be rejected since c1.f1 is inherited
alter table c1 drop column f1;
ERROR:  cannot drop inherited column "f1"
---END---
---START---
alter table p1 drop column f1;
---END---
---START---
-- c1.f1 is dropped now, since there is no local definition for it
select f1 from c1;
ERROR:  column "f1" does not exist
LINE 1: select f1 from c1;
               ^
HINT:  Perhaps you meant to reference the column "c1.f2".
---END---
---START---
drop table p1 cascade;
NOTICE:  drop cascades to table c1
---END---
---START---
CREATE TABLE p1 (gemini_pk serial PRIMARY KEY, f1 integer, f2 integer);
---END---
---START---
CREATE TABLE c1 (gemini_pk serial PRIMARY KEY) INHERITS (p1);
NOTICE:  merging column "gemini_pk" with inherited definition
---END---
---START---
-- should be rejected since c1.f1 is inherited
alter table c1 drop column f1;
ERROR:  cannot drop inherited column "f1"
---END---
---START---
alter table only p1 drop column f1;
---END---
---START---
-- c1.f1 is NOT dropped, but must now be considered non-inherited
alter table c1 drop column f1;
---END---
---START---
drop table p1 cascade;
NOTICE:  drop cascades to table c1
---END---
---START---
CREATE TABLE p1 (gemini_pk serial PRIMARY KEY, f1 integer, f2 integer);
---END---
---START---
CREATE TABLE c1 (gemini_pk serial PRIMARY KEY, f1 integer NOT NULL) INHERITS (p1);
NOTICE:  merging column "gemini_pk" with inherited definition
NOTICE:  merging column "f1" with inherited definition
---END---
---START---
-- should be rejected since c1.f1 is inherited
alter table c1 drop column f1;
ERROR:  cannot drop inherited column "f1"
---END---
---START---
alter table only p1 drop column f1;
---END---
---START---
-- c1.f1 is still there, but no longer inherited
alter table c1 drop column f1;
---END---
---START---
drop table p1 cascade;
NOTICE:  drop cascades to table c1
---END---
---START---
CREATE TABLE p1 (gemini_pk serial PRIMARY KEY, id integer, name text);
---END---
---START---
CREATE TABLE p2 (gemini_pk serial PRIMARY KEY, id2 integer, name text, height integer);
---END---
---START---
CREATE TABLE c1 (gemini_pk serial PRIMARY KEY, age integer) INHERITS (p1, p2);
NOTICE:  merging multiple inherited definitions of column "gemini_pk"
NOTICE:  merging multiple inherited definitions of column "name"
NOTICE:  merging column "gemini_pk" with inherited definition
---END---
---START---
CREATE TABLE gc1 (gemini_pk serial PRIMARY KEY) INHERITS (c1);
NOTICE:  merging column "gemini_pk" with inherited definition
---END---
---START---
select relname, attname, attinhcount, attislocal
from pg_class join pg_attribute on (pg_class.oid = pg_attribute.attrelid)
where relname in ('p1','p2','c1','gc1') and attnum > 0 and not attisdropped
order by relname, attnum;
 relname |  attname  | attinhcount | attislocal 
---------+-----------+-------------+------------
 c1      | gemini_pk |           2 | t
 c1      | id        |           1 | f
 c1      | name      |           2 | f
 c1      | id2       |           1 | f
 c1      | height    |           1 | f
 c1      | age       |           0 | t
 gc1     | gemini_pk |           1 | t
 gc1     | id        |           1 | f
 gc1     | name      |           1 | f
 gc1     | id2       |           1 | f
 gc1     | height    |           1 | f
 gc1     | age       |           1 | f
 p1      | gemini_pk |           0 | t
 p1      | id        |           0 | t
 p1      | name      |           0 | t
 p2      | gemini_pk |           0 | t
 p2      | id2       |           0 | t
 p2      | name      |           0 | t
 p2      | height    |           0 | t
(19 rows)

---END---
---START---
-- should work
alter table only p1 drop column name;
---END---
---START---
-- should work. Now c1.name is local and inhcount is 0.
alter table p2 drop column name;
---END---
---START---
-- should be rejected since its inherited
alter table gc1 drop column name;
ERROR:  cannot drop inherited column "name"
---END---
---START---
-- should work, and drop gc1.name along
alter table c1 drop column name;
---END---
---START---
-- should fail: column does not exist
alter table gc1 drop column name;
ERROR:  column "name" of relation "gc1" does not exist
---END---
---START---
-- should work and drop the attribute in all tables
alter table p2 drop column height;
---END---
---START---
CREATE TABLE dropcolumnexists (gemini_pk serial PRIMARY KEY);
---END---
---START---
alter table dropColumnExists drop column non_existing;
ERROR:  column "non_existing" of relation "dropcolumnexists" does not exist
---END---
---START---
--fail
alter table dropColumnExists drop column if exists non_existing;
NOTICE:  column "non_existing" of relation "dropcolumnexists" does not exist, skipping
---END---
---START---
--succeed
select relname, attname, attinhcount, attislocal
from pg_class join pg_attribute on (pg_class.oid = pg_attribute.attrelid)
where relname in ('p1','p2','c1','gc1') and attnum > 0 and not attisdropped
order by relname, attnum;
 relname |  attname  | attinhcount | attislocal 
---------+-----------+-------------+------------
 c1      | gemini_pk |           2 | t
 c1      | id        |           1 | f
 c1      | id2       |           1 | f
 c1      | age       |           0 | t
 gc1     | gemini_pk |           1 | t
 gc1     | id        |           1 | f
 gc1     | id2       |           1 | f
 gc1     | age       |           1 | f
 p1      | gemini_pk |           0 | t
 p1      | id        |           0 | t
 p2      | gemini_pk |           0 | t
 p2      | id2       |           0 | t
(12 rows)

---END---
---START---
drop table p1, p2 cascade;
NOTICE:  drop cascades to 2 other objects
DETAIL:  drop cascades to table c1
drop cascades to table gc1
---END---
---START---
CREATE TABLE depth0 (gemini_pk serial PRIMARY KEY);
---END---
---START---
CREATE TABLE depth1 (gemini_pk serial PRIMARY KEY, c text) INHERITS (depth0);
NOTICE:  merging column "gemini_pk" with inherited definition
---END---
---START---
CREATE TABLE depth2 (gemini_pk serial PRIMARY KEY) INHERITS (depth1);
NOTICE:  merging column "gemini_pk" with inherited definition
---END---
---START---
alter table depth0 add c text;
NOTICE:  merging definition of column "c" for child "depth1"
---END---
---START---
select attrelid::regclass, attname, attinhcount, attislocal
from pg_attribute
where attnum > 0 and attrelid::regclass in ('depth0', 'depth1', 'depth2')
order by attrelid::regclass::text, attnum;
 attrelid |  attname  | attinhcount | attislocal 
----------+-----------+-------------+------------
 depth0   | gemini_pk |           0 | t
 depth0   | c         |           0 | t
 depth1   | gemini_pk |           1 | t
 depth1   | c         |           1 | t
 depth2   | gemini_pk |           1 | t
 depth2   | c         |           1 | f
(6 rows)

---END---
---START---
CREATE TABLE p1 (gemini_pk serial PRIMARY KEY, f1 integer);
---END---
---START---
CREATE TABLE c1 (gemini_pk serial PRIMARY KEY, f2 text, f3 integer) INHERITS (p1);
NOTICE:  merging column "gemini_pk" with inherited definition
---END---
---START---
alter table p1 add column a1 int check (a1 > 0);
---END---
---START---
alter table p1 add column f2 text;
NOTICE:  merging definition of column "f2" for child "c1"
---END---
---START---
insert into p1 values (1,2,'abc');
ERROR:  invalid input syntax for type integer: "abc"
LINE 1: insert into p1 values (1,2,'abc');
                                   ^
---END---
---START---
insert into c1 values(11,'xyz',33,0);
ERROR:  invalid input syntax for type integer: "xyz"
LINE 1: insert into c1 values(11,'xyz',33,0);
                                 ^
---END---
---START---
-- should fail
insert into c1 values(11,'xyz',33,22);
ERROR:  invalid input syntax for type integer: "xyz"
LINE 1: insert into c1 values(11,'xyz',33,22);
                                 ^
---END---
---START---
select * from p1;
 gemini_pk | f1 | a1 | f2 
-----------+----+----+----
(0 rows)

---END---
---START---
update p1 set a1 = a1 + 1, f2 = upper(f2);
---END---
---START---
select * from p1;
 gemini_pk | f1 | a1 | f2 
-----------+----+----+----
(0 rows)

---END---
---START---
drop table p1 cascade;
NOTICE:  drop cascades to table c1
---END---
---START---
-- test that operations with a dropped column do not try to reference
-- its datatype
create domain mytype as text;
---END---
---START---
DROP TABLE IF EXISTS foo;
NOTICE:  table "foo" does not exist, skipping
CREATE TABLE foo (gemini_pk serial PRIMARY KEY, f1 text, f2 mytype, f3 text);
---END---
---START---
insert into foo values('bb','cc','dd');
ERROR:  invalid input syntax for type integer: "bb"
LINE 1: insert into foo values('bb','cc','dd');
                               ^
---END---
---START---
select * from foo;
 gemini_pk | f1 | f2 | f3 
-----------+----+----+----
(0 rows)

---END---
---START---
drop domain mytype cascade;
NOTICE:  drop cascades to column f2 of table foo
---END---
---START---
select * from foo;
 gemini_pk | f1 | f3 
-----------+----+----
(0 rows)

---END---
---START---
insert into foo values('qq','rr');
ERROR:  invalid input syntax for type integer: "qq"
LINE 1: insert into foo values('qq','rr');
                               ^
---END---
---START---
select * from foo;
 gemini_pk | f1 | f3 
-----------+----+----
(0 rows)

---END---
---START---
update foo set f3 = 'zz';
---END---
---START---
select * from foo;
 gemini_pk | f1 | f3 
-----------+----+----
(0 rows)

---END---
---START---
select f3,max(f1) from foo group by f3;
 f3 | max 
----+-----
(0 rows)

---END---
---START---
-- Simple tests for alter table column type
alter table foo alter f1 TYPE integer;
ERROR:  column "f1" cannot be cast automatically to type integer
HINT:  You might need to specify "USING f1::integer".
---END---
---START---
-- fails
alter table foo alter f1 TYPE varchar(10);
---END---
---START---
CREATE TABLE anothertab (gemini_pk serial PRIMARY KEY, atcol1 serial8, atcol2 boolean, CONSTRAINT anothertab_chk CHECK (atcol1 <= 3));
---END---
---START---
insert into anothertab (atcol1, atcol2) values (default, true);
---END---
---START---
insert into anothertab (atcol1, atcol2) values (default, false);
---END---
---START---
select * from anothertab;
 gemini_pk | atcol1 | atcol2 
-----------+--------+--------
         1 |      1 | t
         2 |      2 | f
(2 rows)

---END---
---START---
alter table anothertab alter column atcol1 type boolean;
ERROR:  column "atcol1" cannot be cast automatically to type boolean
HINT:  You might need to specify "USING atcol1::boolean".
---END---
---START---
-- fails
alter table anothertab alter column atcol1 type boolean using atcol1::int;
ERROR:  result of USING clause for column "atcol1" cannot be cast automatically to type boolean
HINT:  You might need to add an explicit cast.
---END---
---START---
-- fails
alter table anothertab alter column atcol1 type integer;
---END---
---START---
select * from anothertab;
 gemini_pk | atcol1 | atcol2 
-----------+--------+--------
         1 |      1 | t
         2 |      2 | f
(2 rows)

---END---
---START---
insert into anothertab (atcol1, atcol2) values (45, null);
ERROR:  new row for relation "anothertab" violates check constraint "anothertab_chk"
DETAIL:  Failing row contains (3, 45, null).
---END---
---START---
-- fails
insert into anothertab (atcol1, atcol2) values (default, null);
---END---
---START---
select * from anothertab;
 gemini_pk | atcol1 | atcol2 
-----------+--------+--------
         1 |      1 | t
         2 |      2 | f
         4 |      3 | 
(3 rows)

---END---
---START---
alter table anothertab alter column atcol2 type text
      using case when atcol2 is true then 'IT WAS TRUE'
                 when atcol2 is false then 'IT WAS FALSE'
                 else 'IT WAS NULL!' end;
---END---
---START---
select * from anothertab;
 gemini_pk | atcol1 |    atcol2    
-----------+--------+--------------
         1 |      1 | IT WAS TRUE
         2 |      2 | IT WAS FALSE
         4 |      3 | IT WAS NULL!
(3 rows)

---END---
---START---
alter table anothertab alter column atcol1 type boolean
        using case when atcol1 % 2 = 0 then true else false end;
ERROR:  default for column "atcol1" cannot be cast automatically to type boolean
---END---
---START---
-- fails
alter table anothertab alter column atcol1 drop default;
---END---
---START---
alter table anothertab alter column atcol1 type boolean
        using case when atcol1 % 2 = 0 then true else false end;
ERROR:  operator does not exist: boolean <= integer
HINT:  No operator matches the given name and argument types. You might need to add explicit type casts.
---END---
---START---
-- fails
alter table anothertab drop constraint anothertab_chk;
---END---
---START---
alter table anothertab drop constraint anothertab_chk;
ERROR:  constraint "anothertab_chk" of relation "anothertab" does not exist
---END---
---START---
-- fails
alter table anothertab drop constraint IF EXISTS anothertab_chk;
NOTICE:  constraint "anothertab_chk" of relation "anothertab" does not exist, skipping
---END---
---START---
-- succeeds
alter table anothertab alter column atcol1 type boolean
        using case when atcol1 % 2 = 0 then true else false end;
---END---
---START---
select * from anothertab;
 gemini_pk | atcol1 |    atcol2    
-----------+--------+--------------
         1 | f      | IT WAS TRUE
         2 | t      | IT WAS FALSE
         4 | f      | IT WAS NULL!
(3 rows)

---END---
---START---
drop table anothertab;
---END---
---START---
-- Test index handling in alter table column type (cf. bugs #15835, #15865)
create table anothertab(f1 int primary key, f2 int unique,
                        f3 int, f4 int, f5 int);
---END---
---START---
alter table anothertab
  add exclude using btree (f3 with =);
---END---
---START---
alter table anothertab
  add exclude using btree (f4 with =) where (f4 is not null);
---END---
---START---
alter table anothertab
  add exclude using btree (f4 with =) where (f5 > 0);
---END---
---START---
alter table anothertab
  add unique(f1,f4);
---END---
---START---
create index on anothertab(f2,f3);
---END---
---START---
create unique index on anothertab(f4);
---END---
---START---
\d anothertab
             Table "public.anothertab"
 Column |  Type   | Collation | Nullable | Default 
--------+---------+-----------+----------+---------
 f1     | integer |           | not null | 
 f2     | integer |           |          | 
 f3     | integer |           |          | 
 f4     | integer |           |          | 
 f5     | integer |           |          | 
Indexes:
    "anothertab_pkey" PRIMARY KEY, btree (f1)
    "anothertab_f1_f4_key" UNIQUE CONSTRAINT, btree (f1, f4)
    "anothertab_f2_f3_idx" btree (f2, f3)
    "anothertab_f2_key" UNIQUE CONSTRAINT, btree (f2)
    "anothertab_f3_excl" EXCLUDE USING btree (f3 WITH =)
    "anothertab_f4_excl" EXCLUDE USING btree (f4 WITH =) WHERE (f4 IS NOT NULL)
    "anothertab_f4_excl1" EXCLUDE USING btree (f4 WITH =) WHERE (f5 > 0)
    "anothertab_f4_idx" UNIQUE, btree (f4)

alter table anothertab alter column f1 type bigint;
---END---
---START---
alter table anothertab
  alter column f2 type bigint,
  alter column f3 type bigint,
  alter column f4 type bigint;
---END---
---START---
alter table anothertab alter column f5 type bigint;
---END---
---START---
\d anothertab
            Table "public.anothertab"
 Column |  Type  | Collation | Nullable | Default 
--------+--------+-----------+----------+---------
 f1     | bigint |           | not null | 
 f2     | bigint |           |          | 
 f3     | bigint |           |          | 
 f4     | bigint |           |          | 
 f5     | bigint |           |          | 
Indexes:
    "anothertab_pkey" PRIMARY KEY, btree (f1)
    "anothertab_f1_f4_key" UNIQUE CONSTRAINT, btree (f1, f4)
    "anothertab_f2_f3_idx" btree (f2, f3)
    "anothertab_f2_key" UNIQUE CONSTRAINT, btree (f2)
    "anothertab_f3_excl" EXCLUDE USING btree (f3 WITH =)
    "anothertab_f4_excl" EXCLUDE USING btree (f4 WITH =) WHERE (f4 IS NOT NULL)
    "anothertab_f4_excl1" EXCLUDE USING btree (f4 WITH =) WHERE (f5 > 0)
    "anothertab_f4_idx" UNIQUE, btree (f4)

drop table anothertab;
---END---
---START---
CREATE TABLE another (gemini_pk serial PRIMARY KEY, f1 integer, f2 text, f3 text);
---END---
---START---
insert into another values(1, 'one', 'uno');
ERROR:  invalid input syntax for type integer: "one"
LINE 1: insert into another values(1, 'one', 'uno');
                                      ^
---END---
---START---
insert into another values(2, 'two', 'due');
ERROR:  invalid input syntax for type integer: "two"
LINE 1: insert into another values(2, 'two', 'due');
                                      ^
---END---
---START---
insert into another values(3, 'three', 'tre');
ERROR:  invalid input syntax for type integer: "three"
LINE 1: insert into another values(3, 'three', 'tre');
                                      ^
---END---
---START---
select * from another;
 gemini_pk | f1 | f2 | f3 
-----------+----+----+----
(0 rows)

---END---
---START---
alter table another
  alter f1 type text using f2 || ' and ' || f3 || ' more',
  alter f2 type bigint using f1 * 10,
  drop column f3;
---END---
---START---
select * from another;
 gemini_pk | f1 | f2 
-----------+----+----
(0 rows)

---END---
---START---
drop table another;
---END---
---START---
-- Create an index that skips WAL, then perform a SET DATA TYPE that skips
-- rewriting the index.
begin;
---END---
---START---
create table skip_wal_skip_rewrite_index (c varchar(10) primary key);
---END---
---START---
alter table skip_wal_skip_rewrite_index alter c type varchar(20);
---END---
---START---
commit;
---END---
---START---
CREATE TABLE at_tab1 (gemini_pk serial PRIMARY KEY, a integer, b text);
---END---
---START---
CREATE TABLE at_tab2 (gemini_pk serial PRIMARY KEY, x integer, y at_tab1);
---END---
---START---
alter table at_tab1 alter column b type varchar;
ERROR:  cannot alter table "at_tab1" because column "at_tab2.y" uses its row type
---END---
---START---
-- fails
drop table at_tab2;
---END---
---START---
CREATE TABLE at_tab2 (gemini_pk serial PRIMARY KEY, x integer, y text, CHECK (CAST((x, y) AS at_tab1) = CAST((1, '42') AS at_tab1)));
ERROR:  cannot cast type record to at_tab1
LINE 1: ..._pk serial PRIMARY KEY, x integer, y text, CHECK (CAST((x, y...
                                                             ^
DETAIL:  Input has too few columns.
---END---
---START---
alter table at_tab1 alter column b type varchar;
---END---
---START---
-- allowed, but ...
insert into at_tab2 values(1,'42');
ERROR:  relation "at_tab2" does not exist
LINE 1: insert into at_tab2 values(1,'42');
                    ^
---END---
---START---
-- ... this will fail
drop table at_tab1, at_tab2;
ERROR:  table "at_tab2" does not exist
---END---
---START---
CREATE TABLE at_tab1 (gemini_pk serial PRIMARY KEY, a integer, b text) PARTITION BY list (a);
ERROR:  relation "at_tab1" already exists
---END---
---START---
CREATE TABLE at_tab2 (gemini_pk serial PRIMARY KEY, x integer, y at_tab1);
---END---
---START---
alter table at_tab1 alter column b type varchar;
ERROR:  cannot alter table "at_tab1" because column "at_tab2.y" uses its row type
---END---
---START---
-- fails
drop table at_tab1, at_tab2;
---END---
---START---
CREATE TABLE at_partitioned (gemini_pk serial PRIMARY KEY, a integer, b text) PARTITION BY range (a);
ERROR:  unique constraint on partitioned table must include all partitioning columns
DETAIL:  PRIMARY KEY constraint on table "at_partitioned" lacks column "a" which is part of the partition key.
---END---
---START---
create table at_part_1 partition of at_partitioned for values from (0) to (1000);
ERROR:  relation "at_partitioned" does not exist
---END---
---START---
insert into at_partitioned values (512, '0.123');
ERROR:  relation "at_partitioned" does not exist
LINE 1: insert into at_partitioned values (512, '0.123');
                    ^
---END---
---START---
CREATE TABLE at_part_2 (gemini_pk serial PRIMARY KEY, b text, a integer);
---END---
---START---
insert into at_part_2 values ('1.234', 1024);
ERROR:  invalid input syntax for type integer: "1.234"
LINE 1: insert into at_part_2 values ('1.234', 1024);
                                      ^
---END---
---START---
create index on at_partitioned (b);
ERROR:  relation "at_partitioned" does not exist
---END---
---START---
create index on at_partitioned (a);
ERROR:  relation "at_partitioned" does not exist
---END---
---START---
\d at_part_1
\d at_part_2
                                 Table "public.at_part_2"
  Column   |  Type   | Collation | Nullable |                   Default                    
-----------+---------+-----------+----------+----------------------------------------------
 gemini_pk | integer |           | not null | nextval('at_part_2_gemini_pk_seq'::regclass)
 b         | text    |           |          | 
 a         | integer |           |          | 
Indexes:
    "at_part_2_pkey" PRIMARY KEY, btree (gemini_pk)

alter table at_partitioned attach partition at_part_2 for values from (1000) to (2000);
ERROR:  relation "at_partitioned" does not exist
---END---
---START---
\d at_part_2
                                 Table "public.at_part_2"
  Column   |  Type   | Collation | Nullable |                   Default                    
-----------+---------+-----------+----------+----------------------------------------------
 gemini_pk | integer |           | not null | nextval('at_part_2_gemini_pk_seq'::regclass)
 b         | text    |           |          | 
 a         | integer |           |          | 
Indexes:
    "at_part_2_pkey" PRIMARY KEY, btree (gemini_pk)

alter table at_partitioned alter column b type numeric using b::numeric;
ERROR:  relation "at_partitioned" does not exist
---END---
---START---
\d at_part_1
\d at_part_2
                                 Table "public.at_part_2"
  Column   |  Type   | Collation | Nullable |                   Default                    
-----------+---------+-----------+----------+----------------------------------------------
 gemini_pk | integer |           | not null | nextval('at_part_2_gemini_pk_seq'::regclass)
 b         | text    |           |          | 
 a         | integer |           |          | 
Indexes:
    "at_part_2_pkey" PRIMARY KEY, btree (gemini_pk)

drop table at_partitioned;
ERROR:  table "at_partitioned" does not exist
---END---
---START---
CREATE TABLE at_partitioned (gemini_pk serial PRIMARY KEY, id integer, name varchar(64), UNIQUE (id, name)) PARTITION BY hash (id);
ERROR:  unique constraint on partitioned table must include all partitioning columns
DETAIL:  PRIMARY KEY constraint on table "at_partitioned" lacks column "id" which is part of the partition key.
---END---
---START---
comment on constraint at_partitioned_id_name_key on at_partitioned is 'parent constraint';
ERROR:  relation "at_partitioned" does not exist
---END---
---START---
comment on index at_partitioned_id_name_key is 'parent index';
ERROR:  relation "at_partitioned_id_name_key" does not exist
---END---
---START---
create table at_partitioned_0 partition of at_partitioned
  for values with (modulus 2, remainder 0);
ERROR:  relation "at_partitioned" does not exist
---END---
---START---
comment on constraint at_partitioned_0_id_name_key on at_partitioned_0 is 'child 0 constraint';
ERROR:  relation "at_partitioned_0" does not exist
---END---
---START---
comment on index at_partitioned_0_id_name_key is 'child 0 index';
ERROR:  relation "at_partitioned_0_id_name_key" does not exist
---END---
---START---
create table at_partitioned_1 partition of at_partitioned
  for values with (modulus 2, remainder 1);
ERROR:  relation "at_partitioned" does not exist
---END---
---START---
comment on constraint at_partitioned_1_id_name_key on at_partitioned_1 is 'child 1 constraint';
ERROR:  relation "at_partitioned_1" does not exist
---END---
---START---
comment on index at_partitioned_1_id_name_key is 'child 1 index';
ERROR:  relation "at_partitioned_1_id_name_key" does not exist
---END---
---START---
insert into at_partitioned values(1, 'foo');
ERROR:  relation "at_partitioned" does not exist
LINE 1: insert into at_partitioned values(1, 'foo');
                    ^
---END---
---START---
insert into at_partitioned values(3, 'bar');
ERROR:  relation "at_partitioned" does not exist
LINE 1: insert into at_partitioned values(3, 'bar');
                    ^
---END---
---START---
DROP TABLE IF EXISTS old_oids;
NOTICE:  table "old_oids" does not exist, skipping
create table old_oids as
  select relname, oid as oldoid, relfilenode as oldfilenode
  from pg_class where relname like 'at_partitioned%';
---END---
---START---
select relname,
  c.oid = oldoid as orig_oid,
  case relfilenode
    when 0 then 'none'
    when c.oid then 'own'
    when oldfilenode then 'orig'
    else 'OTHER'
    end as storage,
  obj_description(c.oid, 'pg_class') as desc
  from pg_class c left join old_oids using (relname)
  where relname like 'at_partitioned%'
  order by relname;
 relname | orig_oid | storage | desc 
---------+----------+---------+------
(0 rows)

---END---
---START---
select conname, obj_description(oid, 'pg_constraint') as desc
  from pg_constraint where conname like 'at_partitioned%'
  order by conname;
 conname | desc 
---------+------
(0 rows)

---END---
---START---
alter table at_partitioned alter column name type varchar(127);
ERROR:  relation "at_partitioned" does not exist
---END---
---START---
-- Note: these tests currently show the wrong behavior for comments :-(
select relname,
  c.oid = oldoid as orig_oid,
  case relfilenode
    when 0 then 'none'
    when c.oid then 'own'
    when oldfilenode then 'orig'
    else 'OTHER'
    end as storage,
  obj_description(c.oid, 'pg_class') as desc
  from pg_class c left join old_oids using (relname)
  where relname like 'at_partitioned%'
  order by relname;
 relname | orig_oid | storage | desc 
---------+----------+---------+------
(0 rows)

---END---
---START---
select conname, obj_description(oid, 'pg_constraint') as desc
  from pg_constraint where conname like 'at_partitioned%'
  order by conname;
 conname | desc 
---------+------
(0 rows)

---END---
---START---
-- Don't remove this DROP, it exposes bug #15672
drop table at_partitioned;
ERROR:  table "at_partitioned" does not exist
---END---
---START---
-- disallow recursive containment of row types
DROP TABLE IF EXISTS recur1;
NOTICE:  table "recur1" does not exist, skipping
CREATE TABLE recur1 (gemini_pk serial PRIMARY KEY, f1 integer);
---END---
---START---
alter table recur1 add column f2 recur1;
ERROR:  composite type recur1 cannot be made a member of itself
---END---
---START---
-- fails
alter table recur1 add column f2 recur1[];
ERROR:  composite type recur1 cannot be made a member of itself
---END---
---START---
-- fails
create domain array_of_recur1 as recur1[];
---END---
---START---
alter table recur1 add column f2 array_of_recur1;
ERROR:  composite type recur1 cannot be made a member of itself
---END---
---START---
-- fails
DROP TABLE IF EXISTS recur2;
NOTICE:  table "recur2" does not exist, skipping
CREATE TABLE recur2 (gemini_pk serial PRIMARY KEY, f1 integer, f2 recur1);
---END---
---START---
alter table recur1 add column f2 recur2;
ERROR:  composite type recur1 cannot be made a member of itself
---END---
---START---
-- fails
alter table recur1 add column f2 int;
---END---
---START---
alter table recur1 alter column f2 type recur2;
ERROR:  composite type recur1 cannot be made a member of itself
---END---
---START---
CREATE TABLE test_storage (gemini_pk serial PRIMARY KEY, a text, c text STORAGE plain );
---END---
---START---
select reltoastrelid <> 0 as has_toast_table
  from pg_class where oid = 'test_storage'::regclass;
 has_toast_table 
-----------------
 t
(1 row)

---END---
---START---
alter table test_storage alter a set storage plain;
---END---
---START---
-- rewrite table to remove its TOAST table; need a non-constant column default
alter table test_storage add b int default random()::int;
---END---
---START---
select reltoastrelid <> 0 as has_toast_table
  from pg_class where oid = 'test_storage'::regclass;
 has_toast_table 
-----------------
 f
(1 row)

---END---
---START---
alter table test_storage alter a set storage default;
---END---
---START---
-- re-add TOAST table
select reltoastrelid <> 0 as has_toast_table
  from pg_class where oid = 'test_storage'::regclass;
 has_toast_table 
-----------------
 t
(1 row)

---END---
---START---
CREATE TABLE test_storage_failed (gemini_pk serial PRIMARY KEY, a text, b integer STORAGE extended );
ERROR:  column data type integer can only have storage PLAIN
---END---
---START---
-- test that SET STORAGE propagates to index correctly
create index test_storage_idx on test_storage (b, a);
---END---
---START---
alter table test_storage alter column a set storage external;
---END---
---START---
\d+ test_storage
                                                     Table "public.test_storage"
  Column   |  Type   | Collation | Nullable |                     Default                     | Storage  | Stats target | Description 
-----------+---------+-----------+----------+-------------------------------------------------+----------+--------------+-------------
 gemini_pk | integer |           | not null | nextval('test_storage_gemini_pk_seq'::regclass) | plain    |              | 
 a         | text    |           |          |                                                 | external |              | 
 c         | text    |           |          |                                                 | plain    |              | 
 b         | integer |           |          | random()::integer                               | plain    |              | 
Indexes:
    "test_storage_pkey" PRIMARY KEY, btree (gemini_pk)
    "test_storage_idx" btree (b, a)

\d+ test_storage_idx
                Index "public.test_storage_idx"
 Column |  Type   | Key? | Definition | Storage  | Stats target 
--------+---------+------+------------+----------+--------------
 b      | integer | yes  | b          | plain    | 
 a      | text    | yes  | a          | external | 
btree, for table "public.test_storage"

-- ALTER COLUMN TYPE with a check constraint and a child table (bug #13779)
CREATE TABLE test_inh_check (gemini_pk serial PRIMARY KEY, a float check (a > 10.2), b float);
---END---
---START---
CREATE TABLE test_inh_check_child (gemini_pk serial PRIMARY KEY) INHERITS (test_inh_check);
NOTICE:  merging column "gemini_pk" with inherited definition
---END---
---START---
\d test_inh_check
                                      Table "public.test_inh_check"
  Column   |       Type       | Collation | Nullable |                      Default                      
-----------+------------------+-----------+----------+---------------------------------------------------
 gemini_pk | integer          |           | not null | nextval('test_inh_check_gemini_pk_seq'::regclass)
 a         | double precision |           |          | 
 b         | double precision |           |          | 
Indexes:
    "test_inh_check_pkey" PRIMARY KEY, btree (gemini_pk)
Check constraints:
    "test_inh_check_a_check" CHECK (a > 10.2::double precision)
Number of child tables: 1 (Use \d+ to list them.)

\d test_inh_check_child
                                      Table "public.test_inh_check_child"
  Column   |       Type       | Collation | Nullable |                         Default                         
-----------+------------------+-----------+----------+---------------------------------------------------------
 gemini_pk | integer          |           | not null | nextval('test_inh_check_child_gemini_pk_seq'::regclass)
 a         | double precision |           |          | 
 b         | double precision |           |          | 
Indexes:
    "test_inh_check_child_pkey" PRIMARY KEY, btree (gemini_pk)
Check constraints:
    "test_inh_check_a_check" CHECK (a > 10.2::double precision)
Inherits: test_inh_check

select relname, conname, coninhcount, conislocal, connoinherit
  from pg_constraint c, pg_class r
  where relname like 'test_inh_check%' and c.conrelid = r.oid
  order by 1, 2;
       relname        |          conname          | coninhcount | conislocal | connoinherit 
----------------------+---------------------------+-------------+------------+--------------
 test_inh_check       | test_inh_check_a_check    |           0 | t          | f
 test_inh_check       | test_inh_check_pkey       |           0 | t          | t
 test_inh_check_child | test_inh_check_a_check    |           1 | f          | f
 test_inh_check_child | test_inh_check_child_pkey |           0 | t          | t
(4 rows)

---END---
---START---
ALTER TABLE test_inh_check ALTER COLUMN a TYPE numeric;
---END---
---START---
\d test_inh_check
                                      Table "public.test_inh_check"
  Column   |       Type       | Collation | Nullable |                      Default                      
-----------+------------------+-----------+----------+---------------------------------------------------
 gemini_pk | integer          |           | not null | nextval('test_inh_check_gemini_pk_seq'::regclass)
 a         | numeric          |           |          | 
 b         | double precision |           |          | 
Indexes:
    "test_inh_check_pkey" PRIMARY KEY, btree (gemini_pk)
Check constraints:
    "test_inh_check_a_check" CHECK (a::double precision > 10.2::double precision)
Number of child tables: 1 (Use \d+ to list them.)

\d test_inh_check_child
                                      Table "public.test_inh_check_child"
  Column   |       Type       | Collation | Nullable |                         Default                         
-----------+------------------+-----------+----------+---------------------------------------------------------
 gemini_pk | integer          |           | not null | nextval('test_inh_check_child_gemini_pk_seq'::regclass)
 a         | numeric          |           |          | 
 b         | double precision |           |          | 
Indexes:
    "test_inh_check_child_pkey" PRIMARY KEY, btree (gemini_pk)
Check constraints:
    "test_inh_check_a_check" CHECK (a::double precision > 10.2::double precision)
Inherits: test_inh_check

select relname, conname, coninhcount, conislocal, connoinherit
  from pg_constraint c, pg_class r
  where relname like 'test_inh_check%' and c.conrelid = r.oid
  order by 1, 2;
       relname        |          conname          | coninhcount | conislocal | connoinherit 
----------------------+---------------------------+-------------+------------+--------------
 test_inh_check       | test_inh_check_a_check    |           0 | t          | f
 test_inh_check       | test_inh_check_pkey       |           0 | t          | t
 test_inh_check_child | test_inh_check_a_check    |           1 | f          | f
 test_inh_check_child | test_inh_check_child_pkey |           0 | t          | t
(4 rows)

---END---
---START---
-- also try noinherit, local, and local+inherited cases
ALTER TABLE test_inh_check ADD CONSTRAINT bnoinherit CHECK (b > 100) NO INHERIT;
---END---
---START---
ALTER TABLE test_inh_check_child ADD CONSTRAINT blocal CHECK (b < 1000);
---END---
---START---
ALTER TABLE test_inh_check_child ADD CONSTRAINT bmerged CHECK (b > 1);
---END---
---START---
ALTER TABLE test_inh_check ADD CONSTRAINT bmerged CHECK (b > 1);
NOTICE:  merging constraint "bmerged" with inherited definition
---END---
---START---
\d test_inh_check
                                      Table "public.test_inh_check"
  Column   |       Type       | Collation | Nullable |                      Default                      
-----------+------------------+-----------+----------+---------------------------------------------------
 gemini_pk | integer          |           | not null | nextval('test_inh_check_gemini_pk_seq'::regclass)
 a         | numeric          |           |          | 
 b         | double precision |           |          | 
Indexes:
    "test_inh_check_pkey" PRIMARY KEY, btree (gemini_pk)
Check constraints:
    "bmerged" CHECK (b > 1::double precision)
    "bnoinherit" CHECK (b > 100::double precision) NO INHERIT
    "test_inh_check_a_check" CHECK (a::double precision > 10.2::double precision)
Number of child tables: 1 (Use \d+ to list them.)

\d test_inh_check_child
                                      Table "public.test_inh_check_child"
  Column   |       Type       | Collation | Nullable |                         Default                         
-----------+------------------+-----------+----------+---------------------------------------------------------
 gemini_pk | integer          |           | not null | nextval('test_inh_check_child_gemini_pk_seq'::regclass)
 a         | numeric          |           |          | 
 b         | double precision |           |          | 
Indexes:
    "test_inh_check_child_pkey" PRIMARY KEY, btree (gemini_pk)
Check constraints:
    "blocal" CHECK (b < 1000::double precision)
    "bmerged" CHECK (b > 1::double precision)
    "test_inh_check_a_check" CHECK (a::double precision > 10.2::double precision)
Inherits: test_inh_check

select relname, conname, coninhcount, conislocal, connoinherit
  from pg_constraint c, pg_class r
  where relname like 'test_inh_check%' and c.conrelid = r.oid
  order by 1, 2;
       relname        |          conname          | coninhcount | conislocal | connoinherit 
----------------------+---------------------------+-------------+------------+--------------
 test_inh_check       | bmerged                   |           0 | t          | f
 test_inh_check       | bnoinherit                |           0 | t          | t
 test_inh_check       | test_inh_check_a_check    |           0 | t          | f
 test_inh_check       | test_inh_check_pkey       |           0 | t          | t
 test_inh_check_child | blocal                    |           0 | t          | f
 test_inh_check_child | bmerged                   |           1 | t          | f
 test_inh_check_child | test_inh_check_a_check    |           1 | f          | f
 test_inh_check_child | test_inh_check_child_pkey |           0 | t          | t
(8 rows)

---END---
---START---
ALTER TABLE test_inh_check ALTER COLUMN b TYPE numeric;
NOTICE:  merging constraint "bmerged" with inherited definition
---END---
---START---
\d test_inh_check
                                 Table "public.test_inh_check"
  Column   |  Type   | Collation | Nullable |                      Default                      
-----------+---------+-----------+----------+---------------------------------------------------
 gemini_pk | integer |           | not null | nextval('test_inh_check_gemini_pk_seq'::regclass)
 a         | numeric |           |          | 
 b         | numeric |           |          | 
Indexes:
    "test_inh_check_pkey" PRIMARY KEY, btree (gemini_pk)
Check constraints:
    "bmerged" CHECK (b::double precision > 1::double precision)
    "bnoinherit" CHECK (b::double precision > 100::double precision) NO INHERIT
    "test_inh_check_a_check" CHECK (a::double precision > 10.2::double precision)
Number of child tables: 1 (Use \d+ to list them.)

\d test_inh_check_child
                                 Table "public.test_inh_check_child"
  Column   |  Type   | Collation | Nullable |                         Default                         
-----------+---------+-----------+----------+---------------------------------------------------------
 gemini_pk | integer |           | not null | nextval('test_inh_check_child_gemini_pk_seq'::regclass)
 a         | numeric |           |          | 
 b         | numeric |           |          | 
Indexes:
    "test_inh_check_child_pkey" PRIMARY KEY, btree (gemini_pk)
Check constraints:
    "blocal" CHECK (b::double precision < 1000::double precision)
    "bmerged" CHECK (b::double precision > 1::double precision)
    "test_inh_check_a_check" CHECK (a::double precision > 10.2::double precision)
Inherits: test_inh_check

select relname, conname, coninhcount, conislocal, connoinherit
  from pg_constraint c, pg_class r
  where relname like 'test_inh_check%' and c.conrelid = r.oid
  order by 1, 2;
       relname        |          conname          | coninhcount | conislocal | connoinherit 
----------------------+---------------------------+-------------+------------+--------------
 test_inh_check       | bmerged                   |           0 | t          | f
 test_inh_check       | bnoinherit                |           0 | t          | t
 test_inh_check       | test_inh_check_a_check    |           0 | t          | f
 test_inh_check       | test_inh_check_pkey       |           0 | t          | t
 test_inh_check_child | blocal                    |           0 | t          | f
 test_inh_check_child | bmerged                   |           1 | t          | f
 test_inh_check_child | test_inh_check_a_check    |           1 | f          | f
 test_inh_check_child | test_inh_check_child_pkey |           0 | t          | t
(8 rows)

---END---
---START---
CREATE TABLE test_type_diff (gemini_pk serial PRIMARY KEY, f1 integer);
---END---
---START---
CREATE TABLE test_type_diff_c (gemini_pk serial PRIMARY KEY, extra bigint) INHERITS (test_type_diff);
NOTICE:  merging column "gemini_pk" with inherited definition
---END---
---START---
ALTER TABLE test_type_diff ADD COLUMN f2 int;
---END---
---START---
INSERT INTO test_type_diff_c VALUES (1, 2, 3);
---END---
---START---
ALTER TABLE test_type_diff ALTER COLUMN f2 TYPE bigint USING f2::bigint;
---END---
---START---
CREATE TABLE test_type_diff2 (gemini_pk serial PRIMARY KEY, int_two int8, int_four int8, int_eight int8);
---END---
---START---
CREATE TABLE test_type_diff2_c1 (gemini_pk serial PRIMARY KEY, int_four int8, int_eight int8, int_two int8);
---END---
---START---
CREATE TABLE test_type_diff2_c2 (gemini_pk serial PRIMARY KEY, int_eight int8, int_two int8, int_four int8);
---END---
---START---
CREATE TABLE test_type_diff2_c3 (gemini_pk serial PRIMARY KEY, int_two int8, int_four int8, int_eight int8);
---END---
---START---
ALTER TABLE test_type_diff2_c1 INHERIT test_type_diff2;
---END---
---START---
ALTER TABLE test_type_diff2_c2 INHERIT test_type_diff2;
---END---
---START---
ALTER TABLE test_type_diff2_c3 INHERIT test_type_diff2;
---END---
---START---
INSERT INTO test_type_diff2_c1 VALUES (1, 2, 3);
---END---
---START---
INSERT INTO test_type_diff2_c2 VALUES (4, 5, 6);
---END---
---START---
INSERT INTO test_type_diff2_c3 VALUES (7, 8, 9);
---END---
---START---
ALTER TABLE test_type_diff2 ALTER COLUMN int_four TYPE int8 USING int_four::int8;
---END---
---START---
-- whole-row references are disallowed
ALTER TABLE test_type_diff2 ALTER COLUMN int_four TYPE int4 USING (pg_column_size(test_type_diff2));
ERROR:  cannot convert whole-row table reference
DETAIL:  USING expression contains a whole-row table reference.
---END---
---START---
-- check for rollback of ANALYZE corrupting table property flags (bug #11638)
CREATE TABLE check_fk_presence_1 (id int PRIMARY KEY, t text);
---END---
---START---
CREATE TABLE check_fk_presence_2 (gemini_pk serial PRIMARY KEY, id integer REFERENCES check_fk_presence_1, t text);
---END---
---START---
BEGIN;
---END---
---START---
ALTER TABLE check_fk_presence_2 DROP CONSTRAINT check_fk_presence_2_id_fkey;
---END---
---START---
ANALYZE check_fk_presence_2;
---END---
---START---
ROLLBACK;
---END---
---START---
\d check_fk_presence_2
                                 Table "public.check_fk_presence_2"
  Column   |  Type   | Collation | Nullable |                        Default                         
-----------+---------+-----------+----------+--------------------------------------------------------
 gemini_pk | integer |           | not null | nextval('check_fk_presence_2_gemini_pk_seq'::regclass)
 id        | integer |           |          | 
 t         | text    |           |          | 
Indexes:
    "check_fk_presence_2_pkey" PRIMARY KEY, btree (gemini_pk)
Foreign-key constraints:
    "check_fk_presence_2_id_fkey" FOREIGN KEY (id) REFERENCES check_fk_presence_1(id)

DROP TABLE check_fk_presence_1, check_fk_presence_2;
---END---
---START---
CREATE TABLE at_base_table (gemini_pk serial PRIMARY KEY, id integer, stuff text);
---END---
---START---
insert into at_base_table values (23, 'skidoo');
ERROR:  invalid input syntax for type integer: "skidoo"
LINE 1: insert into at_base_table values (23, 'skidoo');
                                              ^
---END---
---START---
create view at_view_1 as select * from at_base_table bt;
---END---
---START---
create view at_view_2 as select *, to_json(v1) as j from at_view_1 v1;
---END---
---START---
\d+ at_view_1
                            View "public.at_view_1"
  Column   |  Type   | Collation | Nullable | Default | Storage  | Description 
-----------+---------+-----------+----------+---------+----------+-------------
 gemini_pk | integer |           |          |         | plain    | 
 id        | integer |           |          |         | plain    | 
 stuff     | text    |           |          |         | extended | 
View definition:
 SELECT gemini_pk,
    id,
    stuff
   FROM at_base_table bt;

\d+ at_view_2
                            View "public.at_view_2"
  Column   |  Type   | Collation | Nullable | Default | Storage  | Description 
-----------+---------+-----------+----------+---------+----------+-------------
 gemini_pk | integer |           |          |         | plain    | 
 id        | integer |           |          |         | plain    | 
 stuff     | text    |           |          |         | extended | 
 j         | json    |           |          |         | extended | 
View definition:
 SELECT gemini_pk,
    id,
    stuff,
    to_json(v1.*) AS j
   FROM at_view_1 v1;

explain (verbose, costs off) select * from at_view_2;
                                      QUERY PLAN                                      
--------------------------------------------------------------------------------------
 Seq Scan on public.at_base_table bt
   Output: bt.gemini_pk, bt.id, bt.stuff, to_json(ROW(bt.gemini_pk, bt.id, bt.stuff))
(2 rows)

---END---
---START---
select * from at_view_2;
 gemini_pk | id | stuff | j 
-----------+----+-------+---
(0 rows)

---END---
---START---
create or replace view at_view_1 as select *, 2+2 as more from at_base_table bt;
---END---
---START---
\d+ at_view_1
                            View "public.at_view_1"
  Column   |  Type   | Collation | Nullable | Default | Storage  | Description 
-----------+---------+-----------+----------+---------+----------+-------------
 gemini_pk | integer |           |          |         | plain    | 
 id        | integer |           |          |         | plain    | 
 stuff     | text    |           |          |         | extended | 
 more      | integer |           |          |         | plain    | 
View definition:
 SELECT gemini_pk,
    id,
    stuff,
    2 + 2 AS more
   FROM at_base_table bt;

\d+ at_view_2
                            View "public.at_view_2"
  Column   |  Type   | Collation | Nullable | Default | Storage  | Description 
-----------+---------+-----------+----------+---------+----------+-------------
 gemini_pk | integer |           |          |         | plain    | 
 id        | integer |           |          |         | plain    | 
 stuff     | text    |           |          |         | extended | 
 j         | json    |           |          |         | extended | 
View definition:
 SELECT gemini_pk,
    id,
    stuff,
    to_json(v1.*) AS j
   FROM at_view_1 v1;

explain (verbose, costs off) select * from at_view_2;
                                       QUERY PLAN                                        
-----------------------------------------------------------------------------------------
 Seq Scan on public.at_base_table bt
   Output: bt.gemini_pk, bt.id, bt.stuff, to_json(ROW(bt.gemini_pk, bt.id, bt.stuff, 4))
(2 rows)

---END---
---START---
select * from at_view_2;
 gemini_pk | id | stuff | j 
-----------+----+-------+---
(0 rows)

---END---
---START---
drop view at_view_2;
---END---
---START---
drop view at_view_1;
---END---
---START---
drop table at_base_table;
---END---
---START---
-- related case (bug #17811)
begin;
---END---
---START---
DROP TABLE IF EXISTS t1;
NOTICE:  table "t1" does not exist, skipping
create table t1 as select * from int8_tbl;
---END---
---START---
create temp view v1 as select 1::int8 as q1;
---END---
---START---
create temp view v2 as select * from v1;
---END---
---START---
create or replace temp view v1 with (security_barrier = true)
  as select * from t1;
ERROR:  cannot change name of view column "q1" to "gemini_pk"
HINT:  Use ALTER VIEW ... RENAME COLUMN ... to change name of view column instead.
---END---
---START---
DROP TABLE IF EXISTS log;
ERROR:  current transaction is aborted, commands ignored until end of transaction block
CREATE TABLE log (gemini_pk serial PRIMARY KEY, q1 int8, q2 int8);
ERROR:  current transaction is aborted, commands ignored until end of transaction block
---END---
---START---
create rule v1_upd_rule as on update to v1
  do also insert into log values (new.*);
ERROR:  current transaction is aborted, commands ignored until end of transaction block
---END---
---START---
update v2 set q1 = q1 + 1 where q1 = 123;
ERROR:  current transaction is aborted, commands ignored until end of transaction block
---END---
---START---
select * from t1;
ERROR:  current transaction is aborted, commands ignored until end of transaction block
---END---
---START---
select * from log;
ERROR:  current transaction is aborted, commands ignored until end of transaction block
---END---
---START---
rollback;
---END---
---START---
-- check adding a column not itself requiring a rewrite, together with
-- a column requiring a default (bug #16038)
-- ensure that rewrites aren't silently optimized away, removing the
-- value of the test
CREATE FUNCTION check_ddl_rewrite(p_tablename regclass, p_ddl text)
RETURNS boolean
LANGUAGE plpgsql AS $$
DECLARE
    v_relfilenode oid;
BEGIN
    v_relfilenode := relfilenode FROM pg_class WHERE oid = p_tablename;

    EXECUTE p_ddl;

    RETURN v_relfilenode <> (SELECT relfilenode FROM pg_class WHERE oid = p_tablename);
END;
$$;
---END---
---START---
CREATE TABLE rewrite_test (gemini_pk serial PRIMARY KEY, col text);
---END---
---START---
INSERT INTO rewrite_test VALUES ('something');
ERROR:  invalid input syntax for type integer: "something"
LINE 1: INSERT INTO rewrite_test VALUES ('something');
                                         ^
---END---
---START---
INSERT INTO rewrite_test VALUES (NULL);
ERROR:  null value in column "gemini_pk" of relation "rewrite_test" violates not-null constraint
DETAIL:  Failing row contains (null, null).
---END---
---START---
-- empty[12] don't need rewrite, but notempty[12]_rewrite will force one
SELECT check_ddl_rewrite('rewrite_test', $$
  ALTER TABLE rewrite_test
      ADD COLUMN empty1 text,
      ADD COLUMN notempty1_rewrite serial;
$$);
 check_ddl_rewrite 
-------------------
 t
(1 row)

---END---
---START---
SELECT check_ddl_rewrite('rewrite_test', $$
    ALTER TABLE rewrite_test
        ADD COLUMN notempty2_rewrite serial,
        ADD COLUMN empty2 text;
$$);
 check_ddl_rewrite 
-------------------
 t
(1 row)

---END---
---START---
-- also check that fast defaults cause no problem, first without rewrite
SELECT check_ddl_rewrite('rewrite_test', $$
    ALTER TABLE rewrite_test
        ADD COLUMN empty3 text,
        ADD COLUMN notempty3_norewrite int default 42;
$$);
 check_ddl_rewrite 
-------------------
 f
(1 row)

---END---
---START---
SELECT check_ddl_rewrite('rewrite_test', $$
    ALTER TABLE rewrite_test
        ADD COLUMN notempty4_norewrite int default 42,
        ADD COLUMN empty4 text;
$$);
 check_ddl_rewrite 
-------------------
 f
(1 row)

---END---
---START---
-- then with rewrite
SELECT check_ddl_rewrite('rewrite_test', $$
    ALTER TABLE rewrite_test
        ADD COLUMN empty5 text,
        ADD COLUMN notempty5_norewrite int default 42,
        ADD COLUMN notempty5_rewrite serial;
$$);
 check_ddl_rewrite 
-------------------
 t
(1 row)

---END---
---START---
SELECT check_ddl_rewrite('rewrite_test', $$
    ALTER TABLE rewrite_test
        ADD COLUMN notempty6_rewrite serial,
        ADD COLUMN empty6 text,
        ADD COLUMN notempty6_norewrite int default 42;
$$);
 check_ddl_rewrite 
-------------------
 t
(1 row)

---END---
---START---
-- cleanup
DROP FUNCTION check_ddl_rewrite(regclass, text);
---END---
---START---
DROP TABLE rewrite_test;
---END---
---START---
--
-- lock levels
--
drop type lockmodes;
ERROR:  type "lockmodes" does not exist
---END---
---START---
create type lockmodes as enum (
 'SIReadLock'
,'AccessShareLock'
,'RowShareLock'
,'RowExclusiveLock'
,'ShareUpdateExclusiveLock'
,'ShareLock'
,'ShareRowExclusiveLock'
,'ExclusiveLock'
,'AccessExclusiveLock'
);
---END---
---START---
drop view my_locks;
ERROR:  view "my_locks" does not exist
---END---
---START---
create or replace view my_locks as
select case when c.relname like 'pg_toast%' then 'pg_toast' else c.relname end, max(mode::lockmodes) as max_lockmode
from pg_locks l join pg_class c on l.relation = c.oid
where virtualtransaction = (
        select virtualtransaction
        from pg_locks
        where transactionid = pg_current_xact_id()::xid)
and locktype = 'relation'
and relnamespace != (select oid from pg_namespace where nspname = 'pg_catalog')
and c.relname != 'my_locks'
group by c.relname;
---END---
---START---
create table alterlock (f1 int primary key, f2 text);
---END---
---START---
insert into alterlock values (1, 'foo');
---END---
---START---
create table alterlock2 (f3 int primary key, f1 int);
---END---
---START---
insert into alterlock2 values (1, 1);
---END---
---START---
begin;
---END---
---START---
alter table alterlock alter column f2 set statistics 150;
---END---
---START---
select * from my_locks order by 1;
  relname  |       max_lockmode       
-----------+--------------------------
 alterlock | ShareUpdateExclusiveLock
(1 row)

---END---
---START---
rollback;
---END---
---START---
begin;
---END---
---START---
alter table alterlock cluster on alterlock_pkey;
---END---
---START---
select * from my_locks order by 1;
    relname     |       max_lockmode       
----------------+--------------------------
 alterlock      | ShareUpdateExclusiveLock
 alterlock_pkey | ShareUpdateExclusiveLock
(2 rows)

---END---
---START---
commit;
---END---
---START---
begin;
---END---
---START---
alter table alterlock set without cluster;
---END---
---START---
select * from my_locks order by 1;
  relname  |       max_lockmode       
-----------+--------------------------
 alterlock | ShareUpdateExclusiveLock
(1 row)

---END---
---START---
commit;
---END---
---START---
begin;
---END---
---START---
alter table alterlock set (fillfactor = 100);
---END---
---START---
select * from my_locks order by 1;
  relname  |       max_lockmode       
-----------+--------------------------
 alterlock | ShareUpdateExclusiveLock
 pg_toast  | ShareUpdateExclusiveLock
(2 rows)

---END---
---START---
commit;
---END---
---START---
begin;
---END---
---START---
alter table alterlock reset (fillfactor);
---END---
---START---
select * from my_locks order by 1;
  relname  |       max_lockmode       
-----------+--------------------------
 alterlock | ShareUpdateExclusiveLock
 pg_toast  | ShareUpdateExclusiveLock
(2 rows)

---END---
---START---
commit;
---END---
---START---
begin;
---END---
---START---
alter table alterlock set (toast.autovacuum_enabled = off);
---END---
---START---
select * from my_locks order by 1;
  relname  |       max_lockmode       
-----------+--------------------------
 alterlock | ShareUpdateExclusiveLock
 pg_toast  | ShareUpdateExclusiveLock
(2 rows)

---END---
---START---
commit;
---END---
---START---
begin;
---END---
---START---
alter table alterlock set (autovacuum_enabled = off);
---END---
---START---
select * from my_locks order by 1;
  relname  |       max_lockmode       
-----------+--------------------------
 alterlock | ShareUpdateExclusiveLock
 pg_toast  | ShareUpdateExclusiveLock
(2 rows)

---END---
---START---
commit;
---END---
---START---
begin;
---END---
---START---
alter table alterlock alter column f2 set (n_distinct = 1);
---END---
---START---
select * from my_locks order by 1;
  relname  |       max_lockmode       
-----------+--------------------------
 alterlock | ShareUpdateExclusiveLock
(1 row)

---END---
---START---
rollback;
---END---
---START---
-- test that mixing options with different lock levels works as expected
begin;
---END---
---START---
alter table alterlock set (autovacuum_enabled = off, fillfactor = 80);
---END---
---START---
select * from my_locks order by 1;
  relname  |       max_lockmode       
-----------+--------------------------
 alterlock | ShareUpdateExclusiveLock
 pg_toast  | ShareUpdateExclusiveLock
(2 rows)

---END---
---START---
commit;
---END---
---START---
begin;
---END---
---START---
alter table alterlock alter column f2 set storage extended;
---END---
---START---
select * from my_locks order by 1;
  relname  |    max_lockmode     
-----------+---------------------
 alterlock | AccessExclusiveLock
(1 row)

---END---
---START---
rollback;
---END---
---START---
begin;
---END---
---START---
alter table alterlock alter column f2 set default 'x';
---END---
---START---
select * from my_locks order by 1;
  relname  |    max_lockmode     
-----------+---------------------
 alterlock | AccessExclusiveLock
(1 row)

---END---
---START---
rollback;
---END---
---START---
begin;
---END---
---START---
create trigger ttdummy
	before delete or update on alterlock
	for each row
	execute procedure
	ttdummy (1, 1);
---END---
---START---
select * from my_locks order by 1;
  relname  |     max_lockmode      
-----------+-----------------------
 alterlock | ShareRowExclusiveLock
(1 row)

---END---
---START---
rollback;
---END---
---START---
begin;
---END---
---START---
select * from my_locks order by 1;
 relname | max_lockmode 
---------+--------------
(0 rows)

---END---
---START---
alter table alterlock2 add foreign key (f1) references alterlock (f1);
---END---
---START---
select * from my_locks order by 1;
     relname     |     max_lockmode      
-----------------+-----------------------
 alterlock       | ShareRowExclusiveLock
 alterlock2      | ShareRowExclusiveLock
 alterlock2_pkey | AccessShareLock
 alterlock_pkey  | AccessShareLock
(4 rows)

---END---
---START---
rollback;
---END---
---START---
begin;
---END---
---START---
alter table alterlock2
add constraint alterlock2nv foreign key (f1) references alterlock (f1) NOT VALID;
---END---
---START---
select * from my_locks order by 1;
  relname   |     max_lockmode      
------------+-----------------------
 alterlock  | ShareRowExclusiveLock
 alterlock2 | ShareRowExclusiveLock
(2 rows)

---END---
---START---
commit;
---END---
---START---
begin;
---END---
---START---
alter table alterlock2 validate constraint alterlock2nv;
---END---
---START---
select * from my_locks order by 1;
     relname     |       max_lockmode       
-----------------+--------------------------
 alterlock       | RowShareLock
 alterlock2      | ShareUpdateExclusiveLock
 alterlock2_pkey | AccessShareLock
 alterlock_pkey  | AccessShareLock
(4 rows)

---END---
---START---
rollback;
---END---
---START---
create or replace view my_locks as
select case when c.relname like 'pg_toast%' then 'pg_toast' else c.relname end, max(mode::lockmodes) as max_lockmode
from pg_locks l join pg_class c on l.relation = c.oid
where virtualtransaction = (
        select virtualtransaction
        from pg_locks
        where transactionid = pg_current_xact_id()::xid)
and locktype = 'relation'
and relnamespace != (select oid from pg_namespace where nspname = 'pg_catalog')
and c.relname = 'my_locks'
group by c.relname;
---END---
---START---
-- raise exception
alter table my_locks set (autovacuum_enabled = false);
ERROR:  unrecognized parameter "autovacuum_enabled"
---END---
---START---
alter view my_locks set (autovacuum_enabled = false);
ERROR:  unrecognized parameter "autovacuum_enabled"
---END---
---START---
alter table my_locks reset (autovacuum_enabled);
---END---
---START---
alter view my_locks reset (autovacuum_enabled);
---END---
---START---
begin;
---END---
---START---
alter view my_locks set (security_barrier=off);
---END---
---START---
select * from my_locks order by 1;
 relname  |    max_lockmode     
----------+---------------------
 my_locks | AccessExclusiveLock
(1 row)

---END---
---START---
alter view my_locks reset (security_barrier);
---END---
---START---
rollback;
---END---
---START---
-- this test intentionally applies the ALTER TABLE command against a view, but
-- uses a view option so we expect this to succeed. This form of SQL is
-- accepted for historical reasons, as shown in the docs for ALTER VIEW
begin;
---END---
---START---
alter table my_locks set (security_barrier=off);
---END---
---START---
select * from my_locks order by 1;
 relname  |    max_lockmode     
----------+---------------------
 my_locks | AccessExclusiveLock
(1 row)

---END---
---START---
alter table my_locks reset (security_barrier);
---END---
---START---
rollback;
---END---
---START---
-- cleanup
drop table alterlock2;
---END---
---START---
drop table alterlock;
---END---
---START---
drop view my_locks;
---END---
---START---
drop type lockmodes;
---END---
---START---
--
-- alter function
--
create function test_strict(text) returns text as
    'select coalesce($1, ''got passed a null'');'
    language sql returns null on null input;
---END---
---START---
select test_strict(NULL);
 test_strict 
-------------
 
(1 row)

---END---
---START---
alter function test_strict(text) called on null input;
---END---
---START---
select test_strict(NULL);
    test_strict    
-------------------
 got passed a null
(1 row)

---END---
---START---
create function non_strict(text) returns text as
    'select coalesce($1, ''got passed a null'');'
    language sql called on null input;
---END---
---START---
select non_strict(NULL);
    non_strict     
-------------------
 got passed a null
(1 row)

---END---
---START---
alter function non_strict(text) returns null on null input;
---END---
---START---
select non_strict(NULL);
 non_strict 
------------
 
(1 row)

---END---
---START---
--
-- alter object set schema
--
create schema alter1;
---END---
---START---
create schema alter2;
---END---
---START---
create table alter1.t1(f1 serial primary key, f2 int check (f2 > 0));
---END---
---START---
create view alter1.v1 as select * from alter1.t1;
---END---
---START---
create function alter1.plus1(int) returns int as 'select $1+1' language sql;
---END---
---START---
create domain alter1.posint integer check (value > 0);
---END---
---START---
create type alter1.ctype as (f1 int, f2 text);
---END---
---START---
create function alter1.same(alter1.ctype, alter1.ctype) returns boolean language sql
as 'select $1.f1 is not distinct from $2.f1 and $1.f2 is not distinct from $2.f2';
---END---
---START---
create operator alter1.=(procedure = alter1.same, leftarg  = alter1.ctype, rightarg = alter1.ctype);
---END---
---START---
create operator class alter1.ctype_hash_ops default for type alter1.ctype using hash as
  operator 1 alter1.=(alter1.ctype, alter1.ctype);
---END---
---START---
create conversion alter1.latin1_to_utf8 for 'latin1' to 'utf8' from iso8859_1_to_utf8;
---END---
---START---
create text search parser alter1.prs(start = prsd_start, gettoken = prsd_nexttoken, end = prsd_end, lextypes = prsd_lextype);
---END---
---START---
create text search configuration alter1.cfg(parser = alter1.prs);
---END---
---START---
create text search template alter1.tmpl(init = dsimple_init, lexize = dsimple_lexize);
---END---
---START---
create text search dictionary alter1.dict(template = alter1.tmpl);
---END---
---START---
insert into alter1.t1(f2) values(11);
---END---
---START---
insert into alter1.t1(f2) values(12);
---END---
---START---
alter table alter1.t1 set schema alter1;
---END---
---START---
-- no-op, same schema
alter table alter1.t1 set schema alter2;
---END---
---START---
alter table alter1.v1 set schema alter2;
---END---
---START---
alter function alter1.plus1(int) set schema alter2;
---END---
---START---
alter domain alter1.posint set schema alter2;
---END---
---START---
alter operator class alter1.ctype_hash_ops using hash set schema alter2;
---END---
---START---
alter operator family alter1.ctype_hash_ops using hash set schema alter2;
---END---
---START---
alter operator alter1.=(alter1.ctype, alter1.ctype) set schema alter2;
---END---
---START---
alter function alter1.same(alter1.ctype, alter1.ctype) set schema alter2;
---END---
---START---
alter type alter1.ctype set schema alter1;
---END---
---START---
-- no-op, same schema
alter type alter1.ctype set schema alter2;
---END---
---START---
alter conversion alter1.latin1_to_utf8 set schema alter2;
---END---
---START---
alter text search parser alter1.prs set schema alter2;
---END---
---START---
alter text search configuration alter1.cfg set schema alter2;
---END---
---START---
alter text search template alter1.tmpl set schema alter2;
---END---
---START---
alter text search dictionary alter1.dict set schema alter2;
---END---
---START---
-- this should succeed because nothing is left in alter1
drop schema alter1;
---END---
---START---
insert into alter2.t1(f2) values(13);
---END---
---START---
insert into alter2.t1(f2) values(14);
---END---
---START---
select * from alter2.t1;
 f1 | f2 
----+----
  1 | 11
  2 | 12
  3 | 13
  4 | 14
(4 rows)

---END---
---START---
select * from alter2.v1;
 f1 | f2 
----+----
  1 | 11
  2 | 12
  3 | 13
  4 | 14
(4 rows)

---END---
---START---
select alter2.plus1(41);
 plus1 
-------
    42
(1 row)

---END---
---START---
-- clean up
drop schema alter2 cascade;
NOTICE:  drop cascades to 13 other objects
DETAIL:  drop cascades to table alter2.t1
drop cascades to view alter2.v1
drop cascades to function alter2.plus1(integer)
drop cascades to type alter2.posint
drop cascades to type alter2.ctype
drop cascades to function alter2.same(alter2.ctype,alter2.ctype)
drop cascades to operator alter2.=(alter2.ctype,alter2.ctype)
drop cascades to operator family alter2.ctype_hash_ops for access method hash
drop cascades to conversion alter2.latin1_to_utf8
drop cascades to text search parser alter2.prs
drop cascades to text search configuration alter2.cfg
drop cascades to text search template alter2.tmpl
drop cascades to text search dictionary alter2.dict
---END---
---START---
--
-- composite types
--
CREATE TYPE test_type AS (a int);
---END---
---START---
\d test_type
         Composite type "public.test_type"
 Column |  Type   | Collation | Nullable | Default 
--------+---------+-----------+----------+---------
 a      | integer |           |          | 

ALTER TYPE nosuchtype ADD ATTRIBUTE b text;
ERROR:  relation "nosuchtype" does not exist
---END---
---START---
-- fails
ALTER TYPE test_type ADD ATTRIBUTE b text;
---END---
---START---
\d test_type
         Composite type "public.test_type"
 Column |  Type   | Collation | Nullable | Default 
--------+---------+-----------+----------+---------
 a      | integer |           |          | 
 b      | text    |           |          | 

ALTER TYPE test_type ADD ATTRIBUTE b text;
ERROR:  column "b" of relation "test_type" already exists
---END---
---START---
-- fails
ALTER TYPE test_type ALTER ATTRIBUTE b SET DATA TYPE varchar;
---END---
---START---
\d test_type
              Composite type "public.test_type"
 Column |       Type        | Collation | Nullable | Default 
--------+-------------------+-----------+----------+---------
 a      | integer           |           |          | 
 b      | character varying |           |          | 

ALTER TYPE test_type ALTER ATTRIBUTE b SET DATA TYPE integer;
---END---
---START---
\d test_type
         Composite type "public.test_type"
 Column |  Type   | Collation | Nullable | Default 
--------+---------+-----------+----------+---------
 a      | integer |           |          | 
 b      | integer |           |          | 

ALTER TYPE test_type DROP ATTRIBUTE b;
---END---
---START---
\d test_type
         Composite type "public.test_type"
 Column |  Type   | Collation | Nullable | Default 
--------+---------+-----------+----------+---------
 a      | integer |           |          | 

ALTER TYPE test_type DROP ATTRIBUTE c;
ERROR:  column "c" of relation "test_type" does not exist
---END---
---START---
-- fails
ALTER TYPE test_type DROP ATTRIBUTE IF EXISTS c;
NOTICE:  column "c" of relation "test_type" does not exist, skipping
---END---
---START---
ALTER TYPE test_type DROP ATTRIBUTE a, ADD ATTRIBUTE d boolean;
---END---
---START---
\d test_type
         Composite type "public.test_type"
 Column |  Type   | Collation | Nullable | Default 
--------+---------+-----------+----------+---------
 d      | boolean |           |          | 

ALTER TYPE test_type RENAME ATTRIBUTE a TO aa;
ERROR:  column "a" does not exist
---END---
---START---
ALTER TYPE test_type RENAME ATTRIBUTE d TO dd;
---END---
---START---
\d test_type
         Composite type "public.test_type"
 Column |  Type   | Collation | Nullable | Default 
--------+---------+-----------+----------+---------
 dd     | boolean |           |          | 

DROP TYPE test_type;
---END---
---START---
CREATE TYPE test_type1 AS (a int, b text);
---END---
---START---
CREATE TABLE test_tbl1 (gemini_pk serial PRIMARY KEY, x integer, y test_type1);
---END---
---START---
ALTER TYPE test_type1 ALTER ATTRIBUTE b TYPE varchar;
ERROR:  cannot alter type "test_type1" because column "test_tbl1.y" uses it
---END---
---START---
-- fails
DROP TABLE test_tbl1;
---END---
---START---
CREATE TABLE test_tbl1 (gemini_pk serial PRIMARY KEY, x integer, y text);
---END---
---START---
CREATE INDEX test_tbl1_idx ON test_tbl1((row(x,y)::test_type1));
---END---
---START---
ALTER TYPE test_type1 ALTER ATTRIBUTE b TYPE varchar;
ERROR:  cannot alter type "test_type1" because column "test_tbl1_idx.row" uses it
---END---
---START---
-- fails
DROP TABLE test_tbl1;
---END---
---START---
DROP TYPE test_type1;
---END---
---START---
CREATE TYPE test_type2 AS (a int, b text);
---END---
---START---
CREATE TABLE test_tbl2 OF test_type2 (gemini_pk serial PRIMARY KEY);
ERROR:  syntax error at or near "serial"
LINE 1: CREATE TABLE test_tbl2 OF test_type2 (gemini_pk serial PRIMA...
                                                        ^
---END---
---START---
CREATE TABLE test_tbl2_subclass (gemini_pk serial PRIMARY KEY) INHERITS (test_tbl2);
ERROR:  relation "test_tbl2" does not exist
---END---
---START---
\d test_type2
        Composite type "public.test_type2"
 Column |  Type   | Collation | Nullable | Default 
--------+---------+-----------+----------+---------
 a      | integer |           |          | 
 b      | text    |           |          | 

\d test_tbl2
ALTER TYPE test_type2 ADD ATTRIBUTE c text;
---END---
---START---
-- fails
ALTER TYPE test_type2 ADD ATTRIBUTE c text CASCADE;
ERROR:  column "c" of relation "test_type2" already exists
---END---
---START---
\d test_type2
        Composite type "public.test_type2"
 Column |  Type   | Collation | Nullable | Default 
--------+---------+-----------+----------+---------
 a      | integer |           |          | 
 b      | text    |           |          | 
 c      | text    |           |          | 

\d test_tbl2
ALTER TYPE test_type2 ALTER ATTRIBUTE b TYPE varchar;
---END---
---START---
-- fails
ALTER TYPE test_type2 ALTER ATTRIBUTE b TYPE varchar CASCADE;
---END---
---START---
\d test_type2
             Composite type "public.test_type2"
 Column |       Type        | Collation | Nullable | Default 
--------+-------------------+-----------+----------+---------
 a      | integer           |           |          | 
 b      | character varying |           |          | 
 c      | text              |           |          | 

\d test_tbl2
ALTER TYPE test_type2 DROP ATTRIBUTE b;
---END---
---START---
-- fails
ALTER TYPE test_type2 DROP ATTRIBUTE b CASCADE;
ERROR:  column "b" of relation "test_type2" does not exist
---END---
---START---
\d test_type2
        Composite type "public.test_type2"
 Column |  Type   | Collation | Nullable | Default 
--------+---------+-----------+----------+---------
 a      | integer |           |          | 
 c      | text    |           |          | 

\d test_tbl2
ALTER TYPE test_type2 RENAME ATTRIBUTE a TO aa;
---END---
---START---
-- fails
ALTER TYPE test_type2 RENAME ATTRIBUTE a TO aa CASCADE;
ERROR:  column "a" does not exist
---END---
---START---
\d test_type2
        Composite type "public.test_type2"
 Column |  Type   | Collation | Nullable | Default 
--------+---------+-----------+----------+---------
 aa     | integer |           |          | 
 c      | text    |           |          | 

\d test_tbl2
\d test_tbl2_subclass
DROP TABLE test_tbl2_subclass, test_tbl2;
ERROR:  table "test_tbl2_subclass" does not exist
---END---
---START---
DROP TYPE test_type2;
---END---
---START---
CREATE TYPE test_typex AS (a int, b text);
---END---
---START---
CREATE TABLE test_tblx (gemini_pk serial PRIMARY KEY, x integer, y test_typex CHECK (((y)).a > 0));
---END---
---START---
ALTER TYPE test_typex DROP ATTRIBUTE a;
ERROR:  cannot drop column a of composite type test_typex because other objects depend on it
DETAIL:  constraint test_tblx_y_check on table test_tblx depends on column a of composite type test_typex
HINT:  Use DROP ... CASCADE to drop the dependent objects too.
---END---
---START---
-- fails
ALTER TYPE test_typex DROP ATTRIBUTE a CASCADE;
NOTICE:  drop cascades to constraint test_tblx_y_check on table test_tblx
---END---
---START---
\d test_tblx
                                   Table "public.test_tblx"
  Column   |    Type    | Collation | Nullable |                   Default                    
-----------+------------+-----------+----------+----------------------------------------------
 gemini_pk | integer    |           | not null | nextval('test_tblx_gemini_pk_seq'::regclass)
 x         | integer    |           |          | 
 y         | test_typex |           |          | 
Indexes:
    "test_tblx_pkey" PRIMARY KEY, btree (gemini_pk)

DROP TABLE test_tblx;
---END---
---START---
DROP TYPE test_typex;
---END---
---START---
-- This test isn't that interesting on its own, but the purpose is to leave
-- behind a table to test pg_upgrade with. The table has a composite type
-- column in it, and the composite type has a dropped attribute.
CREATE TYPE test_type3 AS (a int);
---END---
---START---
CREATE TABLE test_tbl3 (c) AS SELECT '(1)'::test_type3;
---END---
---START---
ALTER TYPE test_type3 DROP ATTRIBUTE a, ADD ATTRIBUTE b int;
---END---
---START---
CREATE TYPE test_type_empty AS ();
---END---
---START---
DROP TYPE test_type_empty;
---END---
---START---
--
-- typed tables: OF / NOT OF
--
CREATE TYPE tt_t0 AS (z inet, x int, y numeric);
---END---
---START---
ALTER TYPE tt_t0 DROP ATTRIBUTE z;
---END---
---START---
CREATE TABLE tt0 (gemini_pk serial PRIMARY KEY, x integer NOT NULL, y numeric);
---END---
---START---
CREATE TABLE tt1 (gemini_pk serial PRIMARY KEY, x integer, y bigint);
---END---
---START---
CREATE TABLE tt2 (gemini_pk serial PRIMARY KEY, x integer, y numeric);
---END---
---START---
CREATE TABLE tt3 (gemini_pk serial PRIMARY KEY, y numeric, x integer);
---END---
---START---
CREATE TABLE tt4 (gemini_pk serial PRIMARY KEY, x integer);
---END---
---START---
CREATE TABLE tt5 (gemini_pk serial PRIMARY KEY, x integer, y numeric, z integer);
---END---
---START---
CREATE TABLE tt6 (gemini_pk serial PRIMARY KEY) INHERITS (tt0);
NOTICE:  merging column "gemini_pk" with inherited definition
---END---
---START---
CREATE TABLE tt7 (gemini_pk serial PRIMARY KEY, x integer, q text, y numeric);
---END---
---START---
ALTER TABLE tt7 DROP q;
---END---
---START---
-- OK
ALTER TABLE tt0 OF tt_t0;
ERROR:  table has column "gemini_pk" where type requires "x"
---END---
---START---
ALTER TABLE tt1 OF tt_t0;
ERROR:  table has column "gemini_pk" where type requires "x"
---END---
---START---
ALTER TABLE tt2 OF tt_t0;
ERROR:  table has column "gemini_pk" where type requires "x"
---END---
---START---
ALTER TABLE tt3 OF tt_t0;
ERROR:  table has column "gemini_pk" where type requires "x"
---END---
---START---
ALTER TABLE tt4 OF tt_t0;
ERROR:  table has column "gemini_pk" where type requires "x"
---END---
---START---
ALTER TABLE tt5 OF tt_t0;
ERROR:  table has column "gemini_pk" where type requires "x"
---END---
---START---
ALTER TABLE tt6 OF tt_t0;
ERROR:  typed tables cannot inherit
---END---
---START---
ALTER TABLE tt7 OF tt_t0;
ERROR:  table has column "gemini_pk" where type requires "x"
---END---
---START---
CREATE TYPE tt_t1 AS (x int, y numeric);
---END---
---START---
ALTER TABLE tt7 OF tt_t1;
ERROR:  table has column "gemini_pk" where type requires "x"
---END---
---START---
-- reassign an already-typed table
ALTER TABLE tt7 NOT OF;
ERROR:  "tt7" is not a typed table
---END---
---START---
\d tt7
                                 Table "public.tt7"
  Column   |  Type   | Collation | Nullable |                Default                 
-----------+---------+-----------+----------+----------------------------------------
 gemini_pk | integer |           | not null | nextval('tt7_gemini_pk_seq'::regclass)
 x         | integer |           |          | 
 y         | numeric |           |          | 
Indexes:
    "tt7_pkey" PRIMARY KEY, btree (gemini_pk)

-- make sure we can drop a constraint on the parent but it remains on the child
CREATE TABLE test_drop_constr_parent (gemini_pk serial PRIMARY KEY, c text CHECK (c IS NOT NULL));
---END---
---START---
CREATE TABLE test_drop_constr_child (gemini_pk serial PRIMARY KEY) INHERITS (test_drop_constr_parent);
NOTICE:  merging column "gemini_pk" with inherited definition
---END---
---START---
ALTER TABLE ONLY test_drop_constr_parent DROP CONSTRAINT "test_drop_constr_parent_c_check";
---END---
---START---
-- should fail
INSERT INTO test_drop_constr_child (c) VALUES (NULL);
ERROR:  new row for relation "test_drop_constr_child" violates check constraint "test_drop_constr_parent_c_check"
DETAIL:  Failing row contains (1, null).
---END---
---START---
DROP TABLE test_drop_constr_parent CASCADE;
NOTICE:  drop cascades to table test_drop_constr_child
---END---
---START---
--
-- IF EXISTS test
--
ALTER TABLE IF EXISTS tt8 ADD COLUMN f int;
NOTICE:  relation "tt8" does not exist, skipping
---END---
---START---
ALTER TABLE IF EXISTS tt8 ADD CONSTRAINT xxx PRIMARY KEY(f);
NOTICE:  relation "tt8" does not exist, skipping
---END---
---START---
ALTER TABLE IF EXISTS tt8 ADD CHECK (f BETWEEN 0 AND 10);
NOTICE:  relation "tt8" does not exist, skipping
---END---
---START---
ALTER TABLE IF EXISTS tt8 ALTER COLUMN f SET DEFAULT 0;
NOTICE:  relation "tt8" does not exist, skipping
---END---
---START---
ALTER TABLE IF EXISTS tt8 RENAME COLUMN f TO f1;
NOTICE:  relation "tt8" does not exist, skipping
---END---
---START---
ALTER TABLE IF EXISTS tt8 SET SCHEMA alter2;
NOTICE:  relation "tt8" does not exist, skipping
---END---
---START---
CREATE TABLE tt8 (gemini_pk serial PRIMARY KEY, a integer);
---END---
---START---
CREATE SCHEMA alter2;
---END---
---START---
ALTER TABLE IF EXISTS tt8 ADD COLUMN f int;
---END---
---START---
ALTER TABLE IF EXISTS tt8 ADD CONSTRAINT xxx PRIMARY KEY(f);
ERROR:  multiple primary keys for table "tt8" are not allowed
---END---
---START---
ALTER TABLE IF EXISTS tt8 ADD CHECK (f BETWEEN 0 AND 10);
---END---
---START---
ALTER TABLE IF EXISTS tt8 ALTER COLUMN f SET DEFAULT 0;
---END---
---START---
ALTER TABLE IF EXISTS tt8 RENAME COLUMN f TO f1;
---END---
---START---
ALTER TABLE IF EXISTS tt8 SET SCHEMA alter2;
---END---
---START---
\d alter2.tt8
                                     Table "alter2.tt8"
  Column   |  Type   | Collation | Nullable |                    Default                    
-----------+---------+-----------+----------+-----------------------------------------------
 gemini_pk | integer |           | not null | nextval('alter2.tt8_gemini_pk_seq'::regclass)
 a         | integer |           |          | 
 f1        | integer |           |          | 0
Indexes:
    "tt8_pkey" PRIMARY KEY, btree (gemini_pk)
Check constraints:
    "tt8_f_check" CHECK (f1 >= 0 AND f1 <= 10)

DROP TABLE alter2.tt8;
---END---
---START---
DROP SCHEMA alter2;
---END---
---START---
CREATE TABLE tt9 (gemini_pk serial PRIMARY KEY, c integer);
---END---
---START---
ALTER TABLE tt9 ADD CHECK(c > 1);
---END---
---START---
ALTER TABLE tt9 ADD CHECK(c > 2);
---END---
---START---
-- picks nonconflicting name
ALTER TABLE tt9 ADD CONSTRAINT foo CHECK(c > 3);
---END---
---START---
ALTER TABLE tt9 ADD CONSTRAINT foo CHECK(c > 4);
ERROR:  constraint "foo" for relation "tt9" already exists
---END---
---START---
-- fail, dup name
ALTER TABLE tt9 ADD UNIQUE(c);
---END---
---START---
ALTER TABLE tt9 ADD UNIQUE(c);
---END---
---START---
-- picks nonconflicting name
ALTER TABLE tt9 ADD CONSTRAINT tt9_c_key UNIQUE(c);
ERROR:  relation "tt9_c_key" already exists
---END---
---START---
-- fail, dup name
ALTER TABLE tt9 ADD CONSTRAINT foo UNIQUE(c);
ERROR:  relation "foo" already exists
---END---
---START---
-- fail, dup name
ALTER TABLE tt9 ADD CONSTRAINT tt9_c_key CHECK(c > 5);
ERROR:  constraint "tt9_c_key" for relation "tt9" already exists
---END---
---START---
-- fail, dup name
ALTER TABLE tt9 ADD CONSTRAINT tt9_c_key2 CHECK(c > 6);
---END---
---START---
ALTER TABLE tt9 ADD UNIQUE(c);
---END---
---START---
-- picks nonconflicting name
\d tt9
                                 Table "public.tt9"
  Column   |  Type   | Collation | Nullable |                Default                 
-----------+---------+-----------+----------+----------------------------------------
 gemini_pk | integer |           | not null | nextval('tt9_gemini_pk_seq'::regclass)
 c         | integer |           |          | 
Indexes:
    "tt9_pkey" PRIMARY KEY, btree (gemini_pk)
    "tt9_c_key" UNIQUE CONSTRAINT, btree (c)
    "tt9_c_key1" UNIQUE CONSTRAINT, btree (c)
    "tt9_c_key3" UNIQUE CONSTRAINT, btree (c)
Check constraints:
    "foo" CHECK (c > 3)
    "tt9_c_check" CHECK (c > 1)
    "tt9_c_check1" CHECK (c > 2)
    "tt9_c_key2" CHECK (c > 6)

DROP TABLE tt9;
---END---
---START---
-- Check that comments on constraints and indexes are not lost at ALTER TABLE.
CREATE TABLE comment_test (
  id int,
  positive_col int CHECK (positive_col > 0),
  indexed_col int,
  CONSTRAINT comment_test_pk PRIMARY KEY (id));
---END---
---START---
CREATE INDEX comment_test_index ON comment_test(indexed_col);
---END---
---START---
COMMENT ON COLUMN comment_test.id IS 'Column ''id'' on comment_test';
---END---
---START---
COMMENT ON INDEX comment_test_index IS 'Simple index on comment_test';
---END---
---START---
COMMENT ON CONSTRAINT comment_test_positive_col_check ON comment_test IS 'CHECK constraint on comment_test.positive_col';
---END---
---START---
COMMENT ON CONSTRAINT comment_test_pk ON comment_test IS 'PRIMARY KEY constraint of comment_test';
---END---
---START---
COMMENT ON INDEX comment_test_pk IS 'Index backing the PRIMARY KEY of comment_test';
---END---
---START---
SELECT col_description('comment_test'::regclass, 1) as comment;
           comment           
-----------------------------
 Column 'id' on comment_test
(1 row)

---END---
---START---
SELECT indexrelid::regclass::text as index, obj_description(indexrelid, 'pg_class') as comment FROM pg_index where indrelid = 'comment_test'::regclass ORDER BY 1, 2;
       index        |                    comment                    
--------------------+-----------------------------------------------
 comment_test_index | Simple index on comment_test
 comment_test_pk    | Index backing the PRIMARY KEY of comment_test
(2 rows)

---END---
---START---
SELECT conname as constraint, obj_description(oid, 'pg_constraint') as comment FROM pg_constraint where conrelid = 'comment_test'::regclass ORDER BY 1, 2;
           constraint            |                    comment                    
---------------------------------+-----------------------------------------------
 comment_test_pk                 | PRIMARY KEY constraint of comment_test
 comment_test_positive_col_check | CHECK constraint on comment_test.positive_col
(2 rows)

---END---
---START---
-- Change the datatype of all the columns. ALTER TABLE is optimized to not
-- rebuild an index if the new data type is binary compatible with the old
-- one. Check do a dummy ALTER TABLE that doesn't change the datatype
-- first, to test that no-op codepath, and another one that does.
ALTER TABLE comment_test ALTER COLUMN indexed_col SET DATA TYPE int;
---END---
---START---
ALTER TABLE comment_test ALTER COLUMN indexed_col SET DATA TYPE text;
---END---
---START---
ALTER TABLE comment_test ALTER COLUMN id SET DATA TYPE int;
---END---
---START---
ALTER TABLE comment_test ALTER COLUMN id SET DATA TYPE text;
---END---
---START---
ALTER TABLE comment_test ALTER COLUMN positive_col SET DATA TYPE int;
---END---
---START---
ALTER TABLE comment_test ALTER COLUMN positive_col SET DATA TYPE bigint;
---END---
---START---
-- Check that the comments are intact.
SELECT col_description('comment_test'::regclass, 1) as comment;
           comment           
-----------------------------
 Column 'id' on comment_test
(1 row)

---END---
---START---
SELECT indexrelid::regclass::text as index, obj_description(indexrelid, 'pg_class') as comment FROM pg_index where indrelid = 'comment_test'::regclass ORDER BY 1, 2;
       index        |                    comment                    
--------------------+-----------------------------------------------
 comment_test_index | Simple index on comment_test
 comment_test_pk    | Index backing the PRIMARY KEY of comment_test
(2 rows)

---END---
---START---
SELECT conname as constraint, obj_description(oid, 'pg_constraint') as comment FROM pg_constraint where conrelid = 'comment_test'::regclass ORDER BY 1, 2;
           constraint            |                    comment                    
---------------------------------+-----------------------------------------------
 comment_test_pk                 | PRIMARY KEY constraint of comment_test
 comment_test_positive_col_check | CHECK constraint on comment_test.positive_col
(2 rows)

---END---
---START---
CREATE TABLE comment_test_child (gemini_pk serial PRIMARY KEY, id text CONSTRAINT comment_test_child_fk REFERENCES comment_test);
---END---
---START---
CREATE INDEX comment_test_child_fk ON comment_test_child(id);
---END---
---START---
COMMENT ON COLUMN comment_test_child.id IS 'Column ''id'' on comment_test_child';
---END---
---START---
COMMENT ON INDEX comment_test_child_fk IS 'Index backing the FOREIGN KEY of comment_test_child';
---END---
---START---
COMMENT ON CONSTRAINT comment_test_child_fk ON comment_test_child IS 'FOREIGN KEY constraint of comment_test_child';
---END---
---START---
-- Change column type of parent
ALTER TABLE comment_test ALTER COLUMN id SET DATA TYPE text;
---END---
---START---
ALTER TABLE comment_test ALTER COLUMN id SET DATA TYPE int USING id::integer;
ERROR:  foreign key constraint "comment_test_child_fk" cannot be implemented
DETAIL:  Key columns "id" and "id" are of incompatible types: text and integer.
---END---
---START---
-- Comments should be intact
SELECT col_description('comment_test_child'::regclass, 1) as comment;
 comment 
---------
 
(1 row)

---END---
---START---
SELECT indexrelid::regclass::text as index, obj_description(indexrelid, 'pg_class') as comment FROM pg_index where indrelid = 'comment_test_child'::regclass ORDER BY 1, 2;
          index          |                       comment                       
-------------------------+-----------------------------------------------------
 comment_test_child_fk   | Index backing the FOREIGN KEY of comment_test_child
 comment_test_child_pkey | 
(2 rows)

---END---
---START---
SELECT conname as constraint, obj_description(oid, 'pg_constraint') as comment FROM pg_constraint where conrelid = 'comment_test_child'::regclass ORDER BY 1, 2;
       constraint        |                   comment                    
-------------------------+----------------------------------------------
 comment_test_child_fk   | FOREIGN KEY constraint of comment_test_child
 comment_test_child_pkey | 
(2 rows)

---END---
---START---
-- Check that we map relation oids to filenodes and back correctly.  Only
-- display bad mappings so the test output doesn't change all the time.  A
-- filenode function call can return NULL for a relation dropped concurrently
-- with the call's surrounding query, so ignore a NULL mapped_oid for
-- relations that no longer exist after all calls finish.
DROP TABLE IF EXISTS filenode_mapping;
NOTICE:  table "filenode_mapping" does not exist, skipping
CREATE TABLE filenode_mapping AS
SELECT
    oid, mapped_oid, reltablespace, relfilenode, relname
FROM pg_class,
    pg_filenode_relation(reltablespace, pg_relation_filenode(oid)) AS mapped_oid
WHERE relkind IN ('r', 'i', 'S', 't', 'm') AND mapped_oid IS DISTINCT FROM oid;
---END---
---START---
SELECT m.* FROM filenode_mapping m LEFT JOIN pg_class c ON c.oid = m.oid
WHERE c.oid IS NOT NULL OR m.mapped_oid IS NOT NULL;
 oid | mapped_oid | reltablespace | relfilenode | relname 
-----+------------+---------------+-------------+---------
(0 rows)

---END---
---START---
-- Checks on creating and manipulation of user defined relations in
-- pg_catalog.
SHOW allow_system_table_mods;
 allow_system_table_mods 
-------------------------
 off
(1 row)

---END---
---START---
CREATE TABLE pg_catalog.new_system_table (gemini_pk serial PRIMARY KEY);
ERROR:  permission denied to create "pg_catalog.new_system_table_gemini_pk_seq"
DETAIL:  System catalog modifications are currently disallowed.
---END---
---START---
-- instead create in public first, move to catalog
CREATE TABLE new_system_table(id serial primary key, othercol text);
---END---
---START---
ALTER TABLE new_system_table SET SCHEMA pg_catalog;
---END---
---START---
ALTER TABLE new_system_table SET SCHEMA public;
---END---
---START---
ALTER TABLE new_system_table SET SCHEMA pg_catalog;
---END---
---START---
-- will be ignored -- already there:
ALTER TABLE new_system_table SET SCHEMA pg_catalog;
---END---
---START---
ALTER TABLE new_system_table RENAME TO old_system_table;
---END---
---START---
CREATE INDEX old_system_table__othercol ON old_system_table (othercol);
---END---
---START---
INSERT INTO old_system_table(othercol) VALUES ('somedata'), ('otherdata');
---END---
---START---
UPDATE old_system_table SET id = -id;
---END---
---START---
DELETE FROM old_system_table WHERE othercol = 'somedata';
---END---
---START---
TRUNCATE old_system_table;
---END---
---START---
ALTER TABLE old_system_table DROP CONSTRAINT new_system_table_pkey;
---END---
---START---
ALTER TABLE old_system_table DROP COLUMN othercol;
---END---
---START---
DROP TABLE old_system_table;
---END---
---START---
-- set logged
CREATE UNLOGGED TABLE unlogged1(f1 SERIAL PRIMARY KEY, f2 TEXT);
---END---
---START---
-- has sequence, toast
-- check relpersistence of an unlogged table
SELECT relname, relkind, relpersistence FROM pg_class WHERE relname ~ '^unlogged1'
UNION ALL
SELECT r.relname || ' toast table', t.relkind, t.relpersistence FROM pg_class r JOIN pg_class t ON t.oid = r.reltoastrelid WHERE r.relname ~ '^unlogged1'
UNION ALL
SELECT r.relname || ' toast index', ri.relkind, ri.relpersistence FROM pg_class r join pg_class t ON t.oid = r.reltoastrelid JOIN pg_index i ON i.indrelid = t.oid JOIN pg_class ri ON ri.oid = i.indexrelid WHERE r.relname ~ '^unlogged1'
ORDER BY relname;
        relname        | relkind | relpersistence 
-----------------------+---------+----------------
 unlogged1             | r       | u
 unlogged1 toast index | i       | u
 unlogged1 toast table | t       | u
 unlogged1_f1_seq      | S       | u
 unlogged1_pkey        | i       | u
(5 rows)

---END---
---START---
CREATE UNLOGGED TABLE unlogged2(f1 SERIAL PRIMARY KEY, f2 INTEGER REFERENCES unlogged1);
---END---
---START---
-- foreign key
CREATE UNLOGGED TABLE unlogged3(f1 SERIAL PRIMARY KEY, f2 INTEGER REFERENCES unlogged3);
---END---
---START---
-- self-referencing foreign key
ALTER TABLE unlogged3 SET LOGGED;
---END---
---START---
-- skip self-referencing foreign key
ALTER TABLE unlogged2 SET LOGGED;
ERROR:  could not change table "unlogged2" to logged because it references unlogged table "unlogged1"
---END---
---START---
-- fails because a foreign key to an unlogged table exists
ALTER TABLE unlogged1 SET LOGGED;
---END---
---START---
-- check relpersistence of an unlogged table after changing to permanent
SELECT relname, relkind, relpersistence FROM pg_class WHERE relname ~ '^unlogged1'
UNION ALL
SELECT r.relname || ' toast table', t.relkind, t.relpersistence FROM pg_class r JOIN pg_class t ON t.oid = r.reltoastrelid WHERE r.relname ~ '^unlogged1'
UNION ALL
SELECT r.relname || ' toast index', ri.relkind, ri.relpersistence FROM pg_class r join pg_class t ON t.oid = r.reltoastrelid JOIN pg_index i ON i.indrelid = t.oid JOIN pg_class ri ON ri.oid = i.indexrelid WHERE r.relname ~ '^unlogged1'
ORDER BY relname;
        relname        | relkind | relpersistence 
-----------------------+---------+----------------
 unlogged1             | r       | p
 unlogged1 toast index | i       | p
 unlogged1 toast table | t       | p
 unlogged1_f1_seq      | S       | p
 unlogged1_pkey        | i       | p
(5 rows)

---END---
---START---
ALTER TABLE unlogged1 SET LOGGED;
---END---
---START---
-- silently do nothing
DROP TABLE unlogged3;
---END---
---START---
DROP TABLE unlogged2;
---END---
---START---
DROP TABLE unlogged1;
---END---
---START---
-- set unlogged
CREATE TABLE logged1(f1 SERIAL PRIMARY KEY, f2 TEXT);
---END---
---START---
-- has sequence, toast
-- check relpersistence of a permanent table
SELECT relname, relkind, relpersistence FROM pg_class WHERE relname ~ '^logged1'
UNION ALL
SELECT r.relname || ' toast table', t.relkind, t.relpersistence FROM pg_class r JOIN pg_class t ON t.oid = r.reltoastrelid WHERE r.relname ~ '^logged1'
UNION ALL
SELECT r.relname ||' toast index', ri.relkind, ri.relpersistence FROM pg_class r join pg_class t ON t.oid = r.reltoastrelid JOIN pg_index i ON i.indrelid = t.oid JOIN pg_class ri ON ri.oid = i.indexrelid WHERE r.relname ~ '^logged1'
ORDER BY relname;
       relname       | relkind | relpersistence 
---------------------+---------+----------------
 logged1             | r       | p
 logged1 toast index | i       | p
 logged1 toast table | t       | p
 logged1_f1_seq      | S       | p
 logged1_pkey        | i       | p
(5 rows)

---END---
---START---
CREATE TABLE logged2(f1 SERIAL PRIMARY KEY, f2 INTEGER REFERENCES logged1);
---END---
---START---
-- foreign key
CREATE TABLE logged3(f1 SERIAL PRIMARY KEY, f2 INTEGER REFERENCES logged3);
---END---
---START---
-- self-referencing foreign key
ALTER TABLE logged1 SET UNLOGGED;
ERROR:  could not change table "logged1" to unlogged because it references logged table "logged2"
---END---
---START---
-- fails because a foreign key from a permanent table exists
ALTER TABLE logged3 SET UNLOGGED;
---END---
---START---
-- skip self-referencing foreign key
ALTER TABLE logged2 SET UNLOGGED;
---END---
---START---
ALTER TABLE logged1 SET UNLOGGED;
---END---
---START---
-- check relpersistence of a permanent table after changing to unlogged
SELECT relname, relkind, relpersistence FROM pg_class WHERE relname ~ '^logged1'
UNION ALL
SELECT r.relname || ' toast table', t.relkind, t.relpersistence FROM pg_class r JOIN pg_class t ON t.oid = r.reltoastrelid WHERE r.relname ~ '^logged1'
UNION ALL
SELECT r.relname || ' toast index', ri.relkind, ri.relpersistence FROM pg_class r join pg_class t ON t.oid = r.reltoastrelid JOIN pg_index i ON i.indrelid = t.oid JOIN pg_class ri ON ri.oid = i.indexrelid WHERE r.relname ~ '^logged1'
ORDER BY relname;
       relname       | relkind | relpersistence 
---------------------+---------+----------------
 logged1             | r       | u
 logged1 toast index | i       | u
 logged1 toast table | t       | u
 logged1_f1_seq      | S       | u
 logged1_pkey        | i       | u
(5 rows)

---END---
---START---
ALTER TABLE logged1 SET UNLOGGED;
---END---
---START---
-- silently do nothing
DROP TABLE logged3;
---END---
---START---
DROP TABLE logged2;
---END---
---START---
DROP TABLE logged1;
---END---
---START---
CREATE TABLE test_add_column (gemini_pk serial PRIMARY KEY, c1 integer);
---END---
---START---
\d test_add_column
                                 Table "public.test_add_column"
  Column   |  Type   | Collation | Nullable |                      Default                       
-----------+---------+-----------+----------+----------------------------------------------------
 gemini_pk | integer |           | not null | nextval('test_add_column_gemini_pk_seq'::regclass)
 c1        | integer |           |          | 
Indexes:
    "test_add_column_pkey" PRIMARY KEY, btree (gemini_pk)

ALTER TABLE test_add_column
	ADD COLUMN c2 integer;
---END---
---START---
\d test_add_column
                                 Table "public.test_add_column"
  Column   |  Type   | Collation | Nullable |                      Default                       
-----------+---------+-----------+----------+----------------------------------------------------
 gemini_pk | integer |           | not null | nextval('test_add_column_gemini_pk_seq'::regclass)
 c1        | integer |           |          | 
 c2        | integer |           |          | 
Indexes:
    "test_add_column_pkey" PRIMARY KEY, btree (gemini_pk)

ALTER TABLE test_add_column
	ADD COLUMN c2 integer;
ERROR:  column "c2" of relation "test_add_column" already exists
---END---
---START---
-- fail because c2 already exists
ALTER TABLE ONLY test_add_column
	ADD COLUMN c2 integer;
ERROR:  column "c2" of relation "test_add_column" already exists
---END---
---START---
-- fail because c2 already exists
\d test_add_column
                                 Table "public.test_add_column"
  Column   |  Type   | Collation | Nullable |                      Default                       
-----------+---------+-----------+----------+----------------------------------------------------
 gemini_pk | integer |           | not null | nextval('test_add_column_gemini_pk_seq'::regclass)
 c1        | integer |           |          | 
 c2        | integer |           |          | 
Indexes:
    "test_add_column_pkey" PRIMARY KEY, btree (gemini_pk)

ALTER TABLE test_add_column
	ADD COLUMN IF NOT EXISTS c2 integer;
NOTICE:  column "c2" of relation "test_add_column" already exists, skipping
---END---
---START---
-- skipping because c2 already exists
ALTER TABLE ONLY test_add_column
	ADD COLUMN IF NOT EXISTS c2 integer;
NOTICE:  column "c2" of relation "test_add_column" already exists, skipping
---END---
---START---
-- skipping because c2 already exists
\d test_add_column
                                 Table "public.test_add_column"
  Column   |  Type   | Collation | Nullable |                      Default                       
-----------+---------+-----------+----------+----------------------------------------------------
 gemini_pk | integer |           | not null | nextval('test_add_column_gemini_pk_seq'::regclass)
 c1        | integer |           |          | 
 c2        | integer |           |          | 
Indexes:
    "test_add_column_pkey" PRIMARY KEY, btree (gemini_pk)

ALTER TABLE test_add_column
	ADD COLUMN c2 integer, -- fail because c2 already exists
	ADD COLUMN c3 integer primary key;
ERROR:  column "c2" of relation "test_add_column" already exists
---END---
---START---
\d test_add_column
                                 Table "public.test_add_column"
  Column   |  Type   | Collation | Nullable |                      Default                       
-----------+---------+-----------+----------+----------------------------------------------------
 gemini_pk | integer |           | not null | nextval('test_add_column_gemini_pk_seq'::regclass)
 c1        | integer |           |          | 
 c2        | integer |           |          | 
Indexes:
    "test_add_column_pkey" PRIMARY KEY, btree (gemini_pk)

ALTER TABLE test_add_column
	ADD COLUMN IF NOT EXISTS c2 integer, -- skipping because c2 already exists
	ADD COLUMN c3 integer primary key;
NOTICE:  column "c2" of relation "test_add_column" already exists, skipping
ERROR:  multiple primary keys for table "test_add_column" are not allowed
---END---
---START---
\d test_add_column
                                 Table "public.test_add_column"
  Column   |  Type   | Collation | Nullable |                      Default                       
-----------+---------+-----------+----------+----------------------------------------------------
 gemini_pk | integer |           | not null | nextval('test_add_column_gemini_pk_seq'::regclass)
 c1        | integer |           |          | 
 c2        | integer |           |          | 
Indexes:
    "test_add_column_pkey" PRIMARY KEY, btree (gemini_pk)

ALTER TABLE test_add_column
	ADD COLUMN IF NOT EXISTS c2 integer, -- skipping because c2 already exists
	ADD COLUMN IF NOT EXISTS c3 integer primary key;
NOTICE:  column "c2" of relation "test_add_column" already exists, skipping
ERROR:  multiple primary keys for table "test_add_column" are not allowed
---END---
---START---
-- skipping because c3 already exists
\d test_add_column
                                 Table "public.test_add_column"
  Column   |  Type   | Collation | Nullable |                      Default                       
-----------+---------+-----------+----------+----------------------------------------------------
 gemini_pk | integer |           | not null | nextval('test_add_column_gemini_pk_seq'::regclass)
 c1        | integer |           |          | 
 c2        | integer |           |          | 
Indexes:
    "test_add_column_pkey" PRIMARY KEY, btree (gemini_pk)

ALTER TABLE test_add_column
	ADD COLUMN IF NOT EXISTS c2 integer, -- skipping because c2 already exists
	ADD COLUMN IF NOT EXISTS c3 integer, -- skipping because c3 already exists
	ADD COLUMN c4 integer REFERENCES test_add_column;
NOTICE:  column "c2" of relation "test_add_column" already exists, skipping
---END---
---START---
\d test_add_column
                                 Table "public.test_add_column"
  Column   |  Type   | Collation | Nullable |                      Default                       
-----------+---------+-----------+----------+----------------------------------------------------
 gemini_pk | integer |           | not null | nextval('test_add_column_gemini_pk_seq'::regclass)
 c1        | integer |           |          | 
 c2        | integer |           |          | 
 c3        | integer |           |          | 
 c4        | integer |           |          | 
Indexes:
    "test_add_column_pkey" PRIMARY KEY, btree (gemini_pk)
Foreign-key constraints:
    "test_add_column_c4_fkey" FOREIGN KEY (c4) REFERENCES test_add_column(gemini_pk)
Referenced by:
    TABLE "test_add_column" CONSTRAINT "test_add_column_c4_fkey" FOREIGN KEY (c4) REFERENCES test_add_column(gemini_pk)

ALTER TABLE test_add_column
	ADD COLUMN IF NOT EXISTS c4 integer REFERENCES test_add_column;
NOTICE:  column "c4" of relation "test_add_column" already exists, skipping
---END---
---START---
\d test_add_column
                                 Table "public.test_add_column"
  Column   |  Type   | Collation | Nullable |                      Default                       
-----------+---------+-----------+----------+----------------------------------------------------
 gemini_pk | integer |           | not null | nextval('test_add_column_gemini_pk_seq'::regclass)
 c1        | integer |           |          | 
 c2        | integer |           |          | 
 c3        | integer |           |          | 
 c4        | integer |           |          | 
Indexes:
    "test_add_column_pkey" PRIMARY KEY, btree (gemini_pk)
Foreign-key constraints:
    "test_add_column_c4_fkey" FOREIGN KEY (c4) REFERENCES test_add_column(gemini_pk)
Referenced by:
    TABLE "test_add_column" CONSTRAINT "test_add_column_c4_fkey" FOREIGN KEY (c4) REFERENCES test_add_column(gemini_pk)

ALTER TABLE test_add_column
	ADD COLUMN IF NOT EXISTS c5 SERIAL CHECK (c5 > 8);
---END---
---START---
\d test_add_column
                                 Table "public.test_add_column"
  Column   |  Type   | Collation | Nullable |                      Default                       
-----------+---------+-----------+----------+----------------------------------------------------
 gemini_pk | integer |           | not null | nextval('test_add_column_gemini_pk_seq'::regclass)
 c1        | integer |           |          | 
 c2        | integer |           |          | 
 c3        | integer |           |          | 
 c4        | integer |           |          | 
 c5        | integer |           | not null | nextval('test_add_column_c5_seq'::regclass)
Indexes:
    "test_add_column_pkey" PRIMARY KEY, btree (gemini_pk)
Check constraints:
    "test_add_column_c5_check" CHECK (c5 > 8)
Foreign-key constraints:
    "test_add_column_c4_fkey" FOREIGN KEY (c4) REFERENCES test_add_column(gemini_pk)
Referenced by:
    TABLE "test_add_column" CONSTRAINT "test_add_column_c4_fkey" FOREIGN KEY (c4) REFERENCES test_add_column(gemini_pk)

ALTER TABLE test_add_column
	ADD COLUMN IF NOT EXISTS c5 SERIAL CHECK (c5 > 10);
NOTICE:  column "c5" of relation "test_add_column" already exists, skipping
---END---
---START---
\d test_add_column*
                                 Table "public.test_add_column"
  Column   |  Type   | Collation | Nullable |                      Default                       
-----------+---------+-----------+----------+----------------------------------------------------
 gemini_pk | integer |           | not null | nextval('test_add_column_gemini_pk_seq'::regclass)
 c1        | integer |           |          | 
 c2        | integer |           |          | 
 c3        | integer |           |          | 
 c4        | integer |           |          | 
 c5        | integer |           | not null | nextval('test_add_column_c5_seq'::regclass)
Indexes:
    "test_add_column_pkey" PRIMARY KEY, btree (gemini_pk)
Check constraints:
    "test_add_column_c5_check" CHECK (c5 > 8)
Foreign-key constraints:
    "test_add_column_c4_fkey" FOREIGN KEY (c4) REFERENCES test_add_column(gemini_pk)
Referenced by:
    TABLE "test_add_column" CONSTRAINT "test_add_column_c4_fkey" FOREIGN KEY (c4) REFERENCES test_add_column(gemini_pk)

               Sequence "public.test_add_column_c5_seq"
  Type   | Start | Minimum |  Maximum   | Increment | Cycles? | Cache 
---------+-------+---------+------------+-----------+---------+-------
 integer |     1 |       1 | 2147483647 |         1 | no      |     1
Owned by: public.test_add_column.c5

           Sequence "public.test_add_column_gemini_pk_seq"
  Type   | Start | Minimum |  Maximum   | Increment | Cycles? | Cache 
---------+-------+---------+------------+-----------+---------+-------
 integer |     1 |       1 | 2147483647 |         1 | no      |     1
Owned by: public.test_add_column.gemini_pk

   Index "public.test_add_column_pkey"
  Column   |  Type   | Key? | Definition 
-----------+---------+------+------------
 gemini_pk | integer | yes  | gemini_pk
primary key, btree, for table "public.test_add_column"

DROP TABLE test_add_column;
---END---
---START---
\d test_add_column*
-- assorted cases with multiple ALTER TABLE steps
CREATE TABLE ataddindex(gemini_pk serial PRIMARY KEY, f1 INT);
---END---
---START---
INSERT INTO ataddindex VALUES (42), (43);
---END---
---START---
CREATE UNIQUE INDEX ataddindexi0 ON ataddindex(f1);
---END---
---START---
ALTER TABLE ataddindex
  ADD PRIMARY KEY USING INDEX ataddindexi0,
  ALTER f1 TYPE BIGINT;
ERROR:  multiple primary keys for table "ataddindex" are not allowed
---END---
---START---
\d ataddindex
                                 Table "public.ataddindex"
  Column   |  Type   | Collation | Nullable |                    Default                    
-----------+---------+-----------+----------+-----------------------------------------------
 gemini_pk | integer |           | not null | nextval('ataddindex_gemini_pk_seq'::regclass)
 f1        | integer |           |          | 
Indexes:
    "ataddindex_pkey" PRIMARY KEY, btree (gemini_pk)
    "ataddindexi0" UNIQUE, btree (f1)

DROP TABLE ataddindex;
---END---
---START---
CREATE TABLE ataddindex (gemini_pk serial PRIMARY KEY, f1 varchar(10));
---END---
---START---
INSERT INTO ataddindex(f1) VALUES ('foo'), ('a');
---END---
---START---
ALTER TABLE ataddindex
  ALTER f1 SET DATA TYPE TEXT,
  ADD EXCLUDE ((f1 LIKE 'a') WITH =);
---END---
---START---
\d ataddindex
                                 Table "public.ataddindex"
  Column   |  Type   | Collation | Nullable |                    Default                    
-----------+---------+-----------+----------+-----------------------------------------------
 gemini_pk | integer |           | not null | nextval('ataddindex_gemini_pk_seq'::regclass)
 f1        | text    |           |          | 
Indexes:
    "ataddindex_pkey" PRIMARY KEY, btree (gemini_pk)
    "ataddindex_expr_excl" EXCLUDE USING btree ((f1 ~~ 'a'::text) WITH =)

DROP TABLE ataddindex;
---END---
---START---
CREATE TABLE ataddindex (gemini_pk serial PRIMARY KEY, id integer, ref_id integer);
---END---
---START---
ALTER TABLE ataddindex
  ADD PRIMARY KEY (id),
  ADD FOREIGN KEY (ref_id) REFERENCES ataddindex;
ERROR:  multiple primary keys for table "ataddindex" are not allowed
---END---
---START---
\d ataddindex
                                 Table "public.ataddindex"
  Column   |  Type   | Collation | Nullable |                    Default                    
-----------+---------+-----------+----------+-----------------------------------------------
 gemini_pk | integer |           | not null | nextval('ataddindex_gemini_pk_seq'::regclass)
 id        | integer |           |          | 
 ref_id    | integer |           |          | 
Indexes:
    "ataddindex_pkey" PRIMARY KEY, btree (gemini_pk)

DROP TABLE ataddindex;
---END---
---START---
CREATE TABLE ataddindex (gemini_pk serial PRIMARY KEY, id integer, ref_id integer);
---END---
---START---
ALTER TABLE ataddindex
  ADD UNIQUE (id),
  ADD FOREIGN KEY (ref_id) REFERENCES ataddindex (id);
---END---
---START---
\d ataddindex
                                 Table "public.ataddindex"
  Column   |  Type   | Collation | Nullable |                    Default                    
-----------+---------+-----------+----------+-----------------------------------------------
 gemini_pk | integer |           | not null | nextval('ataddindex_gemini_pk_seq'::regclass)
 id        | integer |           |          | 
 ref_id    | integer |           |          | 
Indexes:
    "ataddindex_pkey" PRIMARY KEY, btree (gemini_pk)
    "ataddindex_id_key" UNIQUE CONSTRAINT, btree (id)
Foreign-key constraints:
    "ataddindex_ref_id_fkey" FOREIGN KEY (ref_id) REFERENCES ataddindex(id)
Referenced by:
    TABLE "ataddindex" CONSTRAINT "ataddindex_ref_id_fkey" FOREIGN KEY (ref_id) REFERENCES ataddindex(id)

DROP TABLE ataddindex;
---END---
---START---
CREATE TABLE partitioned (gemini_pk serial PRIMARY KEY, a integer, b integer) PARTITION BY range (a, ((a + b) + 1));
ERROR:  unique constraint on partitioned table must include all partitioning columns
DETAIL:  PRIMARY KEY constraint on table "partitioned" lacks column "a" which is part of the partition key.
---END---
---START---
ALTER TABLE partitioned ADD EXCLUDE USING gist (a WITH &&);
ERROR:  relation "partitioned" does not exist
---END---
---START---
-- cannot drop column that is part of the partition key
ALTER TABLE partitioned DROP COLUMN a;
ERROR:  relation "partitioned" does not exist
---END---
---START---
ALTER TABLE partitioned ALTER COLUMN a TYPE char(5);
ERROR:  relation "partitioned" does not exist
---END---
---START---
ALTER TABLE partitioned DROP COLUMN b;
ERROR:  relation "partitioned" does not exist
---END---
---START---
ALTER TABLE partitioned ALTER COLUMN b TYPE char(5);
ERROR:  relation "partitioned" does not exist
---END---
---START---
-- specifying storage parameters for partitioned tables is not supported
ALTER TABLE partitioned SET (fillfactor=100);
ERROR:  relation "partitioned" does not exist
---END---
---START---
CREATE TABLE nonpartitioned (gemini_pk serial PRIMARY KEY, a integer, b integer);
---END---
---START---
ALTER TABLE partitioned INHERIT nonpartitioned;
ERROR:  relation "partitioned" does not exist
---END---
---START---
ALTER TABLE nonpartitioned INHERIT partitioned;
ERROR:  relation "partitioned" does not exist
---END---
---START---
-- cannot add NO INHERIT constraint to partitioned tables
ALTER TABLE partitioned ADD CONSTRAINT chk_a CHECK (a > 0) NO INHERIT;
ERROR:  relation "partitioned" does not exist
---END---
---START---
DROP TABLE partitioned, nonpartitioned;
ERROR:  table "partitioned" does not exist
---END---
---START---
CREATE TABLE unparted (gemini_pk serial PRIMARY KEY, a integer);
---END---
---START---
CREATE TABLE fail_part (gemini_pk serial PRIMARY KEY, LIKE unparted);
ERROR:  column "gemini_pk" specified more than once
---END---
---START---
ALTER TABLE unparted ATTACH PARTITION fail_part FOR VALUES IN ('a');
ERROR:  table "unparted" is not partitioned
---END---
---START---
DROP TABLE unparted, fail_part;
ERROR:  table "fail_part" does not exist
---END---
---START---
CREATE TABLE list_parted (gemini_pk serial PRIMARY KEY, a integer NOT NULL, b varchar COLLATE "C", CONSTRAINT check_a CHECK (a > 0)) PARTITION BY list (a);
ERROR:  unique constraint on partitioned table must include all partitioning columns
DETAIL:  PRIMARY KEY constraint on table "list_parted" lacks column "a" which is part of the partition key.
---END---
---START---
CREATE TABLE fail_part (gemini_pk serial PRIMARY KEY, LIKE list_parted);
ERROR:  relation "list_parted" does not exist
LINE 1: ...BLE fail_part (gemini_pk serial PRIMARY KEY, LIKE list_parte...
                                                             ^
---END---
---START---
ALTER TABLE list_parted ATTACH PARTITION fail_part FOR VALUES FROM (1) TO (10);
ERROR:  relation "list_parted" does not exist
---END---
---START---
DROP TABLE fail_part;
ERROR:  table "fail_part" does not exist
---END---
---START---
-- check that the table being attached exists
ALTER TABLE list_parted ATTACH PARTITION nonexistent FOR VALUES IN (1);
ERROR:  relation "list_parted" does not exist
---END---
---START---
-- check ownership of the source table
CREATE ROLE regress_test_me;
---END---
---START---
CREATE ROLE regress_test_not_me;
---END---
---START---
CREATE TABLE not_owned_by_me (gemini_pk serial PRIMARY KEY, LIKE list_parted);
ERROR:  relation "list_parted" does not exist
LINE 1: ...t_owned_by_me (gemini_pk serial PRIMARY KEY, LIKE list_parte...
                                                             ^
---END---
---START---
ALTER TABLE not_owned_by_me OWNER TO regress_test_not_me;
ERROR:  relation "not_owned_by_me" does not exist
---END---
---START---
SET SESSION AUTHORIZATION regress_test_me;
---END---
---START---
CREATE TABLE owned_by_me (gemini_pk serial PRIMARY KEY, a integer) PARTITION BY list (a);
ERROR:  unique constraint on partitioned table must include all partitioning columns
DETAIL:  PRIMARY KEY constraint on table "owned_by_me" lacks column "a" which is part of the partition key.
---END---
---START---
ALTER TABLE owned_by_me ATTACH PARTITION not_owned_by_me FOR VALUES IN (1);
ERROR:  relation "owned_by_me" does not exist
---END---
---START---
RESET SESSION AUTHORIZATION;
---END---
---START---
DROP TABLE owned_by_me, not_owned_by_me;
ERROR:  table "owned_by_me" does not exist
---END---
---START---
DROP ROLE regress_test_not_me;
---END---
---START---
DROP ROLE regress_test_me;
---END---
---START---
CREATE TABLE parent (gemini_pk serial PRIMARY KEY, LIKE list_parted);
ERROR:  relation "list_parted" does not exist
LINE 1: ... TABLE parent (gemini_pk serial PRIMARY KEY, LIKE list_parte...
                                                             ^
---END---
---START---
CREATE TABLE child (gemini_pk serial PRIMARY KEY) INHERITS (parent);
ERROR:  relation "parent" does not exist
---END---
---START---
ALTER TABLE list_parted ATTACH PARTITION child FOR VALUES IN (1);
ERROR:  relation "list_parted" does not exist
---END---
---START---
ALTER TABLE list_parted ATTACH PARTITION parent FOR VALUES IN (1);
ERROR:  relation "list_parted" does not exist
---END---
---START---
DROP TABLE parent CASCADE;
ERROR:  table "parent" does not exist
---END---
---START---
-- check any TEMP-ness
DROP TABLE IF EXISTS temp_parted;
NOTICE:  table "temp_parted" does not exist, skipping
CREATE TABLE temp_parted (gemini_pk serial PRIMARY KEY, a integer) PARTITION BY list (a);
ERROR:  unique constraint on partitioned table must include all partitioning columns
DETAIL:  PRIMARY KEY constraint on table "temp_parted" lacks column "a" which is part of the partition key.
---END---
---START---
CREATE TABLE perm_part (gemini_pk serial PRIMARY KEY, a integer);
---END---
---START---
ALTER TABLE temp_parted ATTACH PARTITION perm_part FOR VALUES IN (1);
ERROR:  relation "temp_parted" does not exist
---END---
---START---
DROP TABLE temp_parted, perm_part;
ERROR:  table "temp_parted" does not exist
---END---
---START---
-- check that the table being attached is not a typed table
CREATE TYPE mytype AS (a int);
---END---
---START---
CREATE TABLE fail_part OF mytype (gemini_pk serial PRIMARY KEY);
ERROR:  syntax error at or near "serial"
LINE 1: CREATE TABLE fail_part OF mytype (gemini_pk serial PRIMARY K...
                                                    ^
---END---
---START---
ALTER TABLE list_parted ATTACH PARTITION fail_part FOR VALUES IN (1);
ERROR:  relation "list_parted" does not exist
---END---
---START---
DROP TYPE mytype CASCADE;
---END---
---START---
CREATE TABLE fail_part (gemini_pk serial PRIMARY KEY, LIKE list_parted, c integer);
ERROR:  relation "list_parted" does not exist
LINE 1: ...BLE fail_part (gemini_pk serial PRIMARY KEY, LIKE list_parte...
                                                             ^
---END---
---START---
ALTER TABLE list_parted ATTACH PARTITION fail_part FOR VALUES IN (1);
ERROR:  relation "list_parted" does not exist
---END---
---START---
DROP TABLE fail_part;
ERROR:  table "fail_part" does not exist
---END---
---START---
CREATE TABLE fail_part (gemini_pk serial PRIMARY KEY, a integer NOT NULL);
---END---
---START---
ALTER TABLE list_parted ATTACH PARTITION fail_part FOR VALUES IN (1);
ERROR:  relation "list_parted" does not exist
---END---
---START---
DROP TABLE fail_part;
---END---
---START---
CREATE TABLE fail_part (gemini_pk serial PRIMARY KEY, b varchar, a integer NOT NULL);
---END---
---START---
ALTER TABLE list_parted ATTACH PARTITION fail_part FOR VALUES IN (1);
ERROR:  relation "list_parted" does not exist
---END---
---START---
ALTER TABLE fail_part ALTER b TYPE char (2) COLLATE "POSIX";
---END---
---START---
ALTER TABLE list_parted ATTACH PARTITION fail_part FOR VALUES IN (1);
ERROR:  relation "list_parted" does not exist
---END---
---START---
DROP TABLE fail_part;
---END---
---START---
CREATE TABLE fail_part (gemini_pk serial PRIMARY KEY, b varchar COLLATE "C", a integer NOT NULL);
---END---
---START---
ALTER TABLE list_parted ATTACH PARTITION fail_part FOR VALUES IN (1);
ERROR:  relation "list_parted" does not exist
---END---
---START---
-- check that the constraint matches in definition with parent's constraint
ALTER TABLE fail_part ADD CONSTRAINT check_a CHECK (a >= 0);
---END---
---START---
ALTER TABLE list_parted ATTACH PARTITION fail_part FOR VALUES IN (1);
ERROR:  relation "list_parted" does not exist
---END---
---START---
DROP TABLE fail_part;
---END---
---START---
CREATE TABLE part_1 (gemini_pk serial PRIMARY KEY, a integer NOT NULL, b varchar COLLATE "C", CONSTRAINT check_a CHECK (a > 0));
---END---
---START---
ALTER TABLE list_parted ATTACH PARTITION part_1 FOR VALUES IN (1);
ERROR:  relation "list_parted" does not exist
---END---
---START---
-- attislocal and conislocal are always false for merged attributes and constraints respectively.
SELECT attislocal, attinhcount FROM pg_attribute WHERE attrelid = 'part_1'::regclass AND attnum > 0;
 attislocal | attinhcount 
------------+-------------
 t          |           0
 t          |           0
 t          |           0
(3 rows)

---END---
---START---
SELECT conislocal, coninhcount FROM pg_constraint WHERE conrelid = 'part_1'::regclass AND conname = 'check_a';
 conislocal | coninhcount 
------------+-------------
 t          |           0
(1 row)

---END---
---START---
CREATE TABLE fail_part (gemini_pk serial PRIMARY KEY, LIKE part_1 INCLUDING CONSTRAINTS);
ERROR:  column "gemini_pk" specified more than once
---END---
---START---
ALTER TABLE list_parted ATTACH PARTITION fail_part FOR VALUES IN (1);
ERROR:  relation "list_parted" does not exist
---END---
---START---
DROP TABLE fail_part;
ERROR:  table "fail_part" does not exist
---END---
---START---
CREATE TABLE def_part (gemini_pk serial PRIMARY KEY, LIKE list_parted INCLUDING CONSTRAINTS);
ERROR:  relation "list_parted" does not exist
LINE 1: ...ABLE def_part (gemini_pk serial PRIMARY KEY, LIKE list_parte...
                                                             ^
---END---
---START---
ALTER TABLE list_parted ATTACH PARTITION def_part DEFAULT;
ERROR:  relation "list_parted" does not exist
---END---
---START---
CREATE TABLE fail_def_part (gemini_pk serial PRIMARY KEY, LIKE part_1 INCLUDING CONSTRAINTS);
ERROR:  column "gemini_pk" specified more than once
---END---
---START---
ALTER TABLE list_parted ATTACH PARTITION fail_def_part DEFAULT;
ERROR:  relation "list_parted" does not exist
---END---
---START---
CREATE TABLE list_parted2 (gemini_pk serial PRIMARY KEY, a integer, b char) PARTITION BY list (a);
ERROR:  unique constraint on partitioned table must include all partitioning columns
DETAIL:  PRIMARY KEY constraint on table "list_parted2" lacks column "a" which is part of the partition key.
---END---
---START---
CREATE TABLE part_2 (gemini_pk serial PRIMARY KEY, LIKE list_parted2);
ERROR:  relation "list_parted2" does not exist
LINE 1: ... TABLE part_2 (gemini_pk serial PRIMARY KEY, LIKE list_parte...
                                                             ^
---END---
---START---
INSERT INTO part_2 VALUES (3, 'a');
ERROR:  relation "part_2" does not exist
LINE 1: INSERT INTO part_2 VALUES (3, 'a');
                    ^
---END---
---START---
ALTER TABLE list_parted2 ATTACH PARTITION part_2 FOR VALUES IN (2);
ERROR:  relation "list_parted2" does not exist
---END---
---START---
-- should be ok after deleting the bad row
DELETE FROM part_2;
ERROR:  relation "part_2" does not exist
LINE 1: DELETE FROM part_2;
                    ^
---END---
---START---
ALTER TABLE list_parted2 ATTACH PARTITION part_2 FOR VALUES IN (2);
ERROR:  relation "list_parted2" does not exist
---END---
---START---
-- check partition cannot be attached if default has some row for its values
CREATE TABLE list_parted2_def PARTITION OF list_parted2 DEFAULT;
ERROR:  relation "list_parted2" does not exist
---END---
---START---
INSERT INTO list_parted2_def VALUES (11, 'z');
ERROR:  relation "list_parted2_def" does not exist
LINE 1: INSERT INTO list_parted2_def VALUES (11, 'z');
                    ^
---END---
---START---
CREATE TABLE part_3 (gemini_pk serial PRIMARY KEY, LIKE list_parted2);
ERROR:  relation "list_parted2" does not exist
LINE 1: ... TABLE part_3 (gemini_pk serial PRIMARY KEY, LIKE list_parte...
                                                             ^
---END---
---START---
ALTER TABLE list_parted2 ATTACH PARTITION part_3 FOR VALUES IN (11);
ERROR:  relation "list_parted2" does not exist
---END---
---START---
-- should be ok after deleting the bad row
DELETE FROM list_parted2_def WHERE a = 11;
ERROR:  relation "list_parted2_def" does not exist
LINE 1: DELETE FROM list_parted2_def WHERE a = 11;
                    ^
---END---
---START---
ALTER TABLE list_parted2 ATTACH PARTITION part_3 FOR VALUES IN (11);
ERROR:  relation "list_parted2" does not exist
---END---
---START---
CREATE TABLE part_3_4 (gemini_pk serial PRIMARY KEY, LIKE list_parted2, CONSTRAINT check_a CHECK (a IN (3)));
ERROR:  relation "list_parted2" does not exist
LINE 1: ...ABLE part_3_4 (gemini_pk serial PRIMARY KEY, LIKE list_parte...
                                                             ^
---END---
---START---
-- however, if a list partition does not accept nulls, there should be
-- an explicit NOT NULL constraint on the partition key column for the
-- validation scan to be skipped;
ALTER TABLE list_parted2 ATTACH PARTITION part_3_4 FOR VALUES IN (3, 4);
ERROR:  relation "list_parted2" does not exist
---END---
---START---
-- adding a NOT NULL constraint will cause the scan to be skipped
ALTER TABLE list_parted2 DETACH PARTITION part_3_4;
ERROR:  relation "list_parted2" does not exist
---END---
---START---
ALTER TABLE part_3_4 ALTER a SET NOT NULL;
ERROR:  relation "part_3_4" does not exist
---END---
---START---
ALTER TABLE list_parted2 ATTACH PARTITION part_3_4 FOR VALUES IN (3, 4);
ERROR:  relation "list_parted2" does not exist
---END---
---START---
-- check if default partition scan skipped
ALTER TABLE list_parted2_def ADD CONSTRAINT check_a CHECK (a IN (5, 6));
ERROR:  relation "list_parted2_def" does not exist
---END---
---START---
CREATE TABLE part_55_66 PARTITION OF list_parted2 FOR VALUES IN (55, 66);
ERROR:  relation "list_parted2" does not exist
---END---
---START---
CREATE TABLE range_parted (gemini_pk serial PRIMARY KEY, a integer, b integer) PARTITION BY range (a, b);
ERROR:  unique constraint on partitioned table must include all partitioning columns
DETAIL:  PRIMARY KEY constraint on table "range_parted" lacks column "a" which is part of the partition key.
---END---
---START---
CREATE TABLE part1 (gemini_pk serial PRIMARY KEY, a integer NOT NULL CHECK (a = 1), b integer NOT NULL CHECK (b >= 1 AND b <= 10));
---END---
---START---
INSERT INTO part1 VALUES (1, 10);
ERROR:  null value in column "b" of relation "part1" violates not-null constraint
DETAIL:  Failing row contains (1, 10, null).
---END---
---START---
-- Remember the TO bound is exclusive
ALTER TABLE range_parted ATTACH PARTITION part1 FOR VALUES FROM (1, 1) TO (1, 10);
ERROR:  relation "range_parted" does not exist
---END---
---START---
-- should be ok after deleting the bad row
DELETE FROM part1;
---END---
---START---
ALTER TABLE range_parted ATTACH PARTITION part1 FOR VALUES FROM (1, 1) TO (1, 10);
ERROR:  relation "range_parted" does not exist
---END---
---START---
CREATE TABLE part2 (gemini_pk serial PRIMARY KEY, a integer NOT NULL CHECK (a = 1), b integer NOT NULL CHECK (b >= 10 AND b < 18));
---END---
---START---
ALTER TABLE range_parted ATTACH PARTITION part2 FOR VALUES FROM (1, 10) TO (1, 20);
ERROR:  relation "range_parted" does not exist
---END---
---START---
-- Create default partition
CREATE TABLE partr_def1 PARTITION OF range_parted DEFAULT;
ERROR:  relation "range_parted" does not exist
---END---
---START---
CREATE TABLE partr_def2 (gemini_pk serial PRIMARY KEY, LIKE part1 INCLUDING CONSTRAINTS);
ERROR:  column "gemini_pk" specified more than once
---END---
---START---
ALTER TABLE range_parted ATTACH PARTITION partr_def2 DEFAULT;
ERROR:  relation "range_parted" does not exist
---END---
---START---
-- Overlapping partitions cannot be attached, hence, following should give error
INSERT INTO partr_def1 VALUES (2, 10);
ERROR:  relation "partr_def1" does not exist
LINE 1: INSERT INTO partr_def1 VALUES (2, 10);
                    ^
---END---
---START---
CREATE TABLE part3 (gemini_pk serial PRIMARY KEY, LIKE range_parted);
ERROR:  relation "range_parted" does not exist
LINE 1: ...E TABLE part3 (gemini_pk serial PRIMARY KEY, LIKE range_part...
                                                             ^
---END---
---START---
ALTER TABLE range_parted ATTACH partition part3 FOR VALUES FROM (2, 10) TO (2, 20);
ERROR:  relation "range_parted" does not exist
---END---
---START---
-- Attaching partitions should be successful when there are no overlapping rows
ALTER TABLE range_parted ATTACH partition part3 FOR VALUES FROM (3, 10) TO (3, 20);
ERROR:  relation "range_parted" does not exist
---END---
---START---
CREATE TABLE part_5 (gemini_pk serial PRIMARY KEY, LIKE list_parted2) PARTITION BY list (b);
ERROR:  relation "list_parted2" does not exist
LINE 1: ... TABLE part_5 (gemini_pk serial PRIMARY KEY, LIKE list_parte...
                                                             ^
---END---
---START---
-- check that violating rows are correctly reported
CREATE TABLE part_5_a PARTITION OF part_5 FOR VALUES IN ('a');
ERROR:  relation "part_5" does not exist
---END---
---START---
INSERT INTO part_5_a (a, b) VALUES (6, 'a');
ERROR:  relation "part_5_a" does not exist
LINE 1: INSERT INTO part_5_a (a, b) VALUES (6, 'a');
                    ^
---END---
---START---
ALTER TABLE list_parted2 ATTACH PARTITION part_5 FOR VALUES IN (5);
ERROR:  relation "list_parted2" does not exist
---END---
---START---
-- delete the faulting row and also add a constraint to skip the scan
DELETE FROM part_5_a WHERE a NOT IN (3);
ERROR:  relation "part_5_a" does not exist
LINE 1: DELETE FROM part_5_a WHERE a NOT IN (3);
                    ^
---END---
---START---
ALTER TABLE part_5 ADD CONSTRAINT check_a CHECK (a IS NOT NULL AND a = 5);
ERROR:  relation "part_5" does not exist
---END---
---START---
ALTER TABLE list_parted2 ATTACH PARTITION part_5 FOR VALUES IN (5);
ERROR:  relation "list_parted2" does not exist
---END---
---START---
ALTER TABLE list_parted2 DETACH PARTITION part_5;
ERROR:  relation "list_parted2" does not exist
---END---
---START---
ALTER TABLE part_5 DROP CONSTRAINT check_a;
ERROR:  relation "part_5" does not exist
---END---
---START---
-- scan should again be skipped, even though NOT NULL is now a column property
ALTER TABLE part_5 ADD CONSTRAINT check_a CHECK (a IN (5)), ALTER a SET NOT NULL;
ERROR:  relation "part_5" does not exist
---END---
---START---
ALTER TABLE list_parted2 ATTACH PARTITION part_5 FOR VALUES IN (5);
ERROR:  relation "list_parted2" does not exist
---END---
---START---
CREATE TABLE part_6 (gemini_pk serial PRIMARY KEY, c integer, LIKE list_parted2, CONSTRAINT check_a CHECK (a IS NOT NULL AND a = 6));
ERROR:  relation "list_parted2" does not exist
LINE 1: ..._6 (gemini_pk serial PRIMARY KEY, c integer, LIKE list_parte...
                                                             ^
---END---
---START---
ALTER TABLE part_6 DROP c;
ERROR:  relation "part_6" does not exist
---END---
---START---
ALTER TABLE list_parted2 ATTACH PARTITION part_6 FOR VALUES IN (6);
ERROR:  relation "list_parted2" does not exist
---END---
---START---
CREATE TABLE part_7 (gemini_pk serial PRIMARY KEY, LIKE list_parted2, CONSTRAINT check_a CHECK (a IS NOT NULL AND a = 7)) PARTITION BY list (b);
ERROR:  relation "list_parted2" does not exist
LINE 1: ... TABLE part_7 (gemini_pk serial PRIMARY KEY, LIKE list_parte...
                                                             ^
---END---
---START---
CREATE TABLE part_7_a_null (gemini_pk serial PRIMARY KEY, c integer, d integer, e integer, LIKE list_parted2, CONSTRAINT check_b CHECK (b IS NULL OR b = 'a'), CONSTRAINT check_a CHECK (a IS NOT NULL AND a = 7));
ERROR:  relation "list_parted2" does not exist
LINE 1: ...RIMARY KEY, c integer, d integer, e integer, LIKE list_parte...
                                                             ^
---END---
---START---
ALTER TABLE part_7_a_null DROP c, DROP d, DROP e;
ERROR:  relation "part_7_a_null" does not exist
---END---
---START---
ALTER TABLE part_7 ATTACH PARTITION part_7_a_null FOR VALUES IN ('a', null);
ERROR:  relation "part_7" does not exist
---END---
---START---
ALTER TABLE list_parted2 ATTACH PARTITION part_7 FOR VALUES IN (7);
ERROR:  relation "list_parted2" does not exist
---END---
---START---
-- Same example, but check this time that the constraint correctly detects
-- violating rows
ALTER TABLE list_parted2 DETACH PARTITION part_7;
ERROR:  relation "list_parted2" does not exist
---END---
---START---
ALTER TABLE part_7 DROP CONSTRAINT check_a;
ERROR:  relation "part_7" does not exist
---END---
---START---
-- thusly, scan won't be skipped
INSERT INTO part_7 (a, b) VALUES (8, null), (9, 'a');
ERROR:  relation "part_7" does not exist
LINE 1: INSERT INTO part_7 (a, b) VALUES (8, null), (9, 'a');
                    ^
---END---
---START---
SELECT tableoid::regclass, a, b FROM part_7 order by a;
ERROR:  relation "part_7" does not exist
LINE 1: SELECT tableoid::regclass, a, b FROM part_7 order by a;
                                             ^
---END---
---START---
ALTER TABLE list_parted2 ATTACH PARTITION part_7 FOR VALUES IN (7);
ERROR:  relation "list_parted2" does not exist
---END---
---START---
-- check that leaf partitions of default partition are scanned when
-- attaching a partitioned table.
ALTER TABLE part_5 DROP CONSTRAINT check_a;
ERROR:  relation "part_5" does not exist
---END---
---START---
CREATE TABLE part5_def PARTITION OF part_5 DEFAULT PARTITION BY LIST(a);
ERROR:  relation "part_5" does not exist
---END---
---START---
CREATE TABLE part5_def_p1 PARTITION OF part5_def FOR VALUES IN (5);
ERROR:  relation "part5_def" does not exist
---END---
---START---
INSERT INTO part5_def_p1 VALUES (5, 'y');
ERROR:  relation "part5_def_p1" does not exist
LINE 1: INSERT INTO part5_def_p1 VALUES (5, 'y');
                    ^
---END---
---START---
CREATE TABLE part5_p1 (gemini_pk serial PRIMARY KEY, LIKE part_5);
ERROR:  relation "part_5" does not exist
LINE 1: ... TABLE part5_p1 (gemini_pk serial PRIMARY KEY, LIKE part_5);
                                                               ^
---END---
---START---
ALTER TABLE part_5 ATTACH PARTITION part5_p1 FOR VALUES IN ('y');
ERROR:  relation "part_5" does not exist
---END---
---START---
-- should be ok after deleting the bad row
DELETE FROM part5_def_p1 WHERE b = 'y';
ERROR:  relation "part5_def_p1" does not exist
LINE 1: DELETE FROM part5_def_p1 WHERE b = 'y';
                    ^
---END---
---START---
ALTER TABLE part_5 ATTACH PARTITION part5_p1 FOR VALUES IN ('y');
ERROR:  relation "part_5" does not exist
---END---
---START---
-- check that the table being attached is not already a partition
ALTER TABLE list_parted2 ATTACH PARTITION part_2 FOR VALUES IN (2);
ERROR:  relation "list_parted2" does not exist
---END---
---START---
-- check that circular inheritance is not allowed
ALTER TABLE part_5 ATTACH PARTITION list_parted2 FOR VALUES IN ('b');
ERROR:  relation "part_5" does not exist
---END---
---START---
ALTER TABLE list_parted2 ATTACH PARTITION list_parted2 FOR VALUES IN (0);
ERROR:  relation "list_parted2" does not exist
---END---
---START---
CREATE TABLE quuux (gemini_pk serial PRIMARY KEY, a integer, b text) PARTITION BY list (a);
ERROR:  unique constraint on partitioned table must include all partitioning columns
DETAIL:  PRIMARY KEY constraint on table "quuux" lacks column "a" which is part of the partition key.
---END---
---START---
CREATE TABLE quuux_default PARTITION OF quuux DEFAULT PARTITION BY LIST (b);
ERROR:  relation "quuux" does not exist
---END---
---START---
CREATE TABLE quuux_default1 PARTITION OF quuux_default (
	CONSTRAINT check_1 CHECK (a IS NOT NULL AND a = 1)
) FOR VALUES IN ('b');
ERROR:  relation "quuux_default" does not exist
---END---
---START---
CREATE TABLE quuux1 (gemini_pk serial PRIMARY KEY, a integer, b text);
---END---
---START---
ALTER TABLE quuux ATTACH PARTITION quuux1 FOR VALUES IN (1);
ERROR:  relation "quuux" does not exist
---END---
---START---
CREATE TABLE quuux2 (gemini_pk serial PRIMARY KEY, a integer, b text);
---END---
---START---
ALTER TABLE quuux ATTACH PARTITION quuux2 FOR VALUES IN (2);
ERROR:  relation "quuux" does not exist
---END---
---START---
-- skip validation
DROP TABLE quuux1, quuux2;
---END---
---START---
-- should validate for quuux1, but not for quuux2
CREATE TABLE quuux1 PARTITION OF quuux FOR VALUES IN (1);
ERROR:  relation "quuux" does not exist
---END---
---START---
CREATE TABLE quuux2 PARTITION OF quuux FOR VALUES IN (2);
ERROR:  relation "quuux" does not exist
---END---
---START---
DROP TABLE quuux;
ERROR:  table "quuux" does not exist
---END---
---START---
CREATE TABLE hash_parted (gemini_pk serial PRIMARY KEY, a integer, b integer) PARTITION BY hash (a part_test_int4_ops);
ERROR:  operator class "part_test_int4_ops" does not accept data type integer
---END---
---START---
CREATE TABLE hpart_1 PARTITION OF hash_parted FOR VALUES WITH (MODULUS 4, REMAINDER 0);
ERROR:  relation "hash_parted" does not exist
---END---
---START---
CREATE TABLE fail_part (gemini_pk serial PRIMARY KEY, LIKE hpart_1);
ERROR:  relation "hpart_1" does not exist
LINE 1: ...ABLE fail_part (gemini_pk serial PRIMARY KEY, LIKE hpart_1);
                                                              ^
---END---
---START---
ALTER TABLE hash_parted ATTACH PARTITION fail_part FOR VALUES WITH (MODULUS 8, REMAINDER 4);
ERROR:  relation "hash_parted" does not exist
---END---
---START---
ALTER TABLE hash_parted ATTACH PARTITION fail_part FOR VALUES WITH (MODULUS 8, REMAINDER 0);
ERROR:  relation "hash_parted" does not exist
---END---
---START---
DROP TABLE fail_part;
ERROR:  table "fail_part" does not exist
---END---
---START---
CREATE TABLE hpart_2 (gemini_pk serial PRIMARY KEY, LIKE hash_parted);
ERROR:  relation "hash_parted" does not exist
LINE 1: ...TABLE hpart_2 (gemini_pk serial PRIMARY KEY, LIKE hash_parte...
                                                             ^
---END---
---START---
INSERT INTO hpart_2 VALUES (3, 0);
ERROR:  relation "hpart_2" does not exist
LINE 1: INSERT INTO hpart_2 VALUES (3, 0);
                    ^
---END---
---START---
ALTER TABLE hash_parted ATTACH PARTITION hpart_2 FOR VALUES WITH (MODULUS 4, REMAINDER 1);
ERROR:  relation "hash_parted" does not exist
---END---
---START---
-- should be ok after deleting the bad row
DELETE FROM hpart_2;
ERROR:  relation "hpart_2" does not exist
LINE 1: DELETE FROM hpart_2;
                    ^
---END---
---START---
ALTER TABLE hash_parted ATTACH PARTITION hpart_2 FOR VALUES WITH (MODULUS 4, REMAINDER 1);
ERROR:  relation "hash_parted" does not exist
---END---
---START---
CREATE TABLE hpart_5 (gemini_pk serial PRIMARY KEY, LIKE hash_parted) PARTITION BY list (b);
ERROR:  relation "hash_parted" does not exist
LINE 1: ...TABLE hpart_5 (gemini_pk serial PRIMARY KEY, LIKE hash_parte...
                                                             ^
---END---
---START---
-- check that violating rows are correctly reported
CREATE TABLE hpart_5_a PARTITION OF hpart_5 FOR VALUES IN ('1', '2', '3');
ERROR:  relation "hpart_5" does not exist
---END---
---START---
INSERT INTO hpart_5_a (a, b) VALUES (7, 1);
ERROR:  relation "hpart_5_a" does not exist
LINE 1: INSERT INTO hpart_5_a (a, b) VALUES (7, 1);
                    ^
---END---
---START---
ALTER TABLE hash_parted ATTACH PARTITION hpart_5 FOR VALUES WITH (MODULUS 4, REMAINDER 2);
ERROR:  relation "hash_parted" does not exist
---END---
---START---
-- should be ok after deleting the bad row
DELETE FROM hpart_5_a;
ERROR:  relation "hpart_5_a" does not exist
LINE 1: DELETE FROM hpart_5_a;
                    ^
---END---
---START---
ALTER TABLE hash_parted ATTACH PARTITION hpart_5 FOR VALUES WITH (MODULUS 4, REMAINDER 2);
ERROR:  relation "hash_parted" does not exist
---END---
---START---
CREATE TABLE fail_part (gemini_pk serial PRIMARY KEY, LIKE hash_parted);
ERROR:  relation "hash_parted" does not exist
LINE 1: ...BLE fail_part (gemini_pk serial PRIMARY KEY, LIKE hash_parte...
                                                             ^
---END---
---START---
ALTER TABLE hash_parted ATTACH PARTITION fail_part FOR VALUES WITH (MODULUS 0, REMAINDER 1);
ERROR:  relation "hash_parted" does not exist
---END---
---START---
ALTER TABLE hash_parted ATTACH PARTITION fail_part FOR VALUES WITH (MODULUS 8, REMAINDER 8);
ERROR:  relation "hash_parted" does not exist
---END---
---START---
ALTER TABLE hash_parted ATTACH PARTITION fail_part FOR VALUES WITH (MODULUS 3, REMAINDER 2);
ERROR:  relation "hash_parted" does not exist
---END---
---START---
DROP TABLE fail_part;
ERROR:  table "fail_part" does not exist
---END---
---START---
CREATE TABLE regular_table (gemini_pk serial PRIMARY KEY, a integer);
---END---
---START---
ALTER TABLE regular_table DETACH PARTITION any_name;
ERROR:  table "regular_table" is not partitioned
---END---
---START---
DROP TABLE regular_table;
---END---
---START---
-- check that the partition being detached exists at all
ALTER TABLE list_parted2 DETACH PARTITION part_4;
ERROR:  relation "list_parted2" does not exist
---END---
---START---
ALTER TABLE hash_parted DETACH PARTITION hpart_4;
ERROR:  relation "hash_parted" does not exist
---END---
---START---
CREATE TABLE not_a_part (gemini_pk serial PRIMARY KEY, a integer);
---END---
---START---
ALTER TABLE list_parted2 DETACH PARTITION not_a_part;
ERROR:  relation "list_parted2" does not exist
---END---
---START---
ALTER TABLE list_parted2 DETACH PARTITION part_1;
ERROR:  relation "list_parted2" does not exist
---END---
---START---
ALTER TABLE hash_parted DETACH PARTITION not_a_part;
ERROR:  relation "hash_parted" does not exist
---END---
---START---
DROP TABLE not_a_part;
---END---
---START---
-- check that, after being detached, attinhcount/coninhcount is dropped to 0 and
-- attislocal/conislocal is set to true
ALTER TABLE list_parted2 DETACH PARTITION part_3_4;
ERROR:  relation "list_parted2" does not exist
---END---
---START---
SELECT attinhcount, attislocal FROM pg_attribute WHERE attrelid = 'part_3_4'::regclass AND attnum > 0;
ERROR:  relation "part_3_4" does not exist
LINE 1: ...nt, attislocal FROM pg_attribute WHERE attrelid = 'part_3_4'...
                                                             ^
---END---
---START---
SELECT coninhcount, conislocal FROM pg_constraint WHERE conrelid = 'part_3_4'::regclass AND conname = 'check_a';
ERROR:  relation "part_3_4" does not exist
LINE 1: ...t, conislocal FROM pg_constraint WHERE conrelid = 'part_3_4'...
                                                             ^
---END---
---START---
DROP TABLE part_3_4;
ERROR:  table "part_3_4" does not exist
---END---
---START---
CREATE TABLE range_parted2 (gemini_pk serial PRIMARY KEY, a integer) PARTITION BY range (a);
ERROR:  unique constraint on partitioned table must include all partitioning columns
DETAIL:  PRIMARY KEY constraint on table "range_parted2" lacks column "a" which is part of the partition key.
---END---
---START---
CREATE TABLE part_rp PARTITION OF range_parted2 FOR VALUES FROM (0) to (100);
ERROR:  relation "range_parted2" does not exist
---END---
---START---
ALTER TABLE range_parted2 DETACH PARTITION part_rp;
ERROR:  relation "range_parted2" does not exist
---END---
---START---
DROP TABLE range_parted2;
ERROR:  table "range_parted2" does not exist
---END---
---START---
SELECT * from part_rp;
ERROR:  relation "part_rp" does not exist
LINE 1: SELECT * from part_rp;
                      ^
---END---
---START---
DROP TABLE part_rp;
ERROR:  table "part_rp" does not exist
---END---
---START---
CREATE TABLE range_parted2 (gemini_pk serial PRIMARY KEY, a integer) PARTITION BY range (a);
ERROR:  unique constraint on partitioned table must include all partitioning columns
DETAIL:  PRIMARY KEY constraint on table "range_parted2" lacks column "a" which is part of the partition key.
---END---
---START---
CREATE TABLE part_rp PARTITION OF range_parted2 FOR VALUES FROM (0) to (100);
ERROR:  relation "range_parted2" does not exist
---END---
---START---
BEGIN;
---END---
---START---
-- doesn't work in a partition block
ALTER TABLE range_parted2 DETACH PARTITION part_rp CONCURRENTLY;
ERROR:  ALTER TABLE ... DETACH CONCURRENTLY cannot run inside a transaction block
---END---
---START---
COMMIT;
---END---
---START---
CREATE TABLE part_rpd PARTITION OF range_parted2 DEFAULT;
ERROR:  relation "range_parted2" does not exist
---END---
---START---
-- doesn't work if there's a default partition
ALTER TABLE range_parted2 DETACH PARTITION part_rp CONCURRENTLY;
ERROR:  relation "range_parted2" does not exist
---END---
---START---
-- doesn't work for the default partition
ALTER TABLE range_parted2 DETACH PARTITION part_rpd CONCURRENTLY;
ERROR:  relation "range_parted2" does not exist
---END---
---START---
DROP TABLE part_rpd;
ERROR:  table "part_rpd" does not exist
---END---
---START---
-- works fine
ALTER TABLE range_parted2 DETACH PARTITION part_rp CONCURRENTLY;
ERROR:  relation "range_parted2" does not exist
---END---
---START---
\d+ range_parted2
-- constraint should be created
\d part_rp
CREATE TABLE part_rp100 PARTITION OF range_parted2 (CHECK (a>=123 AND a<133 AND a IS NOT NULL)) FOR VALUES FROM (100) to (200);
ERROR:  relation "range_parted2" does not exist
---END---
---START---
ALTER TABLE range_parted2 DETACH PARTITION part_rp100 CONCURRENTLY;
ERROR:  relation "range_parted2" does not exist
---END---
---START---
-- redundant constraint should not be created
\d part_rp100
DROP TABLE range_parted2;
ERROR:  table "range_parted2" does not exist
---END---
---START---
-- Check ALTER TABLE commands for partitioned tables and partitions
-- cannot add/drop column to/from *only* the parent
ALTER TABLE ONLY list_parted2 ADD COLUMN c int;
ERROR:  relation "list_parted2" does not exist
---END---
---START---
ALTER TABLE ONLY list_parted2 DROP COLUMN b;
ERROR:  relation "list_parted2" does not exist
---END---
---START---
-- cannot add a column to partition or drop an inherited one
ALTER TABLE part_2 ADD COLUMN c text;
ERROR:  relation "part_2" does not exist
---END---
---START---
ALTER TABLE part_2 DROP COLUMN b;
ERROR:  relation "part_2" does not exist
---END---
---START---
-- Nor rename, alter type
ALTER TABLE part_2 RENAME COLUMN b to c;
ERROR:  relation "part_2" does not exist
---END---
---START---
ALTER TABLE part_2 ALTER COLUMN b TYPE text;
ERROR:  relation "part_2" does not exist
---END---
---START---
-- cannot add/drop NOT NULL or check constraints to *only* the parent, when
-- partitions exist
ALTER TABLE ONLY list_parted2 ALTER b SET NOT NULL;
ERROR:  relation "list_parted2" does not exist
---END---
---START---
ALTER TABLE ONLY list_parted2 ADD CONSTRAINT check_b CHECK (b <> 'zz');
ERROR:  relation "list_parted2" does not exist
---END---
---START---
ALTER TABLE list_parted2 ALTER b SET NOT NULL;
ERROR:  relation "list_parted2" does not exist
---END---
---START---
ALTER TABLE ONLY list_parted2 ALTER b DROP NOT NULL;
ERROR:  relation "list_parted2" does not exist
---END---
---START---
ALTER TABLE list_parted2 ADD CONSTRAINT check_b CHECK (b <> 'zz');
ERROR:  relation "list_parted2" does not exist
---END---
---START---
ALTER TABLE ONLY list_parted2 DROP CONSTRAINT check_b;
ERROR:  relation "list_parted2" does not exist
---END---
---START---
CREATE TABLE parted_no_parts (gemini_pk serial PRIMARY KEY, a integer) PARTITION BY list (a);
ERROR:  unique constraint on partitioned table must include all partitioning columns
DETAIL:  PRIMARY KEY constraint on table "parted_no_parts" lacks column "a" which is part of the partition key.
---END---
---START---
ALTER TABLE ONLY parted_no_parts ALTER a SET NOT NULL;
ERROR:  relation "parted_no_parts" does not exist
---END---
---START---
ALTER TABLE ONLY parted_no_parts ADD CONSTRAINT check_a CHECK (a > 0);
ERROR:  relation "parted_no_parts" does not exist
---END---
---START---
ALTER TABLE ONLY parted_no_parts ALTER a DROP NOT NULL;
ERROR:  relation "parted_no_parts" does not exist
---END---
---START---
ALTER TABLE ONLY parted_no_parts DROP CONSTRAINT check_a;
ERROR:  relation "parted_no_parts" does not exist
---END---
---START---
DROP TABLE parted_no_parts;
ERROR:  table "parted_no_parts" does not exist
---END---
---START---
-- cannot drop inherited NOT NULL or check constraints from partition
ALTER TABLE list_parted2 ALTER b SET NOT NULL, ADD CONSTRAINT check_a2 CHECK (a > 0);
ERROR:  relation "list_parted2" does not exist
---END---
---START---
ALTER TABLE part_2 ALTER b DROP NOT NULL;
ERROR:  relation "part_2" does not exist
---END---
---START---
ALTER TABLE part_2 DROP CONSTRAINT check_a2;
ERROR:  relation "part_2" does not exist
---END---
---START---
-- Doesn't make sense to add NO INHERIT constraints on partitioned tables
ALTER TABLE list_parted2 add constraint check_b2 check (b <> 'zz') NO INHERIT;
ERROR:  relation "list_parted2" does not exist
---END---
---START---
CREATE TABLE inh_test (gemini_pk serial PRIMARY KEY) INHERITS (part_2);
ERROR:  relation "part_2" does not exist
---END---
---START---
CREATE TABLE inh_test (gemini_pk serial PRIMARY KEY, LIKE part_2);
ERROR:  relation "part_2" does not exist
LINE 1: ... TABLE inh_test (gemini_pk serial PRIMARY KEY, LIKE part_2);
                                                               ^
---END---
---START---
ALTER TABLE inh_test INHERIT part_2;
ERROR:  relation "inh_test" does not exist
---END---
---START---
ALTER TABLE part_2 INHERIT inh_test;
ERROR:  relation "part_2" does not exist
---END---
---START---
-- cannot drop or alter type of partition key columns of lower level
-- partitioned tables; for example, part_5, which is list_parted2's
-- partition, is partitioned on b;
ALTER TABLE list_parted2 DROP COLUMN b;
ERROR:  relation "list_parted2" does not exist
---END---
---START---
ALTER TABLE list_parted2 ALTER COLUMN b TYPE text;
ERROR:  relation "list_parted2" does not exist
---END---
---START---
-- dropping non-partition key columns should be allowed on the parent table.
ALTER TABLE list_parted DROP COLUMN b;
ERROR:  relation "list_parted" does not exist
---END---
---START---
SELECT * FROM list_parted;
ERROR:  relation "list_parted" does not exist
LINE 1: SELECT * FROM list_parted;
                      ^
---END---
---START---
-- cleanup
DROP TABLE list_parted, list_parted2, range_parted;
ERROR:  table "list_parted" does not exist
---END---
---START---
DROP TABLE fail_def_part;
ERROR:  table "fail_def_part" does not exist
---END---
---START---
DROP TABLE hash_parted;
ERROR:  table "hash_parted" does not exist
---END---
---START---
CREATE TABLE p (gemini_pk serial PRIMARY KEY, a integer, b integer) PARTITION BY range (a, b);
ERROR:  unique constraint on partitioned table must include all partitioning columns
DETAIL:  PRIMARY KEY constraint on table "p" lacks column "a" which is part of the partition key.
---END---
---START---
CREATE TABLE p1 (gemini_pk serial PRIMARY KEY, b integer, a integer NOT NULL) PARTITION BY range (b);
ERROR:  unique constraint on partitioned table must include all partitioning columns
DETAIL:  PRIMARY KEY constraint on table "p1" lacks column "b" which is part of the partition key.
---END---
---START---
CREATE TABLE p11 (gemini_pk serial PRIMARY KEY, LIKE p1);
ERROR:  relation "p1" does not exist
LINE 1: CREATE TABLE p11 (gemini_pk serial PRIMARY KEY, LIKE p1);
                                                             ^
---END---
---START---
alter table p11 drop a;
ERROR:  relation "p11" does not exist
---END---
---START---
alter table p11 add a int;
ERROR:  relation "p11" does not exist
---END---
---START---
alter table p11 drop a;
ERROR:  relation "p11" does not exist
---END---
---START---
alter table p11 add a int not null;
ERROR:  relation "p11" does not exist
---END---
---START---
-- attnum for key attribute 'a' is different in p, p1, and p11
select attrelid::regclass, attname, attnum
from pg_attribute
where attname = 'a'
 and (attrelid = 'p'::regclass
   or attrelid = 'p1'::regclass
   or attrelid = 'p11'::regclass)
order by attrelid::regclass::text;
ERROR:  relation "p" does not exist
LINE 4:  and (attrelid = 'p'::regclass
                         ^
---END---
---START---
alter table p1 attach partition p11 for values from (2) to (5);
ERROR:  relation "p1" does not exist
---END---
---START---
insert into p1 (a, b) values (2, 3);
ERROR:  relation "p1" does not exist
LINE 1: insert into p1 (a, b) values (2, 3);
                    ^
---END---
---START---
-- check that partition validation scan correctly detects violating rows
alter table p attach partition p1 for values from (1, 2) to (1, 10);
ERROR:  relation "p" does not exist
---END---
---START---
-- cleanup
drop table p;
ERROR:  table "p" does not exist
---END---
---START---
drop table p1;
ERROR:  table "p1" does not exist
---END---
---START---
CREATE TABLE parted_validate_test (gemini_pk serial PRIMARY KEY, a integer) PARTITION BY list (a);
ERROR:  unique constraint on partitioned table must include all partitioning columns
DETAIL:  PRIMARY KEY constraint on table "parted_validate_test" lacks column "a" which is part of the partition key.
---END---
---START---
create table parted_validate_test_1 partition of parted_validate_test for values in (0, 1);
ERROR:  relation "parted_validate_test" does not exist
---END---
---START---
alter table parted_validate_test add constraint parted_validate_test_chka check (a > 0) not valid;
ERROR:  relation "parted_validate_test" does not exist
---END---
---START---
alter table parted_validate_test validate constraint parted_validate_test_chka;
ERROR:  relation "parted_validate_test" does not exist
---END---
---START---
drop table parted_validate_test;
ERROR:  table "parted_validate_test" does not exist
---END---
---START---
CREATE TABLE attmp (gemini_pk serial PRIMARY KEY, i integer);
---END---
---START---
INSERT INTO attmp VALUES (1);
---END---
---START---
ALTER TABLE attmp ALTER COLUMN i SET (n_distinct = 1, n_distinct_inherited = 2);
---END---
---START---
ALTER TABLE attmp ALTER COLUMN i RESET (n_distinct_inherited);
---END---
---START---
ANALYZE attmp;
---END---
---START---
DROP TABLE attmp;
---END---
---START---
DROP USER regress_alter_table_user1;
---END---
---START---
CREATE TABLE defpart_attach_test (gemini_pk serial PRIMARY KEY, a integer) PARTITION BY list (a);
ERROR:  unique constraint on partitioned table must include all partitioning columns
DETAIL:  PRIMARY KEY constraint on table "defpart_attach_test" lacks column "a" which is part of the partition key.
---END---
---START---
create table defpart_attach_test1 partition of defpart_attach_test for values in (1);
ERROR:  relation "defpart_attach_test" does not exist
---END---
---START---
CREATE TABLE defpart_attach_test_d (gemini_pk serial PRIMARY KEY, b integer, a integer);
---END---
---START---
alter table defpart_attach_test_d drop b;
---END---
---START---
insert into defpart_attach_test_d values (1), (2);
---END---
---START---
-- error because its constraint as the default partition would be violated
-- by the row containing 1
alter table defpart_attach_test attach partition defpart_attach_test_d default;
ERROR:  relation "defpart_attach_test" does not exist
---END---
---START---
delete from defpart_attach_test_d where a = 1;
---END---
---START---
alter table defpart_attach_test_d add check (a > 1);
---END---
---START---
-- should be attached successfully and without needing to be scanned
alter table defpart_attach_test attach partition defpart_attach_test_d default;
ERROR:  relation "defpart_attach_test" does not exist
---END---
---START---
CREATE TABLE defpart_attach_test_2 (gemini_pk serial PRIMARY KEY, LIKE defpart_attach_test_d);
ERROR:  column "gemini_pk" specified more than once
---END---
---START---
alter table defpart_attach_test attach partition defpart_attach_test_2 for values in (2);
ERROR:  relation "defpart_attach_test" does not exist
---END---
---START---
drop table defpart_attach_test;
ERROR:  table "defpart_attach_test" does not exist
---END---
---START---
CREATE TABLE perm_part_parent (gemini_pk serial PRIMARY KEY, a integer) PARTITION BY list (a);
ERROR:  unique constraint on partitioned table must include all partitioning columns
DETAIL:  PRIMARY KEY constraint on table "perm_part_parent" lacks column "a" which is part of the partition key.
---END---
---START---
DROP TABLE IF EXISTS temp_part_parent;
NOTICE:  table "temp_part_parent" does not exist, skipping
CREATE TABLE temp_part_parent (gemini_pk serial PRIMARY KEY, a integer) PARTITION BY list (a);
ERROR:  unique constraint on partitioned table must include all partitioning columns
DETAIL:  PRIMARY KEY constraint on table "temp_part_parent" lacks column "a" which is part of the partition key.
---END---
---START---
CREATE TABLE perm_part_child (gemini_pk serial PRIMARY KEY, a integer);
---END---
---START---
DROP TABLE IF EXISTS temp_part_child;
NOTICE:  table "temp_part_child" does not exist, skipping
CREATE TABLE temp_part_child (gemini_pk serial PRIMARY KEY, a integer);
---END---
---START---
alter table temp_part_parent attach partition perm_part_child default;
ERROR:  relation "temp_part_parent" does not exist
---END---
---START---
-- error
alter table perm_part_parent attach partition temp_part_child default;
ERROR:  relation "perm_part_parent" does not exist
---END---
---START---
-- error
alter table temp_part_parent attach partition temp_part_child default;
ERROR:  relation "temp_part_parent" does not exist
---END---
---START---
-- ok
drop table perm_part_parent cascade;
ERROR:  table "perm_part_parent" does not exist
---END---
---START---
drop table temp_part_parent cascade;
ERROR:  table "temp_part_parent" does not exist
---END---
---START---
CREATE TABLE tab_part_attach (gemini_pk serial PRIMARY KEY, a integer) PARTITION BY list (a);
ERROR:  unique constraint on partitioned table must include all partitioning columns
DETAIL:  PRIMARY KEY constraint on table "tab_part_attach" lacks column "a" which is part of the partition key.
---END---
---START---
create or replace function func_part_attach() returns trigger
  language plpgsql as $$
  begin
    execute 'create table tab_part_attach_1 (a int)';
    execute 'alter table tab_part_attach attach partition tab_part_attach_1 for values in (1)';
    return null;
  end $$;
---END---
---START---
create trigger trig_part_attach before insert on tab_part_attach
  for each statement execute procedure func_part_attach();
ERROR:  relation "tab_part_attach" does not exist
---END---
---START---
insert into tab_part_attach values (1);
ERROR:  relation "tab_part_attach" does not exist
LINE 1: insert into tab_part_attach values (1);
                    ^
---END---
---START---
drop table tab_part_attach;
ERROR:  table "tab_part_attach" does not exist
---END---
---START---
drop function func_part_attach();
---END---
---START---
-- test case where the partitioning operator is a SQL function whose
-- evaluation results in the table's relcache being rebuilt partway through
-- the execution of an ATTACH PARTITION command
create function at_test_sql_partop (int4, int4) returns int language sql
as $$ select case when $1 = $2 then 0 when $1 > $2 then 1 else -1 end; $$;
---END---
---START---
create operator class at_test_sql_partop for type int4 using btree as
    operator 1 < (int4, int4), operator 2 <= (int4, int4),
    operator 3 = (int4, int4), operator 4 >= (int4, int4),
    operator 5 > (int4, int4), function 1 at_test_sql_partop(int4, int4);
---END---
---START---
CREATE TABLE at_test_sql_partop (gemini_pk serial PRIMARY KEY, a integer) PARTITION BY range (a at_test_sql_partop);
ERROR:  unique constraint on partitioned table must include all partitioning columns
DETAIL:  PRIMARY KEY constraint on table "at_test_sql_partop" lacks column "a" which is part of the partition key.
---END---
---START---
CREATE TABLE at_test_sql_partop_1 (gemini_pk serial PRIMARY KEY, a integer);
---END---
---START---
alter table at_test_sql_partop attach partition at_test_sql_partop_1 for values from (0) to (10);
ERROR:  relation "at_test_sql_partop" does not exist
---END---
---START---
drop table at_test_sql_partop;
ERROR:  table "at_test_sql_partop" does not exist
---END---
---START---
drop operator class at_test_sql_partop using btree;
---END---
---START---
drop function at_test_sql_partop;
---END---
---START---
CREATE TABLE bar1 (gemini_pk serial PRIMARY KEY, a integer, b integer NOT NULL DEFAULT 1) PARTITION BY range (a);
ERROR:  unique constraint on partitioned table must include all partitioning columns
DETAIL:  PRIMARY KEY constraint on table "bar1" lacks column "a" which is part of the partition key.
---END---
---START---
CREATE TABLE bar2 (gemini_pk serial PRIMARY KEY, a integer);
---END---
---START---
insert into bar2 values (1);
---END---
---START---
alter table bar2 add column b integer not null default 1;
---END---
---START---
-- (at this point bar2 contains tuple with natts=1)
alter table bar1 attach partition bar2 default;
ERROR:  relation "bar1" does not exist
---END---
---START---
-- this works:
select * from bar1;
ERROR:  relation "bar1" does not exist
LINE 1: select * from bar1;
                      ^
---END---
---START---
-- this exercises tuple conversion:
create function xtrig()
  returns trigger language plpgsql
as $$
  declare
    r record;
  begin
    for r in select * from old loop
      raise info 'a=%, b=%', r.a, r.b;
    end loop;
    return NULL;
  end;
$$;
---END---
---START---
create trigger xtrig
  after update on bar1
  referencing old table as old
  for each statement execute procedure xtrig();
ERROR:  relation "bar1" does not exist
---END---
---START---
update bar1 set a = a + 1;
ERROR:  relation "bar1" does not exist
LINE 1: update bar1 set a = a + 1;
               ^
---END---
---START---
/* End test case for bug #16242 */
/* Test case for bug #17409 */
create table attbl (p1 int constraint pk_attbl primary key);
---END---
---START---
CREATE TABLE atref (gemini_pk serial PRIMARY KEY, c1 integer REFERENCES attbl (p1));
---END---
---START---
cluster attbl using pk_attbl;
---END---
---START---
alter table attbl alter column p1 set data type bigint;
---END---
---START---
alter table atref alter column c1 set data type bigint;
---END---
---START---
drop table attbl, atref;
---END---
---START---
create table attbl (p1 int constraint pk_attbl primary key);
---END---
---START---
alter table attbl replica identity using index pk_attbl;
---END---
---START---
CREATE TABLE atref (gemini_pk serial PRIMARY KEY, c1 integer REFERENCES attbl (p1));
---END---
---START---
alter table attbl alter column p1 set data type bigint;
---END---
---START---
alter table atref alter column c1 set data type bigint;
---END---
---START---
drop table attbl, atref;
---END---
---START---
CREATE TABLE alttype_cluster (gemini_pk serial PRIMARY KEY, a integer);
---END---
---START---
alter table alttype_cluster add primary key (a);
ERROR:  multiple primary keys for table "alttype_cluster" are not allowed
---END---
---START---
create index alttype_cluster_ind on alttype_cluster (a);
---END---
---START---
alter table alttype_cluster cluster on alttype_cluster_ind;
---END---
---START---
-- Normal index remains clustered.
select indexrelid::regclass, indisclustered from pg_index
  where indrelid = 'alttype_cluster'::regclass
  order by indexrelid::regclass::text;
      indexrelid      | indisclustered 
----------------------+----------------
 alttype_cluster_ind  | t
 alttype_cluster_pkey | f
(2 rows)

---END---
---START---
alter table alttype_cluster alter a type bigint;
---END---
---START---
select indexrelid::regclass, indisclustered from pg_index
  where indrelid = 'alttype_cluster'::regclass
  order by indexrelid::regclass::text;
      indexrelid      | indisclustered 
----------------------+----------------
 alttype_cluster_ind  | t
 alttype_cluster_pkey | f
(2 rows)

---END---
---START---
-- Constraint index remains clustered.
alter table alttype_cluster cluster on alttype_cluster_pkey;
---END---
---START---
select indexrelid::regclass, indisclustered from pg_index
  where indrelid = 'alttype_cluster'::regclass
  order by indexrelid::regclass::text;
      indexrelid      | indisclustered 
----------------------+----------------
 alttype_cluster_ind  | f
 alttype_cluster_pkey | t
(2 rows)

---END---
---START---
alter table alttype_cluster alter a type int;
---END---
---START---
select indexrelid::regclass, indisclustered from pg_index
  where indrelid = 'alttype_cluster'::regclass
  order by indexrelid::regclass::text;
      indexrelid      | indisclustered 
----------------------+----------------
 alttype_cluster_ind  | f
 alttype_cluster_pkey | t
(2 rows)

---END---
---START---
drop table alttype_cluster;
---END---
---START---
CREATE TABLE target_parted (gemini_pk serial PRIMARY KEY, a integer, b integer) PARTITION BY list (a);
ERROR:  unique constraint on partitioned table must include all partitioning columns
DETAIL:  PRIMARY KEY constraint on table "target_parted" lacks column "a" which is part of the partition key.
---END---
---START---
CREATE TABLE attach_parted (gemini_pk serial PRIMARY KEY, a integer, b integer) PARTITION BY list (b);
ERROR:  unique constraint on partitioned table must include all partitioning columns
DETAIL:  PRIMARY KEY constraint on table "attach_parted" lacks column "b" which is part of the partition key.
---END---
---START---
create table attach_parted_part1 partition of attach_parted for values in (1);
ERROR:  relation "attach_parted" does not exist
---END---
---START---
-- insert a row directly into the leaf partition so that its partition
-- constraint is built and stored in the relcache
insert into attach_parted_part1 values (1, 1);
ERROR:  relation "attach_parted_part1" does not exist
LINE 1: insert into attach_parted_part1 values (1, 1);
                    ^
---END---
---START---
-- the following better invalidate the partition constraint of the leaf
-- partition too...
alter table target_parted attach partition attach_parted for values in (1);
ERROR:  relation "target_parted" does not exist
---END---
---START---
-- ...such that the following insert fails
insert into attach_parted_part1 values (2, 1);
ERROR:  relation "attach_parted_part1" does not exist
LINE 1: insert into attach_parted_part1 values (2, 1);
                    ^
---END---
---START---
-- ...and doesn't when the partition is detached along with its own partition
alter table target_parted detach partition attach_parted;
ERROR:  relation "target_parted" does not exist
---END---
---START---
insert into attach_parted_part1 values (2, 1);
ERROR:  relation "attach_parted_part1" does not exist
LINE 1: insert into attach_parted_part1 values (2, 1);
                    ^
---END---
---START---
-- Test altering table having publication
create schema alter1;
---END---
---START---
create schema alter2;
---END---
---START---
CREATE TABLE alter1.t1 (gemini_pk serial PRIMARY KEY, a integer);
---END---
---START---
set client_min_messages = 'ERROR';
---END---
---START---
create publication pub1 for table alter1.t1, tables in schema alter2;
---END---
---START---
reset client_min_messages;
---END---
---START---
alter table alter1.t1 set schema alter2;
---END---
---START---
\d+ alter2.t1
                                                        Table "alter2.t1"
  Column   |  Type   | Collation | Nullable |                   Default                    | Storage | Stats target | Description 
-----------+---------+-----------+----------+----------------------------------------------+---------+--------------+-------------
 gemini_pk | integer |           | not null | nextval('alter2.t1_gemini_pk_seq'::regclass) | plain   |              | 
 a         | integer |           |          |                                              | plain   |              | 
Indexes:
    "t1_pkey" PRIMARY KEY, btree (gemini_pk)
Publications:
    "pub1"

drop publication pub1;
---END---
---START---
drop schema alter1 cascade;
---END---
---START---
drop schema alter2 cascade;
NOTICE:  drop cascades to table alter2.t1
---END---
