---START---
--
-- ARRAYS
--
-- directory paths are passed to us in environment variables
\getenv abs_srcdir PG_ABS_SRCDIR
CREATE TABLE arrtest (
	a 			int8[],
	b 			int8[][][],
	c 			text[],
	d			text[][],
	e 			float8[],
	f			varchar(5)[],
	g			varchar(5)[]
);
---END---
---START---
CREATE TABLE array_op_test (gemini_pk serial PRIMARY KEY, seqno int8, i int8[], t text[]);
---END---
---START---
\set filename :abs_srcdir '/data/array.data'
COPY array_op_test FROM :'filename';
ERROR:  invalid input syntax for type bigint: "{92,75,71,52,64,83}"
CONTEXT:  COPY array_op_test, line 1, column seqno: "{92,75,71,52,64,83}"
---END---
---START---
ANALYZE array_op_test;
---END---
---START---
--
-- only the 'e' array is 0-based, the others are 1-based.
--
INSERT INTO arrtest (a[1:5], b[1:1][1:2][1:2], c, d, f, g)
   VALUES ('{1,2,3,4,5}', '{{{0,0},{1,2}}}', '{}', '{}', '{}', '{}');
---END---
---START---
UPDATE arrtest SET e[0] = '1.1';
---END---
---START---
UPDATE arrtest SET e[1] = '2.2';
---END---
---START---
INSERT INTO arrtest (f)
   VALUES ('{"too long"}');
ERROR:  value too long for type character varying(5)
---END---
---START---
INSERT INTO arrtest (a, b[1:2][1:2], c, d, e, f, g)
   VALUES ('{11,12,23}', '{{3,4},{4,5}}', '{"foobar"}',
           '{{"elt1", "elt2"}}', '{"3.4", "6.7"}',
           '{"abc","abcde"}', '{"abc","abcde"}');
---END---
---START---
INSERT INTO arrtest (a, b[1:2], c, d[1:2])
   VALUES ('{}', '{3,4}', '{foo,bar}', '{bar,foo}');
---END---
---START---
INSERT INTO arrtest (b[2]) VALUES(now());
ERROR:  subscripted assignment to "b" requires type bigint but expression is of type timestamp with time zone
LINE 1: INSERT INTO arrtest (b[2]) VALUES(now());
                             ^
HINT:  You will need to rewrite or cast the expression.
---END---
---START---
-- error, type mismatch
INSERT INTO arrtest (b[1:2]) VALUES(now());
ERROR:  subscripted assignment to "b" requires type bigint[] but expression is of type timestamp with time zone
LINE 1: INSERT INTO arrtest (b[1:2]) VALUES(now());
                             ^
HINT:  You will need to rewrite or cast the expression.
---END---
---START---
-- error, type mismatch
SELECT * FROM arrtest;
      a      |        b        |     c     |       d       |        e        |      f      |      g      
-------------+-----------------+-----------+---------------+-----------------+-------------+-------------
 {1,2,3,4,5} | {{{0,0},{1,2}}} | {}        | {}            | [0:1]={1.1,2.2} | {}          | {}
 {11,12,23}  | {{3,4},{4,5}}   | {foobar}  | {{elt1,elt2}} | {3.4,6.7}       | {abc,abcde} | {abc,abcde}
 {}          | {3,4}           | {foo,bar} | {bar,foo}     |                 |             | 
(3 rows)

---END---
---START---
SELECT arrtest.a[1],
          arrtest.b[1][1][1],
          arrtest.c[1],
          arrtest.d[1][1],
          arrtest.e[0]
   FROM arrtest;
 a  | b |   c    |  d   |  e  
----+---+--------+------+-----
  1 | 0 |        |      | 1.1
 11 |   | foobar | elt1 |    
    |   | foo    |      |    
(3 rows)

---END---
---START---
SELECT a[1], b[1][1][1], c[1], d[1][1], e[0]
   FROM arrtest;
 a  | b |   c    |  d   |  e  
----+---+--------+------+-----
  1 | 0 |        |      | 1.1
 11 |   | foobar | elt1 |    
    |   | foo    |      |    
(3 rows)

---END---
---START---
SELECT a[1:3],
          b[1:1][1:2][1:2],
          c[1:2],
          d[1:1][1:2]
   FROM arrtest;
     a      |        b        |     c     |       d       
------------+-----------------+-----------+---------------
 {1,2,3}    | {{{0,0},{1,2}}} | {}        | {}
 {11,12,23} | {}              | {foobar}  | {{elt1,elt2}}
 {}         | {}              | {foo,bar} | {}
(3 rows)

---END---
---START---
SELECT array_ndims(a) AS a,array_ndims(b) AS b,array_ndims(c) AS c
   FROM arrtest;
 a | b | c 
---+---+---
 1 | 3 |  
 1 | 2 | 1
   | 1 | 1
(3 rows)

---END---
---START---
SELECT array_dims(a) AS a,array_dims(b) AS b,array_dims(c) AS c
   FROM arrtest;
   a   |        b        |   c   
-------+-----------------+-------
 [1:5] | [1:1][1:2][1:2] | 
 [1:3] | [1:2][1:2]      | [1:1]
       | [1:2]           | [1:2]
(3 rows)

---END---
---START---
-- returns nothing
SELECT *
   FROM arrtest
   WHERE a[1] < 5 and
         c = '{"foobar"}'::_name;
ERROR:  operator does not exist: text[] = name[]
LINE 4:          c = '{"foobar"}'::_name;
                   ^
HINT:  No operator matches the given name and argument types. You might need to add explicit type casts.
---END---
---START---
UPDATE arrtest
  SET a[1:2] = '{16,25}'
  WHERE NOT a = '{}'::_int2;
ERROR:  operator does not exist: bigint[] = smallint[]
LINE 3:   WHERE NOT a = '{}'::_int2;
                      ^
HINT:  No operator matches the given name and argument types. You might need to add explicit type casts.
---END---
---START---
UPDATE arrtest
  SET b[1:1][1:1][1:2] = '{113, 117}',
      b[1:1][1:2][2:2] = '{142, 147}'
  WHERE array_dims(b) = '[1:1][1:2][1:2]';
---END---
---START---
UPDATE arrtest
  SET c[2:2] = '{"new_word"}'
  WHERE array_dims(c) is not null;
---END---
---START---
SELECT a,b,c FROM arrtest;
      a      |           b           |         c         
-------------+-----------------------+-------------------
 {1,2,3,4,5} | {{{113,142},{1,147}}} | {}
 {11,12,23}  | {{3,4},{4,5}}         | {foobar,new_word}
 {}          | {3,4}                 | {foo,new_word}
(3 rows)

---END---
---START---
SELECT a[1:3],
          b[1:1][1:2][1:2],
          c[1:2],
          d[1:1][2:2]
   FROM arrtest;
     a      |           b           |         c         |    d     
------------+-----------------------+-------------------+----------
 {1,2,3}    | {{{113,142},{1,147}}} | {}                | {}
 {11,12,23} | {}                    | {foobar,new_word} | {{elt2}}
 {}         | {}                    | {foo,new_word}    | {}
(3 rows)

---END---
---START---
SELECT b[1:1][2][2],
       d[1:1][2]
   FROM arrtest;
           b           |       d       
-----------------------+---------------
 {{{113,142},{1,147}}} | {}
 {}                    | {{elt1,elt2}}
 {}                    | {}
(3 rows)

---END---
---START---
INSERT INTO arrtest(a) VALUES('{1,null,3}');
---END---
---START---
SELECT a FROM arrtest;
      a      
-------------
 {1,2,3,4,5}
 {11,12,23}
 {}
 {1,NULL,3}
(4 rows)

---END---
---START---
UPDATE arrtest SET a[4] = NULL WHERE a[2] IS NULL;
---END---
---START---
SELECT a FROM arrtest WHERE a[2] IS NULL;
        a        
-----------------
 [4:4]={NULL}
 {1,NULL,3,NULL}
(2 rows)

---END---
---START---
DELETE FROM arrtest WHERE a[2] IS NULL AND b IS NULL;
---END---
---START---
SELECT a,b,c FROM arrtest;
      a       |           b           |         c         
--------------+-----------------------+-------------------
 {1,2,3,4,5}  | {{{113,142},{1,147}}} | {}
 {11,12,23}   | {{3,4},{4,5}}         | {foobar,new_word}
 [4:4]={NULL} | {3,4}                 | {foo,new_word}
(3 rows)

---END---
---START---
-- test non-error-throwing API
SELECT pg_input_is_valid('{1,2,3}', 'integer[]');
 pg_input_is_valid 
-------------------
 t
(1 row)

---END---
---START---
SELECT pg_input_is_valid('{1,2', 'integer[]');
 pg_input_is_valid 
-------------------
 f
(1 row)

---END---
---START---
SELECT pg_input_is_valid('{1,zed}', 'integer[]');
 pg_input_is_valid 
-------------------
 f
(1 row)

---END---
---START---
SELECT * FROM pg_input_error_info('{1,zed}', 'integer[]');
                   message                    | detail | hint | sql_error_code 
----------------------------------------------+--------+------+----------------
 invalid input syntax for type integer: "zed" |        |      | 22P02
(1 row)

---END---
---START---
-- test mixed slice/scalar subscripting
select '{{1,2,3},{4,5,6},{7,8,9}}'::int[];
           int4            
---------------------------
 {{1,2,3},{4,5,6},{7,8,9}}
(1 row)

---END---
---START---
select ('{{1,2,3},{4,5,6},{7,8,9}}'::int[])[1:2][2];
     int4      
---------------
 {{1,2},{4,5}}
(1 row)

---END---
---START---
select '[0:2][0:2]={{1,2,3},{4,5,6},{7,8,9}}'::int[];
                 int4                 
--------------------------------------
 [0:2][0:2]={{1,2,3},{4,5,6},{7,8,9}}
(1 row)

---END---
---START---
select ('[0:2][0:2]={{1,2,3},{4,5,6},{7,8,9}}'::int[])[1:2][2];
     int4      
---------------
 {{5,6},{8,9}}
(1 row)

---END---
---START---
--
-- check subscription corner cases
--
-- More subscripts than MAXDIM (6)
SELECT ('{}'::int[])[1][2][3][4][5][6][7];
ERROR:  number of array dimensions (7) exceeds the maximum allowed (6)
---END---
---START---
-- NULL index yields NULL when selecting
SELECT ('{{{1},{2},{3}},{{4},{5},{6}}}'::int[])[1][NULL][1];
 int4 
------
     
(1 row)

---END---
---START---
SELECT ('{{{1},{2},{3}},{{4},{5},{6}}}'::int[])[1][NULL:1][1];
 int4 
------
 
(1 row)

---END---
---START---
SELECT ('{{{1},{2},{3}},{{4},{5},{6}}}'::int[])[1][1:NULL][1];
 int4 
------
 
(1 row)

---END---
---START---
-- NULL index in assignment is an error
UPDATE arrtest
  SET c[NULL] = '{"can''t assign"}'
  WHERE array_dims(c) is not null;
ERROR:  array subscript in assignment must not be null
---END---
---START---
UPDATE arrtest
  SET c[NULL:1] = '{"can''t assign"}'
  WHERE array_dims(c) is not null;
ERROR:  array subscript in assignment must not be null
---END---
---START---
UPDATE arrtest
  SET c[1:NULL] = '{"can''t assign"}'
  WHERE array_dims(c) is not null;
ERROR:  array subscript in assignment must not be null
---END---
---START---
-- Un-subscriptable type
SELECT (now())[1];
ERROR:  cannot subscript type timestamp with time zone because it does not support subscripting
LINE 1: SELECT (now())[1];
                ^
---END---
---START---
-- test slices with empty lower and/or upper index
DROP TABLE IF EXISTS arrtest_s;
NOTICE:  table "arrtest_s" does not exist, skipping
CREATE TABLE arrtest_s (gemini_pk serial PRIMARY KEY, a int8[], b int8[][]);
---END---
---START---
INSERT INTO arrtest_s VALUES ('{1,2,3,4,5}', '{{1,2,3}, {4,5,6}, {7,8,9}}');
ERROR:  invalid input syntax for type integer: "{1,2,3,4,5}"
LINE 1: INSERT INTO arrtest_s VALUES ('{1,2,3,4,5}', '{{1,2,3}, {4,5...
                                      ^
---END---
---START---
INSERT INTO arrtest_s VALUES ('[0:4]={1,2,3,4,5}', '[0:2][0:2]={{1,2,3}, {4,5,6}, {7,8,9}}');
ERROR:  invalid input syntax for type integer: "[0:4]={1,2,3,4,5}"
LINE 1: INSERT INTO arrtest_s VALUES ('[0:4]={1,2,3,4,5}', '[0:2][0:...
                                      ^
---END---
---START---
SELECT * FROM arrtest_s;
 gemini_pk | a | b 
-----------+---+---
(0 rows)

---END---
---START---
SELECT a[:3], b[:2][:2] FROM arrtest_s;
 a | b 
---+---
(0 rows)

---END---
---START---
SELECT a[2:], b[2:][2:] FROM arrtest_s;
 a | b 
---+---
(0 rows)

---END---
---START---
SELECT a[:], b[:] FROM arrtest_s;
 a | b 
---+---
(0 rows)

---END---
---START---
-- updates
UPDATE arrtest_s SET a[:3] = '{11, 12, 13}', b[:2][:2] = '{{11,12}, {14,15}}'
  WHERE array_lower(a,1) = 1;
---END---
---START---
SELECT * FROM arrtest_s;
 gemini_pk | a | b 
-----------+---+---
(0 rows)

---END---
---START---
UPDATE arrtest_s SET a[3:] = '{23, 24, 25}', b[2:][2:] = '{{25,26}, {28,29}}';
---END---
---START---
SELECT * FROM arrtest_s;
 gemini_pk | a | b 
-----------+---+---
(0 rows)

---END---
---START---
UPDATE arrtest_s SET a[:] = '{11, 12, 13, 14, 15}';
---END---
---START---
SELECT * FROM arrtest_s;
 gemini_pk | a | b 
-----------+---+---
(0 rows)

---END---
---START---
UPDATE arrtest_s SET a[:] = '{23, 24, 25}';
---END---
---START---
-- fail, too small
INSERT INTO arrtest_s VALUES(NULL, NULL);
ERROR:  null value in column "gemini_pk" of relation "arrtest_s" violates not-null constraint
DETAIL:  Failing row contains (null, null, null).
---END---
---START---
UPDATE arrtest_s SET a[:] = '{11, 12, 13, 14, 15}';
---END---
---START---
-- fail, no good with null
-- we want to work with a point_tbl that includes a null
DROP TABLE IF EXISTS point_tbl;
CREATE TABLE point_tbl AS SELECT * FROM public.point_tbl;
ERROR:  relation "public.point_tbl" does not exist
LINE 1: CREATE TABLE point_tbl AS SELECT * FROM public.point_tbl;
                                                ^
---END---
---START---
INSERT INTO POINT_TBL(f1) VALUES (NULL);
ERROR:  relation "point_tbl" does not exist
LINE 1: INSERT INTO POINT_TBL(f1) VALUES (NULL);
                    ^
---END---
---START---
-- check with fixed-length-array type, such as point
SELECT f1[0:1] FROM POINT_TBL;
ERROR:  relation "point_tbl" does not exist
LINE 1: SELECT f1[0:1] FROM POINT_TBL;
                            ^
---END---
---START---
SELECT f1[0:] FROM POINT_TBL;
ERROR:  relation "point_tbl" does not exist
LINE 1: SELECT f1[0:] FROM POINT_TBL;
                           ^
---END---
---START---
SELECT f1[:1] FROM POINT_TBL;
ERROR:  relation "point_tbl" does not exist
LINE 1: SELECT f1[:1] FROM POINT_TBL;
                           ^
---END---
---START---
SELECT f1[:] FROM POINT_TBL;
ERROR:  relation "point_tbl" does not exist
LINE 1: SELECT f1[:] FROM POINT_TBL;
                          ^
---END---
---START---
-- subscript assignments to fixed-width result in NULL if previous value is NULL
UPDATE point_tbl SET f1[0] = 10 WHERE f1 IS NULL RETURNING *;
ERROR:  relation "point_tbl" does not exist
LINE 1: UPDATE point_tbl SET f1[0] = 10 WHERE f1 IS NULL RETURNING *...
               ^
---END---
---START---
INSERT INTO point_tbl(f1[0]) VALUES(0) RETURNING *;
ERROR:  relation "point_tbl" does not exist
LINE 1: INSERT INTO point_tbl(f1[0]) VALUES(0) RETURNING *;
                    ^
---END---
---START---
-- NULL assignments get ignored
UPDATE point_tbl SET f1[0] = NULL WHERE f1::text = '(10,10)'::point::text RETURNING *;
ERROR:  relation "point_tbl" does not exist
LINE 1: UPDATE point_tbl SET f1[0] = NULL WHERE f1::text = '(10,10)'...
               ^
---END---
---START---
-- but non-NULL subscript assignments work
UPDATE point_tbl SET f1[0] = -10, f1[1] = -10 WHERE f1::text = '(10,10)'::point::text RETURNING *;
ERROR:  relation "point_tbl" does not exist
LINE 1: UPDATE point_tbl SET f1[0] = -10, f1[1] = -10 WHERE f1::text...
               ^
---END---
---START---
-- but not to expand the range
UPDATE point_tbl SET f1[3] = 10 WHERE f1::text = '(-10,-10)'::point::text RETURNING *;
ERROR:  relation "point_tbl" does not exist
LINE 1: UPDATE point_tbl SET f1[3] = 10 WHERE f1::text = '(-10,-10)'...
               ^
---END---
---START---
--
-- test array extension
--
DROP TABLE IF EXISTS arrtest1;
NOTICE:  table "arrtest1" does not exist, skipping
CREATE TABLE arrtest1 (gemini_pk serial PRIMARY KEY, i integer[], t text[]);
---END---
---START---
insert into arrtest1 values(array[1,2,null,4], array['one','two',null,'four']);
ERROR:  column "gemini_pk" is of type integer but expression is of type integer[]
LINE 1: insert into arrtest1 values(array[1,2,null,4], array['one','...
                                    ^
HINT:  You will need to rewrite or cast the expression.
---END---
---START---
select * from arrtest1;
 gemini_pk | i | t 
-----------+---+---
(0 rows)

---END---
---START---
update arrtest1 set i[2] = 22, t[2] = 'twenty-two';
---END---
---START---
select * from arrtest1;
 gemini_pk | i | t 
-----------+---+---
(0 rows)

---END---
---START---
update arrtest1 set i[5] = 5, t[5] = 'five';
---END---
---START---
select * from arrtest1;
 gemini_pk | i | t 
-----------+---+---
(0 rows)

---END---
---START---
update arrtest1 set i[8] = 8, t[8] = 'eight';
---END---
---START---
select * from arrtest1;
 gemini_pk | i | t 
-----------+---+---
(0 rows)

---END---
---START---
update arrtest1 set i[0] = 0, t[0] = 'zero';
---END---
---START---
select * from arrtest1;
 gemini_pk | i | t 
-----------+---+---
(0 rows)

---END---
---START---
update arrtest1 set i[-3] = -3, t[-3] = 'minus-three';
---END---
---START---
select * from arrtest1;
 gemini_pk | i | t 
-----------+---+---
(0 rows)

---END---
---START---
update arrtest1 set i[0:2] = array[10,11,12], t[0:2] = array['ten','eleven','twelve'];
---END---
---START---
select * from arrtest1;
 gemini_pk | i | t 
-----------+---+---
(0 rows)

---END---
---START---
update arrtest1 set i[8:10] = array[18,null,20], t[8:10] = array['p18',null,'p20'];
---END---
---START---
select * from arrtest1;
 gemini_pk | i | t 
-----------+---+---
(0 rows)

---END---
---START---
update arrtest1 set i[11:12] = array[null,22], t[11:12] = array[null,'p22'];
---END---
---START---
select * from arrtest1;
 gemini_pk | i | t 
-----------+---+---
(0 rows)

---END---
---START---
update arrtest1 set i[15:16] = array[null,26], t[15:16] = array[null,'p26'];
---END---
---START---
select * from arrtest1;
 gemini_pk | i | t 
-----------+---+---
(0 rows)

---END---
---START---
update arrtest1 set i[-5:-3] = array[-15,-14,-13], t[-5:-3] = array['m15','m14','m13'];
---END---
---START---
select * from arrtest1;
 gemini_pk | i | t 
-----------+---+---
(0 rows)

---END---
---START---
update arrtest1 set i[-7:-6] = array[-17,null], t[-7:-6] = array['m17',null];
---END---
---START---
select * from arrtest1;
 gemini_pk | i | t 
-----------+---+---
(0 rows)

---END---
---START---
update arrtest1 set i[-12:-10] = array[-22,null,-20], t[-12:-10] = array['m22',null,'m20'];
---END---
---START---
select * from arrtest1;
 gemini_pk | i | t 
-----------+---+---
(0 rows)

---END---
---START---
delete from arrtest1;
---END---
---START---
insert into arrtest1 values(array[1,2,null,4], array['one','two',null,'four']);
ERROR:  column "gemini_pk" is of type integer but expression is of type integer[]
LINE 1: insert into arrtest1 values(array[1,2,null,4], array['one','...
                                    ^
HINT:  You will need to rewrite or cast the expression.
---END---
---START---
select * from arrtest1;
 gemini_pk | i | t 
-----------+---+---
(0 rows)

---END---
---START---
update arrtest1 set i[0:5] = array[0,1,2,null,4,5], t[0:5] = array['z','p1','p2',null,'p4','p5'];
---END---
---START---
select * from arrtest1;
 gemini_pk | i | t 
-----------+---+---
(0 rows)

---END---
---START---
--
-- array expressions and operators
--
-- table creation and INSERTs
DROP TABLE IF EXISTS arrtest2;
NOTICE:  table "arrtest2" does not exist, skipping
CREATE TABLE arrtest2 (gemini_pk serial PRIMARY KEY, i integer[4], f float8[], n numeric[], t text[], d timestamp[]);
---END---
---START---
INSERT INTO arrtest2 VALUES(
  ARRAY[[[113,142],[1,147]]],
  ARRAY[1.1,1.2,1.3]::float8[],
  ARRAY[1.1,1.2,1.3],
  ARRAY[[['aaa','aab'],['aba','abb'],['aca','acb']],[['baa','bab'],['bba','bbb'],['bca','bcb']]],
  ARRAY['19620326','19931223','19970117']::timestamp[]
);
ERROR:  column "gemini_pk" is of type integer but expression is of type integer[]
LINE 2:   ARRAY[[[113,142],[1,147]]],
          ^
HINT:  You will need to rewrite or cast the expression.
---END---
---START---
-- some more test data
DROP TABLE IF EXISTS arrtest_f;
NOTICE:  table "arrtest_f" does not exist, skipping
CREATE TABLE arrtest_f (gemini_pk serial PRIMARY KEY, f0 integer, f1 text, f2 float8);
---END---
---START---
insert into arrtest_f values(1,'cat1',1.21);
ERROR:  invalid input syntax for type integer: "cat1"
LINE 1: insert into arrtest_f values(1,'cat1',1.21);
                                       ^
---END---
---START---
insert into arrtest_f values(2,'cat1',1.24);
ERROR:  invalid input syntax for type integer: "cat1"
LINE 1: insert into arrtest_f values(2,'cat1',1.24);
                                       ^
---END---
---START---
insert into arrtest_f values(3,'cat1',1.18);
ERROR:  invalid input syntax for type integer: "cat1"
LINE 1: insert into arrtest_f values(3,'cat1',1.18);
                                       ^
---END---
---START---
insert into arrtest_f values(4,'cat1',1.26);
ERROR:  invalid input syntax for type integer: "cat1"
LINE 1: insert into arrtest_f values(4,'cat1',1.26);
                                       ^
---END---
---START---
insert into arrtest_f values(5,'cat1',1.15);
ERROR:  invalid input syntax for type integer: "cat1"
LINE 1: insert into arrtest_f values(5,'cat1',1.15);
                                       ^
---END---
---START---
insert into arrtest_f values(6,'cat2',1.15);
ERROR:  invalid input syntax for type integer: "cat2"
LINE 1: insert into arrtest_f values(6,'cat2',1.15);
                                       ^
---END---
---START---
insert into arrtest_f values(7,'cat2',1.26);
ERROR:  invalid input syntax for type integer: "cat2"
LINE 1: insert into arrtest_f values(7,'cat2',1.26);
                                       ^
---END---
---START---
insert into arrtest_f values(8,'cat2',1.32);
ERROR:  invalid input syntax for type integer: "cat2"
LINE 1: insert into arrtest_f values(8,'cat2',1.32);
                                       ^
---END---
---START---
insert into arrtest_f values(9,'cat2',1.30);
ERROR:  invalid input syntax for type integer: "cat2"
LINE 1: insert into arrtest_f values(9,'cat2',1.30);
                                       ^
---END---
---START---
DROP TABLE IF EXISTS arrtest_i;
NOTICE:  table "arrtest_i" does not exist, skipping
CREATE TABLE arrtest_i (gemini_pk serial PRIMARY KEY, f0 integer, f1 text, f2 integer);
---END---
---START---
insert into arrtest_i values(1,'cat1',21);
ERROR:  invalid input syntax for type integer: "cat1"
LINE 1: insert into arrtest_i values(1,'cat1',21);
                                       ^
---END---
---START---
insert into arrtest_i values(2,'cat1',24);
ERROR:  invalid input syntax for type integer: "cat1"
LINE 1: insert into arrtest_i values(2,'cat1',24);
                                       ^
---END---
---START---
insert into arrtest_i values(3,'cat1',18);
ERROR:  invalid input syntax for type integer: "cat1"
LINE 1: insert into arrtest_i values(3,'cat1',18);
                                       ^
---END---
---START---
insert into arrtest_i values(4,'cat1',26);
ERROR:  invalid input syntax for type integer: "cat1"
LINE 1: insert into arrtest_i values(4,'cat1',26);
                                       ^
---END---
---START---
insert into arrtest_i values(5,'cat1',15);
ERROR:  invalid input syntax for type integer: "cat1"
LINE 1: insert into arrtest_i values(5,'cat1',15);
                                       ^
---END---
---START---
insert into arrtest_i values(6,'cat2',15);
ERROR:  invalid input syntax for type integer: "cat2"
LINE 1: insert into arrtest_i values(6,'cat2',15);
                                       ^
---END---
---START---
insert into arrtest_i values(7,'cat2',26);
ERROR:  invalid input syntax for type integer: "cat2"
LINE 1: insert into arrtest_i values(7,'cat2',26);
                                       ^
---END---
---START---
insert into arrtest_i values(8,'cat2',32);
ERROR:  invalid input syntax for type integer: "cat2"
LINE 1: insert into arrtest_i values(8,'cat2',32);
                                       ^
---END---
---START---
insert into arrtest_i values(9,'cat2',30);
ERROR:  invalid input syntax for type integer: "cat2"
LINE 1: insert into arrtest_i values(9,'cat2',30);
                                       ^
---END---
---START---
-- expressions
SELECT t.f[1][3][1] AS "131", t.f[2][2][1] AS "221" FROM (
  SELECT ARRAY[[[111,112],[121,122],[131,132]],[[211,212],[221,122],[231,232]]] AS f
) AS t;
 131 | 221 
-----+-----
 131 | 221
(1 row)

---END---
---START---
SELECT ARRAY[[[[[['hello'],['world']]]]]];
           array           
---------------------------
 {{{{{{hello},{world}}}}}}
(1 row)

---END---
---START---
SELECT ARRAY[ARRAY['hello'],ARRAY['world']];
       array       
-------------------
 {{hello},{world}}
(1 row)

---END---
---START---
SELECT ARRAY(select f2 from arrtest_f order by f2) AS "ARRAY";
 ARRAY 
-------
 {}
(1 row)

---END---
---START---
-- with nulls
SELECT '{1,null,3}'::int[];
    int4    
------------
 {1,NULL,3}
(1 row)

---END---
---START---
SELECT ARRAY[1,NULL,3];
   array    
------------
 {1,NULL,3}
(1 row)

---END---
---START---
-- functions
SELECT array_append(array[42], 6) AS "{42,6}";
 {42,6} 
--------
 {42,6}
(1 row)

---END---
---START---
SELECT array_prepend(6, array[42]) AS "{6,42}";
 {6,42} 
--------
 {6,42}
(1 row)

---END---
---START---
SELECT array_cat(ARRAY[1,2], ARRAY[3,4]) AS "{1,2,3,4}";
 {1,2,3,4} 
-----------
 {1,2,3,4}
(1 row)

---END---
---START---
SELECT array_cat(ARRAY[1,2], ARRAY[[3,4],[5,6]]) AS "{{1,2},{3,4},{5,6}}";
 {{1,2},{3,4},{5,6}} 
---------------------
 {{1,2},{3,4},{5,6}}
(1 row)

---END---
---START---
SELECT array_cat(ARRAY[[3,4],[5,6]], ARRAY[1,2]) AS "{{3,4},{5,6},{1,2}}";
 {{3,4},{5,6},{1,2}} 
---------------------
 {{3,4},{5,6},{1,2}}
(1 row)

---END---
---START---
SELECT array_position(ARRAY[1,2,3,4,5], 4);
 array_position 
----------------
              4
(1 row)

---END---
---START---
SELECT array_position(ARRAY[5,3,4,2,1], 4);
 array_position 
----------------
              3
(1 row)

---END---
---START---
SELECT array_position(ARRAY[[1,2],[3,4]], 3);
ERROR:  searching for elements in multidimensional arrays is not supported
---END---
---START---
SELECT array_position(ARRAY['sun','mon','tue','wed','thu','fri','sat'], 'mon');
 array_position 
----------------
              2
(1 row)

---END---
---START---
SELECT array_position(ARRAY['sun','mon','tue','wed','thu','fri','sat'], 'sat');
 array_position 
----------------
              7
(1 row)

---END---
---START---
SELECT array_position(ARRAY['sun','mon','tue','wed','thu','fri','sat'], NULL);
 array_position 
----------------
               
(1 row)

---END---
---START---
SELECT array_position(ARRAY['sun','mon','tue','wed','thu',NULL,'fri','sat'], NULL);
 array_position 
----------------
              6
(1 row)

---END---
---START---
SELECT array_position(ARRAY['sun','mon','tue','wed','thu',NULL,'fri','sat'], 'sat');
 array_position 
----------------
              8
(1 row)

---END---
---START---
SELECT array_positions(NULL, 10);
 array_positions 
-----------------
 
(1 row)

---END---
---START---
SELECT array_positions(NULL, NULL::int);
 array_positions 
-----------------
 
(1 row)

---END---
---START---
SELECT array_positions(ARRAY[1,2,3,4,5,6,1,2,3,4,5,6], 4);
 array_positions 
-----------------
 {4,10}
(1 row)

---END---
---START---
SELECT array_positions(ARRAY[[1,2],[3,4]], 4);
ERROR:  searching for elements in multidimensional arrays is not supported
---END---
---START---
SELECT array_positions(ARRAY[1,2,3,4,5,6,1,2,3,4,5,6], NULL);
 array_positions 
-----------------
 {}
(1 row)

---END---
---START---
SELECT array_positions(ARRAY[1,2,3,NULL,5,6,1,2,3,NULL,5,6], NULL);
 array_positions 
-----------------
 {4,10}
(1 row)

---END---
---START---
SELECT array_length(array_positions(ARRAY(SELECT 'AAAAAAAAAAAAAAAAAAAAAAAAA'::text || i % 10
                                          FROM generate_series(1,100) g(i)),
                                  'AAAAAAAAAAAAAAAAAAAAAAAAA5'), 1);
 array_length 
--------------
           10
(1 row)

---END---
---START---
DO $$
DECLARE
  o int;
  a int[] := ARRAY[1,2,3,2,3,1,2];
BEGIN
  o := array_position(a, 2);
  WHILE o IS NOT NULL
  LOOP
    RAISE NOTICE '%', o;
    o := array_position(a, 2, o + 1);
  END LOOP;
END
$$ LANGUAGE plpgsql;
NOTICE:  2
NOTICE:  4
NOTICE:  7
---END---
---START---
SELECT array_position('[2:4]={1,2,3}'::int[], 1);
 array_position 
----------------
              2
(1 row)

---END---
---START---
SELECT array_positions('[2:4]={1,2,3}'::int[], 1);
 array_positions 
-----------------
 {2}
(1 row)

---END---
---START---
SELECT
    array_position(ids, (1, 1)),
    array_positions(ids, (1, 1))
        FROM
(VALUES
    (ARRAY[(0, 0), (1, 1)]),
    (ARRAY[(1, 1)])
) AS f (ids);
 array_position | array_positions 
----------------+-----------------
              2 | {2}
              1 | {1}
(2 rows)

---END---
---START---
-- operators
SELECT a FROM arrtest WHERE b = ARRAY[[[113,142],[1,147]]];
ERROR:  operator does not exist: bigint[] = integer[]
LINE 1: SELECT a FROM arrtest WHERE b = ARRAY[[[113,142],[1,147]]];
                                      ^
HINT:  No operator matches the given name and argument types. You might need to add explicit type casts.
---END---
---START---
SELECT NOT ARRAY[1.1,1.2,1.3] = ARRAY[1.1,1.2,1.3] AS "FALSE";
 FALSE 
-------
 f
(1 row)

---END---
---START---
SELECT ARRAY[1,2] || 3 AS "{1,2,3}";
 {1,2,3} 
---------
 {1,2,3}
(1 row)

---END---
---START---
SELECT 0 || ARRAY[1,2] AS "{0,1,2}";
 {0,1,2} 
---------
 {0,1,2}
(1 row)

---END---
---START---
SELECT ARRAY[1,2] || ARRAY[3,4] AS "{1,2,3,4}";
 {1,2,3,4} 
-----------
 {1,2,3,4}
(1 row)

---END---
---START---
SELECT ARRAY[[['hello','world']]] || ARRAY[[['happy','birthday']]] AS "ARRAY";
                ARRAY                 
--------------------------------------
 {{{hello,world}},{{happy,birthday}}}
(1 row)

---END---
---START---
SELECT ARRAY[[1,2],[3,4]] || ARRAY[5,6] AS "{{1,2},{3,4},{5,6}}";
 {{1,2},{3,4},{5,6}} 
---------------------
 {{1,2},{3,4},{5,6}}
(1 row)

---END---
---START---
SELECT ARRAY[0,0] || ARRAY[1,1] || ARRAY[2,2] AS "{0,0,1,1,2,2}";
 {0,0,1,1,2,2} 
---------------
 {0,0,1,1,2,2}
(1 row)

---END---
---START---
SELECT 0 || ARRAY[1,2] || 3 AS "{0,1,2,3}";
 {0,1,2,3} 
-----------
 {0,1,2,3}
(1 row)

---END---
---START---
SELECT ARRAY[1.1] || ARRAY[2,3,4];
  ?column?   
-------------
 {1.1,2,3,4}
(1 row)

---END---
---START---
SELECT array_agg(x) || array_agg(x) FROM (VALUES (ROW(1,2)), (ROW(3,4))) v(x);
             ?column?              
-----------------------------------
 {"(1,2)","(3,4)","(1,2)","(3,4)"}
(1 row)

---END---
---START---
SELECT ROW(1,2) || array_agg(x) FROM (VALUES (ROW(3,4)), (ROW(5,6))) v(x);
         ?column?          
---------------------------
 {"(1,2)","(3,4)","(5,6)"}
(1 row)

---END---
---START---
SELECT * FROM array_op_test WHERE i @> '{32}' ORDER BY seqno;
 gemini_pk | seqno | i | t 
-----------+-------+---+---
(0 rows)

---END---
---START---
SELECT * FROM array_op_test WHERE i && '{32}' ORDER BY seqno;
 gemini_pk | seqno | i | t 
-----------+-------+---+---
(0 rows)

---END---
---START---
SELECT * FROM array_op_test WHERE i @> '{17}' ORDER BY seqno;
 gemini_pk | seqno | i | t 
-----------+-------+---+---
(0 rows)

---END---
---START---
SELECT * FROM array_op_test WHERE i && '{17}' ORDER BY seqno;
 gemini_pk | seqno | i | t 
-----------+-------+---+---
(0 rows)

---END---
---START---
SELECT * FROM array_op_test WHERE i @> '{32,17}' ORDER BY seqno;
 gemini_pk | seqno | i | t 
-----------+-------+---+---
(0 rows)

---END---
---START---
SELECT * FROM array_op_test WHERE i && '{32,17}' ORDER BY seqno;
 gemini_pk | seqno | i | t 
-----------+-------+---+---
(0 rows)

---END---
---START---
SELECT * FROM array_op_test WHERE i <@ '{38,34,32,89}' ORDER BY seqno;
 gemini_pk | seqno | i | t 
-----------+-------+---+---
(0 rows)

---END---
---START---
SELECT * FROM array_op_test WHERE i = '{}' ORDER BY seqno;
 gemini_pk | seqno | i | t 
-----------+-------+---+---
(0 rows)

---END---
---START---
SELECT * FROM array_op_test WHERE i @> '{}' ORDER BY seqno;
 gemini_pk | seqno | i | t 
-----------+-------+---+---
(0 rows)

---END---
---START---
SELECT * FROM array_op_test WHERE i && '{}' ORDER BY seqno;
 gemini_pk | seqno | i | t 
-----------+-------+---+---
(0 rows)

---END---
---START---
SELECT * FROM array_op_test WHERE i <@ '{}' ORDER BY seqno;
 gemini_pk | seqno | i | t 
-----------+-------+---+---
(0 rows)

---END---
---START---
SELECT * FROM array_op_test WHERE i = '{NULL}' ORDER BY seqno;
 gemini_pk | seqno | i | t 
-----------+-------+---+---
(0 rows)

---END---
---START---
SELECT * FROM array_op_test WHERE i @> '{NULL}' ORDER BY seqno;
 gemini_pk | seqno | i | t 
-----------+-------+---+---
(0 rows)

---END---
---START---
SELECT * FROM array_op_test WHERE i && '{NULL}' ORDER BY seqno;
 gemini_pk | seqno | i | t 
-----------+-------+---+---
(0 rows)

---END---
---START---
SELECT * FROM array_op_test WHERE i <@ '{NULL}' ORDER BY seqno;
 gemini_pk | seqno | i | t 
-----------+-------+---+---
(0 rows)

---END---
---START---
SELECT * FROM array_op_test WHERE t @> '{AAAAAAAA72908}' ORDER BY seqno;
 gemini_pk | seqno | i | t 
-----------+-------+---+---
(0 rows)

---END---
---START---
SELECT * FROM array_op_test WHERE t && '{AAAAAAAA72908}' ORDER BY seqno;
 gemini_pk | seqno | i | t 
-----------+-------+---+---
(0 rows)

---END---
---START---
SELECT * FROM array_op_test WHERE t @> '{AAAAAAAAAA646}' ORDER BY seqno;
 gemini_pk | seqno | i | t 
-----------+-------+---+---
(0 rows)

---END---
---START---
SELECT * FROM array_op_test WHERE t && '{AAAAAAAAAA646}' ORDER BY seqno;
 gemini_pk | seqno | i | t 
-----------+-------+---+---
(0 rows)

---END---
---START---
SELECT * FROM array_op_test WHERE t @> '{AAAAAAAA72908,AAAAAAAAAA646}' ORDER BY seqno;
 gemini_pk | seqno | i | t 
-----------+-------+---+---
(0 rows)

---END---
---START---
SELECT * FROM array_op_test WHERE t && '{AAAAAAAA72908,AAAAAAAAAA646}' ORDER BY seqno;
 gemini_pk | seqno | i | t 
-----------+-------+---+---
(0 rows)

---END---
---START---
SELECT * FROM array_op_test WHERE t <@ '{AAAAAAAA72908,AAAAAAAAAAAAAAAAAAA17075,AA88409,AAAAAAAAAAAAAAAAAA36842,AAAAAAA48038,AAAAAAAAAAAAAA10611}' ORDER BY seqno;
 gemini_pk | seqno | i | t 
-----------+-------+---+---
(0 rows)

---END---
---START---
SELECT * FROM array_op_test WHERE t = '{}' ORDER BY seqno;
 gemini_pk | seqno | i | t 
-----------+-------+---+---
(0 rows)

---END---
---START---
SELECT * FROM array_op_test WHERE t @> '{}' ORDER BY seqno;
 gemini_pk | seqno | i | t 
-----------+-------+---+---
(0 rows)

---END---
---START---
SELECT * FROM array_op_test WHERE t && '{}' ORDER BY seqno;
 gemini_pk | seqno | i | t 
-----------+-------+---+---
(0 rows)

---END---
---START---
SELECT * FROM array_op_test WHERE t <@ '{}' ORDER BY seqno;
 gemini_pk | seqno | i | t 
-----------+-------+---+---
(0 rows)

---END---
---START---
-- array casts
SELECT ARRAY[1,2,3]::text[]::int[]::float8[] AS "{1,2,3}";
 {1,2,3} 
---------
 {1,2,3}
(1 row)

---END---
---START---
SELECT pg_typeof(ARRAY[1,2,3]::text[]::int[]::float8[]) AS "double precision[]";
 double precision[] 
--------------------
 double precision[]
(1 row)

---END---
---START---
SELECT ARRAY[['a','bc'],['def','hijk']]::text[]::varchar[] AS "{{a,bc},{def,hijk}}";
 {{a,bc},{def,hijk}} 
---------------------
 {{a,bc},{def,hijk}}
(1 row)

---END---
---START---
SELECT pg_typeof(ARRAY[['a','bc'],['def','hijk']]::text[]::varchar[]) AS "character varying[]";
 character varying[] 
---------------------
 character varying[]
(1 row)

---END---
---START---
SELECT CAST(ARRAY[[[[[['a','bb','ccc']]]]]] as text[]) as "{{{{{{a,bb,ccc}}}}}}";
 {{{{{{a,bb,ccc}}}}}} 
----------------------
 {{{{{{a,bb,ccc}}}}}}
(1 row)

---END---
---START---
SELECT NULL::text[]::int[] AS "NULL";
 NULL 
------
 
(1 row)

---END---
---START---
-- scalar op any/all (array)
select 33 = any ('{1,2,3}');
 ?column? 
----------
 f
(1 row)

---END---
---START---
select 33 = any ('{1,2,33}');
 ?column? 
----------
 t
(1 row)

---END---
---START---
select 33 = all ('{1,2,33}');
 ?column? 
----------
 f
(1 row)

---END---
---START---
select 33 >= all ('{1,2,33}');
 ?column? 
----------
 t
(1 row)

---END---
---START---
-- boundary cases
select null::int >= all ('{1,2,33}');
 ?column? 
----------
 
(1 row)

---END---
---START---
select null::int >= all ('{}');
 ?column? 
----------
 t
(1 row)

---END---
---START---
select null::int >= any ('{}');
 ?column? 
----------
 f
(1 row)

---END---
---START---
-- cross-datatype
select 33.4 = any (array[1,2,3]);
 ?column? 
----------
 f
(1 row)

---END---
---START---
select 33.4 > all (array[1,2,3]);
 ?column? 
----------
 t
(1 row)

---END---
---START---
-- errors
select 33 * any ('{1,2,3}');
ERROR:  op ANY/ALL (array) requires operator to yield boolean
LINE 1: select 33 * any ('{1,2,3}');
                  ^
---END---
---START---
select 33 * any (44);
ERROR:  op ANY/ALL (array) requires array on right side
LINE 1: select 33 * any (44);
                  ^
---END---
---START---
-- nulls
select 33 = any (null::int[]);
 ?column? 
----------
 
(1 row)

---END---
---START---
select null::int = any ('{1,2,3}');
 ?column? 
----------
 
(1 row)

---END---
---START---
select 33 = any ('{1,null,3}');
 ?column? 
----------
 
(1 row)

---END---
---START---
select 33 = any ('{1,null,33}');
 ?column? 
----------
 t
(1 row)

---END---
---START---
select 33 = all (null::int[]);
 ?column? 
----------
 
(1 row)

---END---
---START---
select null::int = all ('{1,2,3}');
 ?column? 
----------
 
(1 row)

---END---
---START---
select 33 = all ('{1,null,3}');
 ?column? 
----------
 f
(1 row)

---END---
---START---
select 33 = all ('{33,null,33}');
 ?column? 
----------
 
(1 row)

---END---
---START---
-- nulls later in the bitmap
SELECT -1 != ALL(ARRAY(SELECT NULLIF(g.i, 900) FROM generate_series(1,1000) g(i)));
 ?column? 
----------
 
(1 row)

---END---
---START---
-- test indexes on arrays
DROP TABLE IF EXISTS arr_tbl;
NOTICE:  table "arr_tbl" does not exist, skipping
CREATE TABLE arr_tbl (gemini_pk serial PRIMARY KEY, f1 integer[] UNIQUE);
---END---
---START---
insert into arr_tbl values ('{1,2,3}');
ERROR:  invalid input syntax for type integer: "{1,2,3}"
LINE 1: insert into arr_tbl values ('{1,2,3}');
                                    ^
---END---
---START---
insert into arr_tbl values ('{1,2}');
ERROR:  invalid input syntax for type integer: "{1,2}"
LINE 1: insert into arr_tbl values ('{1,2}');
                                    ^
---END---
---START---
-- failure expected:
insert into arr_tbl values ('{1,2,3}');
ERROR:  invalid input syntax for type integer: "{1,2,3}"
LINE 1: insert into arr_tbl values ('{1,2,3}');
                                    ^
---END---
---START---
insert into arr_tbl values ('{2,3,4}');
ERROR:  invalid input syntax for type integer: "{2,3,4}"
LINE 1: insert into arr_tbl values ('{2,3,4}');
                                    ^
---END---
---START---
insert into arr_tbl values ('{1,5,3}');
ERROR:  invalid input syntax for type integer: "{1,5,3}"
LINE 1: insert into arr_tbl values ('{1,5,3}');
                                    ^
---END---
---START---
insert into arr_tbl values ('{1,2,10}');
ERROR:  invalid input syntax for type integer: "{1,2,10}"
LINE 1: insert into arr_tbl values ('{1,2,10}');
                                    ^
---END---
---START---
set enable_seqscan to off;
---END---
---START---
set enable_bitmapscan to off;
---END---
---START---
select * from arr_tbl where f1 > '{1,2,3}' and f1 <= '{1,5,3}';
 gemini_pk | f1 
-----------+----
(0 rows)

---END---
---START---
select * from arr_tbl where f1 >= '{1,2,3}' and f1 < '{1,5,3}';
 gemini_pk | f1 
-----------+----
(0 rows)

---END---
---START---
-- test ON CONFLICT DO UPDATE with arrays
DROP TABLE IF EXISTS arr_pk_tbl;
NOTICE:  table "arr_pk_tbl" does not exist, skipping
create table arr_pk_tbl (pk int4 primary key, f1 int[]);
---END---
---START---
insert into arr_pk_tbl values (1, '{1,2,3}');
---END---
---START---
insert into arr_pk_tbl values (1, '{3,4,5}') on conflict (pk)
  do update set f1[1] = excluded.f1[1], f1[3] = excluded.f1[3]
  returning pk, f1;
 pk |   f1    
----+---------
  1 | {3,2,5}
(1 row)

---END---
---START---
insert into arr_pk_tbl(pk, f1[1:2]) values (1, '{6,7,8}') on conflict (pk)
  do update set f1[1] = excluded.f1[1],
    f1[2] = excluded.f1[2],
    f1[3] = excluded.f1[3]
  returning pk, f1;
 pk |     f1     
----+------------
  1 | {6,7,NULL}
(1 row)

---END---
---START---
-- note: if above selects don't produce the expected tuple order,
-- then you didn't get an indexscan plan, and something is busted.
reset enable_seqscan;
---END---
---START---
reset enable_bitmapscan;
---END---
---START---
-- test [not] (like|ilike) (any|all) (...)
select 'foo' like any (array['%a', '%o']);
 ?column? 
----------
 t
(1 row)

---END---
---START---
-- t
select 'foo' like any (array['%a', '%b']);
 ?column? 
----------
 f
(1 row)

---END---
---START---
-- f
select 'foo' like all (array['f%', '%o']);
 ?column? 
----------
 t
(1 row)

---END---
---START---
-- t
select 'foo' like all (array['f%', '%b']);
 ?column? 
----------
 f
(1 row)

---END---
---START---
-- f
select 'foo' not like any (array['%a', '%b']);
 ?column? 
----------
 t
(1 row)

---END---
---START---
-- t
select 'foo' not like all (array['%a', '%o']);
 ?column? 
----------
 f
(1 row)

---END---
---START---
-- f
select 'foo' ilike any (array['%A', '%O']);
 ?column? 
----------
 t
(1 row)

---END---
---START---
-- t
select 'foo' ilike all (array['F%', '%O']);
 ?column? 
----------
 t
(1 row)

---END---
---START---
-- t
--
-- General array parser tests
--
-- none of the following should be accepted
select '{{1,{2}},{2,3}}'::text[];
ERROR:  malformed array literal: "{{1,{2}},{2,3}}"
LINE 1: select '{{1,{2}},{2,3}}'::text[];
               ^
DETAIL:  Unexpected "{" character.
---END---
---START---
select '{{},{}}'::text[];
ERROR:  malformed array literal: "{{},{}}"
LINE 1: select '{{},{}}'::text[];
               ^
DETAIL:  Unexpected "}" character.
---END---
---START---
select E'{{1,2},\\{2,3}}'::text[];
ERROR:  malformed array literal: "{{1,2},\{2,3}}"
LINE 1: select E'{{1,2},\\{2,3}}'::text[];
               ^
DETAIL:  Unexpected "\" character.
---END---
---START---
select '{{"1 2" x},{3}}'::text[];
ERROR:  malformed array literal: "{{"1 2" x},{3}}"
LINE 1: select '{{"1 2" x},{3}}'::text[];
               ^
DETAIL:  Unexpected array element.
---END---
---START---
select '{}}'::text[];
ERROR:  malformed array literal: "{}}"
LINE 1: select '{}}'::text[];
               ^
DETAIL:  Junk after closing right brace.
---END---
---START---
select '{ }}'::text[];
ERROR:  malformed array literal: "{ }}"
LINE 1: select '{ }}'::text[];
               ^
DETAIL:  Junk after closing right brace.
---END---
---START---
select array[];
ERROR:  cannot determine type of empty array
LINE 1: select array[];
               ^
HINT:  Explicitly cast to the desired type, for example ARRAY[]::integer[].
---END---
---START---
-- none of the above should be accepted
-- all of the following should be accepted
select '{}'::text[];
 text 
------
 {}
(1 row)

---END---
---START---
select '{{{1,2,3,4},{2,3,4,5}},{{3,4,5,6},{4,5,6,7}}}'::text[];
                     text                      
-----------------------------------------------
 {{{1,2,3,4},{2,3,4,5}},{{3,4,5,6},{4,5,6,7}}}
(1 row)

---END---
---START---
select '{0 second  ,0 second}'::interval[];
      interval       
---------------------
 {00:00:00,00:00:00}
(1 row)

---END---
---START---
select '{ { "," } , { 3 } }'::text[];
    text     
-------------
 {{","},{3}}
(1 row)

---END---
---START---
select '  {   {  "  0 second  "   ,  0 second  }   }'::text[];
             text              
-------------------------------
 {{"  0 second  ","0 second"}}
(1 row)

---END---
---START---
select '{
           0 second,
           @ 1 hour @ 42 minutes @ 20 seconds
         }'::interval[];
      interval       
---------------------
 {00:00:00,01:42:20}
(1 row)

---END---
---START---
select array[]::text[];
 array 
-------
 {}
(1 row)

---END---
---START---
select '[0:1]={1.1,2.2}'::float8[];
     float8      
-----------------
 [0:1]={1.1,2.2}
(1 row)

---END---
---START---
-- all of the above should be accepted
-- tests for array aggregates
DROP TABLE IF EXISTS arraggtest;
NOTICE:  table "arraggtest" does not exist, skipping
CREATE TABLE arraggtest (gemini_pk serial PRIMARY KEY, f1 integer[], f2 text[][], f3 double precision[]);
---END---
---START---
INSERT INTO arraggtest (f1, f2, f3) VALUES
('{1,2,3,4}','{{grey,red},{blue,blue}}','{1.6, 0.0}');
---END---
---START---
INSERT INTO arraggtest (f1, f2, f3) VALUES
('{1,2,3}','{{grey,red},{grey,blue}}','{1.6}');
---END---
---START---
SELECT max(f1), min(f1), max(f2), min(f2), max(f3), min(f3) FROM arraggtest;
    max    |   min   |           max            |           min            |   max   |  min  
-----------+---------+--------------------------+--------------------------+---------+-------
 {1,2,3,4} | {1,2,3} | {{grey,red},{grey,blue}} | {{grey,red},{blue,blue}} | {1.6,0} | {1.6}
(1 row)

---END---
---START---
INSERT INTO arraggtest (f1, f2, f3) VALUES
('{3,3,2,4,5,6}','{{white,yellow},{pink,orange}}','{2.1,3.3,1.8,1.7,1.6}');
---END---
---START---
SELECT max(f1), min(f1), max(f2), min(f2), max(f3), min(f3) FROM arraggtest;
      max      |   min   |              max               |           min            |          max          |  min  
---------------+---------+--------------------------------+--------------------------+-----------------------+-------
 {3,3,2,4,5,6} | {1,2,3} | {{white,yellow},{pink,orange}} | {{grey,red},{blue,blue}} | {2.1,3.3,1.8,1.7,1.6} | {1.6}
(1 row)

---END---
---START---
INSERT INTO arraggtest (f1, f2, f3) VALUES
('{2}','{{black,red},{green,orange}}','{1.6,2.2,2.6,0.4}');
---END---
---START---
SELECT max(f1), min(f1), max(f2), min(f2), max(f3), min(f3) FROM arraggtest;
      max      |   min   |              max               |             min              |          max          |  min  
---------------+---------+--------------------------------+------------------------------+-----------------------+-------
 {3,3,2,4,5,6} | {1,2,3} | {{white,yellow},{pink,orange}} | {{black,red},{green,orange}} | {2.1,3.3,1.8,1.7,1.6} | {1.6}
(1 row)

---END---
---START---
INSERT INTO arraggtest (f1, f2, f3) VALUES
('{4,2,6,7,8,1}','{{red},{black},{purple},{blue},{blue}}',NULL);
---END---
---START---
SELECT max(f1), min(f1), max(f2), min(f2), max(f3), min(f3) FROM arraggtest;
      max      |   min   |              max               |             min              |          max          |  min  
---------------+---------+--------------------------------+------------------------------+-----------------------+-------
 {4,2,6,7,8,1} | {1,2,3} | {{white,yellow},{pink,orange}} | {{black,red},{green,orange}} | {2.1,3.3,1.8,1.7,1.6} | {1.6}
(1 row)

---END---
---START---
INSERT INTO arraggtest (f1, f2, f3) VALUES
('{}','{{pink,white,blue,red,grey,orange}}','{2.1,1.87,1.4,2.2}');
---END---
---START---
SELECT max(f1), min(f1), max(f2), min(f2), max(f3), min(f3) FROM arraggtest;
      max      | min |              max               |             min              |          max          |  min  
---------------+-----+--------------------------------+------------------------------+-----------------------+-------
 {4,2,6,7,8,1} | {}  | {{white,yellow},{pink,orange}} | {{black,red},{green,orange}} | {2.1,3.3,1.8,1.7,1.6} | {1.6}
(1 row)

---END---
---START---
-- A few simple tests for arrays of composite types
create type comptype as (f1 int, f2 text);
---END---
---START---
CREATE TABLE comptable (gemini_pk serial PRIMARY KEY, c1 comptype, c2 comptype[]);
---END---
---START---
-- XXX would like to not have to specify row() construct types here ...
insert into comptable
  values (row(1,'foo'), array[row(2,'bar')::comptype, row(3,'baz')::comptype]);
ERROR:  column "gemini_pk" is of type integer but expression is of type record
LINE 2:   values (row(1,'foo'), array[row(2,'bar')::comptype, row(3,...
                  ^
HINT:  You will need to rewrite or cast the expression.
---END---
---START---
-- check that implicitly named array type _comptype isn't a problem
create type _comptype as enum('fooey');
---END---
---START---
select * from comptable;
 gemini_pk | c1 | c2 
-----------+----+----
(0 rows)

---END---
---START---
select c2[2].f2 from comptable;
 f2 
----
(0 rows)

---END---
---START---
drop type _comptype;
---END---
---START---
drop table comptable;
---END---
---START---
drop type comptype;
---END---
---START---
create or replace function unnest1(anyarray)
returns setof anyelement as $$
select $1[s] from generate_subscripts($1,1) g(s);
$$ language sql immutable;
---END---
---START---
create or replace function unnest2(anyarray)
returns setof anyelement as $$
select $1[s1][s2] from generate_subscripts($1,1) g1(s1),
                   generate_subscripts($1,2) g2(s2);
$$ language sql immutable;
---END---
---START---
select * from unnest1(array[1,2,3]);
 unnest1 
---------
       1
       2
       3
(3 rows)

---END---
---START---
select * from unnest2(array[[1,2,3],[4,5,6]]);
 unnest2 
---------
       1
       2
       3
       4
       5
       6
(6 rows)

---END---
---START---
drop function unnest1(anyarray);
---END---
---START---
drop function unnest2(anyarray);
---END---
---START---
select array_fill(null::integer, array[3,3],array[2,2]);
                           array_fill                            
-----------------------------------------------------------------
 [2:4][2:4]={{NULL,NULL,NULL},{NULL,NULL,NULL},{NULL,NULL,NULL}}
(1 row)

---END---
---START---
select array_fill(null::integer, array[3,3]);
                      array_fill                      
------------------------------------------------------
 {{NULL,NULL,NULL},{NULL,NULL,NULL},{NULL,NULL,NULL}}
(1 row)

---END---
---START---
select array_fill(null::text, array[3,3],array[2,2]);
                           array_fill                            
-----------------------------------------------------------------
 [2:4][2:4]={{NULL,NULL,NULL},{NULL,NULL,NULL},{NULL,NULL,NULL}}
(1 row)

---END---
---START---
select array_fill(null::text, array[3,3]);
                      array_fill                      
------------------------------------------------------
 {{NULL,NULL,NULL},{NULL,NULL,NULL},{NULL,NULL,NULL}}
(1 row)

---END---
---START---
select array_fill(7, array[3,3],array[2,2]);
              array_fill              
--------------------------------------
 [2:4][2:4]={{7,7,7},{7,7,7},{7,7,7}}
(1 row)

---END---
---START---
select array_fill(7, array[3,3]);
        array_fill         
---------------------------
 {{7,7,7},{7,7,7},{7,7,7}}
(1 row)

---END---
---START---
select array_fill('juhu'::text, array[3,3],array[2,2]);
                           array_fill                            
-----------------------------------------------------------------
 [2:4][2:4]={{juhu,juhu,juhu},{juhu,juhu,juhu},{juhu,juhu,juhu}}
(1 row)

---END---
---START---
select array_fill('juhu'::text, array[3,3]);
                      array_fill                      
------------------------------------------------------
 {{juhu,juhu,juhu},{juhu,juhu,juhu},{juhu,juhu,juhu}}
(1 row)

---END---
---START---
select a, a = '{}' as is_eq, array_dims(a)
  from (select array_fill(42, array[0]) as a) ss;
 a  | is_eq | array_dims 
----+-------+------------
 {} | t     | 
(1 row)

---END---
---START---
select a, a = '{}' as is_eq, array_dims(a)
  from (select array_fill(42, '{}') as a) ss;
 a  | is_eq | array_dims 
----+-------+------------
 {} | t     | 
(1 row)

---END---
---START---
select a, a = '{}' as is_eq, array_dims(a)
  from (select array_fill(42, '{}', '{}') as a) ss;
 a  | is_eq | array_dims 
----+-------+------------
 {} | t     | 
(1 row)

---END---
---START---
-- raise exception
select array_fill(1, null, array[2,2]);
ERROR:  dimension array or low bound array cannot be null
---END---
---START---
select array_fill(1, array[2,2], null);
ERROR:  dimension array or low bound array cannot be null
---END---
---START---
select array_fill(1, array[2,2], '{}');
ERROR:  wrong number of array subscripts
DETAIL:  Low bound array has different size than dimensions array.
---END---
---START---
select array_fill(1, array[3,3], array[1,1,1]);
ERROR:  wrong number of array subscripts
DETAIL:  Low bound array has different size than dimensions array.
---END---
---START---
select array_fill(1, array[1,2,null]);
ERROR:  dimension values cannot be null
---END---
---START---
select array_fill(1, array[[1,2],[3,4]]);
ERROR:  wrong number of array subscripts
DETAIL:  Dimension array must be one dimensional.
---END---
---START---
select string_to_array('1|2|3', '|');
 string_to_array 
-----------------
 {1,2,3}
(1 row)

---END---
---START---
select string_to_array('1|2|3|', '|');
 string_to_array 
-----------------
 {1,2,3,""}
(1 row)

---END---
---START---
select string_to_array('1||2|3||', '||');
 string_to_array 
-----------------
 {1,2|3,""}
(1 row)

---END---
---START---
select string_to_array('1|2|3', '');
 string_to_array 
-----------------
 {1|2|3}
(1 row)

---END---
---START---
select string_to_array('', '|');
 string_to_array 
-----------------
 {}
(1 row)

---END---
---START---
select string_to_array('1|2|3', NULL);
 string_to_array 
-----------------
 {1,|,2,|,3}
(1 row)

---END---
---START---
select string_to_array(NULL, '|') IS NULL;
 ?column? 
----------
 t
(1 row)

---END---
---START---
select string_to_array('abc', '');
 string_to_array 
-----------------
 {abc}
(1 row)

---END---
---START---
select string_to_array('abc', '', 'abc');
 string_to_array 
-----------------
 {NULL}
(1 row)

---END---
---START---
select string_to_array('abc', ',');
 string_to_array 
-----------------
 {abc}
(1 row)

---END---
---START---
select string_to_array('abc', ',', 'abc');
 string_to_array 
-----------------
 {NULL}
(1 row)

---END---
---START---
select string_to_array('1,2,3,4,,6', ',');
 string_to_array 
-----------------
 {1,2,3,4,"",6}
(1 row)

---END---
---START---
select string_to_array('1,2,3,4,,6', ',', '');
 string_to_array  
------------------
 {1,2,3,4,NULL,6}
(1 row)

---END---
---START---
select string_to_array('1,2,3,4,*,6', ',', '*');
 string_to_array  
------------------
 {1,2,3,4,NULL,6}
(1 row)

---END---
---START---
select v, v is null as "is null" from string_to_table('1|2|3', '|') g(v);
 v | is null 
---+---------
 1 | f
 2 | f
 3 | f
(3 rows)

---END---
---START---
select v, v is null as "is null" from string_to_table('1|2|3|', '|') g(v);
 v | is null 
---+---------
 1 | f
 2 | f
 3 | f
   | f
(4 rows)

---END---
---START---
select v, v is null as "is null" from string_to_table('1||2|3||', '||') g(v);
  v  | is null 
-----+---------
 1   | f
 2|3 | f
     | f
(3 rows)

---END---
---START---
select v, v is null as "is null" from string_to_table('1|2|3', '') g(v);
   v   | is null 
-------+---------
 1|2|3 | f
(1 row)

---END---
---START---
select v, v is null as "is null" from string_to_table('', '|') g(v);
 v | is null 
---+---------
(0 rows)

---END---
---START---
select v, v is null as "is null" from string_to_table('1|2|3', NULL) g(v);
 v | is null 
---+---------
 1 | f
 | | f
 2 | f
 | | f
 3 | f
(5 rows)

---END---
---START---
select v, v is null as "is null" from string_to_table(NULL, '|') g(v);
 v | is null 
---+---------
(0 rows)

---END---
---START---
select v, v is null as "is null" from string_to_table('abc', '') g(v);
  v  | is null 
-----+---------
 abc | f
(1 row)

---END---
---START---
select v, v is null as "is null" from string_to_table('abc', '', 'abc') g(v);
 v | is null 
---+---------
   | t
(1 row)

---END---
---START---
select v, v is null as "is null" from string_to_table('abc', ',') g(v);
  v  | is null 
-----+---------
 abc | f
(1 row)

---END---
---START---
select v, v is null as "is null" from string_to_table('abc', ',', 'abc') g(v);
 v | is null 
---+---------
   | t
(1 row)

---END---
---START---
select v, v is null as "is null" from string_to_table('1,2,3,4,,6', ',') g(v);
 v | is null 
---+---------
 1 | f
 2 | f
 3 | f
 4 | f
   | f
 6 | f
(6 rows)

---END---
---START---
select v, v is null as "is null" from string_to_table('1,2,3,4,,6', ',', '') g(v);
 v | is null 
---+---------
 1 | f
 2 | f
 3 | f
 4 | f
   | t
 6 | f
(6 rows)

---END---
---START---
select v, v is null as "is null" from string_to_table('1,2,3,4,*,6', ',', '*') g(v);
 v | is null 
---+---------
 1 | f
 2 | f
 3 | f
 4 | f
   | t
 6 | f
(6 rows)

---END---
---START---
select array_to_string(NULL::int4[], ',') IS NULL;
 ?column? 
----------
 t
(1 row)

---END---
---START---
select array_to_string('{}'::int4[], ',');
 array_to_string 
-----------------
 
(1 row)

---END---
---START---
select array_to_string(array[1,2,3,4,NULL,6], ',');
 array_to_string 
-----------------
 1,2,3,4,6
(1 row)

---END---
---START---
select array_to_string(array[1,2,3,4,NULL,6], ',', '*');
 array_to_string 
-----------------
 1,2,3,4,*,6
(1 row)

---END---
---START---
select array_to_string(array[1,2,3,4,NULL,6], NULL);
 array_to_string 
-----------------
 
(1 row)

---END---
---START---
select array_to_string(array[1,2,3,4,NULL,6], ',', NULL);
 array_to_string 
-----------------
 1,2,3,4,6
(1 row)

---END---
---START---
select array_to_string(string_to_array('1|2|3', '|'), '|');
 array_to_string 
-----------------
 1|2|3
(1 row)

---END---
---START---
select array_length(array[1,2,3], 1);
 array_length 
--------------
            3
(1 row)

---END---
---START---
select array_length(array[[1,2,3], [4,5,6]], 0);
 array_length 
--------------
             
(1 row)

---END---
---START---
select array_length(array[[1,2,3], [4,5,6]], 1);
 array_length 
--------------
            2
(1 row)

---END---
---START---
select array_length(array[[1,2,3], [4,5,6]], 2);
 array_length 
--------------
            3
(1 row)

---END---
---START---
select array_length(array[[1,2,3], [4,5,6]], 3);
 array_length 
--------------
             
(1 row)

---END---
---START---
select cardinality(NULL::int[]);
 cardinality 
-------------
            
(1 row)

---END---
---START---
select cardinality('{}'::int[]);
 cardinality 
-------------
           0
(1 row)

---END---
---START---
select cardinality(array[1,2,3]);
 cardinality 
-------------
           3
(1 row)

---END---
---START---
select cardinality('[2:4]={5,6,7}'::int[]);
 cardinality 
-------------
           3
(1 row)

---END---
---START---
select cardinality('{{1,2}}'::int[]);
 cardinality 
-------------
           2
(1 row)

---END---
---START---
select cardinality('{{1,2},{3,4},{5,6}}'::int[]);
 cardinality 
-------------
           6
(1 row)

---END---
---START---
select cardinality('{{{1,9},{5,6}},{{2,3},{3,4}}}'::int[]);
 cardinality 
-------------
           8
(1 row)

---END---
---START---
-- array_agg(anynonarray)
select array_agg(unique1) from (select unique1 from tenk1 where unique1 < 15 order by unique1) ss;
              array_agg               
--------------------------------------
 {0,1,2,3,4,5,6,7,8,9,10,11,12,13,14}
(1 row)

---END---
---START---
select array_agg(ten) from (select ten from tenk1 where unique1 < 15 order by unique1) ss;
            array_agg            
---------------------------------
 {0,1,2,3,4,5,6,7,8,9,0,1,2,3,4}
(1 row)

---END---
---START---
select array_agg(nullif(ten, 4)) from (select ten from tenk1 where unique1 < 15 order by unique1) ss;
               array_agg               
---------------------------------------
 {0,1,2,3,NULL,5,6,7,8,9,0,1,2,3,NULL}
(1 row)

---END---
---START---
select array_agg(unique1) from tenk1 where unique1 < -15;
 array_agg 
-----------
 
(1 row)

---END---
---START---
-- array_agg(anyarray)
select array_agg(ar)
  from (values ('{1,2}'::int[]), ('{3,4}'::int[])) v(ar);
   array_agg   
---------------
 {{1,2},{3,4}}
(1 row)

---END---
---START---
select array_agg(distinct ar order by ar desc)
  from (select array[i / 2] from generate_series(1,10) a(i)) b(ar);
         array_agg         
---------------------------
 {{5},{4},{3},{2},{1},{0}}
(1 row)

---END---
---START---
select array_agg(ar)
  from (select array_agg(array[i, i+1, i-1])
        from generate_series(1,2) a(i)) b(ar);
      array_agg      
---------------------
 {{{1,2,0},{2,3,1}}}
(1 row)

---END---
---START---
select array_agg(array[i+1.2, i+1.3, i+1.4]) from generate_series(1,3) g(i);
                  array_agg                  
---------------------------------------------
 {{2.2,2.3,2.4},{3.2,3.3,3.4},{4.2,4.3,4.4}}
(1 row)

---END---
---START---
select array_agg(array['Hello', i::text]) from generate_series(9,11) g(i);
             array_agg             
-----------------------------------
 {{Hello,9},{Hello,10},{Hello,11}}
(1 row)

---END---
---START---
select array_agg(array[i, nullif(i, 3), i+1]) from generate_series(1,4) g(i);
              array_agg               
--------------------------------------
 {{1,1,2},{2,2,3},{3,NULL,4},{4,4,5}}
(1 row)

---END---
---START---
-- errors
select array_agg('{}'::int[]) from generate_series(1,2);
ERROR:  cannot accumulate empty arrays
---END---
---START---
select array_agg(null::int[]) from generate_series(1,2);
ERROR:  cannot accumulate null arrays
---END---
---START---
select array_agg(ar)
  from (values ('{1,2}'::int[]), ('{3}'::int[])) v(ar);
ERROR:  cannot accumulate arrays of different dimensionality
---END---
---START---
select unnest(array[1,2,3]);
 unnest 
--------
      1
      2
      3
(3 rows)

---END---
---START---
select * from unnest(array[1,2,3]);
 unnest 
--------
      1
      2
      3
(3 rows)

---END---
---START---
select unnest(array[1,2,3,4.5]::float8[]);
 unnest 
--------
      1
      2
      3
    4.5
(4 rows)

---END---
---START---
select unnest(array[1,2,3,4.5]::numeric[]);
 unnest 
--------
      1
      2
      3
    4.5
(4 rows)

---END---
---START---
select unnest(array[1,2,3,null,4,null,null,5,6]);
 unnest 
--------
      1
      2
      3
       
      4
       
       
      5
      6
(9 rows)

---END---
---START---
select unnest(array[1,2,3,null,4,null,null,5,6]::text[]);
 unnest 
--------
 1
 2
 3
 
 4
 
 
 5
 6
(9 rows)

---END---
---START---
select abs(unnest(array[1,2,null,-3]));
 abs 
-----
   1
   2
    
   3
(4 rows)

---END---
---START---
select array_remove(array[1,2,2,3], 2);
 array_remove 
--------------
 {1,3}
(1 row)

---END---
---START---
select array_remove(array[1,2,2,3], 5);
 array_remove 
--------------
 {1,2,2,3}
(1 row)

---END---
---START---
select array_remove(array[1,NULL,NULL,3], NULL);
 array_remove 
--------------
 {1,3}
(1 row)

---END---
---START---
select array_remove(array['A','CC','D','C','RR'], 'RR');
 array_remove 
--------------
 {A,CC,D,C}
(1 row)

---END---
---START---
select array_remove(array[1.0, 2.1, 3.3], 1);
 array_remove 
--------------
 {2.1,3.3}
(1 row)

---END---
---START---
select array_remove('{{1,2,2},{1,4,3}}', 2);
ERROR:  removing elements from multidimensional arrays is not supported
---END---
---START---
-- not allowed
select array_remove(array['X','X','X'], 'X') = '{}';
 ?column? 
----------
 t
(1 row)

---END---
---START---
select array_replace(array[1,2,5,4],5,3);
 array_replace 
---------------
 {1,2,3,4}
(1 row)

---END---
---START---
select array_replace(array[1,2,5,4],5,NULL);
 array_replace 
---------------
 {1,2,NULL,4}
(1 row)

---END---
---START---
select array_replace(array[1,2,NULL,4,NULL],NULL,5);
 array_replace 
---------------
 {1,2,5,4,5}
(1 row)

---END---
---START---
select array_replace(array['A','B','DD','B'],'B','CC');
 array_replace 
---------------
 {A,CC,DD,CC}
(1 row)

---END---
---START---
select array_replace(array[1,NULL,3],NULL,NULL);
 array_replace 
---------------
 {1,NULL,3}
(1 row)

---END---
---START---
select array_replace(array['AB',NULL,'CDE'],NULL,'12');
 array_replace 
---------------
 {AB,12,CDE}
(1 row)

---END---
---START---
-- array(select array-value ...)
select array(select array[i,i/2] from generate_series(1,5) i);
              array              
---------------------------------
 {{1,0},{2,1},{3,1},{4,2},{5,2}}
(1 row)

---END---
---START---
select array(select array['Hello', i::text] from generate_series(9,11) i);
               array               
-----------------------------------
 {{Hello,9},{Hello,10},{Hello,11}}
(1 row)

---END---
---START---
-- Insert/update on a column that is array of composite
DROP TABLE IF EXISTS t1;
NOTICE:  table "t1" does not exist, skipping
CREATE TABLE t1 (gemini_pk serial PRIMARY KEY, f1 int8_tbl[]);
---END---
---START---
insert into t1 (f1[5].q1) values(42);
---END---
---START---
select * from t1;
 gemini_pk |        f1        
-----------+------------------
         1 | [5:5]={"(,42,)"}
(1 row)

---END---
---START---
update t1 set f1[5].q2 = 43;
---END---
---START---
select * from t1;
 gemini_pk |         f1         
-----------+--------------------
         1 | [5:5]={"(,42,43)"}
(1 row)

---END---
---START---
-- Check that arrays of composites are safely detoasted when needed
DROP TABLE IF EXISTS src;
NOTICE:  table "src" does not exist, skipping
CREATE TABLE src (gemini_pk serial PRIMARY KEY, f1 text);
---END---
---START---
insert into src
  select string_agg(random()::text,'') from generate_series(1,10000);
ERROR:  column "gemini_pk" is of type integer but expression is of type text
LINE 2:   select string_agg(random()::text,'') from generate_series(...
                 ^
HINT:  You will need to rewrite or cast the expression.
---END---
---START---
create type textandtext as (c1 text, c2 text);
---END---
---START---
DROP TABLE IF EXISTS dest;
NOTICE:  table "dest" does not exist, skipping
CREATE TABLE dest (gemini_pk serial PRIMARY KEY, f1 textandtext[]);
---END---
---START---
insert into dest select array[row(f1,f1)::textandtext] from src;
ERROR:  column "gemini_pk" is of type integer but expression is of type textandtext[]
LINE 1: insert into dest select array[row(f1,f1)::textandtext] from ...
                                ^
HINT:  You will need to rewrite or cast the expression.
---END---
---START---
select length(fipshash((f1[1]).c2)) from dest;
 length 
--------
(0 rows)

---END---
---START---
delete from src;
---END---
---START---
select length(fipshash((f1[1]).c2)) from dest;
 length 
--------
(0 rows)

---END---
---START---
truncate table src;
---END---
---START---
drop table src;
---END---
---START---
select length(fipshash((f1[1]).c2)) from dest;
 length 
--------
(0 rows)

---END---
---START---
drop table dest;
---END---
---START---
drop type textandtext;
---END---
---START---
-- Tests for polymorphic-array form of width_bucket()
-- this exercises the varwidth and float8 code paths
SELECT
    op,
    width_bucket(op::numeric, ARRAY[1, 3, 5, 10.0]::numeric[]) AS wb_n1,
    width_bucket(op::numeric, ARRAY[0, 5.5, 9.99]::numeric[]) AS wb_n2,
    width_bucket(op::numeric, ARRAY[-6, -5, 2.0]::numeric[]) AS wb_n3,
    width_bucket(op::float8, ARRAY[1, 3, 5, 10.0]::float8[]) AS wb_f1,
    width_bucket(op::float8, ARRAY[0, 5.5, 9.99]::float8[]) AS wb_f2,
    width_bucket(op::float8, ARRAY[-6, -5, 2.0]::float8[]) AS wb_f3
FROM (VALUES
  (-5.2),
  (-0.0000000001),
  (0.000000000001),
  (1),
  (1.99999999999999),
  (2),
  (2.00000000000001),
  (3),
  (4),
  (4.5),
  (5),
  (5.5),
  (6),
  (7),
  (8),
  (9),
  (9.99999999999999),
  (10),
  (10.0000000000001)
) v(op);
        op        | wb_n1 | wb_n2 | wb_n3 | wb_f1 | wb_f2 | wb_f3 
------------------+-------+-------+-------+-------+-------+-------
             -5.2 |     0 |     0 |     1 |     0 |     0 |     1
    -0.0000000001 |     0 |     0 |     2 |     0 |     0 |     2
   0.000000000001 |     0 |     1 |     2 |     0 |     1 |     2
                1 |     1 |     1 |     2 |     1 |     1 |     2
 1.99999999999999 |     1 |     1 |     2 |     1 |     1 |     2
                2 |     1 |     1 |     3 |     1 |     1 |     3
 2.00000000000001 |     1 |     1 |     3 |     1 |     1 |     3
                3 |     2 |     1 |     3 |     2 |     1 |     3
                4 |     2 |     1 |     3 |     2 |     1 |     3
              4.5 |     2 |     1 |     3 |     2 |     1 |     3
                5 |     3 |     1 |     3 |     3 |     1 |     3
              5.5 |     3 |     2 |     3 |     3 |     2 |     3
                6 |     3 |     2 |     3 |     3 |     2 |     3
                7 |     3 |     2 |     3 |     3 |     2 |     3
                8 |     3 |     2 |     3 |     3 |     2 |     3
                9 |     3 |     2 |     3 |     3 |     2 |     3
 9.99999999999999 |     3 |     3 |     3 |     3 |     3 |     3
               10 |     4 |     3 |     3 |     4 |     3 |     3
 10.0000000000001 |     4 |     3 |     3 |     4 |     3 |     3
(19 rows)

---END---
---START---
-- ensure float8 path handles NaN properly
SELECT
    op,
    width_bucket(op, ARRAY[1, 3, 9, 'NaN', 'NaN']::float8[]) AS wb
FROM (VALUES
  (-5.2::float8),
  (4::float8),
  (77::float8),
  ('NaN'::float8)
) v(op);
  op  | wb 
------+----
 -5.2 |  0
    4 |  2
   77 |  3
  NaN |  5
(4 rows)

---END---
---START---
-- these exercise the generic fixed-width code path
SELECT
    op,
    width_bucket(op, ARRAY[1, 3, 5, 10]) AS wb_1
FROM generate_series(0,11) as op;
 op | wb_1 
----+------
  0 |    0
  1 |    1
  2 |    1
  3 |    2
  4 |    2
  5 |    3
  6 |    3
  7 |    3
  8 |    3
  9 |    3
 10 |    4
 11 |    4
(12 rows)

---END---
---START---
SELECT width_bucket(now(),
                    array['yesterday', 'today', 'tomorrow']::timestamptz[]);
 width_bucket 
--------------
            2
(1 row)

---END---
---START---
-- corner cases
SELECT width_bucket(5, ARRAY[3]);
 width_bucket 
--------------
            1
(1 row)

---END---
---START---
SELECT width_bucket(5, '{}');
 width_bucket 
--------------
            0
(1 row)

---END---
---START---
-- error cases
SELECT width_bucket('5'::text, ARRAY[3, 4]::integer[]);
ERROR:  function width_bucket(text, integer[]) does not exist
LINE 1: SELECT width_bucket('5'::text, ARRAY[3, 4]::integer[]);
               ^
HINT:  No function matches the given name and argument types. You might need to add explicit type casts.
---END---
---START---
SELECT width_bucket(5, ARRAY[3, 4, NULL]);
ERROR:  thresholds array must not contain NULLs
---END---
---START---
SELECT width_bucket(5, ARRAY[ARRAY[1, 2], ARRAY[3, 4]]);
ERROR:  thresholds must be one-dimensional array
---END---
---START---
-- trim_array
SELECT arr, trim_array(arr, 2)
FROM
(VALUES ('{1,2,3,4,5,6}'::bigint[]),
        ('{1,2}'),
        ('[10:16]={1,2,3,4,5,6,7}'),
        ('[-15:-10]={1,2,3,4,5,6}'),
        ('{{1,10},{2,20},{3,30},{4,40}}')) v(arr);
              arr              |   trim_array    
-------------------------------+-----------------
 {1,2,3,4,5,6}                 | {1,2,3,4}
 {1,2}                         | {}
 [10:16]={1,2,3,4,5,6,7}       | {1,2,3,4,5}
 [-15:-10]={1,2,3,4,5,6}       | {1,2,3,4}
 {{1,10},{2,20},{3,30},{4,40}} | {{1,10},{2,20}}
(5 rows)

---END---
---START---
SELECT trim_array(ARRAY[1, 2, 3], -1);
ERROR:  number of elements to trim must be between 0 and 3
---END---
---START---
-- fail
SELECT trim_array(ARRAY[1, 2, 3], 10);
ERROR:  number of elements to trim must be between 0 and 3
---END---
---START---
-- fail
SELECT trim_array(ARRAY[]::int[], 1);
ERROR:  number of elements to trim must be between 0 and 0
---END---
---START---
-- fail
-- array_shuffle
SELECT array_shuffle('{1,2,3,4,5,6}'::int[]) <@ '{1,2,3,4,5,6}';
 ?column? 
----------
 t
(1 row)

---END---
---START---
SELECT array_shuffle('{1,2,3,4,5,6}'::int[]) @> '{1,2,3,4,5,6}';
 ?column? 
----------
 t
(1 row)

---END---
---START---
SELECT array_dims(array_shuffle('[-1:2][2:3]={{1,2},{3,NULL},{5,6},{7,8}}'::int[]));
 array_dims  
-------------
 [-1:2][2:3]
(1 row)

---END---
---START---
SELECT array_dims(array_shuffle('{{{1,2},{3,NULL}},{{5,6},{7,8}},{{9,10},{11,12}}}'::int[]));
   array_dims    
-----------------
 [1:3][1:2][1:2]
(1 row)

---END---
---START---
-- array_sample
SELECT array_sample('{1,2,3,4,5,6}'::int[], 3) <@ '{1,2,3,4,5,6}';
 ?column? 
----------
 t
(1 row)

---END---
---START---
SELECT array_length(array_sample('{1,2,3,4,5,6}'::int[], 3), 1);
 array_length 
--------------
            3
(1 row)

---END---
---START---
SELECT array_dims(array_sample('[-1:2][2:3]={{1,2},{3,NULL},{5,6},{7,8}}'::int[], 3));
 array_dims 
------------
 [1:3][2:3]
(1 row)

---END---
---START---
SELECT array_dims(array_sample('{{{1,2},{3,NULL}},{{5,6},{7,8}},{{9,10},{11,12}}}'::int[], 2));
   array_dims    
-----------------
 [1:2][1:2][1:2]
(1 row)

---END---
---START---
SELECT array_sample('{1,2,3,4,5,6}'::int[], -1);
ERROR:  sample size must be between 0 and 6
---END---
---START---
-- fail
SELECT array_sample('{1,2,3,4,5,6}'::int[], 7);
ERROR:  sample size must be between 0 and 6
---END---
