---START---
-- sanity check of system catalog
SELECT attrelid, attname, attgenerated FROM pg_attribute WHERE attgenerated NOT IN ('', 's');
 attrelid | attname | attgenerated 
----------+---------+--------------
(0 rows)

---END---
---START---
CREATE TABLE gtest0 (a int PRIMARY KEY, b int GENERATED ALWAYS AS (55) STORED);
---END---
---START---
CREATE TABLE gtest1 (a int PRIMARY KEY, b int GENERATED ALWAYS AS (a * 2) STORED);
---END---
---START---
SELECT table_name, column_name, column_default, is_nullable, is_generated, generation_expression FROM information_schema.columns WHERE table_name LIKE 'gtest_' ORDER BY 1, 2;
 table_name | column_name | column_default | is_nullable | is_generated | generation_expression 
------------+-------------+----------------+-------------+--------------+-----------------------
 gtest0     | a           |                | NO          | NEVER        | 
 gtest0     | b           |                | YES         | ALWAYS       | 55
 gtest1     | a           |                | NO          | NEVER        | 
 gtest1     | b           |                | YES         | ALWAYS       | (a * 2)
(4 rows)

---END---
---START---
SELECT table_name, column_name, dependent_column FROM information_schema.column_column_usage ORDER BY 1, 2, 3;
 table_name | column_name | dependent_column 
------------+-------------+------------------
 gtest1     | a           | b
(1 row)

---END---
---START---
\d gtest1
                            Table "public.gtest1"
 Column |  Type   | Collation | Nullable |              Default               
--------+---------+-----------+----------+------------------------------------
 a      | integer |           | not null | 
 b      | integer |           |          | generated always as (a * 2) stored
Indexes:
    "gtest1_pkey" PRIMARY KEY, btree (a)

-- duplicate generated
CREATE TABLE gtest_err_1 (a int PRIMARY KEY, b int GENERATED ALWAYS AS (a * 2) STORED GENERATED ALWAYS AS (a * 3) STORED);
ERROR:  multiple generation clauses specified for column "b" of table "gtest_err_1"
LINE 1: ...ARY KEY, b int GENERATED ALWAYS AS (a * 2) STORED GENERATED ...
                                                             ^
---END---
---START---
-- references to other generated columns, including self-references
CREATE TABLE gtest_err_2a (a int PRIMARY KEY, b int GENERATED ALWAYS AS (b * 2) STORED);
ERROR:  cannot use generated column "b" in column generation expression
LINE 1: ...2a (a int PRIMARY KEY, b int GENERATED ALWAYS AS (b * 2) STO...
                                                             ^
DETAIL:  A generated column cannot reference another generated column.
---END---
---START---
CREATE TABLE gtest_err_2b (a int PRIMARY KEY, b int GENERATED ALWAYS AS (a * 2) STORED, c int GENERATED ALWAYS AS (b * 3) STORED);
ERROR:  cannot use generated column "b" in column generation expression
LINE 1: ...AYS AS (a * 2) STORED, c int GENERATED ALWAYS AS (b * 3) STO...
                                                             ^
DETAIL:  A generated column cannot reference another generated column.
---END---
---START---
-- a whole-row var is a self-reference on steroids, so disallow that too
CREATE TABLE gtest_err_2c (a int PRIMARY KEY,
    b int GENERATED ALWAYS AS (num_nulls(gtest_err_2c)) STORED);
ERROR:  cannot use whole-row variable in column generation expression
LINE 2:     b int GENERATED ALWAYS AS (num_nulls(gtest_err_2c)) STOR...
                                                 ^
DETAIL:  This would cause the generated column to depend on its own value.
---END---
---START---
-- invalid reference
CREATE TABLE gtest_err_3 (a int PRIMARY KEY, b int GENERATED ALWAYS AS (c * 2) STORED);
ERROR:  column "c" does not exist
LINE 1: ..._3 (a int PRIMARY KEY, b int GENERATED ALWAYS AS (c * 2) STO...
                                                             ^
---END---
---START---
-- generation expression must be immutable
CREATE TABLE gtest_err_4 (a int PRIMARY KEY, b double precision GENERATED ALWAYS AS (random()) STORED);
ERROR:  generation expression is not immutable
---END---
---START---
-- cannot have default/identity and generated
CREATE TABLE gtest_err_5a (a int PRIMARY KEY, b int DEFAULT 5 GENERATED ALWAYS AS (a * 2) STORED);
ERROR:  both default and generation expression specified for column "b" of table "gtest_err_5a"
LINE 1: ... gtest_err_5a (a int PRIMARY KEY, b int DEFAULT 5 GENERATED ...
                                                             ^
---END---
---START---
CREATE TABLE gtest_err_5b (a int PRIMARY KEY, b int GENERATED ALWAYS AS identity GENERATED ALWAYS AS (a * 2) STORED);
ERROR:  both identity and generation expression specified for column "b" of table "gtest_err_5b"
LINE 1: ...t PRIMARY KEY, b int GENERATED ALWAYS AS identity GENERATED ...
                                                             ^
---END---
---START---
-- reference to system column not allowed in generated column
-- (except tableoid, which we test below)
CREATE TABLE gtest_err_6a (a int PRIMARY KEY, b bool GENERATED ALWAYS AS (xmin <> 37) STORED);
ERROR:  cannot use system column "xmin" in column generation expression
LINE 1: ...a (a int PRIMARY KEY, b bool GENERATED ALWAYS AS (xmin <> 37...
                                                             ^
---END---
---START---
-- various prohibited constructs
CREATE TABLE gtest_err_7a (a int PRIMARY KEY, b int GENERATED ALWAYS AS (avg(a)) STORED);
ERROR:  aggregate functions are not allowed in column generation expressions
LINE 1: ...7a (a int PRIMARY KEY, b int GENERATED ALWAYS AS (avg(a)) ST...
                                                             ^
---END---
---START---
CREATE TABLE gtest_err_7b (a int PRIMARY KEY, b int GENERATED ALWAYS AS (row_number() OVER (ORDER BY a)) STORED);
ERROR:  window functions are not allowed in column generation expressions
LINE 1: ...7b (a int PRIMARY KEY, b int GENERATED ALWAYS AS (row_number...
                                                             ^
---END---
---START---
CREATE TABLE gtest_err_7c (a int PRIMARY KEY, b int GENERATED ALWAYS AS ((SELECT a)) STORED);
ERROR:  cannot use subquery in column generation expression
LINE 1: ...7c (a int PRIMARY KEY, b int GENERATED ALWAYS AS ((SELECT a)...
                                                             ^
---END---
---START---
CREATE TABLE gtest_err_7d (a int PRIMARY KEY, b int GENERATED ALWAYS AS (generate_series(1, a)) STORED);
ERROR:  set-returning functions are not allowed in column generation expressions
LINE 1: ...7d (a int PRIMARY KEY, b int GENERATED ALWAYS AS (generate_s...
                                                             ^
---END---
---START---
-- GENERATED BY DEFAULT not allowed
CREATE TABLE gtest_err_8 (a int PRIMARY KEY, b int GENERATED BY DEFAULT AS (a * 2) STORED);
ERROR:  for a generated column, GENERATED ALWAYS must be specified
LINE 1: ...E gtest_err_8 (a int PRIMARY KEY, b int GENERATED BY DEFAULT...
                                                             ^
---END---
---START---
INSERT INTO gtest1 VALUES (1);
---END---
---START---
INSERT INTO gtest1 VALUES (2, DEFAULT);
---END---
---START---
-- ok
INSERT INTO gtest1 VALUES (3, 33);
ERROR:  cannot insert a non-DEFAULT value into column "b"
DETAIL:  Column "b" is a generated column.
---END---
---START---
-- error
INSERT INTO gtest1 VALUES (3, 33), (4, 44);
ERROR:  cannot insert a non-DEFAULT value into column "b"
DETAIL:  Column "b" is a generated column.
---END---
---START---
-- error
INSERT INTO gtest1 VALUES (3, DEFAULT), (4, 44);
ERROR:  cannot insert a non-DEFAULT value into column "b"
DETAIL:  Column "b" is a generated column.
---END---
---START---
-- error
INSERT INTO gtest1 VALUES (3, 33), (4, DEFAULT);
ERROR:  cannot insert a non-DEFAULT value into column "b"
DETAIL:  Column "b" is a generated column.
---END---
---START---
-- error
INSERT INTO gtest1 VALUES (3, DEFAULT), (4, DEFAULT);
---END---
---START---
-- ok
SELECT * FROM gtest1 ORDER BY a;
 a | b 
---+---
 1 | 2
 2 | 4
 3 | 6
 4 | 8
(4 rows)

---END---
---START---
DELETE FROM gtest1 WHERE a >= 3;
---END---
---START---
UPDATE gtest1 SET b = DEFAULT WHERE a = 1;
---END---
---START---
UPDATE gtest1 SET b = 11 WHERE a = 1;
ERROR:  column "b" can only be updated to DEFAULT
DETAIL:  Column "b" is a generated column.
---END---
---START---
-- error
SELECT * FROM gtest1 ORDER BY a;
 a | b 
---+---
 1 | 2
 2 | 4
(2 rows)

---END---
---START---
SELECT a, b, b * 2 AS b2 FROM gtest1 ORDER BY a;
 a | b | b2 
---+---+----
 1 | 2 |  4
 2 | 4 |  8
(2 rows)

---END---
---START---
SELECT a, b FROM gtest1 WHERE b = 4 ORDER BY a;
 a | b 
---+---
 2 | 4
(1 row)

---END---
---START---
-- test that overflow error happens on write
INSERT INTO gtest1 VALUES (2000000000);
ERROR:  integer out of range
---END---
---START---
SELECT * FROM gtest1;
 a | b 
---+---
 2 | 4
 1 | 2
(2 rows)

---END---
---START---
DELETE FROM gtest1 WHERE a = 2000000000;
---END---
---START---
CREATE TABLE gtestx (gemini_pk serial PRIMARY KEY, x integer, y integer);
---END---
---START---
INSERT INTO gtestx VALUES (11, 1), (22, 2), (33, 3);
---END---
---START---
SELECT * FROM gtestx, gtest1 WHERE gtestx.y = gtest1.a;
 gemini_pk | x | y | a | b 
-----------+---+---+---+---
(0 rows)

---END---
---START---
DROP TABLE gtestx;
---END---
---START---
-- test UPDATE/DELETE quals
SELECT * FROM gtest1 ORDER BY a;
 a | b 
---+---
 1 | 2
 2 | 4
(2 rows)

---END---
---START---
UPDATE gtest1 SET a = 3 WHERE b = 4;
---END---
---START---
SELECT * FROM gtest1 ORDER BY a;
 a | b 
---+---
 1 | 2
 3 | 6
(2 rows)

---END---
---START---
DELETE FROM gtest1 WHERE b = 2;
---END---
---START---
SELECT * FROM gtest1 ORDER BY a;
 a | b 
---+---
 3 | 6
(1 row)

---END---
---START---
-- test MERGE
CREATE TABLE gtestm (
  id int PRIMARY KEY,
  f1 int,
  f2 int,
  f3 int GENERATED ALWAYS AS (f1 * 2) STORED,
  f4 int GENERATED ALWAYS AS (f2 * 2) STORED
);
---END---
---START---
INSERT INTO gtestm VALUES (1, 5, 100);
---END---
---START---
MERGE INTO gtestm t USING (VALUES (1, 10), (2, 20)) v(id, f1) ON t.id = v.id
  WHEN MATCHED THEN UPDATE SET f1 = v.f1
  WHEN NOT MATCHED THEN INSERT VALUES (v.id, v.f1, 200);
---END---
---START---
SELECT * FROM gtestm ORDER BY id;
 id | f1 | f2  | f3 | f4  
----+----+-----+----+-----
  1 | 10 | 100 | 20 | 200
  2 | 20 | 200 | 40 | 400
(2 rows)

---END---
---START---
DROP TABLE gtestm;
---END---
---START---
-- views
CREATE VIEW gtest1v AS SELECT * FROM gtest1;
---END---
---START---
SELECT * FROM gtest1v;
 a | b 
---+---
 3 | 6
(1 row)

---END---
---START---
INSERT INTO gtest1v VALUES (4, 8);
ERROR:  cannot insert a non-DEFAULT value into column "b"
DETAIL:  Column "b" is a generated column.
---END---
---START---
-- error
INSERT INTO gtest1v VALUES (5, DEFAULT);
---END---
---START---
-- ok
INSERT INTO gtest1v VALUES (6, 66), (7, 77);
ERROR:  cannot insert a non-DEFAULT value into column "b"
DETAIL:  Column "b" is a generated column.
---END---
---START---
-- error
INSERT INTO gtest1v VALUES (6, DEFAULT), (7, 77);
ERROR:  cannot insert a non-DEFAULT value into column "b"
DETAIL:  Column "b" is a generated column.
---END---
---START---
-- error
INSERT INTO gtest1v VALUES (6, 66), (7, DEFAULT);
ERROR:  cannot insert a non-DEFAULT value into column "b"
DETAIL:  Column "b" is a generated column.
---END---
---START---
-- error
INSERT INTO gtest1v VALUES (6, DEFAULT), (7, DEFAULT);
---END---
---START---
-- ok
ALTER VIEW gtest1v ALTER COLUMN b SET DEFAULT 100;
---END---
---START---
INSERT INTO gtest1v VALUES (8, DEFAULT);
ERROR:  cannot insert a non-DEFAULT value into column "b"
DETAIL:  Column "b" is a generated column.
---END---
---START---
-- error
INSERT INTO gtest1v VALUES (8, DEFAULT), (9, DEFAULT);
ERROR:  cannot insert a non-DEFAULT value into column "b"
DETAIL:  Column "b" is a generated column.
---END---
---START---
-- error
SELECT * FROM gtest1v;
 a | b  
---+----
 3 |  6
 5 | 10
 6 | 12
 7 | 14
(4 rows)

---END---
---START---
DELETE FROM gtest1v WHERE a >= 5;
---END---
---START---
DROP VIEW gtest1v;
---END---
---START---
-- CTEs
WITH foo AS (SELECT * FROM gtest1) SELECT * FROM foo;
 a | b 
---+---
 3 | 6
(1 row)

---END---
---START---
CREATE TABLE gtest1_1 (gemini_pk serial PRIMARY KEY) INHERITS (gtest1);
---END---
---START---
SELECT * FROM gtest1_1;
 a | b | gemini_pk 
---+---+-----------
(0 rows)

---END---
---START---
\d gtest1_1
                                 Table "public.gtest1_1"
  Column   |  Type   | Collation | Nullable |                   Default                   
-----------+---------+-----------+----------+---------------------------------------------
 a         | integer |           | not null | 
 b         | integer |           |          | generated always as (a * 2) stored
 gemini_pk | integer |           | not null | nextval('gtest1_1_gemini_pk_seq'::regclass)
Indexes:
    "gtest1_1_pkey" PRIMARY KEY, btree (gemini_pk)
Inherits: gtest1

INSERT INTO gtest1_1 VALUES (4);
---END---
---START---
SELECT * FROM gtest1_1;
 a | b | gemini_pk 
---+---+-----------
 4 | 8 |         1
(1 row)

---END---
---START---
SELECT * FROM gtest1;
 a | b 
---+---
 3 | 6
 4 | 8
(2 rows)

---END---
---START---
CREATE TABLE gtest_normal (gemini_pk serial PRIMARY KEY, a integer, b integer);
---END---
---START---
CREATE TABLE gtest_normal_child (gemini_pk serial PRIMARY KEY, a integer, b integer GENERATED ALWAYS AS (a * 2) STORED) INHERITS (gtest_normal);
NOTICE:  merging column "gemini_pk" with inherited definition
NOTICE:  merging column "a" with inherited definition
NOTICE:  merging column "b" with inherited definition
ERROR:  child column "b" specifies generation expression
HINT:  A child table column cannot be generated unless its parent column is.
---END---
---START---
CREATE TABLE gtest_normal_child (gemini_pk serial PRIMARY KEY, a integer, b integer GENERATED ALWAYS AS (a * 2) STORED);
---END---
---START---
ALTER TABLE gtest_normal_child INHERIT gtest_normal;
ERROR:  column "b" in child table must not be a generated column
---END---
---START---
-- error
DROP TABLE gtest_normal, gtest_normal_child;
---END---
---START---
CREATE TABLE gtestx (gemini_pk serial PRIMARY KEY, x integer, b integer DEFAULT 10) INHERITS (gtest1);
NOTICE:  moving and merging column "b" with inherited definition
DETAIL:  User-specified column moved to the position of the inherited column.
ERROR:  column "b" inherits from generated column but specifies default
---END---
---START---
CREATE TABLE gtestx (gemini_pk serial PRIMARY KEY, x integer, b integer GENERATED ALWAYS AS IDENTITY) INHERITS (gtest1);
NOTICE:  moving and merging column "b" with inherited definition
DETAIL:  User-specified column moved to the position of the inherited column.
ERROR:  column "b" inherits from generated column but specifies identity
---END---
---START---
CREATE TABLE gtestx (gemini_pk serial PRIMARY KEY, x integer, b integer GENERATED ALWAYS AS (a * 22) STORED) INHERITS (gtest1);
NOTICE:  moving and merging column "b" with inherited definition
DETAIL:  User-specified column moved to the position of the inherited column.
---END---
---START---
-- ok, overrides parent
\d+ gtestx
                                                     Table "public.gtestx"
  Column   |  Type   | Collation | Nullable |                  Default                  | Storage | Stats target | Description 
-----------+---------+-----------+----------+-------------------------------------------+---------+--------------+-------------
 a         | integer |           | not null |                                           | plain   |              | 
 b         | integer |           |          | generated always as (a * 22) stored       | plain   |              | 
 gemini_pk | integer |           | not null | nextval('gtestx_gemini_pk_seq'::regclass) | plain   |              | 
 x         | integer |           |          |                                           | plain   |              | 
Indexes:
    "gtestx_pkey" PRIMARY KEY, btree (gemini_pk)
Inherits: gtest1

CREATE TABLE gtestxx_1 (gemini_pk serial PRIMARY KEY, a int NOT NULL, b int);
---END---
---START---
ALTER TABLE gtestxx_1 INHERIT gtest1;
ERROR:  column "b" in child table must be a generated column
---END---
---START---
CREATE TABLE gtestxx_3 (gemini_pk serial PRIMARY KEY, a integer NOT NULL, b integer GENERATED ALWAYS AS (a * 2) STORED);
---END---
---START---
ALTER TABLE gtestxx_3 INHERIT gtest1;
---END---
---START---
CREATE TABLE gtestxx_4 (gemini_pk serial PRIMARY KEY, b integer GENERATED ALWAYS AS (a * 2) STORED, a integer NOT NULL);
---END---
---START---
ALTER TABLE gtestxx_4 INHERIT gtest1;
---END---
---START---
CREATE TABLE gtesty (gemini_pk serial PRIMARY KEY, x integer, b integer DEFAULT 55);
---END---
---START---
CREATE TABLE gtest1_y (gemini_pk serial PRIMARY KEY) INHERITS (gtest0, gtesty);
NOTICE:  merging multiple inherited definitions of column "b"
ERROR:  inherited column "b" has a generation conflict
---END---
---START---
-- error
DROP TABLE gtesty;
---END---
---START---
CREATE TABLE gtesty (gemini_pk serial PRIMARY KEY, x integer, b integer);
---END---
---START---
CREATE TABLE gtest1_y (gemini_pk serial PRIMARY KEY) INHERITS (gtest1, gtesty);
NOTICE:  merging multiple inherited definitions of column "b"
ERROR:  inherited column "b" has a generation conflict
---END---
---START---
-- error
DROP TABLE gtesty;
---END---
---START---
CREATE TABLE gtesty (gemini_pk serial PRIMARY KEY, x integer, b integer GENERATED ALWAYS AS (x * 22) STORED);
---END---
---START---
CREATE TABLE gtest1_y (gemini_pk serial PRIMARY KEY) INHERITS (gtest1, gtesty);
NOTICE:  merging multiple inherited definitions of column "b"
NOTICE:  moving and merging column "gemini_pk" with inherited definition
DETAIL:  User-specified column moved to the position of the inherited column.
ERROR:  column "b" inherits conflicting generation expressions
HINT:  To resolve the conflict, specify a generation expression explicitly.
---END---
---START---
CREATE TABLE gtest1_y (gemini_pk serial PRIMARY KEY, b integer GENERATED ALWAYS AS (x + 1) STORED) INHERITS (gtest1, gtesty);
NOTICE:  merging multiple inherited definitions of column "b"
NOTICE:  moving and merging column "gemini_pk" with inherited definition
DETAIL:  User-specified column moved to the position of the inherited column.
NOTICE:  merging column "b" with inherited definition
---END---
---START---
-- ok
\d gtest1_y
                                 Table "public.gtest1_y"
  Column   |  Type   | Collation | Nullable |                   Default                   
-----------+---------+-----------+----------+---------------------------------------------
 a         | integer |           | not null | 
 b         | integer |           |          | generated always as (x + 1) stored
 gemini_pk | integer |           | not null | nextval('gtest1_y_gemini_pk_seq'::regclass)
 x         | integer |           |          | 
Indexes:
    "gtest1_y_pkey" PRIMARY KEY, btree (gemini_pk)
Inherits: gtest1,
          gtesty

-- test correct handling of GENERATED column that's only in child
CREATE TABLE gtestp (gemini_pk serial PRIMARY KEY, f1 int);
---END---
---START---
CREATE TABLE gtestc (gemini_pk serial PRIMARY KEY, f2 integer GENERATED ALWAYS AS (f1 + 1) STORED) INHERITS (gtestp);
NOTICE:  merging column "gemini_pk" with inherited definition
---END---
---START---
INSERT INTO gtestc values(42);
---END---
---START---
TABLE gtestc;
 gemini_pk | f1 | f2 
-----------+----+----
        42 |    |   
(1 row)

---END---
---START---
UPDATE gtestp SET f1 = f1 * 10;
---END---
---START---
TABLE gtestc;
 gemini_pk | f1 | f2 
-----------+----+----
        42 |    |   
(1 row)

---END---
---START---
DROP TABLE gtestp CASCADE;
NOTICE:  drop cascades to table gtestc
---END---
---START---
CREATE TABLE gtest3 (gemini_pk serial PRIMARY KEY, a integer, b integer GENERATED ALWAYS AS (a * 3) STORED);
---END---
---START---
INSERT INTO gtest3 (a) VALUES (1), (2), (3), (NULL);
---END---
---START---
SELECT * FROM gtest3 ORDER BY a;
 gemini_pk | a | b 
-----------+---+---
         1 | 1 | 3
         2 | 2 | 6
         3 | 3 | 9
         4 |   |  
(4 rows)

---END---
---START---
UPDATE gtest3 SET a = 22 WHERE a = 2;
---END---
---START---
SELECT * FROM gtest3 ORDER BY a;
 gemini_pk | a  | b  
-----------+----+----
         1 |  1 |  3
         3 |  3 |  9
         2 | 22 | 66
         4 |    |   
(4 rows)

---END---
---START---
CREATE TABLE gtest3a (gemini_pk serial PRIMARY KEY, a text, b text GENERATED ALWAYS AS ((a || '+') || a) STORED);
---END---
---START---
INSERT INTO gtest3a (a) VALUES ('a'), ('b'), ('c'), (NULL);
---END---
---START---
SELECT * FROM gtest3a ORDER BY a;
 gemini_pk | a |  b  
-----------+---+-----
         1 | a | a+a
         2 | b | b+b
         3 | c | c+c
         4 |   | 
(4 rows)

---END---
---START---
UPDATE gtest3a SET a = 'bb' WHERE a = 'b';
---END---
---START---
SELECT * FROM gtest3a ORDER BY a;
 gemini_pk | a  |   b   
-----------+----+-------
         1 | a  | a+a
         2 | bb | bb+bb
         3 | c  | c+c
         4 |    | 
(4 rows)

---END---
---START---
-- COPY
TRUNCATE gtest1;
---END---
---START---
INSERT INTO gtest1 (a) VALUES (1), (2);
---END---
---START---
COPY gtest1 TO stdout;
1
2
COPY gtest1 (a, b) TO stdout;
ERROR:  column "b" is a generated column
DETAIL:  Generated columns cannot be used in COPY.
-- COPY gtest1 FROM stdin;
-- 3
-- 4
-- \.
---END---
---START---
-- COPY gtest1 (a, b) FROM stdin;
SELECT * FROM gtest1 ORDER BY a;
 a | b 
---+---
 1 | 2
 2 | 4
(2 rows)

TRUNCATE gtest3;
INSERT INTO gtest3 (a) VALUES (1), (2);
COPY gtest3 TO stdout;
5	1
6	2
COPY gtest3 (a, b) TO stdout;
ERROR:  column "b" is a generated column
DETAIL:  Generated columns cannot be used in COPY.
-- COPY gtest3 FROM stdin;
-- 3
-- 4
-- \.
---END---
---START---
-- COPY gtest3 (a, b) FROM stdin;
---END---
---START---
SELECT * FROM gtest3 ORDER BY a;
 gemini_pk | a | b 
-----------+---+---
         5 | 1 | 3
         6 | 2 | 6
(2 rows)

---END---
---START---
-- null values
CREATE TABLE gtest2 (a int PRIMARY KEY, b int GENERATED ALWAYS AS (NULL) STORED);
---END---
---START---
INSERT INTO gtest2 VALUES (1);
---END---
---START---
SELECT * FROM gtest2;
 a | b 
---+---
 1 |  
(1 row)

---END---
---START---
CREATE TABLE gtest_varlena (gemini_pk serial PRIMARY KEY, a varchar, b varchar GENERATED ALWAYS AS (a) STORED);
---END---
---START---
INSERT INTO gtest_varlena (a) VALUES('01234567890123456789');
---END---
---START---
INSERT INTO gtest_varlena (a) VALUES(NULL);
---END---
---START---
SELECT * FROM gtest_varlena ORDER BY a;
 gemini_pk |          a           |          b           
-----------+----------------------+----------------------
         1 | 01234567890123456789 | 01234567890123456789
         2 |                      | 
(2 rows)

---END---
---START---
DROP TABLE gtest_varlena;
---END---
---START---
-- composite types
CREATE TYPE double_int as (a int, b int);
---END---
---START---
CREATE TABLE gtest4 (gemini_pk serial PRIMARY KEY, a integer, b double_int GENERATED ALWAYS AS ((a * 2, a * 3)) STORED);
---END---
---START---
INSERT INTO gtest4 VALUES (1), (6);
---END---
---START---
SELECT * FROM gtest4;
 gemini_pk | a |  b  
-----------+---+-----
         1 |   | (,)
         6 |   | (,)
(2 rows)

---END---
---START---
DROP TABLE gtest4;
---END---
---START---
DROP TYPE double_int;
---END---
---START---
-- using tableoid is allowed
CREATE TABLE gtest_tableoid (
  a int PRIMARY KEY,
  b bool GENERATED ALWAYS AS (tableoid = 'gtest_tableoid'::regclass) STORED
);
---END---
---START---
INSERT INTO gtest_tableoid VALUES (1), (2);
---END---
---START---
ALTER TABLE gtest_tableoid ADD COLUMN
  c regclass GENERATED ALWAYS AS (tableoid) STORED;
---END---
---START---
SELECT * FROM gtest_tableoid;
 a | b |       c        
---+---+----------------
 1 | t | gtest_tableoid
 2 | t | gtest_tableoid
(2 rows)

---END---
---START---
-- drop column behavior
CREATE TABLE gtest10 (a int PRIMARY KEY, b int, c int GENERATED ALWAYS AS (b * 2) STORED);
---END---
---START---
ALTER TABLE gtest10 DROP COLUMN b;
ERROR:  cannot drop column b of table gtest10 because other objects depend on it
DETAIL:  column c of table gtest10 depends on column b of table gtest10
HINT:  Use DROP ... CASCADE to drop the dependent objects too.
---END---
---START---
-- fails
ALTER TABLE gtest10 DROP COLUMN b CASCADE;
NOTICE:  drop cascades to column c of table gtest10
---END---
---START---
-- drops c too
\d gtest10
              Table "public.gtest10"
 Column |  Type   | Collation | Nullable | Default 
--------+---------+-----------+----------+---------
 a      | integer |           | not null | 
Indexes:
    "gtest10_pkey" PRIMARY KEY, btree (a)

CREATE TABLE gtest10a (a int PRIMARY KEY, b int GENERATED ALWAYS AS (a * 2) STORED);
---END---
---START---
ALTER TABLE gtest10a DROP COLUMN b;
---END---
---START---
INSERT INTO gtest10a (a) VALUES (1);
---END---
---START---
-- privileges
CREATE USER regress_user11;
---END---
---START---
CREATE TABLE gtest11s (a int PRIMARY KEY, b int, c int GENERATED ALWAYS AS (b * 2) STORED);
---END---
---START---
INSERT INTO gtest11s VALUES (1, 10), (2, 20);
---END---
---START---
GRANT SELECT (a, c) ON gtest11s TO regress_user11;
---END---
---START---
CREATE FUNCTION gf1(a int) RETURNS int AS $$ SELECT a * 3 $$ IMMUTABLE LANGUAGE SQL;
---END---
---START---
REVOKE ALL ON FUNCTION gf1(int) FROM PUBLIC;
---END---
---START---
CREATE TABLE gtest12s (a int PRIMARY KEY, b int, c int GENERATED ALWAYS AS (gf1(b)) STORED);
---END---
---START---
INSERT INTO gtest12s VALUES (1, 10), (2, 20);
---END---
---START---
GRANT SELECT (a, c) ON gtest12s TO regress_user11;
---END---
---START---
SET ROLE regress_user11;
---END---
---START---
SELECT a, b FROM gtest11s;
ERROR:  permission denied for table gtest11s
---END---
---START---
-- not allowed
SELECT a, c FROM gtest11s;
 a | c  
---+----
 1 | 20
 2 | 40
(2 rows)

---END---
---START---
-- allowed
SELECT gf1(10);
ERROR:  permission denied for function gf1
---END---
---START---
-- not allowed
SELECT a, c FROM gtest12s;
 a | c  
---+----
 1 | 30
 2 | 60
(2 rows)

---END---
---START---
-- allowed
RESET ROLE;
---END---
---START---
DROP FUNCTION gf1(int);
ERROR:  cannot drop function gf1(integer) because other objects depend on it
DETAIL:  column c of table gtest12s depends on function gf1(integer)
HINT:  Use DROP ... CASCADE to drop the dependent objects too.
---END---
---START---
-- fail
DROP TABLE gtest11s, gtest12s;
---END---
---START---
DROP FUNCTION gf1(int);
---END---
---START---
DROP USER regress_user11;
---END---
---START---
-- check constraints
CREATE TABLE gtest20 (a int PRIMARY KEY, b int GENERATED ALWAYS AS (a * 2) STORED CHECK (b < 50));
---END---
---START---
INSERT INTO gtest20 (a) VALUES (10);
---END---
---START---
-- ok
INSERT INTO gtest20 (a) VALUES (30);
ERROR:  new row for relation "gtest20" violates check constraint "gtest20_b_check"
DETAIL:  Failing row contains (30, 60).
---END---
---START---
-- violates constraint
CREATE TABLE gtest20a (a int PRIMARY KEY, b int GENERATED ALWAYS AS (a * 2) STORED);
---END---
---START---
INSERT INTO gtest20a (a) VALUES (10);
---END---
---START---
INSERT INTO gtest20a (a) VALUES (30);
---END---
---START---
ALTER TABLE gtest20a ADD CHECK (b < 50);
ERROR:  check constraint "gtest20a_b_check" of relation "gtest20a" is violated by some row
---END---
---START---
-- fails on existing row
CREATE TABLE gtest20b (a int PRIMARY KEY, b int GENERATED ALWAYS AS (a * 2) STORED);
---END---
---START---
INSERT INTO gtest20b (a) VALUES (10);
---END---
---START---
INSERT INTO gtest20b (a) VALUES (30);
---END---
---START---
ALTER TABLE gtest20b ADD CONSTRAINT chk CHECK (b < 50) NOT VALID;
---END---
---START---
ALTER TABLE gtest20b VALIDATE CONSTRAINT chk;
ERROR:  check constraint "chk" of relation "gtest20b" is violated by some row
---END---
---START---
-- fails on existing row
-- not-null constraints
CREATE TABLE gtest21a (a int PRIMARY KEY, b int GENERATED ALWAYS AS (nullif(a, 0)) STORED NOT NULL);
---END---
---START---
INSERT INTO gtest21a (a) VALUES (1);
---END---
---START---
-- ok
INSERT INTO gtest21a (a) VALUES (0);
ERROR:  null value in column "b" of relation "gtest21a" violates not-null constraint
DETAIL:  Failing row contains (0, null).
---END---
---START---
-- violates constraint
CREATE TABLE gtest21b (a int PRIMARY KEY, b int GENERATED ALWAYS AS (nullif(a, 0)) STORED);
---END---
---START---
ALTER TABLE gtest21b ALTER COLUMN b SET NOT NULL;
---END---
---START---
INSERT INTO gtest21b (a) VALUES (1);
---END---
---START---
-- ok
INSERT INTO gtest21b (a) VALUES (0);
ERROR:  null value in column "b" of relation "gtest21b" violates not-null constraint
DETAIL:  Failing row contains (0, null).
---END---
---START---
-- violates constraint
ALTER TABLE gtest21b ALTER COLUMN b DROP NOT NULL;
---END---
---START---
INSERT INTO gtest21b (a) VALUES (0);
---END---
---START---
-- ok now
-- index constraints
CREATE TABLE gtest22a (a int PRIMARY KEY, b int GENERATED ALWAYS AS (a / 2) STORED UNIQUE);
---END---
---START---
INSERT INTO gtest22a VALUES (2);
---END---
---START---
INSERT INTO gtest22a VALUES (3);
ERROR:  duplicate key value violates unique constraint "gtest22a_b_key"
DETAIL:  Key (b)=(1) already exists.
---END---
---START---
INSERT INTO gtest22a VALUES (4);
---END---
---START---
CREATE TABLE gtest22b (a int, b int GENERATED ALWAYS AS (a / 2) STORED, PRIMARY KEY (a, b));
---END---
---START---
INSERT INTO gtest22b VALUES (2);
---END---
---START---
INSERT INTO gtest22b VALUES (2);
ERROR:  duplicate key value violates unique constraint "gtest22b_pkey"
DETAIL:  Key (a, b)=(2, 1) already exists.
---END---
---START---
CREATE TABLE gtest22c (gemini_pk serial PRIMARY KEY, a integer, b integer GENERATED ALWAYS AS (a * 2) STORED);
---END---
---START---
CREATE INDEX gtest22c_b_idx ON gtest22c (b);
---END---
---START---
CREATE INDEX gtest22c_expr_idx ON gtest22c ((b * 3));
---END---
---START---
CREATE INDEX gtest22c_pred_idx ON gtest22c (a) WHERE b > 0;
---END---
---START---
\d gtest22c
                                 Table "public.gtest22c"
  Column   |  Type   | Collation | Nullable |                   Default                   
-----------+---------+-----------+----------+---------------------------------------------
 gemini_pk | integer |           | not null | nextval('gtest22c_gemini_pk_seq'::regclass)
 a         | integer |           |          | 
 b         | integer |           |          | generated always as (a * 2) stored
Indexes:
    "gtest22c_pkey" PRIMARY KEY, btree (gemini_pk)
    "gtest22c_b_idx" btree (b)
    "gtest22c_expr_idx" btree ((b * 3))
    "gtest22c_pred_idx" btree (a) WHERE b > 0

INSERT INTO gtest22c VALUES (1), (2), (3);
---END---
---START---
SET enable_seqscan TO off;
---END---
---START---
SET enable_bitmapscan TO off;
---END---
---START---
EXPLAIN (COSTS OFF) SELECT * FROM gtest22c WHERE b = 4;
                 QUERY PLAN                  
---------------------------------------------
 Index Scan using gtest22c_b_idx on gtest22c
   Index Cond: (b = 4)
(2 rows)

---END---
---START---
SELECT * FROM gtest22c WHERE b = 4;
 gemini_pk | a | b 
-----------+---+---
(0 rows)

---END---
---START---
EXPLAIN (COSTS OFF) SELECT * FROM gtest22c WHERE b * 3 = 6;
                   QUERY PLAN                   
------------------------------------------------
 Index Scan using gtest22c_expr_idx on gtest22c
   Index Cond: ((b * 3) = 6)
(2 rows)

---END---
---START---
SELECT * FROM gtest22c WHERE b * 3 = 6;
 gemini_pk | a | b 
-----------+---+---
(0 rows)

---END---
---START---
EXPLAIN (COSTS OFF) SELECT * FROM gtest22c WHERE a = 1 AND b > 0;
                   QUERY PLAN                   
------------------------------------------------
 Index Scan using gtest22c_pred_idx on gtest22c
   Index Cond: (a = 1)
(2 rows)

---END---
---START---
SELECT * FROM gtest22c WHERE a = 1 AND b > 0;
 gemini_pk | a | b 
-----------+---+---
(0 rows)

---END---
---START---
RESET enable_seqscan;
---END---
---START---
RESET enable_bitmapscan;
---END---
---START---
-- foreign keys
CREATE TABLE gtest23a (x int PRIMARY KEY, y int);
---END---
---START---
INSERT INTO gtest23a VALUES (1, 11), (2, 22), (3, 33);
---END---
---START---
CREATE TABLE gtest23x (a int PRIMARY KEY, b int GENERATED ALWAYS AS (a * 2) STORED REFERENCES gtest23a (x) ON UPDATE CASCADE);
ERROR:  invalid ON UPDATE action for foreign key constraint containing generated column
---END---
---START---
-- error
CREATE TABLE gtest23x (a int PRIMARY KEY, b int GENERATED ALWAYS AS (a * 2) STORED REFERENCES gtest23a (x) ON DELETE SET NULL);
ERROR:  invalid ON DELETE action for foreign key constraint containing generated column
---END---
---START---
-- error
CREATE TABLE gtest23b (a int PRIMARY KEY, b int GENERATED ALWAYS AS (a * 2) STORED REFERENCES gtest23a (x));
---END---
---START---
\d gtest23b
                           Table "public.gtest23b"
 Column |  Type   | Collation | Nullable |              Default               
--------+---------+-----------+----------+------------------------------------
 a      | integer |           | not null | 
 b      | integer |           |          | generated always as (a * 2) stored
Indexes:
    "gtest23b_pkey" PRIMARY KEY, btree (a)
Foreign-key constraints:
    "gtest23b_b_fkey" FOREIGN KEY (b) REFERENCES gtest23a(x)

INSERT INTO gtest23b VALUES (1);
---END---
---START---
-- ok
INSERT INTO gtest23b VALUES (5);
ERROR:  insert or update on table "gtest23b" violates foreign key constraint "gtest23b_b_fkey"
DETAIL:  Key (b)=(10) is not present in table "gtest23a".
---END---
---START---
-- error
DROP TABLE gtest23b;
---END---
---START---
DROP TABLE gtest23a;
---END---
---START---
CREATE TABLE gtest23p (x int, y int GENERATED ALWAYS AS (x * 2) STORED, PRIMARY KEY (y));
---END---
---START---
INSERT INTO gtest23p VALUES (1), (2), (3);
---END---
---START---
CREATE TABLE gtest23q (a int PRIMARY KEY, b int REFERENCES gtest23p (y));
---END---
---START---
INSERT INTO gtest23q VALUES (1, 2);
---END---
---START---
-- ok
INSERT INTO gtest23q VALUES (2, 5);
ERROR:  insert or update on table "gtest23q" violates foreign key constraint "gtest23q_b_fkey"
DETAIL:  Key (b)=(5) is not present in table "gtest23p".
---END---
---START---
-- error
-- domains
CREATE DOMAIN gtestdomain1 AS int CHECK (VALUE < 10);
---END---
---START---
CREATE TABLE gtest24 (a int PRIMARY KEY, b gtestdomain1 GENERATED ALWAYS AS (a * 2) STORED);
---END---
---START---
INSERT INTO gtest24 (a) VALUES (4);
---END---
---START---
-- ok
INSERT INTO gtest24 (a) VALUES (6);
ERROR:  value for domain gtestdomain1 violates check constraint "gtestdomain1_check"
---END---
---START---
-- error
-- typed tables (currently not supported)
CREATE TYPE gtest_type AS (f1 integer, f2 text, f3 bigint);
---END---
---START---
CREATE TABLE gtest28 OF gtest_type (gemini_pk serial PRIMARY KEY, f1 WITH OPTIONS GENERATED ALWAYS AS (f2 * 2) STORED);
ERROR:  syntax error at or near "serial"
LINE 1: CREATE TABLE gtest28 OF gtest_type (gemini_pk serial PRIMARY...
                                                      ^
---END---
---START---
DROP TYPE gtest_type CASCADE;
---END---
---START---
CREATE TABLE gtest_parent (gemini_pk serial PRIMARY KEY, f1 date NOT NULL, f2 bigint, f3 bigint) PARTITION BY range (f1);
ERROR:  unique constraint on partitioned table must include all partitioning columns
DETAIL:  PRIMARY KEY constraint on table "gtest_parent" lacks column "f1" which is part of the partition key.
---END---
---START---
CREATE TABLE gtest_child PARTITION OF gtest_parent (
    f3 WITH OPTIONS GENERATED ALWAYS AS (f2 * 2) STORED
) FOR VALUES FROM ('2016-07-01') TO ('2016-08-01');
ERROR:  relation "gtest_parent" does not exist
---END---
---START---
CREATE TABLE gtest_child (gemini_pk serial PRIMARY KEY, f1 date NOT NULL, f2 bigint, f3 bigint GENERATED ALWAYS AS (f2 * 2) STORED);
---END---
---START---
ALTER TABLE gtest_parent ATTACH PARTITION gtest_child FOR VALUES FROM ('2016-07-01') TO ('2016-08-01');
ERROR:  relation "gtest_parent" does not exist
---END---
---START---
-- error
DROP TABLE gtest_parent, gtest_child;
ERROR:  table "gtest_parent" does not exist
---END---
---START---
CREATE TABLE gtest_parent (gemini_pk serial PRIMARY KEY, f1 date NOT NULL, f2 bigint, f3 bigint GENERATED ALWAYS AS (f2 * 2) STORED) PARTITION BY range (f1);
ERROR:  unique constraint on partitioned table must include all partitioning columns
DETAIL:  PRIMARY KEY constraint on table "gtest_parent" lacks column "f1" which is part of the partition key.
---END---
---START---
CREATE TABLE gtest_child PARTITION OF gtest_parent
  FOR VALUES FROM ('2016-07-01') TO ('2016-08-01');
ERROR:  relation "gtest_parent" does not exist
---END---
---START---
-- inherits gen expr
CREATE TABLE gtest_child2 PARTITION OF gtest_parent (
    f3 WITH OPTIONS GENERATED ALWAYS AS (f2 * 22) STORED  -- overrides gen expr
) FOR VALUES FROM ('2016-08-01') TO ('2016-09-01');
ERROR:  relation "gtest_parent" does not exist
---END---
---START---
CREATE TABLE gtest_child3 PARTITION OF gtest_parent (
    f3 DEFAULT 42  -- error
) FOR VALUES FROM ('2016-09-01') TO ('2016-10-01');
ERROR:  relation "gtest_parent" does not exist
---END---
---START---
CREATE TABLE gtest_child3 PARTITION OF gtest_parent (
    f3 WITH OPTIONS GENERATED ALWAYS AS IDENTITY  -- error
) FOR VALUES FROM ('2016-09-01') TO ('2016-10-01');
ERROR:  identity columns are not supported on partitions
---END---
---START---
CREATE TABLE gtest_child3 (gemini_pk serial PRIMARY KEY, f1 date NOT NULL, f2 bigint, f3 bigint);
---END---
---START---
ALTER TABLE gtest_parent ATTACH PARTITION gtest_child3 FOR VALUES FROM ('2016-09-01') TO ('2016-10-01');
ERROR:  relation "gtest_parent" does not exist
---END---
---START---
-- error
DROP TABLE gtest_child3;
---END---
---START---
CREATE TABLE gtest_child3 (gemini_pk serial PRIMARY KEY, f1 date NOT NULL, f2 bigint, f3 bigint DEFAULT 42);
---END---
---START---
ALTER TABLE gtest_parent ATTACH PARTITION gtest_child3 FOR VALUES FROM ('2016-09-01') TO ('2016-10-01');
ERROR:  relation "gtest_parent" does not exist
---END---
---START---
-- error
DROP TABLE gtest_child3;
---END---
---START---
CREATE TABLE gtest_child3 (gemini_pk serial PRIMARY KEY, f1 date NOT NULL, f2 bigint, f3 bigint GENERATED ALWAYS AS IDENTITY);
---END---
---START---
ALTER TABLE gtest_parent ATTACH PARTITION gtest_child3 FOR VALUES FROM ('2016-09-01') TO ('2016-10-01');
ERROR:  relation "gtest_parent" does not exist
---END---
---START---
-- error
DROP TABLE gtest_child3;
---END---
---START---
CREATE TABLE gtest_child3 (gemini_pk serial PRIMARY KEY, f1 date NOT NULL, f2 bigint, f3 bigint GENERATED ALWAYS AS (f2 * 33) STORED);
---END---
---START---
ALTER TABLE gtest_parent ATTACH PARTITION gtest_child3 FOR VALUES FROM ('2016-09-01') TO ('2016-10-01');
ERROR:  relation "gtest_parent" does not exist
---END---
---START---
\d gtest_child
                                 Table "public.gtest_child"
  Column   |  Type   | Collation | Nullable |                    Default                     
-----------+---------+-----------+----------+------------------------------------------------
 gemini_pk | integer |           | not null | nextval('gtest_child_gemini_pk_seq'::regclass)
 f1        | date    |           | not null | 
 f2        | bigint  |           |          | 
 f3        | bigint  |           |          | generated always as (f2 * 2) stored
Indexes:
    "gtest_child_pkey" PRIMARY KEY, btree (gemini_pk)

\d gtest_child2
\d gtest_child3
                                 Table "public.gtest_child3"
  Column   |  Type   | Collation | Nullable |                     Default                     
-----------+---------+-----------+----------+-------------------------------------------------
 gemini_pk | integer |           | not null | nextval('gtest_child3_gemini_pk_seq'::regclass)
 f1        | date    |           | not null | 
 f2        | bigint  |           |          | 
 f3        | bigint  |           |          | generated always as (f2 * 33) stored
Indexes:
    "gtest_child3_pkey" PRIMARY KEY, btree (gemini_pk)

INSERT INTO gtest_parent (f1, f2) VALUES ('2016-07-15', 1);
ERROR:  relation "gtest_parent" does not exist
LINE 1: INSERT INTO gtest_parent (f1, f2) VALUES ('2016-07-15', 1);
                    ^
---END---
---START---
SELECT * FROM gtest_parent;
ERROR:  relation "gtest_parent" does not exist
LINE 1: SELECT * FROM gtest_parent;
                      ^
---END---
---START---
SELECT * FROM gtest_child;
 gemini_pk | f1 | f2 | f3 
-----------+----+----+----
(0 rows)

---END---
---START---
UPDATE gtest_parent SET f1 = f1 + 60;
ERROR:  relation "gtest_parent" does not exist
LINE 1: UPDATE gtest_parent SET f1 = f1 + 60;
               ^
---END---
---START---
SELECT * FROM gtest_parent;
ERROR:  relation "gtest_parent" does not exist
LINE 1: SELECT * FROM gtest_parent;
                      ^
---END---
---START---
SELECT * FROM gtest_child3;
 gemini_pk | f1 | f2 | f3 
-----------+----+----+----
(0 rows)

---END---
---START---
CREATE TABLE gtest_part_key (gemini_pk serial PRIMARY KEY, f1 date NOT NULL, f2 bigint, f3 bigint GENERATED ALWAYS AS (f2 * 2) STORED) PARTITION BY range (f3);
ERROR:  cannot use generated column in partition key
LINE 1: ...ENERATED ALWAYS AS (f2 * 2) STORED) PARTITION BY range (f3);
                                                                   ^
DETAIL:  Column "f3" is a generated column.
---END---
---START---
CREATE TABLE gtest_part_key (gemini_pk serial PRIMARY KEY, f1 date NOT NULL, f2 bigint, f3 bigint GENERATED ALWAYS AS (f2 * 2) STORED) PARTITION BY range ((f3 * 3));
ERROR:  cannot use generated column in partition key
LINE 1: ...ED ALWAYS AS (f2 * 2) STORED) PARTITION BY range ((f3 * 3));
                                                             ^
DETAIL:  Column "f3" is a generated column.
---END---
---START---
-- ALTER TABLE ... ADD COLUMN
CREATE TABLE gtest25 (a int PRIMARY KEY);
---END---
---START---
INSERT INTO gtest25 VALUES (3), (4);
---END---
---START---
ALTER TABLE gtest25 ADD COLUMN b int GENERATED ALWAYS AS (a * 3) STORED;
---END---
---START---
SELECT * FROM gtest25 ORDER BY a;
 a | b  
---+----
 3 |  9
 4 | 12
(2 rows)

---END---
---START---
ALTER TABLE gtest25 ADD COLUMN x int GENERATED ALWAYS AS (b * 4) STORED;
ERROR:  cannot use generated column "b" in column generation expression
DETAIL:  A generated column cannot reference another generated column.
---END---
---START---
-- error
ALTER TABLE gtest25 ADD COLUMN x int GENERATED ALWAYS AS (z * 4) STORED;
ERROR:  column "z" does not exist
---END---
---START---
-- error
ALTER TABLE gtest25 ADD COLUMN c int DEFAULT 42,
  ADD COLUMN x int GENERATED ALWAYS AS (c * 4) STORED;
---END---
---START---
ALTER TABLE gtest25 ADD COLUMN d int DEFAULT 101;
---END---
---START---
ALTER TABLE gtest25 ALTER COLUMN d SET DATA TYPE float8,
  ADD COLUMN y float8 GENERATED ALWAYS AS (d * 4) STORED;
---END---
---START---
SELECT * FROM gtest25 ORDER BY a;
 a | b  | c  |  x  |  d  |  y  
---+----+----+-----+-----+-----
 3 |  9 | 42 | 168 | 101 | 404
 4 | 12 | 42 | 168 | 101 | 404
(2 rows)

---END---
---START---
\d gtest25
                                         Table "public.gtest25"
 Column |       Type       | Collation | Nullable |                       Default                        
--------+------------------+-----------+----------+------------------------------------------------------
 a      | integer          |           | not null | 
 b      | integer          |           |          | generated always as (a * 3) stored
 c      | integer          |           |          | 42
 x      | integer          |           |          | generated always as (c * 4) stored
 d      | double precision |           |          | 101
 y      | double precision |           |          | generated always as (d * 4::double precision) stored
Indexes:
    "gtest25_pkey" PRIMARY KEY, btree (a)

-- ALTER TABLE ... ALTER COLUMN
CREATE TABLE gtest27 (
    a int,
    b int,
    x int GENERATED ALWAYS AS ((a + b) * 2) STORED
);
---END---
---START---
INSERT INTO gtest27 (a, b) VALUES (3, 7), (4, 11);
---END---
---START---
ALTER TABLE gtest27 ALTER COLUMN a TYPE text;
ERROR:  cannot alter type of a column used by a generated column
DETAIL:  Column "a" is used by generated column "x".
---END---
---START---
-- error
ALTER TABLE gtest27 ALTER COLUMN x TYPE numeric;
---END---
---START---
\d gtest27
                                Table "public.gtest27"
 Column |  Type   | Collation | Nullable |                  Default                   
--------+---------+-----------+----------+--------------------------------------------
 a      | integer |           |          | 
 b      | integer |           |          | 
 x      | numeric |           |          | generated always as (((a + b) * 2)) stored

SELECT * FROM gtest27;
 a | b  | x  
---+----+----
 3 |  7 | 20
 4 | 11 | 30
(2 rows)

---END---
---START---
ALTER TABLE gtest27 ALTER COLUMN x TYPE boolean USING x <> 0;
ERROR:  cannot specify USING when altering type of generated column
DETAIL:  Column "x" is a generated column.
---END---
---START---
-- error
ALTER TABLE gtest27 ALTER COLUMN x DROP DEFAULT;
ERROR:  column "x" of relation "gtest27" is a generated column
HINT:  Use ALTER TABLE ... ALTER COLUMN ... DROP EXPRESSION instead.
---END---
---START---
-- error
-- It's possible to alter the column types this way:
ALTER TABLE gtest27
  DROP COLUMN x,
  ALTER COLUMN a TYPE bigint,
  ALTER COLUMN b TYPE bigint,
  ADD COLUMN x bigint GENERATED ALWAYS AS ((a + b) * 2) STORED;
---END---
---START---
\d gtest27
                              Table "public.gtest27"
 Column |  Type  | Collation | Nullable |                 Default                  
--------+--------+-----------+----------+------------------------------------------
 a      | bigint |           |          | 
 b      | bigint |           |          | 
 x      | bigint |           |          | generated always as ((a + b) * 2) stored

-- Ideally you could just do this, but not today (and should x change type?):
ALTER TABLE gtest27
  ALTER COLUMN a TYPE float8,
  ALTER COLUMN b TYPE float8;
ERROR:  cannot alter type of a column used by a generated column
DETAIL:  Column "a" is used by generated column "x".
---END---
---START---
-- error
\d gtest27
                              Table "public.gtest27"
 Column |  Type  | Collation | Nullable |                 Default                  
--------+--------+-----------+----------+------------------------------------------
 a      | bigint |           |          | 
 b      | bigint |           |          | 
 x      | bigint |           |          | generated always as ((a + b) * 2) stored

SELECT * FROM gtest27;
 a | b  | x  
---+----+----
 3 |  7 | 20
 4 | 11 | 30
(2 rows)

---END---
---START---
CREATE TABLE gtest29 (gemini_pk serial PRIMARY KEY, a integer, b integer GENERATED ALWAYS AS (a * 2) STORED);
---END---
---START---
INSERT INTO gtest29 (a) VALUES (3), (4);
---END---
---START---
ALTER TABLE gtest29 ALTER COLUMN a DROP EXPRESSION;
ERROR:  column "a" of relation "gtest29" is not a stored generated column
---END---
---START---
-- error
ALTER TABLE gtest29 ALTER COLUMN a DROP EXPRESSION IF EXISTS;
NOTICE:  column "a" of relation "gtest29" is not a stored generated column, skipping
---END---
---START---
-- notice
ALTER TABLE gtest29 ALTER COLUMN b DROP EXPRESSION;
---END---
---START---
INSERT INTO gtest29 (a) VALUES (5);
---END---
---START---
INSERT INTO gtest29 (a, b) VALUES (6, 66);
---END---
---START---
SELECT * FROM gtest29;
 gemini_pk | a | b  
-----------+---+----
         1 | 3 |  6
         2 | 4 |  8
         3 | 5 |   
         4 | 6 | 66
(4 rows)

---END---
---START---
\d gtest29
                                 Table "public.gtest29"
  Column   |  Type   | Collation | Nullable |                  Default                   
-----------+---------+-----------+----------+--------------------------------------------
 gemini_pk | integer |           | not null | nextval('gtest29_gemini_pk_seq'::regclass)
 a         | integer |           |          | 
 b         | integer |           |          | 
Indexes:
    "gtest29_pkey" PRIMARY KEY, btree (gemini_pk)

-- check that dependencies between columns have also been removed
ALTER TABLE gtest29 DROP COLUMN a;
---END---
---START---
-- should not drop b
\d gtest29
                                 Table "public.gtest29"
  Column   |  Type   | Collation | Nullable |                  Default                   
-----------+---------+-----------+----------+--------------------------------------------
 gemini_pk | integer |           | not null | nextval('gtest29_gemini_pk_seq'::regclass)
 b         | integer |           |          | 
Indexes:
    "gtest29_pkey" PRIMARY KEY, btree (gemini_pk)

-- with inheritance
CREATE TABLE gtest30 (
    a int,
    b int GENERATED ALWAYS AS (a * 2) STORED
);
---END---
---START---
CREATE TABLE gtest30_1 (gemini_pk serial PRIMARY KEY) INHERITS (gtest30);
---END---
---START---
ALTER TABLE gtest30 ALTER COLUMN b DROP EXPRESSION;
---END---
---START---
\d gtest30
              Table "public.gtest30"
 Column |  Type   | Collation | Nullable | Default 
--------+---------+-----------+----------+---------
 a      | integer |           |          | 
 b      | integer |           |          | 
Number of child tables: 1 (Use \d+ to list them.)

\d gtest30_1
                                 Table "public.gtest30_1"
  Column   |  Type   | Collation | Nullable |                   Default                    
-----------+---------+-----------+----------+----------------------------------------------
 a         | integer |           |          | 
 b         | integer |           |          | 
 gemini_pk | integer |           | not null | nextval('gtest30_1_gemini_pk_seq'::regclass)
Indexes:
    "gtest30_1_pkey" PRIMARY KEY, btree (gemini_pk)
Inherits: gtest30

DROP TABLE gtest30 CASCADE;
NOTICE:  drop cascades to table gtest30_1
---END---
---START---
CREATE TABLE gtest30 (gemini_pk serial PRIMARY KEY, a integer, b integer GENERATED ALWAYS AS (a * 2) STORED);
---END---
---START---
CREATE TABLE gtest30_1 (gemini_pk serial PRIMARY KEY) INHERITS (gtest30);
NOTICE:  merging column "gemini_pk" with inherited definition
---END---
---START---
ALTER TABLE ONLY gtest30 ALTER COLUMN b DROP EXPRESSION;
ERROR:  ALTER TABLE / DROP EXPRESSION must be applied to child tables too
---END---
---START---
-- error
\d gtest30
                                 Table "public.gtest30"
  Column   |  Type   | Collation | Nullable |                  Default                   
-----------+---------+-----------+----------+--------------------------------------------
 gemini_pk | integer |           | not null | nextval('gtest30_gemini_pk_seq'::regclass)
 a         | integer |           |          | 
 b         | integer |           |          | generated always as (a * 2) stored
Indexes:
    "gtest30_pkey" PRIMARY KEY, btree (gemini_pk)
Number of child tables: 1 (Use \d+ to list them.)

\d gtest30_1
                                 Table "public.gtest30_1"
  Column   |  Type   | Collation | Nullable |                   Default                    
-----------+---------+-----------+----------+----------------------------------------------
 gemini_pk | integer |           | not null | nextval('gtest30_1_gemini_pk_seq'::regclass)
 a         | integer |           |          | 
 b         | integer |           |          | generated always as (a * 2) stored
Indexes:
    "gtest30_1_pkey" PRIMARY KEY, btree (gemini_pk)
Inherits: gtest30

ALTER TABLE gtest30_1 ALTER COLUMN b DROP EXPRESSION;
ERROR:  cannot drop generation expression from inherited column
---END---
---START---
-- error
-- triggers
CREATE TABLE gtest26 (
    a int PRIMARY KEY,
    b int GENERATED ALWAYS AS (a * 2) STORED
);
---END---
---START---
CREATE FUNCTION gtest_trigger_func() RETURNS trigger
  LANGUAGE plpgsql
AS $$
BEGIN
  IF tg_op IN ('DELETE', 'UPDATE') THEN
    RAISE INFO '%: %: old = %', TG_NAME, TG_WHEN, OLD;
  END IF;
  IF tg_op IN ('INSERT', 'UPDATE') THEN
    RAISE INFO '%: %: new = %', TG_NAME, TG_WHEN, NEW;
  END IF;
  IF tg_op = 'DELETE' THEN
    RETURN OLD;
  ELSE
    RETURN NEW;
  END IF;
END
$$;
---END---
---START---
CREATE TRIGGER gtest1 BEFORE DELETE OR UPDATE ON gtest26
  FOR EACH ROW
  WHEN (OLD.b < 0)  -- ok
  EXECUTE PROCEDURE gtest_trigger_func();
---END---
---START---
CREATE TRIGGER gtest2a BEFORE INSERT OR UPDATE ON gtest26
  FOR EACH ROW
  WHEN (NEW.b < 0)  -- error
  EXECUTE PROCEDURE gtest_trigger_func();
ERROR:  BEFORE trigger's WHEN condition cannot reference NEW generated columns
LINE 3:   WHEN (NEW.b < 0)  -- error
                ^
DETAIL:  Column "b" is a generated column.
---END---
---START---
CREATE TRIGGER gtest2b BEFORE INSERT OR UPDATE ON gtest26
  FOR EACH ROW
  WHEN (NEW.* IS NOT NULL)  -- error
  EXECUTE PROCEDURE gtest_trigger_func();
ERROR:  BEFORE trigger's WHEN condition cannot reference NEW generated columns
LINE 3:   WHEN (NEW.* IS NOT NULL)  -- error
                ^
DETAIL:  A whole-row reference is used and the table contains generated columns.
---END---
---START---
CREATE TRIGGER gtest2 BEFORE INSERT ON gtest26
  FOR EACH ROW
  WHEN (NEW.a < 0)
  EXECUTE PROCEDURE gtest_trigger_func();
---END---
---START---
CREATE TRIGGER gtest3 AFTER DELETE OR UPDATE ON gtest26
  FOR EACH ROW
  WHEN (OLD.b < 0)  -- ok
  EXECUTE PROCEDURE gtest_trigger_func();
---END---
---START---
CREATE TRIGGER gtest4 AFTER INSERT OR UPDATE ON gtest26
  FOR EACH ROW
  WHEN (NEW.b < 0)  -- ok
  EXECUTE PROCEDURE gtest_trigger_func();
---END---
---START---
INSERT INTO gtest26 (a) VALUES (-2), (0), (3);
INFO:  gtest2: BEFORE: new = (-2,)
INFO:  gtest4: AFTER: new = (-2,-4)
---END---
---START---
SELECT * FROM gtest26 ORDER BY a;
 a  | b  
----+----
 -2 | -4
  0 |  0
  3 |  6
(3 rows)

---END---
---START---
UPDATE gtest26 SET a = a * -2;
INFO:  gtest1: BEFORE: old = (-2,-4)
INFO:  gtest1: BEFORE: new = (4,)
INFO:  gtest3: AFTER: old = (-2,-4)
INFO:  gtest3: AFTER: new = (4,8)
INFO:  gtest4: AFTER: old = (3,6)
INFO:  gtest4: AFTER: new = (-6,-12)
---END---
---START---
SELECT * FROM gtest26 ORDER BY a;
 a  |  b  
----+-----
 -6 | -12
  0 |   0
  4 |   8
(3 rows)

---END---
---START---
DELETE FROM gtest26 WHERE a = -6;
INFO:  gtest1: BEFORE: old = (-6,-12)
INFO:  gtest3: AFTER: old = (-6,-12)
---END---
---START---
SELECT * FROM gtest26 ORDER BY a;
 a | b 
---+---
 0 | 0
 4 | 8
(2 rows)

---END---
---START---
DROP TRIGGER gtest1 ON gtest26;
---END---
---START---
DROP TRIGGER gtest2 ON gtest26;
---END---
---START---
DROP TRIGGER gtest3 ON gtest26;
---END---
---START---
-- Check that an UPDATE of "a" fires the trigger for UPDATE OF b, per
-- SQL standard.
CREATE FUNCTION gtest_trigger_func3() RETURNS trigger
  LANGUAGE plpgsql
AS $$
BEGIN
  RAISE NOTICE 'OK';
  RETURN NEW;
END
$$;
---END---
---START---
CREATE TRIGGER gtest11 BEFORE UPDATE OF b ON gtest26
  FOR EACH ROW
  EXECUTE PROCEDURE gtest_trigger_func3();
---END---
---START---
UPDATE gtest26 SET a = 1 WHERE a = 0;
NOTICE:  OK
---END---
---START---
DROP TRIGGER gtest11 ON gtest26;
---END---
---START---
TRUNCATE gtest26;
---END---
---START---
-- check that modifications of stored generated columns in triggers do
-- not get propagated
CREATE FUNCTION gtest_trigger_func4() RETURNS trigger
  LANGUAGE plpgsql
AS $$
BEGIN
  NEW.a = 10;
  NEW.b = 300;
  RETURN NEW;
END;
$$;
---END---
---START---
CREATE TRIGGER gtest12_01 BEFORE UPDATE ON gtest26
  FOR EACH ROW
  EXECUTE PROCEDURE gtest_trigger_func();
---END---
---START---
CREATE TRIGGER gtest12_02 BEFORE UPDATE ON gtest26
  FOR EACH ROW
  EXECUTE PROCEDURE gtest_trigger_func4();
---END---
---START---
CREATE TRIGGER gtest12_03 BEFORE UPDATE ON gtest26
  FOR EACH ROW
  EXECUTE PROCEDURE gtest_trigger_func();
---END---
---START---
INSERT INTO gtest26 (a) VALUES (1);
---END---
---START---
UPDATE gtest26 SET a = 11 WHERE a = 1;
INFO:  gtest12_01: BEFORE: old = (1,2)
INFO:  gtest12_01: BEFORE: new = (11,)
INFO:  gtest12_03: BEFORE: old = (1,2)
INFO:  gtest12_03: BEFORE: new = (10,)
---END---
---START---
SELECT * FROM gtest26 ORDER BY a;
 a  | b  
----+----
 10 | 20
(1 row)

---END---
---START---
CREATE TABLE gtest28a (gemini_pk serial PRIMARY KEY, a integer, b integer, c integer, x integer GENERATED ALWAYS AS (b * 2) STORED);
---END---
---START---
ALTER TABLE gtest28a DROP COLUMN a;
---END---
---START---
CREATE TABLE gtest28b (gemini_pk serial PRIMARY KEY, LIKE gtest28a INCLUDING GENERATED);
ERROR:  column "gemini_pk" specified more than once
---END---
