---START---
-- sanity check of system catalog
SELECT attrelid, attname, attidentity FROM pg_attribute WHERE attidentity NOT IN ('', 'a', 'd');
 attrelid | attname | attidentity 
----------+---------+-------------
(0 rows)

---END---
---START---
CREATE TABLE itest1 (gemini_pk serial PRIMARY KEY, a integer GENERATED BY DEFAULT AS IDENTITY, b text);
---END---
---START---
CREATE TABLE itest2 (gemini_pk serial PRIMARY KEY, a bigint GENERATED ALWAYS AS IDENTITY, b text);
---END---
---START---
CREATE TABLE itest3 (gemini_pk serial PRIMARY KEY, a smallint GENERATED BY DEFAULT AS IDENTITY(START WITH 7 INCREMENT BY 5), b text);
---END---
---START---
ALTER TABLE itest3 ALTER COLUMN a ADD GENERATED ALWAYS AS IDENTITY;
ERROR:  column "a" of relation "itest3" is already an identity column
---END---
---START---
-- error
SELECT table_name, column_name, column_default, is_nullable, is_identity, identity_generation, identity_start, identity_increment, identity_maximum, identity_minimum, identity_cycle FROM information_schema.columns WHERE table_name LIKE 'itest_' ORDER BY 1, 2;
 table_name | column_name |              column_default               | is_nullable | is_identity | identity_generation | identity_start | identity_increment |  identity_maximum   | identity_minimum | identity_cycle 
------------+-------------+-------------------------------------------+-------------+-------------+---------------------+----------------+--------------------+---------------------+------------------+----------------
 itest1     | a           |                                           | NO          | YES         | BY DEFAULT          | 1              | 1                  | 2147483647          | 1                | NO
 itest1     | b           |                                           | YES         | NO          |                     |                |                    |                     |                  | NO
 itest1     | gemini_pk   | nextval('itest1_gemini_pk_seq'::regclass) | NO          | NO          |                     |                |                    |                     |                  | NO
 itest2     | a           |                                           | NO          | YES         | ALWAYS              | 1              | 1                  | 9223372036854775807 | 1                | NO
 itest2     | b           |                                           | YES         | NO          |                     |                |                    |                     |                  | NO
 itest2     | gemini_pk   | nextval('itest2_gemini_pk_seq'::regclass) | NO          | NO          |                     |                |                    |                     |                  | NO
 itest3     | a           |                                           | NO          | YES         | BY DEFAULT          | 7              | 5                  | 32767               | 1                | NO
 itest3     | b           |                                           | YES         | NO          |                     |                |                    |                     |                  | NO
 itest3     | gemini_pk   | nextval('itest3_gemini_pk_seq'::regclass) | NO          | NO          |                     |                |                    |                     |                  | NO
(9 rows)

---END---
---START---
-- internal sequences should not be shown here
SELECT sequence_name FROM information_schema.sequences WHERE sequence_name LIKE 'itest%';
    sequence_name     
----------------------
 itest1_gemini_pk_seq
 itest2_gemini_pk_seq
 itest3_gemini_pk_seq
(3 rows)

---END---
---START---
SELECT pg_get_serial_sequence('itest1', 'a');
 pg_get_serial_sequence 
------------------------
 public.itest1_a_seq
(1 row)

---END---
---START---
\d itest1_a_seq
                    Sequence "public.itest1_a_seq"
  Type   | Start | Minimum |  Maximum   | Increment | Cycles? | Cache 
---------+-------+---------+------------+-----------+---------+-------
 integer |     1 |       1 | 2147483647 |         1 | no      |     1
Sequence for identity column: public.itest1.a

CREATE TABLE itest4 (gemini_pk serial PRIMARY KEY, a int, b text);
---END---
---START---
ALTER TABLE itest4 ALTER COLUMN a ADD GENERATED ALWAYS AS IDENTITY;
ERROR:  column "a" of relation "itest4" must be declared NOT NULL before identity can be added
---END---
---START---
-- error, requires NOT NULL
ALTER TABLE itest4 ALTER COLUMN a SET NOT NULL;
---END---
---START---
ALTER TABLE itest4 ALTER COLUMN a ADD GENERATED ALWAYS AS IDENTITY;
---END---
---START---
-- ok
ALTER TABLE itest4 ALTER COLUMN a DROP NOT NULL;
ERROR:  column "a" of relation "itest4" is an identity column
---END---
---START---
-- error, disallowed
ALTER TABLE itest4 ALTER COLUMN a ADD GENERATED ALWAYS AS IDENTITY;
ERROR:  column "a" of relation "itest4" is already an identity column
---END---
---START---
-- error, already set
ALTER TABLE itest4 ALTER COLUMN b ADD GENERATED ALWAYS AS IDENTITY;
ERROR:  identity column type must be smallint, integer, or bigint
---END---
---START---
-- error, wrong data type
-- for later
ALTER TABLE itest4 ALTER COLUMN b SET DEFAULT '';
---END---
---START---
-- @hengfeng: this crashes the emulator
-- CREATE TABLE itest_err_1 (gemini_pk serial PRIMARY KEY, a text GENERATED BY DEFAULT AS IDENTITY);
---END---
---START---
CREATE TABLE itest_err_2 (gemini_pk serial PRIMARY KEY, a integer GENERATED ALWAYS AS IDENTITY GENERATED BY DEFAULT AS IDENTITY);
ERROR:  multiple identity specifications for column "a" of table "itest_err_2"
LINE 1: ...IMARY KEY, a integer GENERATED ALWAYS AS IDENTITY GENERATED ...
                                                             ^
---END---
---START---
CREATE TABLE itest_err_3 (gemini_pk serial PRIMARY KEY, a integer DEFAULT 5 GENERATED BY DEFAULT AS IDENTITY);
ERROR:  both default and identity specified for column "a" of table "itest_err_3"
LINE 1: ...gemini_pk serial PRIMARY KEY, a integer DEFAULT 5 GENERATED ...
                                                             ^
---END---
---START---
CREATE TABLE itest_err_4 (gemini_pk serial PRIMARY KEY, a serial GENERATED BY DEFAULT AS IDENTITY);
ERROR:  both default and identity specified for column "a" of table "itest_err_4"
---END---
---START---
INSERT INTO itest1 DEFAULT VALUES;
---END---
---START---
INSERT INTO itest1 DEFAULT VALUES;
---END---
---START---
INSERT INTO itest2 DEFAULT VALUES;
---END---
---START---
INSERT INTO itest2 DEFAULT VALUES;
---END---
---START---
INSERT INTO itest3 DEFAULT VALUES;
---END---
---START---
INSERT INTO itest3 DEFAULT VALUES;
---END---
---START---
INSERT INTO itest4 DEFAULT VALUES;
---END---
---START---
INSERT INTO itest4 DEFAULT VALUES;
---END---
---START---
SELECT * FROM itest1;
 gemini_pk | a | b 
-----------+---+---
         1 | 1 | 
         2 | 2 | 
(2 rows)

---END---
---START---
SELECT * FROM itest2;
 gemini_pk | a | b 
-----------+---+---
         1 | 1 | 
         2 | 2 | 
(2 rows)

---END---
---START---
SELECT * FROM itest3;
 gemini_pk | a  | b 
-----------+----+---
         1 |  7 | 
         2 | 12 | 
(2 rows)

---END---
---START---
SELECT * FROM itest4;
 gemini_pk | a | b 
-----------+---+---
         1 | 1 | 
         2 | 2 | 
(2 rows)

---END---
---START---
CREATE TABLE itest5 (gemini_pk serial PRIMARY KEY, a integer GENERATED ALWAYS AS IDENTITY, b text);
---END---
---START---
INSERT INTO itest5 VALUES (1, 'a');
ERROR:  invalid input syntax for type integer: "a"
LINE 1: INSERT INTO itest5 VALUES (1, 'a');
                                      ^
---END---
---START---
-- error
INSERT INTO itest5 VALUES (DEFAULT, 'a');
ERROR:  invalid input syntax for type integer: "a"
LINE 1: INSERT INTO itest5 VALUES (DEFAULT, 'a');
                                            ^
---END---
---START---
-- ok
INSERT INTO itest5 VALUES (2, 'b'), (3, 'c');
ERROR:  invalid input syntax for type integer: "b"
LINE 1: INSERT INTO itest5 VALUES (2, 'b'), (3, 'c');
                                      ^
---END---
---START---
-- error
INSERT INTO itest5 VALUES (DEFAULT, 'b'), (3, 'c');
ERROR:  invalid input syntax for type integer: "b"
LINE 1: INSERT INTO itest5 VALUES (DEFAULT, 'b'), (3, 'c');
                                            ^
---END---
---START---
-- error
INSERT INTO itest5 VALUES (2, 'b'), (DEFAULT, 'c');
ERROR:  invalid input syntax for type integer: "b"
LINE 1: INSERT INTO itest5 VALUES (2, 'b'), (DEFAULT, 'c');
                                      ^
---END---
---START---
-- error
INSERT INTO itest5 VALUES (DEFAULT, 'b'), (DEFAULT, 'c');
ERROR:  invalid input syntax for type integer: "b"
LINE 1: INSERT INTO itest5 VALUES (DEFAULT, 'b'), (DEFAULT, 'c');
                                            ^
---END---
---START---
-- ok
INSERT INTO itest5 OVERRIDING SYSTEM VALUE VALUES (-1, 'aa');
ERROR:  invalid input syntax for type integer: "aa"
LINE 1: ...NSERT INTO itest5 OVERRIDING SYSTEM VALUE VALUES (-1, 'aa');
                                                                 ^
---END---
---START---
INSERT INTO itest5 OVERRIDING SYSTEM VALUE VALUES (-2, 'bb'), (-3, 'cc');
ERROR:  invalid input syntax for type integer: "bb"
LINE 1: ...T INTO itest5 OVERRIDING SYSTEM VALUE VALUES (-2, 'bb'), (-3...
                                                             ^
---END---
---START---
INSERT INTO itest5 OVERRIDING SYSTEM VALUE VALUES (DEFAULT, 'dd'), (-4, 'ee');
ERROR:  invalid input syntax for type integer: "dd"
LINE 1: ...O itest5 OVERRIDING SYSTEM VALUE VALUES (DEFAULT, 'dd'), (-4...
                                                             ^
---END---
---START---
INSERT INTO itest5 OVERRIDING SYSTEM VALUE VALUES (-5, 'ff'), (DEFAULT, 'gg');
ERROR:  invalid input syntax for type integer: "ff"
LINE 1: ...T INTO itest5 OVERRIDING SYSTEM VALUE VALUES (-5, 'ff'), (DE...
                                                             ^
---END---
---START---
INSERT INTO itest5 OVERRIDING SYSTEM VALUE VALUES (DEFAULT, 'hh'), (DEFAULT, 'ii');
ERROR:  invalid input syntax for type integer: "hh"
LINE 1: ...O itest5 OVERRIDING SYSTEM VALUE VALUES (DEFAULT, 'hh'), (DE...
                                                             ^
---END---
---START---
INSERT INTO itest5 OVERRIDING USER VALUE VALUES (-1, 'aaa');
ERROR:  invalid input syntax for type integer: "aaa"
LINE 1: INSERT INTO itest5 OVERRIDING USER VALUE VALUES (-1, 'aaa');
                                                             ^
---END---
---START---
INSERT INTO itest5 OVERRIDING USER VALUE VALUES (-2, 'bbb'), (-3, 'ccc');
ERROR:  invalid input syntax for type integer: "bbb"
LINE 1: ...ERT INTO itest5 OVERRIDING USER VALUE VALUES (-2, 'bbb'), (-...
                                                             ^
---END---
---START---
INSERT INTO itest5 OVERRIDING USER VALUE VALUES (DEFAULT, 'ddd'), (-4, 'eee');
ERROR:  invalid input syntax for type integer: "ddd"
LINE 1: ...NTO itest5 OVERRIDING USER VALUE VALUES (DEFAULT, 'ddd'), (-...
                                                             ^
---END---
---START---
INSERT INTO itest5 OVERRIDING USER VALUE VALUES (-5, 'fff'), (DEFAULT, 'ggg');
ERROR:  invalid input syntax for type integer: "fff"
LINE 1: ...ERT INTO itest5 OVERRIDING USER VALUE VALUES (-5, 'fff'), (D...
                                                             ^
---END---
---START---
INSERT INTO itest5 OVERRIDING USER VALUE VALUES (DEFAULT, 'hhh'), (DEFAULT, 'iii');
ERROR:  invalid input syntax for type integer: "hhh"
LINE 1: ...NTO itest5 OVERRIDING USER VALUE VALUES (DEFAULT, 'hhh'), (D...
                                                             ^
---END---
---START---
SELECT * FROM itest5;
 gemini_pk | a | b 
-----------+---+---
(0 rows)

---END---
---START---
DROP TABLE itest5;
---END---
---START---
INSERT INTO itest3 VALUES (DEFAULT, 'a');
ERROR:  invalid input syntax for type smallint: "a"
LINE 1: INSERT INTO itest3 VALUES (DEFAULT, 'a');
                                            ^
---END---
---START---
INSERT INTO itest3 VALUES (DEFAULT, 'b'), (DEFAULT, 'c');
ERROR:  invalid input syntax for type smallint: "b"
LINE 1: INSERT INTO itest3 VALUES (DEFAULT, 'b'), (DEFAULT, 'c');
                                            ^
---END---
---START---
SELECT * FROM itest3;
 gemini_pk | a  | b 
-----------+----+---
         1 |  7 | 
         2 | 12 | 
(2 rows)

---END---
---START---
-- OVERRIDING tests
-- GENERATED BY DEFAULT
-- This inserts the row as presented:
INSERT INTO itest1 VALUES (10, 'xyz');
ERROR:  invalid input syntax for type integer: "xyz"
LINE 1: INSERT INTO itest1 VALUES (10, 'xyz');
                                       ^
---END---
---START---
-- With GENERATED BY DEFAULT, OVERRIDING SYSTEM VALUE is not allowed
-- by the standard, but we allow it as a no-op, since it is of use if
-- there are multiple identity columns in a table, which is also an
-- extension.
INSERT INTO itest1 OVERRIDING SYSTEM VALUE VALUES (20, 'xyz');
ERROR:  invalid input syntax for type integer: "xyz"
LINE 1: ...SERT INTO itest1 OVERRIDING SYSTEM VALUE VALUES (20, 'xyz');
                                                                ^
---END---
---START---
-- This ignores the 30 and uses the sequence value instead:
INSERT INTO itest1 OVERRIDING USER VALUE VALUES (30, 'xyz');
ERROR:  invalid input syntax for type integer: "xyz"
LINE 1: INSERT INTO itest1 OVERRIDING USER VALUE VALUES (30, 'xyz');
                                                             ^
---END---
---START---
SELECT * FROM itest1;
 gemini_pk | a | b 
-----------+---+---
         1 | 1 | 
         2 | 2 | 
(2 rows)

---END---
---START---
-- GENERATED ALWAYS
-- This is an error:
INSERT INTO itest2 VALUES (10, 'xyz');
ERROR:  invalid input syntax for type bigint: "xyz"
LINE 1: INSERT INTO itest2 VALUES (10, 'xyz');
                                       ^
---END---
---START---
-- This inserts the row as presented:
INSERT INTO itest2 OVERRIDING SYSTEM VALUE VALUES (20, 'xyz');
ERROR:  invalid input syntax for type bigint: "xyz"
LINE 1: ...SERT INTO itest2 OVERRIDING SYSTEM VALUE VALUES (20, 'xyz');
                                                                ^
---END---
---START---
-- This ignores the 30 and uses the sequence value instead:
INSERT INTO itest2 OVERRIDING USER VALUE VALUES (30, 'xyz');
ERROR:  invalid input syntax for type bigint: "xyz"
LINE 1: INSERT INTO itest2 OVERRIDING USER VALUE VALUES (30, 'xyz');
                                                             ^
---END---
---START---
SELECT * FROM itest2;
 gemini_pk | a | b 
-----------+---+---
         1 | 1 | 
         2 | 2 | 
(2 rows)

---END---
---START---
-- UPDATE tests
-- GENERATED BY DEFAULT is not restricted.
UPDATE itest1 SET a = 101 WHERE a = 1;
---END---
---START---
UPDATE itest1 SET a = DEFAULT WHERE a = 2;
---END---
---START---
SELECT * FROM itest1;
 gemini_pk |  a  | b 
-----------+-----+---
         1 | 101 | 
         2 |   3 | 
(2 rows)

---END---
---START---
-- GENERATED ALWAYS allows only DEFAULT.
UPDATE itest2 SET a = 101 WHERE a = 1;
ERROR:  column "a" can only be updated to DEFAULT
DETAIL:  Column "a" is an identity column defined as GENERATED ALWAYS.
---END---
---START---
-- error
UPDATE itest2 SET a = DEFAULT WHERE a = 2;
---END---
---START---
-- ok
SELECT * FROM itest2;
 gemini_pk | a | b 
-----------+---+---
         1 | 1 | 
         2 | 3 | 
(2 rows)

---END---
---START---
-- COPY tests
CREATE TABLE itest9 (a int GENERATED ALWAYS AS IDENTITY, b text, c bigint);
-- COPY itest9 FROM stdin;
-- 100	foo	200
-- 101	bar	201
-- \.
---END---
---START---
-- COPY itest9 (b, c) FROM stdin;
-- foo2	202
-- bar2	203
-- \.
---END---
---START---
SELECT * FROM itest9 ORDER BY c;
 a | b | c 
---+---+---
(0 rows)

---END---
---START---
-- DROP IDENTITY tests
ALTER TABLE itest4 ALTER COLUMN a DROP IDENTITY;
---END---
---START---
ALTER TABLE itest4 ALTER COLUMN a DROP IDENTITY;
ERROR:  column "a" of relation "itest4" is not an identity column
---END---
---START---
-- error
ALTER TABLE itest4 ALTER COLUMN a DROP IDENTITY IF EXISTS;
NOTICE:  column "a" of relation "itest4" is not an identity column, skipping
---END---
---START---
-- noop
INSERT INTO itest4 DEFAULT VALUES;
ERROR:  null value in column "a" of relation "itest4" violates not-null constraint
DETAIL:  Failing row contains (3, null, ).
---END---
---START---
-- fails because NOT NULL is not dropped
ALTER TABLE itest4 ALTER COLUMN a DROP NOT NULL;
---END---
---START---
INSERT INTO itest4 DEFAULT VALUES;
---END---
---START---
SELECT * FROM itest4;
 gemini_pk | a | b 
-----------+---+---
         1 | 1 | 
         2 | 2 | 
         4 |   | 
(3 rows)

---END---
---START---
-- check that sequence is removed
SELECT sequence_name FROM itest4_a_seq;
ERROR:  relation "itest4_a_seq" does not exist
LINE 1: SELECT sequence_name FROM itest4_a_seq;
                                  ^
---END---
---START---
CREATE TABLE itest10 (gemini_pk serial PRIMARY KEY, a integer GENERATED BY DEFAULT AS IDENTITY, b text);
---END---
---START---
CREATE TABLE itest11 (gemini_pk serial PRIMARY KEY, a integer GENERATED ALWAYS AS IDENTITY, b text);
---END---
---START---
CREATE VIEW itestv10 AS SELECT * FROM itest10;
---END---
---START---
CREATE VIEW itestv11 AS SELECT * FROM itest11;
---END---
---START---
INSERT INTO itestv10 DEFAULT VALUES;
---END---
---START---
INSERT INTO itestv10 DEFAULT VALUES;
---END---
---START---
INSERT INTO itestv11 DEFAULT VALUES;
---END---
---START---
INSERT INTO itestv11 DEFAULT VALUES;
---END---
---START---
SELECT * FROM itestv10;
 gemini_pk | a | b 
-----------+---+---
         1 | 1 | 
         2 | 2 | 
(2 rows)

---END---
---START---
SELECT * FROM itestv11;
 gemini_pk | a | b 
-----------+---+---
         1 | 1 | 
         2 | 2 | 
(2 rows)

---END---
---START---
INSERT INTO itestv10 VALUES (10, 'xyz');
ERROR:  invalid input syntax for type integer: "xyz"
LINE 1: INSERT INTO itestv10 VALUES (10, 'xyz');
                                         ^
---END---
---START---
INSERT INTO itestv10 OVERRIDING USER VALUE VALUES (11, 'xyz');
ERROR:  invalid input syntax for type integer: "xyz"
LINE 1: ...SERT INTO itestv10 OVERRIDING USER VALUE VALUES (11, 'xyz');
                                                                ^
---END---
---START---
SELECT * FROM itestv10;
 gemini_pk | a | b 
-----------+---+---
         1 | 1 | 
         2 | 2 | 
(2 rows)

---END---
---START---
INSERT INTO itestv11 VALUES (10, 'xyz');
ERROR:  invalid input syntax for type integer: "xyz"
LINE 1: INSERT INTO itestv11 VALUES (10, 'xyz');
                                         ^
---END---
---START---
INSERT INTO itestv11 OVERRIDING SYSTEM VALUE VALUES (11, 'xyz');
ERROR:  invalid input syntax for type integer: "xyz"
LINE 1: ...RT INTO itestv11 OVERRIDING SYSTEM VALUE VALUES (11, 'xyz');
                                                                ^
---END---
---START---
SELECT * FROM itestv11;
 gemini_pk | a | b 
-----------+---+---
         1 | 1 | 
         2 | 2 | 
(2 rows)

---END---
---START---
DROP VIEW itestv10, itestv11;
---END---
---START---
CREATE TABLE itest13 (gemini_pk serial PRIMARY KEY, a integer);
---END---
---START---
-- add column to empty table
ALTER TABLE itest13 ADD COLUMN b int GENERATED BY DEFAULT AS IDENTITY;
---END---
---START---
INSERT INTO itest13 VALUES (1), (2), (3);
---END---
---START---
-- add column to populated table
ALTER TABLE itest13 ADD COLUMN c int GENERATED BY DEFAULT AS IDENTITY;
---END---
---START---
SELECT * FROM itest13;
 gemini_pk | a | b | c 
-----------+---+---+---
         1 |   | 1 | 1
         2 |   | 2 | 2
         3 |   | 3 | 3
(3 rows)

---END---
---START---
-- various ALTER COLUMN tests
-- fail, not allowed for identity columns
ALTER TABLE itest1 ALTER COLUMN a SET DEFAULT 1;
ERROR:  column "a" of relation "itest1" is an identity column
---END---
---START---
CREATE TABLE itest5 (gemini_pk serial PRIMARY KEY, a serial, b text);
---END---
---START---
ALTER TABLE itest5 ALTER COLUMN a ADD GENERATED ALWAYS AS IDENTITY;
ERROR:  column "a" of relation "itest5" already has a default value
---END---
---START---
ALTER TABLE itest3 ALTER COLUMN a TYPE int;
---END---
---START---
SELECT seqtypid::regtype FROM pg_sequence WHERE seqrelid = 'itest3_a_seq'::regclass;
 seqtypid 
----------
 integer
(1 row)

---END---
---START---
\d itest3
                                 Table "public.itest3"
  Column   |  Type   | Collation | Nullable |                  Default                  
-----------+---------+-----------+----------+-------------------------------------------
 gemini_pk | integer |           | not null | nextval('itest3_gemini_pk_seq'::regclass)
 a         | integer |           | not null | generated by default as identity
 b         | text    |           |          | 
Indexes:
    "itest3_pkey" PRIMARY KEY, btree (gemini_pk)

ALTER TABLE itest3 ALTER COLUMN a TYPE text;
ERROR:  identity column type must be smallint, integer, or bigint
---END---
---START---
-- error
-- kinda silly to change property in the same command, but it should work
ALTER TABLE itest3
  ADD COLUMN c int GENERATED BY DEFAULT AS IDENTITY,
  ALTER COLUMN c SET GENERATED ALWAYS;
---END---
---START---
\d itest3
                                 Table "public.itest3"
  Column   |  Type   | Collation | Nullable |                  Default                  
-----------+---------+-----------+----------+-------------------------------------------
 gemini_pk | integer |           | not null | nextval('itest3_gemini_pk_seq'::regclass)
 a         | integer |           | not null | generated by default as identity
 b         | text    |           |          | 
 c         | integer |           | not null | generated always as identity
Indexes:
    "itest3_pkey" PRIMARY KEY, btree (gemini_pk)

-- ALTER COLUMN ... SET
CREATE TABLE itest6 (a int GENERATED ALWAYS AS IDENTITY, b text);
---END---
---START---
INSERT INTO itest6 DEFAULT VALUES;
---END---
---START---
ALTER TABLE itest6 ALTER COLUMN a SET GENERATED BY DEFAULT SET INCREMENT BY 2 SET START WITH 100 RESTART;
---END---
---START---
INSERT INTO itest6 DEFAULT VALUES;
---END---
---START---
INSERT INTO itest6 DEFAULT VALUES;
---END---
---START---
SELECT * FROM itest6;
  a  | b 
-----+---
   1 | 
 100 | 
 102 | 
(3 rows)

---END---
---START---
SELECT table_name, column_name, is_identity, identity_generation FROM information_schema.columns WHERE table_name = 'itest6' ORDER BY 1, 2;
 table_name | column_name | is_identity | identity_generation 
------------+-------------+-------------+---------------------
 itest6     | a           | YES         | BY DEFAULT
 itest6     | b           | NO          | 
(2 rows)

---END---
---START---
ALTER TABLE itest6 ALTER COLUMN b SET INCREMENT BY 2;
ERROR:  column "b" of relation "itest6" is not an identity column
---END---
---START---
-- fail, not identity
-- prohibited direct modification of sequence
ALTER SEQUENCE itest6_a_seq OWNED BY NONE;
ERROR:  cannot change ownership of identity sequence
DETAIL:  Sequence "itest6_a_seq" is linked to table "itest6".
---END---
---START---
CREATE TABLE itest7 (gemini_pk serial PRIMARY KEY, a integer GENERATED ALWAYS AS IDENTITY);
---END---
---START---
INSERT INTO itest7 DEFAULT VALUES;
---END---
---START---
SELECT * FROM itest7;
 gemini_pk | a 
-----------+---
         1 | 1
(1 row)

---END---
---START---
CREATE TABLE itest7a (gemini_pk serial PRIMARY KEY, b text) INHERITS (itest7);
NOTICE:  merging column "gemini_pk" with inherited definition
---END---
---START---
CREATE TABLE itest7b (gemini_pk serial PRIMARY KEY, a integer);
---END---
---START---
CREATE TABLE itest7c (gemini_pk serial PRIMARY KEY, a integer GENERATED ALWAYS AS IDENTITY) INHERITS (itest7b);
NOTICE:  merging column "gemini_pk" with inherited definition
NOTICE:  merging column "a" with inherited definition
---END---
---START---
INSERT INTO itest7c DEFAULT VALUES;
---END---
---START---
SELECT * FROM itest7c;
 gemini_pk | a 
-----------+---
         1 | 1
(1 row)

---END---
---START---
CREATE TABLE itest7d (gemini_pk serial PRIMARY KEY, a integer NOT NULL);
---END---
---START---
CREATE TABLE itest7e (gemini_pk serial PRIMARY KEY) INHERITS (itest7d);
NOTICE:  merging column "gemini_pk" with inherited definition
---END---
---START---
ALTER TABLE itest7d ALTER COLUMN a ADD GENERATED ALWAYS AS IDENTITY;
---END---
---START---
ALTER TABLE itest7d ADD COLUMN b int GENERATED ALWAYS AS IDENTITY;
ERROR:  cannot recursively add identity column to table that has child tables
---END---
---START---
-- error
SELECT table_name, column_name, is_nullable, is_identity, identity_generation FROM information_schema.columns WHERE table_name LIKE 'itest7%' ORDER BY 1, 2;
 table_name | column_name | is_nullable | is_identity | identity_generation 
------------+-------------+-------------+-------------+---------------------
 itest7     | a           | NO          | YES         | ALWAYS
 itest7     | gemini_pk   | NO          | NO          | 
 itest7a    | a           | NO          | NO          | 
 itest7a    | b           | YES         | NO          | 
 itest7a    | gemini_pk   | NO          | NO          | 
 itest7b    | a           | YES         | NO          | 
 itest7b    | gemini_pk   | NO          | NO          | 
 itest7c    | a           | NO          | YES         | ALWAYS
 itest7c    | gemini_pk   | NO          | NO          | 
 itest7d    | a           | NO          | YES         | ALWAYS
 itest7d    | gemini_pk   | NO          | NO          | 
 itest7e    | a           | NO          | NO          | 
 itest7e    | gemini_pk   | NO          | NO          | 
(13 rows)

---END---
---START---
-- These ALTER TABLE variants will not recurse.
ALTER TABLE itest7 ALTER COLUMN a SET GENERATED BY DEFAULT;
---END---
---START---
ALTER TABLE itest7 ALTER COLUMN a RESTART;
---END---
---START---
ALTER TABLE itest7 ALTER COLUMN a DROP IDENTITY;
---END---
---START---
-- privileges
CREATE USER regress_identity_user1;
---END---
---START---
CREATE TABLE itest8 (gemini_pk serial PRIMARY KEY, a integer GENERATED ALWAYS AS IDENTITY, b text);
---END---
---START---
GRANT SELECT, INSERT ON itest8 TO regress_identity_user1;
---END---
---START---
SET ROLE regress_identity_user1;
---END---
---START---
INSERT INTO itest8 DEFAULT VALUES;
ERROR:  permission denied for sequence itest8_gemini_pk_seq
---END---
---START---
SELECT * FROM itest8;
 gemini_pk | a | b 
-----------+---+---
(0 rows)

---END---
---START---
RESET ROLE;
---END---
---START---
DROP TABLE itest8;
---END---
---START---
DROP USER regress_identity_user1;
---END---
---START---
CREATE TABLE itest8 (gemini_pk serial PRIMARY KEY, f1 integer);
---END---
---START---
ALTER TABLE itest8
  ADD COLUMN f2 int NOT NULL,
  ALTER COLUMN f2 ADD GENERATED ALWAYS AS IDENTITY;
---END---
---START---
ALTER TABLE itest8
  ADD COLUMN f3 int NOT NULL,
  ALTER COLUMN f3 ADD GENERATED ALWAYS AS IDENTITY,
  ALTER COLUMN f3 SET GENERATED BY DEFAULT SET INCREMENT 10;
---END---
---START---
ALTER TABLE itest8
  ADD COLUMN f4 int;
---END---
---START---
ALTER TABLE itest8
  ALTER COLUMN f4 SET NOT NULL,
  ALTER COLUMN f4 ADD GENERATED ALWAYS AS IDENTITY,
  ALTER COLUMN f4 SET DATA TYPE bigint;
---END---
---START---
ALTER TABLE itest8
  ADD COLUMN f5 int GENERATED ALWAYS AS IDENTITY;
---END---
---START---
ALTER TABLE itest8
  ALTER COLUMN f5 DROP IDENTITY,
  ALTER COLUMN f5 DROP NOT NULL,
  ALTER COLUMN f5 SET DATA TYPE bigint;
---END---
---START---
INSERT INTO itest8 VALUES(0), (1);
---END---
---START---
-- This does not work when the table isn't empty.  That's intentional,
-- since ADD GENERATED should only affect later insertions:
ALTER TABLE itest8
  ADD COLUMN f22 int NOT NULL,
  ALTER COLUMN f22 ADD GENERATED ALWAYS AS IDENTITY;
ERROR:  column "f22" of relation "itest8" contains null values
---END---
---START---
TABLE itest8;
 gemini_pk | f1 | f2 | f3 | f4 | f5 
-----------+----+----+----+----+----
         0 |    |  1 |  1 |  1 |   
         1 |    |  2 | 11 |  2 |   
(2 rows)

---END---
---START---
\d+ itest8
                                                     Table "public.itest8"
  Column   |  Type   | Collation | Nullable |                  Default                  | Storage | Stats target | Description 
-----------+---------+-----------+----------+-------------------------------------------+---------+--------------+-------------
 gemini_pk | integer |           | not null | nextval('itest8_gemini_pk_seq'::regclass) | plain   |              | 
 f1        | integer |           |          |                                           | plain   |              | 
 f2        | integer |           | not null | generated always as identity              | plain   |              | 
 f3        | integer |           | not null | generated by default as identity          | plain   |              | 
 f4        | bigint  |           | not null | generated always as identity              | plain   |              | 
 f5        | bigint  |           |          |                                           | plain   |              | 
Indexes:
    "itest8_pkey" PRIMARY KEY, btree (gemini_pk)

\d itest8_f2_seq
                   Sequence "public.itest8_f2_seq"
  Type   | Start | Minimum |  Maximum   | Increment | Cycles? | Cache 
---------+-------+---------+------------+-----------+---------+-------
 integer |     1 |       1 | 2147483647 |         1 | no      |     1
Sequence for identity column: public.itest8.f2

\d itest8_f3_seq
                   Sequence "public.itest8_f3_seq"
  Type   | Start | Minimum |  Maximum   | Increment | Cycles? | Cache 
---------+-------+---------+------------+-----------+---------+-------
 integer |     1 |       1 | 2147483647 |        10 | no      |     1
Sequence for identity column: public.itest8.f3

\d itest8_f4_seq
                       Sequence "public.itest8_f4_seq"
  Type  | Start | Minimum |       Maximum       | Increment | Cycles? | Cache 
--------+-------+---------+---------------------+-----------+---------+-------
 bigint |     1 |       1 | 9223372036854775807 |         1 | no      |     1
Sequence for identity column: public.itest8.f4

\d itest8_f5_seq
DROP TABLE itest8;
---END---
---START---
-- typed tables (currently not supported)
CREATE TYPE itest_type AS (f1 integer, f2 text, f3 bigint);
---END---
---START---
CREATE TABLE itest12 OF itest_type (gemini_pk serial PRIMARY KEY, f1 WITH OPTIONS GENERATED ALWAYS AS IDENTITY);
ERROR:  syntax error at or near "serial"
LINE 1: CREATE TABLE itest12 OF itest_type (gemini_pk serial PRIMARY...
                                                      ^
---END---
---START---
-- error
DROP TYPE itest_type CASCADE;
---END---
---START---
CREATE TABLE itest_parent (gemini_pk serial PRIMARY KEY, f1 date NOT NULL, f2 text, f3 bigint) PARTITION BY range (f1);
ERROR:  unique constraint on partitioned table must include all partitioning columns
DETAIL:  PRIMARY KEY constraint on table "itest_parent" lacks column "f1" which is part of the partition key.
---END---
---START---
CREATE TABLE itest_child PARTITION OF itest_parent (
    f3 WITH OPTIONS GENERATED ALWAYS AS IDENTITY
) FOR VALUES FROM ('2016-07-01') TO ('2016-08-01');
ERROR:  identity columns are not supported on partitions
---END---
---START---
-- error
DROP TABLE itest_parent;
ERROR:  table "itest_parent" does not exist
---END---
---START---
CREATE TABLE itest14 (gemini_pk serial PRIMARY KEY, id serial);
---END---
---START---
ALTER TABLE itest14 ALTER id DROP DEFAULT;
---END---
---START---
ALTER TABLE itest14 ALTER id ADD GENERATED BY DEFAULT AS IDENTITY;
---END---
---START---
INSERT INTO itest14 (id) VALUES (DEFAULT);
---END---
---START---
CREATE TABLE itest15 (gemini_pk serial PRIMARY KEY, id integer GENERATED ALWAYS AS IDENTITY NULL);
ERROR:  conflicting NULL/NOT NULL declarations for column "id" of table "itest15"
LINE 1: ... PRIMARY KEY, id integer GENERATED ALWAYS AS IDENTITY NULL);
                                                                 ^
---END---
---START---
CREATE TABLE itest15 (gemini_pk serial PRIMARY KEY, id integer NULL GENERATED ALWAYS AS IDENTITY);
ERROR:  conflicting NULL/NOT NULL declarations for column "id" of table "itest15"
LINE 1: ...15 (gemini_pk serial PRIMARY KEY, id integer NULL GENERATED ...
                                                             ^
---END---
---START---
CREATE TABLE itest15 (gemini_pk serial PRIMARY KEY, id integer GENERATED ALWAYS AS IDENTITY NOT NULL);
---END---
---START---
DROP TABLE itest15;
---END---
---START---
CREATE TABLE itest15 (gemini_pk serial PRIMARY KEY, id integer NOT NULL GENERATED ALWAYS AS IDENTITY);
---END---
---START---
DROP TABLE itest15;
---END---
---START---
CREATE TABLE itest15 (gemini_pk serial PRIMARY KEY, a integer GENERATED ALWAYS AS IDENTITY, b text);
---END---
---START---
CREATE TABLE itest16 (gemini_pk serial PRIMARY KEY, a integer GENERATED BY DEFAULT AS IDENTITY, b text);
---END---
---START---
MERGE INTO itest15 t
USING (SELECT 10 AS s_a, 'inserted by merge' AS s_b) s
ON t.a = s.s_a
WHEN NOT MATCHED THEN
	INSERT (a, b) VALUES (s.s_a, s.s_b);
ERROR:  cannot insert a non-DEFAULT value into column "a"
DETAIL:  Column "a" is an identity column defined as GENERATED ALWAYS.
HINT:  Use OVERRIDING SYSTEM VALUE to override.
---END---
---START---
-- Used to fail, but now it works and ignores the user supplied value
MERGE INTO itest15 t
USING (SELECT 20 AS s_a, 'inserted by merge' AS s_b) s
ON t.a = s.s_a
WHEN NOT MATCHED THEN
	INSERT (a, b) OVERRIDING USER VALUE VALUES (s.s_a, s.s_b);
---END---
---START---
MERGE INTO itest15 t
USING (SELECT 30 AS s_a, 'inserted by merge' AS s_b) s
ON t.a = s.s_a
WHEN NOT MATCHED THEN
	INSERT (a, b) OVERRIDING SYSTEM VALUE VALUES (s.s_a, s.s_b);
---END---
---START---
MERGE INTO itest16 t
USING (SELECT 10 AS s_a, 'inserted by merge' AS s_b) s
ON t.a = s.s_a
WHEN NOT MATCHED THEN
	INSERT (a, b) VALUES (s.s_a, s.s_b);
---END---
---START---
MERGE INTO itest16 t
USING (SELECT 20 AS s_a, 'inserted by merge' AS s_b) s
ON t.a = s.s_a
WHEN NOT MATCHED THEN
	INSERT (a, b) OVERRIDING USER VALUE VALUES (s.s_a, s.s_b);
---END---
---START---
MERGE INTO itest16 t
USING (SELECT 30 AS s_a, 'inserted by merge' AS s_b) s
ON t.a = s.s_a
WHEN NOT MATCHED THEN
	INSERT (a, b) OVERRIDING SYSTEM VALUE VALUES (s.s_a, s.s_b);
---END---
---START---
SELECT * FROM itest15;
 gemini_pk | a  |         b         
-----------+----+-------------------
         1 |  1 | inserted by merge
         2 | 30 | inserted by merge
(2 rows)

---END---
---START---
SELECT * FROM itest16;
 gemini_pk | a  |         b         
-----------+----+-------------------
         1 | 10 | inserted by merge
         2 |  1 | inserted by merge
         3 | 30 | inserted by merge
(3 rows)

---END---
---START---
DROP TABLE itest15;
---END---
---START---
DROP TABLE itest16;
---END---
