---START---
--
-- TRANSACTIONS
--
BEGIN;
---END---
---START---
CREATE TABLE xacttest (gemini_pk serial PRIMARY KEY, a smallint, b real);
---END---
---START---
INSERT INTO xacttest VALUES
  (56, 7.8),
  (100, 99.097),
  (0, 0.09561),
  (42, 324.78);
---END---
---START---
INSERT INTO xacttest (a, b) VALUES (777, 777.777);
---END---
---START---
END;
---END---
---START---
-- should retrieve one value--
SELECT a FROM xacttest WHERE a > 100;
  a  
-----
 325
 777
(2 rows)

---END---
---START---
BEGIN;
---END---
---START---
CREATE TABLE disappear (gemini_pk serial PRIMARY KEY, a int8);
---END---
---START---
DELETE FROM xacttest;
---END---
---START---
-- should be empty
SELECT * FROM xacttest;
 gemini_pk | a | b 
-----------+---+---
(0 rows)

---END---
---START---
ABORT;
---END---
---START---
-- should not exist
SELECT oid FROM pg_class WHERE relname = 'disappear';
 oid 
-----
(0 rows)

---END---
---START---
-- should have members again
SELECT * FROM xacttest;
 gemini_pk |  a  |    b    
-----------+-----+---------
        56 |   8 |        
       100 |  99 |        
         0 |   0 |        
        42 | 325 |        
         1 | 777 | 777.777
(5 rows)

---END---
---START---
-- Test that transaction characteristics cannot be reset.
BEGIN TRANSACTION ISOLATION LEVEL SERIALIZABLE;
---END---
---START---
SELECT COUNT(*) FROM xacttest;
 count 
-------
     5
(1 row)

---END---
---START---
RESET transaction_isolation;
ERROR:  parameter "transaction_isolation" cannot be reset
---END---
---START---
-- error
END;
---END---
---START---
BEGIN TRANSACTION READ ONLY;
---END---
---START---
SELECT COUNT(*) FROM xacttest;
 count 
-------
     5
(1 row)

---END---
---START---
RESET transaction_read_only;
ERROR:  parameter "transaction_read_only" cannot be reset
---END---
---START---
-- error
END;
---END---
---START---
BEGIN TRANSACTION DEFERRABLE;
---END---
---START---
SELECT COUNT(*) FROM xacttest;
 count 
-------
     5
(1 row)

---END---
---START---
RESET transaction_deferrable;
ERROR:  parameter "transaction_deferrable" cannot be reset
---END---
---START---
-- error
END;
---END---
---START---
CREATE FUNCTION errfunc() RETURNS int LANGUAGE SQL AS 'SELECT 1'
SET transaction_read_only = on;
ERROR:  parameter "transaction_read_only" cannot be set locally in functions
---END---
---START---
CREATE TABLE writetest (gemini_pk serial PRIMARY KEY, a integer);
---END---
---START---
DROP TABLE IF EXISTS temptest;
NOTICE:  table "temptest" does not exist, skipping
CREATE TABLE temptest (gemini_pk serial PRIMARY KEY, a integer);
---END---
---START---
BEGIN;
---END---
---START---
SET TRANSACTION ISOLATION LEVEL SERIALIZABLE, READ ONLY, DEFERRABLE;
---END---
---START---
-- ok
SELECT * FROM writetest;
 gemini_pk | a 
-----------+---
(0 rows)

---END---
---START---
-- ok
SET TRANSACTION READ WRITE;
ERROR:  transaction read-write mode must be set before any query
---END---
---START---
--fail
COMMIT;
---END---
---START---
BEGIN;
---END---
---START---
SET TRANSACTION READ ONLY;
---END---
---START---
-- ok
SET TRANSACTION READ WRITE;
---END---
---START---
-- ok
SET TRANSACTION READ ONLY;
---END---
---START---
-- ok
SELECT * FROM writetest;
 gemini_pk | a 
-----------+---
(0 rows)

---END---
---START---
-- ok
SAVEPOINT x;
---END---
---START---
SET TRANSACTION READ ONLY;
---END---
---START---
-- ok
SELECT * FROM writetest;
 gemini_pk | a 
-----------+---
(0 rows)

---END---
---START---
-- ok
SET TRANSACTION READ ONLY;
---END---
---START---
-- ok
SET TRANSACTION READ WRITE;
ERROR:  cannot set transaction read-write mode inside a read-only transaction
---END---
---START---
--fail
COMMIT;
---END---
---START---
BEGIN;
---END---
---START---
SET TRANSACTION READ WRITE;
---END---
---START---
-- ok
SAVEPOINT x;
---END---
---START---
SET TRANSACTION READ WRITE;
---END---
---START---
-- ok
SET TRANSACTION READ ONLY;
---END---
---START---
-- ok
SELECT * FROM writetest;
 gemini_pk | a 
-----------+---
(0 rows)

---END---
---START---
-- ok
SET TRANSACTION READ ONLY;
---END---
---START---
-- ok
SET TRANSACTION READ WRITE;
ERROR:  cannot set transaction read-write mode inside a read-only transaction
---END---
---START---
--fail
COMMIT;
---END---
---START---
BEGIN;
---END---
---START---
SET TRANSACTION READ WRITE;
---END---
---START---
-- ok
SAVEPOINT x;
---END---
---START---
SET TRANSACTION READ ONLY;
---END---
---START---
-- ok
SELECT * FROM writetest;
 gemini_pk | a 
-----------+---
(0 rows)

---END---
---START---
-- ok
ROLLBACK TO SAVEPOINT x;
---END---
---START---
SHOW transaction_read_only;
 transaction_read_only 
-----------------------
 off
(1 row)

---END---
---START---
-- off
SAVEPOINT y;
---END---
---START---
SET TRANSACTION READ ONLY;
---END---
---START---
-- ok
SELECT * FROM writetest;
 gemini_pk | a 
-----------+---
(0 rows)

---END---
---START---
-- ok
RELEASE SAVEPOINT y;
---END---
---START---
SHOW transaction_read_only;
 transaction_read_only 
-----------------------
 off
(1 row)

---END---
---START---
-- off
COMMIT;
---END---
---START---
SET SESSION CHARACTERISTICS AS TRANSACTION READ ONLY;
---END---
---START---
DROP TABLE writetest;
ERROR:  cannot execute DROP TABLE in a read-only transaction
---END---
---START---
-- fail
INSERT INTO writetest VALUES (1);
ERROR:  cannot execute INSERT in a read-only transaction
---END---
---START---
-- fail
SELECT * FROM writetest;
 gemini_pk | a 
-----------+---
(0 rows)

---END---
---START---
-- ok
DELETE FROM temptest;
ERROR:  cannot execute DELETE in a read-only transaction
---END---
---START---
-- ok
UPDATE temptest SET a = 0 FROM writetest WHERE temptest.a = 1 AND writetest.a = temptest.a;
ERROR:  cannot execute UPDATE in a read-only transaction
---END---
---START---
-- ok
PREPARE test AS UPDATE writetest SET a = 0;
---END---
---START---
-- ok
EXECUTE test;
ERROR:  cannot execute UPDATE in a read-only transaction
---END---
---START---
-- fail
SELECT * FROM writetest, temptest;
 gemini_pk | a | gemini_pk | a 
-----------+---+-----------+---
(0 rows)

---END---
---START---
-- ok
CREATE TABLE test AS SELECT * FROM writetest;
ERROR:  cannot execute CREATE TABLE AS in a read-only transaction
---END---
---START---
-- fail
START TRANSACTION READ WRITE;
---END---
---START---
DROP TABLE writetest;
---END---
---START---
-- ok
COMMIT;
---END---
---START---
-- Subtransactions, basic tests
-- create & drop tables
SET SESSION CHARACTERISTICS AS TRANSACTION READ WRITE;
---END---
---START---
CREATE TABLE trans_foobar (gemini_pk serial PRIMARY KEY, a integer);
---END---
---START---
BEGIN;
---END---
---START---
CREATE TABLE trans_foo (gemini_pk serial PRIMARY KEY, a integer);
---END---
---START---
SAVEPOINT one;
---END---
---START---
DROP TABLE trans_foo;
---END---
---START---
CREATE TABLE trans_bar (gemini_pk serial PRIMARY KEY, a integer);
---END---
---START---
ROLLBACK TO SAVEPOINT one;
---END---
---START---
RELEASE SAVEPOINT one;
---END---
---START---
SAVEPOINT two;
---END---
---START---
CREATE TABLE trans_baz (gemini_pk serial PRIMARY KEY, a integer);
---END---
---START---
RELEASE SAVEPOINT two;
---END---
---START---
drop TABLE trans_foobar;
---END---
---START---
CREATE TABLE trans_barbaz (gemini_pk serial PRIMARY KEY, a integer);
---END---
---START---
COMMIT;
---END---
---START---
-- should exist: trans_barbaz, trans_baz, trans_foo
SELECT * FROM trans_foo;
 gemini_pk | a 
-----------+---
(0 rows)

---END---
---START---
-- should be empty
SELECT * FROM trans_bar;
ERROR:  relation "trans_bar" does not exist
LINE 1: SELECT * FROM trans_bar;
                      ^
---END---
---START---
-- shouldn't exist
SELECT * FROM trans_barbaz;
 gemini_pk | a 
-----------+---
(0 rows)

---END---
---START---
-- should be empty
SELECT * FROM trans_baz;
 gemini_pk | a 
-----------+---
(0 rows)

---END---
---START---
-- should be empty
-- inserts
BEGIN;
---END---
---START---
INSERT INTO trans_foo VALUES (1);
---END---
---START---
SAVEPOINT one;
---END---
---START---
INSERT into trans_bar VALUES (1);
ERROR:  relation "trans_bar" does not exist
LINE 1: INSERT into trans_bar VALUES (1);
                    ^
---END---
---START---
ROLLBACK TO one;
---END---
---START---
RELEASE SAVEPOINT one;
---END---
---START---
SAVEPOINT two;
---END---
---START---
INSERT into trans_barbaz VALUES (1);
---END---
---START---
RELEASE two;
---END---
---START---
SAVEPOINT three;
---END---
---START---
SAVEPOINT four;
---END---
---START---
INSERT INTO trans_foo VALUES (2);
---END---
---START---
RELEASE SAVEPOINT four;
---END---
---START---
ROLLBACK TO SAVEPOINT three;
---END---
---START---
RELEASE SAVEPOINT three;
---END---
---START---
INSERT INTO trans_foo VALUES (3);
---END---
---START---
COMMIT;
---END---
---START---
SELECT * FROM trans_foo;
 gemini_pk | a 
-----------+---
         1 |  
         3 |  
(2 rows)

---END---
---START---
-- should have 1 and 3
SELECT * FROM trans_barbaz;
 gemini_pk | a 
-----------+---
         1 |  
(1 row)

---END---
---START---
-- should have 1
-- test whole-tree commit
BEGIN;
---END---
---START---
SAVEPOINT one;
---END---
---START---
SELECT trans_foo;
ERROR:  column "trans_foo" does not exist
LINE 1: SELECT trans_foo;
               ^
---END---
---START---
ROLLBACK TO SAVEPOINT one;
---END---
---START---
RELEASE SAVEPOINT one;
---END---
---START---
SAVEPOINT two;
---END---
---START---
CREATE TABLE savepoints (gemini_pk serial PRIMARY KEY, a integer);
---END---
---START---
SAVEPOINT three;
---END---
---START---
INSERT INTO savepoints VALUES (1);
---END---
---START---
SAVEPOINT four;
---END---
---START---
INSERT INTO savepoints VALUES (2);
---END---
---START---
SAVEPOINT five;
---END---
---START---
INSERT INTO savepoints VALUES (3);
---END---
---START---
ROLLBACK TO SAVEPOINT five;
---END---
---START---
COMMIT;
---END---
---START---
COMMIT;
WARNING:  there is no transaction in progress
---END---
---START---
-- should not be in a transaction block
SELECT * FROM savepoints;
 gemini_pk | a 
-----------+---
         1 |  
         2 |  
(2 rows)

---END---
---START---
-- test whole-tree rollback
BEGIN;
---END---
---START---
SAVEPOINT one;
---END---
---START---
DELETE FROM savepoints WHERE a=1;
---END---
---START---
RELEASE SAVEPOINT one;
---END---
---START---
SAVEPOINT two;
---END---
---START---
DELETE FROM savepoints WHERE a=1;
---END---
---START---
SAVEPOINT three;
---END---
---START---
DELETE FROM savepoints WHERE a=2;
---END---
---START---
ROLLBACK;
---END---
---START---
COMMIT;
WARNING:  there is no transaction in progress
---END---
---START---
-- should not be in a transaction block
SELECT * FROM savepoints;
 gemini_pk | a 
-----------+---
         1 |  
         2 |  
(2 rows)

---END---
---START---
-- test whole-tree commit on an aborted subtransaction
BEGIN;
---END---
---START---
INSERT INTO savepoints VALUES (4);
---END---
---START---
SAVEPOINT one;
---END---
---START---
INSERT INTO savepoints VALUES (5);
---END---
---START---
SELECT trans_foo;
ERROR:  column "trans_foo" does not exist
LINE 1: SELECT trans_foo;
               ^
---END---
---START---
COMMIT;
---END---
---START---
SELECT * FROM savepoints;
 gemini_pk | a 
-----------+---
         1 |  
         2 |  
(2 rows)

---END---
---START---
BEGIN;
---END---
---START---
INSERT INTO savepoints VALUES (6);
---END---
---START---
SAVEPOINT one;
---END---
---START---
INSERT INTO savepoints VALUES (7);
---END---
---START---
RELEASE SAVEPOINT one;
---END---
---START---
INSERT INTO savepoints VALUES (8);
---END---
---START---
COMMIT;
---END---
---START---
-- rows 6 and 8 should have been created by the same xact
SELECT a.xmin = b.xmin FROM savepoints a, savepoints b WHERE a.a=6 AND b.a=8;
 ?column? 
----------
(0 rows)

---END---
---START---
-- rows 6 and 7 should have been created by different xacts
SELECT a.xmin = b.xmin FROM savepoints a, savepoints b WHERE a.a=6 AND b.a=7;
 ?column? 
----------
(0 rows)

---END---
---START---
BEGIN;
---END---
---START---
INSERT INTO savepoints VALUES (9);
---END---
---START---
SAVEPOINT one;
---END---
---START---
INSERT INTO savepoints VALUES (10);
---END---
---START---
ROLLBACK TO SAVEPOINT one;
---END---
---START---
INSERT INTO savepoints VALUES (11);
---END---
---START---
COMMIT;
---END---
---START---
SELECT a FROM savepoints WHERE a in (9, 10, 11);
 a 
---
(0 rows)

---END---
---START---
-- rows 9 and 11 should have been created by different xacts
SELECT a.xmin = b.xmin FROM savepoints a, savepoints b WHERE a.a=9 AND b.a=11;
 ?column? 
----------
(0 rows)

---END---
---START---
BEGIN;
---END---
---START---
INSERT INTO savepoints VALUES (12);
---END---
---START---
SAVEPOINT one;
---END---
---START---
INSERT INTO savepoints VALUES (13);
---END---
---START---
SAVEPOINT two;
---END---
---START---
INSERT INTO savepoints VALUES (14);
---END---
---START---
ROLLBACK TO SAVEPOINT one;
---END---
---START---
INSERT INTO savepoints VALUES (15);
---END---
---START---
SAVEPOINT two;
---END---
---START---
INSERT INTO savepoints VALUES (16);
---END---
---START---
SAVEPOINT three;
---END---
---START---
INSERT INTO savepoints VALUES (17);
---END---
---START---
COMMIT;
---END---
---START---
SELECT a FROM savepoints WHERE a BETWEEN 12 AND 17;
 a 
---
(0 rows)

---END---
---START---
BEGIN;
---END---
---START---
INSERT INTO savepoints VALUES (18);
---END---
---START---
SAVEPOINT one;
---END---
---START---
INSERT INTO savepoints VALUES (19);
---END---
---START---
SAVEPOINT two;
---END---
---START---
INSERT INTO savepoints VALUES (20);
---END---
---START---
ROLLBACK TO SAVEPOINT one;
---END---
---START---
INSERT INTO savepoints VALUES (21);
---END---
---START---
ROLLBACK TO SAVEPOINT one;
---END---
---START---
INSERT INTO savepoints VALUES (22);
---END---
---START---
COMMIT;
---END---
---START---
SELECT a FROM savepoints WHERE a BETWEEN 18 AND 22;
 a 
---
(0 rows)

---END---
---START---
DROP TABLE savepoints;
---END---
---START---
-- only in a transaction block:
SAVEPOINT one;
ERROR:  SAVEPOINT can only be used in transaction blocks
---END---
---START---
ROLLBACK TO SAVEPOINT one;
ERROR:  ROLLBACK TO SAVEPOINT can only be used in transaction blocks
---END---
---START---
RELEASE SAVEPOINT one;
ERROR:  RELEASE SAVEPOINT can only be used in transaction blocks
---END---
---START---
-- Only "rollback to" allowed in aborted state
BEGIN;
---END---
---START---
SAVEPOINT one;
---END---
---START---
SELECT 0/0;
ERROR:  division by zero
---END---
---START---
SAVEPOINT two;
ERROR:  current transaction is aborted, commands ignored until end of transaction block
---END---
---START---
-- ignored till the end of ...
  RELEASE SAVEPOINT one;
ERROR:  current transaction is aborted, commands ignored until end of transaction block
---END---
---START---
-- ignored till the end of ...
  ROLLBACK TO SAVEPOINT one;
---END---
---START---
SELECT 1;
 ?column? 
----------
        1
(1 row)

---END---
---START---
COMMIT;
---END---
---START---
SELECT 1;
 ?column? 
----------
        1
(1 row)

---END---
---START---
-- this should work
-- check non-transactional behavior of cursors
BEGIN;
---END---
---START---
DECLARE c CURSOR FOR SELECT unique2 FROM tenk1 ORDER BY unique2;
---END---
---START---
SAVEPOINT one;
---END---
---START---
FETCH 10 FROM c;
 unique2 
---------
       0
       1
       2
       3
       4
       5
       6
       7
       8
       9
(10 rows)

---END---
---START---
ROLLBACK TO SAVEPOINT one;
---END---
---START---
FETCH 10 FROM c;
 unique2 
---------
      10
      11
      12
      13
      14
      15
      16
      17
      18
      19
(10 rows)

---END---
---START---
RELEASE SAVEPOINT one;
---END---
---START---
FETCH 10 FROM c;
 unique2 
---------
      20
      21
      22
      23
      24
      25
      26
      27
      28
      29
(10 rows)

---END---
---START---
CLOSE c;
---END---
---START---
DECLARE c CURSOR FOR SELECT unique2/0 FROM tenk1 ORDER BY unique2;
---END---
---START---
SAVEPOINT two;
---END---
---START---
FETCH 10 FROM c;
ERROR:  division by zero
---END---
---START---
ROLLBACK TO SAVEPOINT two;
---END---
---START---
-- c is now dead to the world ...
		FETCH 10 FROM c;
ERROR:  portal "c" cannot be run
---END---
---START---
ROLLBACK TO SAVEPOINT two;
---END---
---START---
RELEASE SAVEPOINT two;
---END---
---START---
FETCH 10 FROM c;
ERROR:  portal "c" cannot be run
---END---
---START---
COMMIT;
---END---
---START---
--
-- Check that "stable" functions are really stable.  They should not be
-- able to see the partial results of the calling query.  (Ideally we would
-- also check that they don't see commits of concurrent transactions, but
-- that's a mite hard to do within the limitations of pg_regress.)
--
select * from xacttest;
 gemini_pk |  a  |    b    
-----------+-----+---------
        56 |   8 |        
       100 |  99 |        
         0 |   0 |        
        42 | 325 |        
         1 | 777 | 777.777
(5 rows)

---END---
---START---
create or replace function max_xacttest() returns smallint language sql as
'select max(a) from xacttest' stable;
---END---
---START---
begin;
---END---
---START---
update xacttest set a = max_xacttest() + 10 where a > 0;
---END---
---START---
select * from xacttest;
 gemini_pk |  a  |    b    
-----------+-----+---------
         0 |   0 |        
        56 | 787 |        
       100 | 787 |        
        42 | 787 |        
         1 | 787 | 777.777
(5 rows)

---END---
---START---
rollback;
---END---
---START---
-- But a volatile function can see the partial results of the calling query
create or replace function max_xacttest() returns smallint language sql as
'select max(a) from xacttest' volatile;
---END---
---START---
begin;
---END---
---START---
update xacttest set a = max_xacttest() + 10 where a > 0;
---END---
---START---
select * from xacttest;
 gemini_pk |  a  |    b    
-----------+-----+---------
         0 |   0 |        
        56 | 787 |        
       100 | 797 |        
        42 | 807 |        
         1 | 817 | 777.777
(5 rows)

---END---
---START---
rollback;
---END---
---START---
-- Now the same test with plpgsql (since it depends on SPI which is different)
create or replace function max_xacttest() returns smallint language plpgsql as
'begin return max(a) from xacttest; end' stable;
---END---
---START---
begin;
---END---
---START---
update xacttest set a = max_xacttest() + 10 where a > 0;
---END---
---START---
select * from xacttest;
 gemini_pk |  a  |    b    
-----------+-----+---------
         0 |   0 |        
        56 | 787 |        
       100 | 787 |        
        42 | 787 |        
         1 | 787 | 777.777
(5 rows)

---END---
---START---
rollback;
---END---
---START---
create or replace function max_xacttest() returns smallint language plpgsql as
'begin return max(a) from xacttest; end' volatile;
---END---
---START---
begin;
---END---
---START---
update xacttest set a = max_xacttest() + 10 where a > 0;
---END---
---START---
select * from xacttest;
 gemini_pk |  a  |    b    
-----------+-----+---------
         0 |   0 |        
        56 | 787 |        
       100 | 797 |        
        42 | 807 |        
         1 | 817 | 777.777
(5 rows)

---END---
---START---
rollback;
---END---
---START---
-- test case for problems with dropping an open relation during abort
BEGIN;
---END---
---START---
savepoint x;
---END---
---START---
CREATE TABLE koju (gemini_pk serial PRIMARY KEY, a integer UNIQUE);
---END---
---START---
INSERT INTO koju VALUES (1);
---END---
---START---
INSERT INTO koju VALUES (1);
ERROR:  duplicate key value violates unique constraint "koju_pkey"
DETAIL:  Key (gemini_pk)=(1) already exists.
---END---
---START---
rollback to x;
---END---
---START---
CREATE TABLE koju (gemini_pk serial PRIMARY KEY, a integer UNIQUE);
---END---
---START---
INSERT INTO koju VALUES (1);
---END---
---START---
INSERT INTO koju VALUES (1);
ERROR:  duplicate key value violates unique constraint "koju_pkey"
DETAIL:  Key (gemini_pk)=(1) already exists.
---END---
---START---
ROLLBACK;
---END---
---START---
DROP TABLE trans_foo;
---END---
---START---
DROP TABLE trans_baz;
---END---
---START---
DROP TABLE trans_barbaz;
---END---
---START---
-- test case for problems with revalidating an open relation during abort
create function inverse(int) returns float8 as
$$
begin
  analyze revalidate_bug;
  return 1::float8/$1;
exception
  when division_by_zero then return 0;
end$$ language plpgsql volatile;
---END---
---START---
CREATE TABLE revalidate_bug (gemini_pk serial PRIMARY KEY, c float8 UNIQUE);
---END---
---START---
insert into revalidate_bug values (1);
---END---
---START---
insert into revalidate_bug values (inverse(0));
---END---
---START---
drop table revalidate_bug;
---END---
---START---
drop function inverse(int);
---END---
---START---
-- verify that cursors created during an aborted subtransaction are
-- closed, but that we do not rollback the effect of any FETCHs
-- performed in the aborted subtransaction
begin;
---END---
---START---
savepoint x;
---END---
---START---
CREATE TABLE trans_abc (gemini_pk serial PRIMARY KEY, a integer);
---END---
---START---
insert into trans_abc values (5);
---END---
---START---
insert into trans_abc values (10);
---END---
---START---
declare foo cursor for select * from trans_abc;
---END---
---START---
fetch from foo;
 gemini_pk | a 
-----------+---
         5 |  
(1 row)

---END---
---START---
rollback to x;
---END---
---START---
-- should fail
fetch from foo;
ERROR:  cursor "foo" does not exist
---END---
---START---
commit;
---END---
---START---
begin;
---END---
---START---
CREATE TABLE trans_abc (gemini_pk serial PRIMARY KEY, a integer);
---END---
---START---
insert into trans_abc values (5);
---END---
---START---
insert into trans_abc values (10);
---END---
---START---
insert into trans_abc values (15);
---END---
---START---
declare foo cursor for select * from trans_abc;
---END---
---START---
fetch from foo;
 gemini_pk | a 
-----------+---
         5 |  
(1 row)

---END---
---START---
savepoint x;
---END---
---START---
fetch from foo;
 gemini_pk | a 
-----------+---
        10 |  
(1 row)

---END---
---START---
rollback to x;
---END---
---START---
fetch from foo;
 gemini_pk | a 
-----------+---
        15 |  
(1 row)

---END---
---START---
abort;
---END---
---START---
-- Test for proper cleanup after a failure in a cursor portal
-- that was created in an outer subtransaction
CREATE FUNCTION invert(x float8) RETURNS float8 LANGUAGE plpgsql AS
$$ begin return 1/x; end $$;
---END---
---START---
CREATE FUNCTION create_temp_tab() RETURNS text
LANGUAGE plpgsql AS $$
BEGIN
  DROP TABLE IF EXISTS new_table;
CREATE TABLE new_table (f1 float8);
  -- case of interest is that we fail while holding an open
  -- relcache reference to new_table
  INSERT INTO new_table SELECT invert(0.0);
  RETURN 'foo';
END $$;
---END---
---START---
BEGIN;
---END---
---START---
DECLARE ok CURSOR FOR SELECT * FROM int8_tbl;
---END---
---START---
DECLARE ctt CURSOR FOR SELECT create_temp_tab();
---END---
---START---
FETCH ok;
 gemini_pk | q1 | q2 
-----------+----+----
(0 rows)

---END---
---START---
SAVEPOINT s1;
---END---
---START---
FETCH ok;
 gemini_pk | q1 | q2 
-----------+----+----
(0 rows)

---END---
---START---
-- should work
FETCH ctt;
NOTICE:  table "new_table" does not exist, skipping
ERROR:  division by zero
CONTEXT:  PL/pgSQL function invert(double precision) line 1 at RETURN
SQL statement "INSERT INTO new_table SELECT invert(0.0)"
PL/pgSQL function create_temp_tab() line 7 at SQL statement
---END---
---START---
-- error occurs here
ROLLBACK TO s1;
---END---
---START---
FETCH ok;
 gemini_pk | q1 | q2 
-----------+----+----
(0 rows)

---END---
---START---
-- should work
FETCH ctt;
ERROR:  portal "ctt" cannot be run
---END---
---START---
-- must be rejected
COMMIT;
---END---
---START---
DROP FUNCTION create_temp_tab();
---END---
---START---
DROP FUNCTION invert(x float8);
---END---
---START---
CREATE TABLE trans_abc (gemini_pk serial PRIMARY KEY, a integer);
---END---
---START---
-- set nondefault value so we have something to override below
SET default_transaction_read_only = on;
---END---
---START---
START TRANSACTION ISOLATION LEVEL REPEATABLE READ, READ WRITE, DEFERRABLE;
---END---
---START---
SHOW transaction_isolation;
 transaction_isolation 
-----------------------
 repeatable read
(1 row)

---END---
---START---
SHOW transaction_read_only;
 transaction_read_only 
-----------------------
 off
(1 row)

---END---
---START---
SHOW transaction_deferrable;
 transaction_deferrable 
------------------------
 on
(1 row)

---END---
---START---
INSERT INTO trans_abc VALUES (1);
---END---
---START---
INSERT INTO trans_abc VALUES (2);
---END---
---START---
COMMIT AND CHAIN;
---END---
---START---
-- TBLOCK_END
SHOW transaction_isolation;
 transaction_isolation 
-----------------------
 repeatable read
(1 row)

---END---
---START---
SHOW transaction_read_only;
 transaction_read_only 
-----------------------
 off
(1 row)

---END---
---START---
SHOW transaction_deferrable;
 transaction_deferrable 
------------------------
 on
(1 row)

---END---
---START---
INSERT INTO trans_abc VALUES ('error');
ERROR:  invalid input syntax for type integer: "error"
LINE 1: INSERT INTO trans_abc VALUES ('error');
                                      ^
---END---
---START---
INSERT INTO trans_abc VALUES (3);
ERROR:  current transaction is aborted, commands ignored until end of transaction block
---END---
---START---
-- check it's really aborted
COMMIT AND CHAIN;
---END---
---START---
-- TBLOCK_ABORT_END
SHOW transaction_isolation;
 transaction_isolation 
-----------------------
 repeatable read
(1 row)

---END---
---START---
SHOW transaction_read_only;
 transaction_read_only 
-----------------------
 off
(1 row)

---END---
---START---
SHOW transaction_deferrable;
 transaction_deferrable 
------------------------
 on
(1 row)

---END---
---START---
INSERT INTO trans_abc VALUES (4);
---END---
---START---
COMMIT;
---END---
---START---
START TRANSACTION ISOLATION LEVEL REPEATABLE READ, READ WRITE, DEFERRABLE;
---END---
---START---
SHOW transaction_isolation;
 transaction_isolation 
-----------------------
 repeatable read
(1 row)

---END---
---START---
SHOW transaction_read_only;
 transaction_read_only 
-----------------------
 off
(1 row)

---END---
---START---
SHOW transaction_deferrable;
 transaction_deferrable 
------------------------
 on
(1 row)

---END---
---START---
SAVEPOINT x;
---END---
---START---
INSERT INTO trans_abc VALUES ('error');
ERROR:  invalid input syntax for type integer: "error"
LINE 1: INSERT INTO trans_abc VALUES ('error');
                                      ^
---END---
---START---
COMMIT AND CHAIN;
---END---
---START---
-- TBLOCK_ABORT_PENDING
SHOW transaction_isolation;
 transaction_isolation 
-----------------------
 repeatable read
(1 row)

---END---
---START---
SHOW transaction_read_only;
 transaction_read_only 
-----------------------
 off
(1 row)

---END---
---START---
SHOW transaction_deferrable;
 transaction_deferrable 
------------------------
 on
(1 row)

---END---
---START---
INSERT INTO trans_abc VALUES (5);
---END---
---START---
COMMIT;
---END---
---START---
START TRANSACTION ISOLATION LEVEL REPEATABLE READ, READ WRITE, DEFERRABLE;
---END---
---START---
SHOW transaction_isolation;
 transaction_isolation 
-----------------------
 repeatable read
(1 row)

---END---
---START---
SHOW transaction_read_only;
 transaction_read_only 
-----------------------
 off
(1 row)

---END---
---START---
SHOW transaction_deferrable;
 transaction_deferrable 
------------------------
 on
(1 row)

---END---
---START---
SAVEPOINT x;
---END---
---START---
COMMIT AND CHAIN;
---END---
---START---
-- TBLOCK_SUBCOMMIT
SHOW transaction_isolation;
 transaction_isolation 
-----------------------
 repeatable read
(1 row)

---END---
---START---
SHOW transaction_read_only;
 transaction_read_only 
-----------------------
 off
(1 row)

---END---
---START---
SHOW transaction_deferrable;
 transaction_deferrable 
------------------------
 on
(1 row)

---END---
---START---
COMMIT;
---END---
---START---
-- different mix of options just for fun
START TRANSACTION ISOLATION LEVEL SERIALIZABLE, READ WRITE, NOT DEFERRABLE;
---END---
---START---
SHOW transaction_isolation;
 transaction_isolation 
-----------------------
 serializable
(1 row)

---END---
---START---
SHOW transaction_read_only;
 transaction_read_only 
-----------------------
 off
(1 row)

---END---
---START---
SHOW transaction_deferrable;
 transaction_deferrable 
------------------------
 off
(1 row)

---END---
---START---
INSERT INTO trans_abc VALUES (6);
---END---
---START---
ROLLBACK AND CHAIN;
---END---
---START---
-- TBLOCK_ABORT_PENDING
SHOW transaction_isolation;
 transaction_isolation 
-----------------------
 serializable
(1 row)

---END---
---START---
SHOW transaction_read_only;
 transaction_read_only 
-----------------------
 off
(1 row)

---END---
---START---
SHOW transaction_deferrable;
 transaction_deferrable 
------------------------
 off
(1 row)

---END---
---START---
INSERT INTO trans_abc VALUES ('error');
ERROR:  invalid input syntax for type integer: "error"
LINE 1: INSERT INTO trans_abc VALUES ('error');
                                      ^
---END---
---START---
ROLLBACK AND CHAIN;
---END---
---START---
-- TBLOCK_ABORT_END
SHOW transaction_isolation;
 transaction_isolation 
-----------------------
 serializable
(1 row)

---END---
---START---
SHOW transaction_read_only;
 transaction_read_only 
-----------------------
 off
(1 row)

---END---
---START---
SHOW transaction_deferrable;
 transaction_deferrable 
------------------------
 off
(1 row)

---END---
---START---
ROLLBACK;
---END---
---START---
-- not allowed outside a transaction block
COMMIT AND CHAIN;
ERROR:  COMMIT AND CHAIN can only be used in transaction blocks
---END---
---START---
-- error
ROLLBACK AND CHAIN;
ERROR:  ROLLBACK AND CHAIN can only be used in transaction blocks
---END---
---START---
-- error
SELECT * FROM trans_abc ORDER BY 1;
 gemini_pk | a 
-----------+---
         1 |  
         2 |  
         4 |  
         5 |  
(4 rows)

---END---
---START---
RESET default_transaction_read_only;
---END---
---START---
DROP TABLE trans_abc;
---END---
---START---
-- Test assorted behaviors around the implicit transaction block created
-- when multiple SQL commands are sent in a single Query message.  These
-- tests rely on the fact that psql will not break SQL commands apart at a
-- backslash-quoted semicolon, but will send them as one Query.
DROP TABLE IF EXISTS i_table;
NOTICE:  table "i_table" does not exist, skipping
CREATE TABLE i_table (gemini_pk serial PRIMARY KEY, f1 integer);
---END---
---START---
-- psql will show all results of a multi-statement Query
SELECT 1\;
---END---
---START---
SELECT 2\;
---END---
---START---
SELECT 3;
 ?column? 
----------
        1
(1 row)

 ?column? 
----------
        2
(1 row)

 ?column? 
----------
        3
(1 row)

---END---
---START---
-- this implicitly commits:
insert into i_table values(1)\;
---END---
---START---
select * from i_table;
 gemini_pk | f1 
-----------+----
         1 |   
(1 row)

---END---
---START---
-- 1/0 error will cause rolling back the whole implicit transaction
insert into i_table values(2)\;
---END---
---START---
select * from i_table\;
---END---
---START---
select 1/0;
 gemini_pk | f1 
-----------+----
         1 |   
         2 |   
(2 rows)

ERROR:  division by zero
---END---
---START---
select * from i_table;
 gemini_pk | f1 
-----------+----
         1 |   
(1 row)

---END---
---START---
rollback;
WARNING:  there is no transaction in progress
---END---
---START---
-- we are not in a transaction at this point
-- can use regular begin/commit/rollback within a single Query
begin\;
---END---
---START---
insert into i_table values(3)\;
---END---
---START---
commit;
---END---
---START---
rollback;
WARNING:  there is no transaction in progress
---END---
---START---
-- we are not in a transaction at this point
begin\;
---END---
---START---
insert into i_table values(4)\;
---END---
---START---
rollback;
---END---
---START---
rollback;
WARNING:  there is no transaction in progress
---END---
---START---
-- we are not in a transaction at this point
-- begin converts implicit transaction into a regular one that
-- can extend past the end of the Query
select 1\;
---END---
---START---
begin\;
---END---
---START---
insert into i_table values(5);
 ?column? 
----------
        1
(1 row)

---END---
---START---
commit;
---END---
---START---
select 1\;
---END---
---START---
begin\;
---END---
---START---
insert into i_table values(6);
 ?column? 
----------
        1
(1 row)

---END---
---START---
rollback;
---END---
---START---
-- commit in implicit-transaction state commits but issues a warning.
insert into i_table values(7)\;
---END---
---START---
commit\;
---END---
---START---
insert into i_table values(8)\;
---END---
---START---
select 1/0;
WARNING:  there is no transaction in progress
ERROR:  division by zero
---END---
---START---
-- similarly, rollback aborts but issues a warning.
insert into i_table values(9)\;
---END---
---START---
rollback\;
---END---
---START---
select 2;
WARNING:  there is no transaction in progress
 ?column? 
----------
        2
(1 row)

---END---
---START---
select * from i_table;
 gemini_pk | f1 
-----------+----
         1 |   
         3 |   
         5 |   
         7 |   
(4 rows)

---END---
---START---
rollback;
WARNING:  there is no transaction in progress
---END---
---START---
-- we are not in a transaction at this point
-- implicit transaction block is still a transaction block, for e.g. VACUUM
SELECT 1\;
---END---
---START---
VACUUM;
 ?column? 
----------
        1
(1 row)

ERROR:  VACUUM cannot run inside a transaction block
---END---
---START---
SELECT 1\;
---END---
---START---
COMMIT\;
---END---
---START---
VACUUM;
WARNING:  there is no transaction in progress
 ?column? 
----------
        1
(1 row)

ERROR:  VACUUM cannot run inside a transaction block
---END---
---START---
-- we disallow savepoint-related commands in implicit-transaction state
SELECT 1\;
---END---
---START---
SAVEPOINT sp;
 ?column? 
----------
        1
(1 row)

ERROR:  SAVEPOINT can only be used in transaction blocks
---END---
---START---
SELECT 1\;
---END---
---START---
COMMIT\;
---END---
---START---
SAVEPOINT sp;
WARNING:  there is no transaction in progress
 ?column? 
----------
        1
(1 row)

ERROR:  SAVEPOINT can only be used in transaction blocks
---END---
---START---
ROLLBACK TO SAVEPOINT sp\;
---END---
---START---
SELECT 2;
ERROR:  ROLLBACK TO SAVEPOINT can only be used in transaction blocks
---END---
---START---
SELECT 2\;
---END---
---START---
RELEASE SAVEPOINT sp\;
---END---
---START---
SELECT 3;
 ?column? 
----------
        2
(1 row)

ERROR:  RELEASE SAVEPOINT can only be used in transaction blocks
---END---
---START---
-- but this is OK, because the BEGIN converts it to a regular xact
SELECT 1\;
---END---
---START---
BEGIN\;
---END---
---START---
SAVEPOINT sp\;
---END---
---START---
ROLLBACK TO SAVEPOINT sp\;
---END---
---START---
COMMIT;
 ?column? 
----------
        1
(1 row)

---END---
---START---
-- Tests for AND CHAIN in implicit transaction blocks
SET TRANSACTION READ ONLY\;
---END---
---START---
COMMIT AND CHAIN;
ERROR:  COMMIT AND CHAIN can only be used in transaction blocks
---END---
---START---
-- error
SHOW transaction_read_only;
 transaction_read_only 
-----------------------
 off
(1 row)

---END---
---START---
SET TRANSACTION READ ONLY\;
---END---
---START---
ROLLBACK AND CHAIN;
ERROR:  ROLLBACK AND CHAIN can only be used in transaction blocks
---END---
---START---
-- error
SHOW transaction_read_only;
 transaction_read_only 
-----------------------
 off
(1 row)

---END---
---START---
CREATE TABLE trans_abc (gemini_pk serial PRIMARY KEY, a integer);
---END---
---START---
-- COMMIT/ROLLBACK + COMMIT/ROLLBACK AND CHAIN
INSERT INTO trans_abc VALUES (7)\;
---END---
---START---
COMMIT\;
---END---
---START---
INSERT INTO trans_abc VALUES (8)\;
---END---
---START---
COMMIT AND CHAIN;
WARNING:  there is no transaction in progress
ERROR:  COMMIT AND CHAIN can only be used in transaction blocks
---END---
---START---
-- 7 commit, 8 error
INSERT INTO trans_abc VALUES (9)\;
---END---
---START---
ROLLBACK\;
---END---
---START---
INSERT INTO trans_abc VALUES (10)\;
---END---
---START---
ROLLBACK AND CHAIN;
WARNING:  there is no transaction in progress
ERROR:  ROLLBACK AND CHAIN can only be used in transaction blocks
---END---
---START---
-- 9 rollback, 10 error
-- COMMIT/ROLLBACK AND CHAIN + COMMIT/ROLLBACK
INSERT INTO trans_abc VALUES (11)\;
---END---
---START---
COMMIT AND CHAIN\;
---END---
---START---
INSERT INTO trans_abc VALUES (12)\;
---END---
---START---
COMMIT;
ERROR:  COMMIT AND CHAIN can only be used in transaction blocks
---END---
---START---
-- 11 error, 12 not reached
INSERT INTO trans_abc VALUES (13)\;
---END---
---START---
ROLLBACK AND CHAIN\;
---END---
---START---
INSERT INTO trans_abc VALUES (14)\;
---END---
---START---
ROLLBACK;
ERROR:  ROLLBACK AND CHAIN can only be used in transaction blocks
---END---
---START---
-- 13 error, 14 not reached
-- START TRANSACTION + COMMIT/ROLLBACK AND CHAIN
START TRANSACTION ISOLATION LEVEL REPEATABLE READ\;
---END---
---START---
INSERT INTO trans_abc VALUES (15)\;
---END---
---START---
COMMIT AND CHAIN;
---END---
---START---
-- 15 ok
SHOW transaction_isolation;
 transaction_isolation 
-----------------------
 repeatable read
(1 row)

---END---
---START---
-- transaction is active at this point
COMMIT;
---END---
---START---
START TRANSACTION ISOLATION LEVEL REPEATABLE READ\;
---END---
---START---
INSERT INTO trans_abc VALUES (16)\;
---END---
---START---
ROLLBACK AND CHAIN;
---END---
---START---
-- 16 ok
SHOW transaction_isolation;
 transaction_isolation 
-----------------------
 repeatable read
(1 row)

---END---
---START---
-- transaction is active at this point
ROLLBACK;
---END---
---START---
SET default_transaction_isolation = 'read committed';
---END---
---START---
-- START TRANSACTION + COMMIT/ROLLBACK + COMMIT/ROLLBACK AND CHAIN
START TRANSACTION ISOLATION LEVEL REPEATABLE READ\;
---END---
---START---
INSERT INTO trans_abc VALUES (17)\;
---END---
---START---
COMMIT\;
---END---
---START---
INSERT INTO trans_abc VALUES (18)\;
---END---
---START---
COMMIT AND CHAIN;
ERROR:  COMMIT AND CHAIN can only be used in transaction blocks
---END---
---START---
-- 17 commit, 18 error
SHOW transaction_isolation;
 transaction_isolation 
-----------------------
 read committed
(1 row)

---END---
---START---
-- out of transaction block
START TRANSACTION ISOLATION LEVEL REPEATABLE READ\;
---END---
---START---
INSERT INTO trans_abc VALUES (19)\;
---END---
---START---
ROLLBACK\;
---END---
---START---
INSERT INTO trans_abc VALUES (20)\;
---END---
---START---
ROLLBACK AND CHAIN;
ERROR:  ROLLBACK AND CHAIN can only be used in transaction blocks
---END---
---START---
-- 19 rollback, 20 error
SHOW transaction_isolation;
 transaction_isolation 
-----------------------
 read committed
(1 row)

---END---
---START---
-- out of transaction block
RESET default_transaction_isolation;
---END---
---START---
SELECT * FROM trans_abc ORDER BY 1;
 gemini_pk | a 
-----------+---
         7 |  
        15 |  
        17 |  
(3 rows)

---END---
---START---
DROP TABLE trans_abc;
---END---
---START---
-- Test for successful cleanup of an aborted transaction at session exit.
-- THIS MUST BE THE LAST TEST IN THIS FILE.
begin;
---END---
---START---
select 1/0;
ERROR:  division by zero
---END---
---START---
rollback to X;
ERROR:  savepoint "x" does not exist
---END---
